Adress,City,Street name,Postal code,Latitude,Longitude,Monthly rent,Aconto,Square meters,Rooms,Floor,Property type,Furnished,Shareable,Pets allowed,Elevator,Senior frendly,Only for students,Balcony/Terrace,Parking,Energy label,Description,Link
"Frøsvej, 6630 Rødding  - Stuen",Rødding,Frøsvej,6630,55.37017,9.057934,3.100 kr.,1.022 kr.,50 m²,1,Stuen,Lejlighed,Nej,Nej,Ja,Nej,Nej,Nej,Nej,Ja,N/A,"nyerenoveret lejlighed i rødding med nyre køkken og badeværelse med have  lejligheden indeholder entre,bad,stue.køkkenalrum,soveværelse og veranda",https://www.boligportal.dk/lejligheder/r%C3%B8dding/50m2-1-vaer-id-897127
"Jægergårdsgade, 8000 Aarhus, Aarhus C  - 2. sal",Aarhus,Jægergårdsgade,8000,56.148036,10.201712,13.751 kr.,1.350 kr.,110 m²,3,2.,Lejlighed,Nej,Ja,Nej,Ja,Nej,Nej,Ja,Nej,B,"Rummelig 3 værelses lejlighed, beliggende centralt i Aarhus - i skønne Jægergårdsgade - som er kendetegnet ved de mange cafeer, restauranter osv. Der er gåafstand til f.eks. Bruuns Galleri, banegården, Aros m.m. 

Lejligheden er i to plan og indeholder bl.a. entré, to gode og rummelige værelser, pænt badeværelse med vaskesøjle og bruseniche. Fra entreen er der en flot trappeopgang til øverste etage.

Øverste etage indeholder et nyt flot køkken i åben forbindelse med en rummelig stue. Her er masser af plads til både spise- og hyggeafdeling. 

Fra både køkken og stue er der udgang til en stor og virkelig skøn sydvendt tagterrasse, hvor der er plads til både lounge møbler, spisebord og stole, grill osv.  

- Lofter til kip. 
- Brændeovn i stuen. 
- Mange fine detaljer!
- Alt i hvidevarer. 
- Elevator i opgangen. 
- Eget kælderrum.

Fantastisk lækker lejlighed, som bare SKAL ses! 

Lejligheden passer perfekt til par/familie, men kan også deles (obs! der er to aflukkede værelser).",https://www.boligportal.dk/lejligheder/aarhus/110m2-3-vaer-id-4904798
"Skejbyparken, 8200 Aarhus, Aarhus N  - 1. sal",Aarhus,Skejbyparken,8200,56.196439,10.189261,6.593 kr.,600 kr.,51 m²,2,1.,Lejlighed,Nej,Nej,Nej,Ja,Nej,Nej,Ja,Ja,C,"I rolige omgivelser tæt på Aarhus C. Finder du/I denne meget velindrettede 2-vær. bl.a. med god altan og gratis parkering lige ved døren.
Lejligheden byder på fin entré med skabsplads. Lyst badeværelse med bruseniche, her er også installeret vaskemaskine og tørretumbler. Velindrette køkken med masser af skabs- og bordplads samt smart halvmur til stuen, der er et dejligt gennemgående lysindfald mellem køkken og stuen. Stuen er nemt at indrette med plads til både spisebord og sofa. Fra stuen er der udgang til skøn altan. Endvidere rummeligt soveværelse med skabsplads.
Der er tørt og fint pulterrum til lejligheden.",https://www.boligportal.dk/lejligheder/aarhus/51m2-2-vaer-id-5369981
"Westergaards Alle, 6740 Bramming",Bramming,Westergaards Alle,6740,55.466444,8.708797,7.400 kr.,N/A,100 m²,4,-,Hus,Nej,Nej,Nej,Nej,Nej,Nej,Nej,Nej,N/A,"Nyrenoveret 2017
3 værelser
Køkken med opvaskemaskine, indbygget ovn og keramisk kogeplade
Stue og køkken er i forbindelse med hinanden
Stort kælderrum til opbevaring
Bryggers i kælder (der er 2 lejligheder om bryggerset)
1 skur til opbevaring af cykler mm.
Dejlig område med 5 min. gang til skole, 5 min. gang til banegård, 5 min. gang til købmand
Billeder kommer senere.",https://www.boligportal.dk/huse/bramming/100m2-4-vaer-id-4932736
"Mysundevej, 8930 Randers, Randers NØ  - 2. sal",Randers,Mysundevej,8930,56.484545,10.031608,9.295 kr.,1.105 kr.,102 m²,4,2.,Lejlighed,Nej,Ja,Nej,Ja,Nej,Nej,Ja,Ja,N/A,"Nyopførte lejelejligheder i Randers tæt på by og natur

Drømmer du om en unik lejebolig med 2, 3 eller 4 værelser i Randers? De nybyggede lejligheder i Randers Kaserne byder på både stort køkken alrum og nem adgang til parkering og Nordre Fælled.

Lej en kvalitetslejlighed med egen altan og terrasse

På Kavalerivej, Hestestræde og Mysundevej i Randers ligger Randers Kaserne, der nu er bygget om til 2, 3 og 4 værelses lejeboliger. Størrelserne varierer mellem 67 til 110 kvadratmeter.

Alle lejligheder har eget depotrum i lejligheden samt egen altan eller terrasse, hvor du kan nyde morgenkaffen. Det store, rummelige køkken er indrettet med køkken/alrum i åben forbindelse med stue, der danner rammen for fællesskab og liv. Køkkenelementerne er fra Svane og alt i hårde hvidevarer er fra Siemens.

I badeværelset kan du nyde både gulvvarme, en rummelig bruseniche med rain shower bruser, samt lejlighedens vaskemaskine og tørretumbler. Varmegenvindingsanlægget sikrer et godt indeklima i hele boligen.
Du har derudover adgang til elevator, ligesom det ikke er et problem at have bil, da du har nem mulighed for parkering uden krav om leje.

En moderne lejebolig i Randers’ historiske rammer

Som lejer i en af disse moderne lejeboliger, har du kort afstand til både Langvang Idrætscenter, Regionshospitalet, pasningsmuligheder, skoler og uddannelsessteder. Har du brug for et åndehul fra byen, ligger Nordre Fælled også lige udenfor din hoveddør. Desuden byder området på alt, hvad du har brug for til dagligdagen med nærliggende og gode indkøbs- og transportmuligheder.

Her i den nordlige del af Randers er atmosfæren hyggelig og fredelig, og der er plads til både singler, par, familier og seniorer.

Velkommen til Randers Kaserne i 8930 Randers

Randers Kaserne rummer 96 unikke lejeboliger i et åbent landskab med både Nordre Fælled som nær nabo. Her er der en by i byen – et kraftcenter for kultur og kreativitet med højt til loftet og et stærkt sammenhold. Velkommen til Kavalerivej, Hestestræde og Mysundevej, 8930 Randers!

OBS: Billederne er fra en lignende bolig og dermed vejledende. Se plantegning.",https://www.boligportal.dk/lejligheder/randers/102m2-4-vaer-id-5354147
"Langebæk Gade, 4772 Langebæk",Langebæk,Langebæk Gade,4772,54.997131,12.090969,6.240 kr.,500 kr.,97 m²,5,-,Hus,Nej,Nej,Ja,Nej,Nej,Nej,Nej,Nej,N/A,"Huset er renoveret med dejligt nyt badeværelse. Huset består af 2 stuer en suite, samt 3 gode værelser + krybekælder og garage. Villa i Langebæk 6 km. fra motorvejen ca.100 km. til København.
Meget naturskønt område. Stille og rolig sidevej.
Kort afstand til indkøbsmuligheder, skole og børneinstitution.",https://www.boligportal.dk/huse/langeb%C3%A6k/97m2-5-vaer-id-2409211
"Tværgade, 9480 Løkken",Løkken,Tværgade,9480,57.313986,9.711579,5.800 kr.,0 kr.,196 m²,5,-,Hus,Nej,Nej,Ja,Nej,Nej,Nej,Ja,Ja,N/A,"Rolige omgivelser, med lukket have, garage. 2 Km fra bedste strand, - Grønhøj.
Nærmest ny 1. sal med 3 gode værelser. 
I Stueetage: Bad/toilet, Stue Køkken /Allrum, værelse og gæstetoilet. 
I alt 136 m2. 
Derudover i længe, ca. 60 m2 med bad og disponible rum.",https://www.boligportal.dk/huse/l%C3%B8kken/196m2-5-vaer-id-4773686
"Bjertparken, 7830 Vinderup",Vinderup,Bjertparken,7830,56.474064,8.777053,7.351 kr.,N/A,106 m²,4,-,Rækkehus,Nej,Ja,Ja,Nej,Nej,Nej,Nej,Nej,N/A,"Husene/rækkehusene, som er beliggende i den sydlige del af byen, er opført i 1999. Hver bolig har egen have og et skur.
Vinderup ligger lige midt i det hele. Midt mellem Holstebro, Struer og Skive. Midt mellem fjord og hede og midt i skøn natur formet under den seneste istid.

I Vinderup er der plads til det gode familieliv.

Her er foreninger for enhver smag og til aktive i alle aldre. Her kan bl.a. dyrkes gymnastik, fodbold, skydning, svømning, badminton, fitness, spejder.
Der er et blomstrende handelsliv i byen med alt fra dagligvarebutikker, bager, frisør, tøjbutikker m.m.

I byen er der dagplejere, vuggestuer, børnehaver og 2 folkeskoler, en med 0.-6 klassetrin og en med 7.-10. klassetrin.

Afdelingen består af 79 familieboliger, 14 studieboliger og 28 ældreboliger.

Boligernes energimærke: B.

Telefonen er åben mandag - torsdag 9.00-12.00 og 13.00-15.00. Fredag fra 9.00-12.00.
For at kunne leje denne bolig, kræver det man er medlem af boligforeningen. På BoligPortal annonceres kun reelt ledige boliger uden eksisterende venteliste på annonceringstidspunktet. Venligst kontakt udlejer hvis du er interesseret i lejemålet.",https://www.boligportal.dk/r%C3%A6kkehuse/vinderup/106m2-4-vaer-id-5368365
"Kastetvej, 9000 Aalborg, Aalborg  - 2. sal",Aalborg,Kastetvej,9000,57.054139,9.896795,5.562 kr.,300 kr.,65 m²,2,2.,Lejlighed,Nej,Nej,Nej,Nej,Nej,Nej,Nej,Nej,N/A,"65 m2 fordelt på 2 gode værelser og med lækker sydvendt have/terrasse. Lejligheden indeholder en lys entré, der giver adgang til to gode værelser, der kan indrettes som stue og soveværelse. Den store stue byder på store vinduer og højt til loftet. Vi bevæger os videre ind i et fint soveværelse, hvor I både finder plads til en stor seng og et stort skab. Fra entréen er der adgang til et godt og praktisk badeværelse. Det samme kan siges om køkkenet, hvor der også er god bord- og skabsplads. Fra lejligheden bevæger vi os ned i en rigtig hyggelig gård. Den byder på lækre terrasser og grønne områder. En rigtig lækker gård, som fungerer som jeres lille grønne oase her i byen. Beliggenheden er helt i top. Med en placering på Kastetvej får I hyggelige caféer, spændende butikker og offentlig transport lige udenfor døren.",https://www.boligportal.dk/lejligheder/aalborg/65m2-2-vaer-id-5330467
"Nørrebrogade, 8930 Randers, Randers NØ  - Stuen",Randers,Nørrebrogade,8930,56.471172,10.036204,3.405 kr.,550 kr.,59 m²,2,Stuen,Lejlighed,Nej,Nej,Nej,Nej,Nej,Nej,Nej,Nej,D,"Sag 44
Lejligheden er beliggende tæt på indkøb, gratis parkering ved vej, lille have til fri afbenyttelse, går afstand til midt byen, et kælderrum til lejligheden og Vaskeri i kælder. INGEN HUSDYR.  Ring eller skriv for fremvisning 
Der betales til indvendig vedligeholdelse konti.",https://www.boligportal.dk/lejligheder/randers/59m2-2-vaer-id-2820993
"Lindevej, 7900 Nykøbing M  - Kælder",Nykøbing M,Lindevej,7900,56.80074,8.870518,1.650 kr.,250 kr.,18 m²,1,Kælder,Værelse,Nej,Nej,Nej,Nej,Nej,Nej,Nej,Ja,N/A,"18 m2 værelse beliggende i kælderen i en ejendom med 6 lejligheder og 4 værelser. Værelset er lyst og vender ud mod gårdhaven bag huset. Der er fælles køkken, bad og toilet med de 4 værelser i kælderen.

Der er fælles vaskerum med vaskemaskine og tørretumbler i kælderen, samt dejlig fælles gårdhave bag huset, for hele husets beboer. 

Værelset er beliggende i gåafstand fra centrum af byen, hvor ejendommen er beliggende på rolig villavej i den nordlige del af Nykøbing og med kun nogle få minutters gang til dejlig badestrand og skov.

Værelset vil evt. også være velegnet blot til opbevaring. 
Der er mulighed for parkering langs vejen, lige udenfor bygningen

Har dette vagt din interesse, så tag endelig kontakt til mig.",https://www.boligportal.dk/v%C3%A6relser/nyk%C3%B8bing-m/18m2-1-vaer-id-5262125
"Boeck-Hansens Vej, 9000 Aalborg, Aalborg  - 2. sal",Aalborg,Boeck-Hansens Vej,9000,57.033851,9.9348,8.600 kr.,800 kr.,82 m²,3,2.,Lejlighed,Nej,Ja,Ja,Ja,Nej,Nej,Ja,Ja,N/A,"Velkommen til denne skønne lejlighed, der byder på et åbent køkken-alrum med et fantastisk lysindfald, to gode soveværelser samt et depotrum. Boligen indeholder et lækkert Invita køkken med opvaskemaskine, køleskab og fryser samt et nyt og moderne badeværelse veludstyret med vaskemaskine og tørretumbler. 

Lejligheden har en stor sydvest- eller sydøst-vendt altan, hvor du har rig mulighed for at nyde solen i sommerhalvåret. Til lejemålet hører en parkeringsplads til fri afbenyttelse samt cykelparkering. 

Beliggenheden er perfekt til dig, der vil bo i et hyggeligt og attraktivt miljø tilbagetrukket fra støj, men samtidig ønsker at bo tæt på byens puls. Kennedy Arkaden og Aalborg Centrum er nemlig kun en 5-minutters cykeltur væk, hvor der er alverdens indkøbsmuligheder og restauranter. Ejendommene er desuden omgivet af skønne, grønne fællesområder med legepladser.

Om lejlighederne kan vi fremhæve:
•	Lyst og moderne nybyggeri
•	Komplet hvidevarepakke
•	Hyggeligt og attraktivt miljø
•	Gåafstand til Aalborg Centrum
•	Mulighed for husdyr",https://www.boligportal.dk/lejligheder/aalborg/82m2-3-vaer-id-5360094
"Østergade, 7480 Vildbjerg  - Kælder",Vildbjerg,Østergade,7480,56.196636,8.768031,3.630 kr.,900 kr.,60 m²,3,Kælder,Lejlighed,Nej,Nej,Nej,Nej,Nej,Nej,Ja,Nej,B,"BØR SES - BØR SES - BØR SES - BØR SES - BØR SES 
Lys 3 værelses kld. lejlighed - Vildbjerg midtby
- Aconto inkluderer el, vand og varme. 
- Dejligt køkkenalrum.
- Stort soveværelse
- Direkte udgang til solgård. 
- Mulighed for leje af parkeringsplads.
- Fælles stor have.
- Fælles vaskeri.",https://www.boligportal.dk/lejligheder/vildbjerg/60m2-3-vaer-id-5361172
"Læderstræde, 1201 København, København K  - 2. sal",København,Læderstræde,1201,55.677903,12.577814,19.900 kr.,1.250 kr.,131 m²,2,2.,Lejlighed,Nej,Nej,Nej,Nej,Nej,Nej,Nej,Nej,N/A,"I hjertet af København centrum på Læderstræde, bag Gammel Strand og få meter fra Storkespringvandet finder du denne meget luksuriøse 2-værelses lejlighed.

Lejligheden rummer 131 kvm., med en stor fordelingsgang med indbygget Kvänum garderobeskab. Badeværelse og køkken ligeledes fra Kvänum med Miele hvidevarer og Dornbracht armaturer. Ydermere indeholder lejligheden en stor stue-køkkenalrum med plads til stort sofaarrangement samt spiseplads. Lejligheden har et soveværelse med indbygget garderobeskab fra Kvänum. I hele lejligheden er der gipsstuk, høje træpaneler og massive Douglas plankegulve.

Ejendommen er en fredet ejendom, der i tidernes morgen er opført for urtekræmmer Nicolai Jaco Greve i 1806 og har gennemgået en gennemgribende renovering i 2020/2021.

Kontakt os endelig for flere informationer. 

Vi glæder os til at vise denne herlighed frem.",https://www.boligportal.dk/lejligheder/k%C3%B8benhavn/131m2-2-vaer-id-5236387
"Hovedgaden, 6980 Tim  - 1. sal",Tim,Hovedgaden,6980,56.196236,8.305365,4.711 kr.,N/A,96 m²,3,1.,Lejlighed,Nej,Nej,Ja,Nej,Nej,Nej,Nej,Nej,N/A,"Familieboliger med: 
Fjernvarme
Carport
Et husdyr tilladt
Vicevært i afdelingen
For at kunne leje denne bolig, kræver det man er medlem af boligforeningen. På BoligPortal annonceres kun reelt ledige boliger uden eksisterende venteliste på annonceringstidspunktet. Venligst kontakt udlejer hvis du er interesseret i lejemålet.",https://www.boligportal.dk/lejligheder/tim/96m2-3-vaer-id-3854138
"Christian X's Vej, 8260 Aarhus, Viby J  - 1. sal",Aarhus,Christian X's Vej,8260,56.129345,10.173139,9.975 kr.,750 kr.,86 m²,3,1.,Lejlighed,Nej,Nej,Nej,Nej,Nej,Nej,Ja,Ja,N/A,"Meget fin nybygget ejendom. Egen terrasser, og grønne arealer foran døren. Parkering, også med lader til el-bil, stor pulterrum i opvarmet kælder, alle hvidevarer, lys og lækker og billig i varme.
Flot lejlighed i 2 plan, med udsigt.",https://www.boligportal.dk/lejligheder/aarhus/86m2-3-vaer-id-5370898
"Råbrovej, 2765 København, Smørum",København,Råbrovej,2765,55.729251,12.292294,11.577 kr.,2.600 kr.,110 m²,3,-,Hus,Nej,Nej,Ja,Nej,Nej,Nej,Nej,Nej,N/A,"Dejligt hus med have med beliggenhed i Lille Smørum.
Tæt på skole og indkøb. 
20 km. fra København.",https://www.boligportal.dk/huse/k%C3%B8benhavn/110m2-3-vaer-id-3448881
"Grødde Huse, 7430 Ikast",Ikast,Grødde Huse,7430,56.126636,9.185137,7.395 kr.,0 kr.,69 m²,2,-,Rækkehus,Nej,Ja,Ja,Nej,Ja,Nej,Ja,Ja,A,"Nybygget rækkehus i familievenligt område - med naturen lige udenfor! 
Drømmer du om at bo i et moderne, bæredygtigt og nyopført rækkehus i rolige og naturskønne omgivelser? 
Så er Grødde Huse i Ikast lige noget for dig!🏡

I dette 2 værelses rækkehus får du:
- Stort lyst køkken-alrum
- Privat have med terrasse🌞
- Mulighed for at have dit husdyr med🐶
- Privat parkeringsplads
- Eget skur🌺
- HTH Køkken med alt i hårde hvidevarer
- Entre med vaskemaskine og tørretumbler😊
- Boligen opvarmes med varmepumper
- Der indlægges fiber i boligen",https://www.boligportal.dk/r%C3%A6kkehuse/ikast/69m2-2-vaer-id-5365819
"Vejlevej, 7190 Billund  - Stuen",Billund,Vejlevej,7190,55.728646,9.117464,6.867 kr.,1.750 kr.,88 m²,2,Stuen,Lejlighed,Nej,Nej,Nej,Ja,Nej,Nej,Nej,Nej,N/A,"Vi kan nu tilbyde denne bolig på 88 m2 beliggende i Billund
For at kunne leje denne bolig, kræver det man er medlem af boligforeningen. På BoligPortal annonceres kun reelt ledige boliger uden eksisterende venteliste på annonceringstidspunktet. Venligst kontakt udlejer hvis du er interesseret i lejemålet.",https://www.boligportal.dk/lejligheder/billund/88m2-2-vaer-id-5232755
"Østre Havnegade, 9000 Aalborg, Aalborg  - 3. sal",Aalborg,Østre Havnegade,9000,57.046424,9.93932,4.895 kr.,900 kr.,75 m²,3,3.,Lejlighed,Nej,Nej,Nej,Nej,Nej,Nej,Nej,Nej,D,"3-værelses lejlighed beliggende på Østre Havnegade, 9000 Aalborg. 

Lejlighed er beliggende i Aalborg C med kort afstand til Nordkraft, Østre Havn, grønne områder ved Østre Anlæg og med gåafstand til centrum. 

Lejemålet indeholder eget køkken og bad, soveværelse og to stuer. 

Lejemålet overtages som beset.",https://www.boligportal.dk/lejligheder/aalborg/75m2-3-vaer-id-5178791
"Fennebakken, 8800 Viborg",Viborg,Fennebakken,8800,56.462038,9.443314,7.800 kr.,0 kr.,105 m²,3,-,Rækkehus,Nej,Nej,Nej,Nej,Nej,Nej,Nej,Nej,N/A,"Et af de populære gårdhavehuse på Fennebakken udlejes.
105 bolig m2 der er indrettet med entre, badeværelse med kar og brus, 2 værelser samt soveværelse. Der er åbent køkken og stort alrum samt opholdsstue m/brændeovn. 
Bryggers med plads til vaskemaskine og tørretumbler. 

Der er lille lukke gårdhave med redskabsrum.

Der er ikke p-plads lige ved huset, men flere p-områder i bebyggelse tæt på ejendommen. 

Beliggende tæt på indkøb, offentlig transport, skole m.v..

Alle forbrugsudgifter, el, vand og varme afregnes direkte til de respektive værker.",https://www.boligportal.dk/r%C3%A6kkehuse/viborg/105m2-3-vaer-id-4108052
"Rindsvej, 8920 Randers, Randers NV  - Stuen",Randers,Rindsvej,8920,56.474567,10.024446,4.750 kr.,700 kr.,79 m²,3,Stuen,Lejlighed,Nej,Nej,Nej,Nej,Nej,Nej,Ja,Nej,N/A,"Lejemålet er beliggende på Rindsvej og består af 3 værelser samt køkken og bad. Lejemålet er 79 m2 og er klar til overtagelse snarest. Månedlig husleje er 4750 kr. og forudbetalt husleje og depositum beløber sig til i alt 19000 kr. 

Send en besked, hvis lejemålet har fanget din interesse.",https://www.boligportal.dk/lejligheder/randers/79m2-3-vaer-id-5278102
"Vilhelm Ehlerts Alle, 8800 Viborg  - 4. sal",Viborg,Vilhelm Ehlerts Alle,8800,56.447673,9.390774,7.200 kr.,0 kr.,65 m²,3,4.,Lejlighed,Nej,Ja,Ja,Ja,Ja,Nej,Ja,Ja,A,"Indbydende treværelses lejlighed med rummeligt køkken-alrum og stue med udgang til altan. Soveværelse, værelse og badeværelse i tidløse materialer.
Køkken-alrum og stue
Lejlighedens køkken-alrum er opført i moderne og stilrene kvalitetsmaterialer og indeholder alt i hårde hvidevarer. I åben forlængelse af køkken-alrummet får du en stor og rummelig stue med plads til både spisebord og sofaområde. Her er desuden direkte udgang til boligens altan eller terrasse.

Værelser
Lejlighedens soveværelse er både lyst og rummeligt med plads til en dobbeltseng. Der medfølger desuden tre faste garderobeskabe, som giver dig god opbevaringsplads. Boligens andet værelse indeholder også et fast garderobeskab, og værelset har en oplagt størrelse til både børneværelse eller kontor.

Badeværelse
Badeværelset er indrettet i samme lyse og moderne materialer som resten af hjemmet. Her får du både bruseniche, toilet og håndvask foruden egen vaskesøjle, så vasketøjet kan klares nemt og bekvemt.

Uderum
Til lejlighederne fra første sal og opefter hører en altan, mens boligerne i stueplan har egen terrasse. Med den direkte udgang fra boligens stue bliver uderummet en naturlig forlængelse af boligen, som indbyder til udehygge.
I kælderen under byggeriet er der parkering til biler og cykler, samt mindre kælderrum. Det er også muligt at parkere sin bil i gårdrummet. Har du elbil, så er der også mulighed for at oplade disse på udvalgte pladser.

Forbrug afregnes direkte med forsyningsværkerne.
Vi aflæser målerne på indflytningsdagen og herefter tilmelder vi lejer til de respektive forsyningsværker.

Det er tilladt at holde op til 2. stk. husdyr mod godkendelse fra udlejer. Visse hunderacer må vi desværre sige nej til grundet race, størrelse og temperament.",https://www.boligportal.dk/lejligheder/viborg/65m2-3-vaer-id-5379025
"Søren Møllers Gade, 8900 Randers, Randers C  - 2. sal",Randers,Søren Møllers Gade,8900,56.462115,10.029742,4.500 kr.,800 kr.,71 m²,3,2.,Lejlighed,Nej,Ja,Nej,Nej,Nej,Nej,Nej,Nej,D,"Moderne og rummelig lejlighed i Søren Møllers Gade, Randers

Du har nu muligheden for at leje denne fantastiske lejlighed beliggende i Søren Møllers Gade , i hjertet af Randers. Med en overkommelig husleje på 4500 kr. plus forbrug a/c på 800 kr. får du her en attraktiv bolig, der er ideel til enkeltpersoner, par eller familier, der ønsker masser af plads og moderne faciliteter.

Lejligheden byder på følgende:

Stor og indbydende stue med rigelig plads til både spiseområde og afslapning
Fuldt udstyret køkken med moderne apparater og opdaterede faciliteter
To rummelige soveværelser, der kan rumme dobbeltsenge og opbevaringsmuligheder
Nyt og stilfuldt badeværelse fra 2020 med moderne inventar og brusebad
Praktisk opbevaringsplads i form af skabe og skabe i hele lejligheden
Mulighed for at tilknytte vaskemaskine og tørretumbler i lejligheden
Området:
Beliggende i Søren Møllers Gade, nyder du godt af en central placering i Randers. Dette område byder på et væld af faciliteter og bekvemmeligheder inden for gåafstand. Der er et bredt udvalg af butikker, supermarkeder, restauranter og caféer i nærheden, så du aldrig vil mangle noget.

Randers er en charmerende by med en rig historie og en blomstrende kulturscene. Du vil finde museer, teatre, biografer og kunstgallerier i nærheden, der giver dig mulighed for at udforske og nyde byens kulturelle tilbud. Naturelskere vil også sætte pris på de smukke parker og rekreative områder i nærheden, hvor man kan nyde afslappende gåture eller udendørs aktiviteter.

Med gode transportforbindelser i nærheden er det nemt at komme rundt i byen og til omkringliggende områder. Der er også adgang til offentlig transport, herunder busser og togstationen i nærheden.

Lejligheden er klar til indflytning nu.
Hvis du leder efter en moderne og rummelig lejlighed i et bekvemt og attraktivt område i Randers, så er denne lejlighed perfekt for dig. Kontakt os i dag for at arrangere en fremvisning eller få yderligere oplysninger. Vi ser frem til at høre fra dig!",https://www.boligportal.dk/lejligheder/randers/71m2-3-vaer-id-5343176
"Immerkær, 2650 København, Hvidovre  - 1. sal",København,Immerkær,2650,55.664214,12.462017,6.000 kr.,0 kr.,19 m²,1,1.,Værelse,Nej,Nej,Nej,Nej,Nej,Nej,Nej,Nej,B,"Skønne værelser tæt på Rødover station og Rødover centeret 

Værelserne er et fælleskab bestående af 9 stk. selvstændige værelser med 1 stort nyt køkken til deling med 2 vaske 2 komfurer samt 2 stk. fælles køleskabe og eget skab med lås (på alle værelser er eget køleskab)
Der udover er køkkenet fuld møbleret med gryder potter og pander samt service til alle 
Fælles rum er ligeledes møbleret incl. tv i 2 stk. af dem.
Der er 2 stk. badeværelser med bad toilet samt vaskemaskine og tørretumbler.
I alle fælles arealer er der indregnet 2 gange ungeligt rengøring 
I huslejen er inkluderet el-vand-varme og fri internet",https://www.boligportal.dk/v%C3%A6relser/k%C3%B8benhavn/19m2-1-vaer-id-5369374
"Rantzausbakke, 8700 Horsens  - 1. sal",Horsens,Rantzausbakke,8700,55.87463,9.802634,9.700 kr.,250 kr.,103 m²,4,1.,Lejlighed,Nej,Ja,Ja,Ja,Ja,Nej,Ja,Nej,A,"Rummelig fireværelses lejlighed med stort køkken-alrum, gode værelser, stilrent bad og egen altan.

Køkken og stue
Lejligheden er opført med et stort og lyst køkken-alrum, hvor det stilrene køkken ligger i en vinkel, der giver en naturlig opdeling mellem køkken og stue. Køkkenet er i hvide HTH-elementer og indeholder alt i hårde hvidevarer. I alrummet er der desuden god plads til både spisebord samt et stueområde med sofa.

Værelser
Fra alrummet er der adgang til boligens soveværelse, der er indrettet med tre faste skabe samt dobbeltseng. Dertil har lejligheden to lige store værelser, der ligger side om side. Begge værelser har et garderobeskab og indeholder plads til både skrivebord og en seng.

Badeværelse
Fra lejlighedens entré er der adgang til et moderne badeværelse med bruseniche, toilet, håndvask samt opbevaring.

Entré
Lejligheden byder velkommen gennem en entré med et enkelt garderobeskab. Entréen har god plads til opbevaringsløsninger til både overtøj og fodtøj.

Uderum
Fra alrummet er der udgang til boligens egen altan, hvor der er plads til udemøbler, blomsterkrukker eller en grill.

Depot/skur
Til lejligheden hører der et skur med. Skuret er ikke isoleret.

Husdyr
Det er tilladt at have op til max. 2 husdyr i lejemålet. 

Fibernet
Der er lagt fibernet i boligen. 

Parkering
Der er mulighed for at parkere sin bil på de fælles p-områder, som er gratis. 

Forbrug / Aconto
Der opkræves 250 kr. vand i aconto. 
El og varme afregnes direkte med forsyning.

* Billederne er vejledende",https://www.boligportal.dk/lejligheder/horsens/103m2-4-vaer-id-5330827
