Adress,City,Street name,Postal code,Latitude,Longitude,Monthly rent,Aconto,Square meters,Rooms,Floor,Property type,Furnished,Shareable,Pets allowed,Elevator,Senior frendly,Only for students,Balcony/Terrace,Parking,Energy label,Description,Link
"Silkeborgvej, 8230 Aarhus, Åbyhøj  - 2. sal",Aarhus,Silkeborgvej,8230,56.155437,10.167333,9.585 kr.,550 kr.,76 m²,3,2.,Lejlighed,Nej,Ja,Nej,Nej,Nej,Nej,Ja,Ja,N/A,"Nyrenoveret 3-værelses lejlighed på 2. sal med altan.
Boligen er på 76 kvm. - som er indrettet med:
- Køkken med opvaskemaskine.
- Fra køkkenet er der adgang til en hyggelig altan mod gården.
- Stor stue mod Silkeborgvej.
- 2 værelser.
- Badeværelset er med brusekabine samt vaskemaskine og tørretumbler.
- Depotrum i kælder
- Cykel- og fælles bilparkering samt hyggeligt gårdmiljø lige uden for døren. 
Pris. 9.585 kr. mdr / Depositum 28.755 kr. / Forbrug vand/ varme 550kr + El som afregnes direkte til leverandøren.
Mulighed for overtagelse fra 15/8, dog senest 1/10-23",https://www.boligportal.dk/lejligheder/aarhus/76m2-3-vaer-id-5294893
"Aagade, 9240 Nibe, Vegger",Nibe,Aagade,9240,56.886299,9.569388,4.200 kr.,500 kr.,100 m²,3,-,Hus,Nej,Nej,Nej,Nej,Nej,Nej,Ja,Ja,C,"Her får du en dejlig lejlighed i stueplan, med stor overdækket terrasse, dejlig lukket have, overdækket parkering, vaskerum og opbevaring i kælder.
I lejligheden har du entre, stue med plankegulv, køkken med udgang til terrasse, 2 værelser og badeværelse. 
Lejligheden er opvarmet med fjernvarme",https://www.boligportal.dk/huse/nibe/100m2-3-vaer-id-5373496
"Østergade, 7470 Karup J  - 1. sal",Karup J,Østergade,7470,56.307078,9.172487,3.800 kr.,850 kr.,59 m²,2,1.,Lejlighed,Nej,Nej,Nej,Nej,Nej,Nej,Nej,Nej,C,"Dejlig lejlighed på 1.sal
fælles have",https://www.boligportal.dk/lejligheder/karup-j/59m2-2-vaer-id-5335348
"Bispevænget, 5000 Odense, Odense C  - Stuen",Odense,Bispevænget,5000,55.403633,10.403389,5.360 kr.,500 kr.,55 m²,2,Stuen,Lejlighed,Nej,Nej,Nej,Nej,Nej,Nej,Nej,Nej,E,"Lejligheden rummer udover entré, køkken med plads til lille spisebord. Københavner badeværelse med brus. Fra entréen er der videre adgang til stuen og rummeligt soveværelse. Nye hvidevarer incl. opvaskemaskine og fryser. Mulighed for tøjvask i ejendommen.
En fin og lys indflytningsklar lejlighed.",https://www.boligportal.dk/lejligheder/odense/55m2-2-vaer-id-5268495
"Stefansgade, 8700 Horsens  - 1. sal",Horsens,Stefansgade,8700,55.868105,9.841832,4.722 kr.,600 kr.,51 m²,2,1.,Lejlighed,Nej,Nej,Nej,Nej,Nej,Nej,Nej,Nej,N/A,"Lejligheden, som er velegnet til flere personer, er en velindrettet to-værelses lejlighed på 51 kvm.
Her får du en yderst vel-beliggende placering i det hyggelige og fremadstormende Horsens. Ejendommen er beliggende i gå-afstand til indkøb og hyggelige caféer og spisesteder.

Du vil samtidig også befinde dig tæt ved byens mange uddannelsesinstutioner og offentlig transport.
Lejemålet er beliggende i velfungerende mindre ejendom med i alt 7 boliger.",https://www.boligportal.dk/lejligheder/horsens/51m2-2-vaer-id-5351512
"Pollenvænget, 8381 Aarhus, Tilst  - 1. sal",Aarhus,Pollenvænget,8381,56.185354,10.127601,6.800 kr.,600 kr.,54 m²,2,1.,Lejlighed,Nej,Nej,Ja,Ja,Ja,Nej,Nej,Ja,A,"Velkommen til Blomsterhaven! 


Beliggende på den tidligere GASA grund, der i sagens natur er døbt Blomsterhaven.

Her er du kun et kvarter fra Aarhus C, om det så er bus, cykel eller bil, du vælger som transportmiddel. Du får ligeledes fri parkering lige foran ejendommen!
Derudover byder boligen på en god planløsning med alt i hårde hvidevarer og et anvendeligt depotrum i ejendommens kælder.

Den flotte bebyggelse tegnet af Arkitema Architects passer med sine venlige etagespring og flotte teglstensfacader perfekt ind i områdets hyggelige landsbymiljø. Gårdrummet giver et fint sammenhæng i bebyggelsen og en fornemmelse af intimitet og nærhed, hvor der er plads til alle.
Området er særdeles attraktivt for både unge og studerende, ældre og børnefamilier, der søger en beliggenhed tæt på folkeskole, indkøb, offentlig transport og med kort afstand til midtbyen.

Kontakt os allerede i dag for en fremvisning!

Det er tilladt at have ét husdyr pr. lejlighed. Hunde må maks. veje 15 kg. som fuldvoksen og der skal søges tilladelse hertil.",https://www.boligportal.dk/lejligheder/aarhus/54m2-2-vaer-id-5363435
"Arresøvej, 8240 Aarhus, Risskov  - 1. sal",Aarhus,Arresøvej,8240,56.202572,10.234778,5.650 kr.,800 kr.,37 m²,1,1.,Lejlighed,Nej,Nej,Ja,Nej,Nej,Nej,Ja,Nej,N/A,"Tag del I fællesskabet

De moderne lejeboliger fordeler sig på 33-107 m2 og med 1-4 værelser. Variationen i boligerne og den gennemgående funktionelle indretning betyder, at der med garanti er en bolig, der matcher dine behov og dit sted i livet.Arresøhave henvender sig til dig, der er studerende, eller som lige har fundet din vej ud på arbejdsmarkedet. Det er både til dig, der er single, eller er en del af et boligsøgende par.Et hjem i rolige omgivelser med kort vej til altingI Risskov får du det bedste af alle verdener. Et bymiljø, der indbyder til ro og socialt nærvær med dine nærmeste – med kort vej til rekreative, grønne oaser og et dyp i havet. Alt sammen blot få kilometer fra Aarhus C.",https://www.boligportal.dk/lejligheder/aarhus/37m2-1-vaer-id-5317155
"Vorgodvej, 6920 Videbæk, Barde  - 1. sal",Videbæk,Vorgodvej,6920,56.099464,8.701924,3.800 kr.,0 kr.,63 m²,2,1.,Lejlighed,Nej,Nej,Ja,Nej,Nej,Nej,Nej,Nej,G,"Lejlighed, Vorgodvej, 6920 Videbæk, etage: 1. sal. Indeholder 2 værelser, et køkken og et badeværelse fordelt på 63 m2

Der er ikke nogle billeder endnu, da lejligheden er under renovering.",https://www.boligportal.dk/lejligheder/videb%C3%A6k/63m2-2-vaer-id-5364773
"Skovparken, 6000 Kolding  - 1. sal",Kolding,Skovparken,6000,55.505156,9.47742,6.640 kr.,1.211 kr.,108 m²,4,1.,Lejlighed,Nej,Nej,Nej,Nej,Nej,Nej,Ja,Nej,N/A,"Vi kan nu tilbyde denne bolig på 108 m2 beliggende i Kolding
For at kunne leje denne bolig, kræver det man er medlem af boligforeningen. På BoligPortal annonceres kun reelt ledige boliger uden eksisterende venteliste på annonceringstidspunktet. Venligst kontakt udlejer hvis du er interesseret i lejemålet.",https://www.boligportal.dk/lejligheder/kolding/108m2-4-vaer-id-5254566
"Kløverbladsgade, 2500 København, Valby  - Stuen",København,Kløverbladsgade,2500,55.655715,12.518916,9.708 kr.,0 kr.,8.6 m²,1,Stuen,Værelse,Ja,Ja,Nej,Nej,Nej,Nej,Nej,Nej,E,"We are offering a room plus a bathroom for a couple to live in our accommodation (2 CPR available). The place has two floors: main floor (comfortable kitchen and living room) and basement floor (the room and bathroom to rent). The location is close to Ny Ellebjerg Station and Valby Station for transportation, and a Spar and Lidl supermarkets are close. The place is residencial and quiet. No pets either smoking is allowed. The advance payment includes water, heating and internet.",https://www.boligportal.dk/v%C3%A6relser/k%C3%B8benhavn/8m2-1-vaer-id-5332754
"Sejrupvej, 7323 Give, Sejrup",Give,Sejrupvej,7323,55.881957,9.30804,8.500 kr.,600 kr.,207 m²,5,-,Hus,Nej,Nej,Ja,Nej,Nej,Nej,Nej,Nej,A,"Vores dejlige hus i Sejrup ved Give i Jylland er ledigt og her er plads til store armbevægelser i det 207 m2 store hus på den 1700 m2 store grund med en 70 m2 stor garage. Boligen opvarmes med en vand til luft varmepumpe og er top isoleret.

Der er 5 soveværelser, stor stue, stort køkken, stort badeværelse og stort bryggers og 'pæn' indgang. Er du et fornuftigt menneske må du gerne have dine husdyr med. Boligen ligger på landet med 4 km til skole og større by med butikker og offentlig transport kører lige til døren. Der er 30 minutters kørsel til Vejle og Herning, 45 minutter til Kolding og 60 minutter til Århus.

Er du interesseret så ring og få en snak.",https://www.boligportal.dk/huse/give/207m2-5-vaer-id-5042255
"Hovedgaden, 8961 Allingåbro",Allingåbro,Hovedgaden,8961,56.463609,10.324716,4.000 kr.,300 kr.,69 m²,2,-,Hus,Nej,Nej,Nej,Nej,Ja,Nej,Ja,Ja,G,"Boligen er et rækkehus beliggende i centrum af Allingåbro. Den vil være nyistandsat ved indflytning. Boligen er godt indrettet og der er to dejlige værelser og en stue/køkken med adgang til dejlig stor afskærmet og privat stenterrasse.

Boligen er opvarmet med ny og energivenlig varmepumpe.

A conto dækker vand.",https://www.boligportal.dk/huse/alling%C3%A5bro/69m2-2-vaer-id-5358712
"Alexander Foss Gade, 9000 Aalborg, Aalborg  - 2. sal",Aalborg,Alexander Foss Gade,9000,57.035693,9.935286,9.295 kr.,775 kr.,88 m²,3,2.,Lejlighed,Nej,Ja,Ja,Ja,Ja,Nej,Nej,Ja,A,"Her er muligheden for at leje en virkelig lækker 3-værelseslejlighed med tagterrasse.
Ejendommen ligger i den attraktive bydele “Eternitten”, hvor ejendommen er et af Dansk Eternit Fabriks gamle bygninger, som er ombygget og totalrenoveret til 29 skønne lejligheder med unikke spor fra de gamle facader.
Lejligheden er indrettet med lyse trægulve og store vinduespartier. Lejligheden er indrettet med et stort køkkenalrum og stue med fantastisk lysindfald fra begge sider, så man får opholdsrum med masser af dagslys.
Værelserne har indbyggede skabe og i soveværelset er der skydelåger, der gør det let at møblere. Derudover har lejligheden et forholdsvis stort badeværelser med bruseniche og vaskesøjle.
Hver bolig har fransk altan og adgang til en stor fælles tagterrasse med udsigt over området. Derudover er der mulighed for at indrette en hyggelig krog i de små udposninger på svalegangen, der leder ind til boligerne.
Der er indlagt fibernet i ejendommen, og der er mulighed for frit at vælge internetudbyder, der kan blandt andet vælges imellem Hiper, Kviknet og Fastspeed m.fl.
OBS: Billederne er fra en af ejendommens øvrige boliger, hvorfor indretningen kan variere fra dette lejemål.



Der medfølger en gratis parkeringslicens til lejligheden, der giver adgang til parkering på parkeringspladsen lige ved siden af ejendommen.



Det er ikke tilladt med husdyr i ejendommen, men der kan gives sær-tilladelse til en lille hund (ikke kat).",https://www.boligportal.dk/lejligheder/aalborg/88m2-3-vaer-id-5101668
"Dalgas Alle, 7800 Skive  - 1. sal",Skive,Dalgas Alle,7800,56.544775,9.023637,4.975 kr.,800 kr.,80 m²,3,1.,Lejlighed,Nej,Nej,Nej,Nej,Nej,Nej,Ja,Nej,N/A,"Stor lys stue med udgang til altan. Soveværelse og værelse med  nye hvide skabe. Nyere køkken med spiseplads, komfur, køle-/fryseskab, opvaskemaskine og emhætte. Nyt badeværelse november 2021. Nye hvide døre november 2021. Entre. Kælderrum. Der er parketgulve i lejligheden. Nye vinduer fra 2015. Energimærke D.
Jægerparken består af tre ejendomme beliggende få minutter fra Skive centrum. Der findes gode busforbindelser til både by og lokalområdet i ganske umiddelbar nærhed til ejendommen. Desuden findes der et større parkanlæg i tilknytning til ejendommen, samt et rigeligt antal parkeringspladser. Der er gode indkøbsmuligheder, restauranter/barer, børnehaver, skoler, indendørs badeland, sportsplads m.m. tæt på byggeriet.
Jægerparken rummer boliger i størrelser fra 50 til 112 kvm.",https://www.boligportal.dk/lejligheder/skive/80m2-3-vaer-id-4763000
"Finsensvej, 2000 København, Frederiksberg  - 2. sal",København,Finsensvej,2000,55.681188,12.51862,7.700 kr.,750 kr.,25 m²,1,2.,Lejlighed,Nej,Nej,Nej,Ja,Nej,Nej,Nej,Nej,A,"Velkommen til Blækhus Frederiksberg!
Blækhus Frederiksberg tilbyder 188 fantastiske og fuldt servicerede lejeboliger med eget tekøkken og badeværelse.
Bliv en del af Blækhus-fællesskabet.
Flotte fællesområder skræddersyet efter fællesskabets behov – her er der både plads til at studere og hygge sig.
Alle fællesrum er naturligvis udstyret med højhastighedsinternet!
En række fordele, der gør Blækhus Frederiksberg til et skønt sted at bo:
- Tagterrasse, perfekt til hyggelige stunder og med udsigt over København
- Fælleskøkkener, hvor du kan lave mad med dine venner
- Lounge- og arbejdsområder, hvor du kan fordybe dig i arbejdet eller studierne
- Gode fælleslokaler, hvor du kan hænge ud med dine naboer og venner
- Et yogalokale, hvor du kan pleje krop og sind
- Et moderne vaskeri med 5 vaskemaskiner og 3 tørretumblere",https://www.boligportal.dk/lejligheder/k%C3%B8benhavn/25m2-1-vaer-id-5228600
"Drewsensvej, 8600 Silkeborg",Silkeborg,Drewsensvej,8600,56.16479,9.548706,4.950 kr.,800 kr.,68 m²,2,-,Lejlighed,Nej,Nej,Nej,Nej,Nej,Nej,Nej,Nej,N/A,"Centralt beliggende lejlighed i 2 plan. Bestående af entre, badeværelse, Stue/køkken samt værelse på 1. sal.
Mulighed for at leje parkeringsplads til lejemålet.",https://www.boligportal.dk/lejligheder/silkeborg/68m2-2-vaer-id-5376598
"Dalgasgade, 6920 Videbæk, Troldhede",Videbæk,Dalgasgade,6920,55.993051,8.740219,2.978 kr.,980 kr.,28 m²,1,-,Lejlighed,Nej,Nej,Nej,Ja,Nej,Nej,Nej,Ja,D,"1 værelses lejlighed midt i Troldhede udlejes. 
Husleje incl. vand, ex. forbrug. Fri WIFI i hele bygningen. Forbrugsbetalingen reguleres i takt med pris-udviklingen stiger eller falder.

Troldhede er en aktiv lokalsamfund med skole/SFO mm., egen købmand i nye lokaler fra 2018. Rigt erhvervsliv i og omkring byen.

Rygning er ikke tilladt indenfor, ej heller fællesarealer. Udenfor er rygning tilladt - dog må skodder IKKE smides på grunden. 

Der betales DKK 1.350,00 for 3 stk. systemnøgler til lejemålet som naturligvis refunderes ved aflevering igen efter endt leje.
Navneskilt postkasse DKK 215,00. 2 kogeplader tilkøbes for DKK 249,00 til lejers ejendom.

Lejeprisen er baseret på 1 person.

Fælles møntvaskeri (Vask/tør). Det er IKKE tilladt at have egen vaskemaskine/tørretumbler eller dybfryser i lejemålet. Parkeringsmuligheder lige ved døren. Store fællesarealer ude som inde.  
Depotrum kan medlejes fra DKK 169,00 pr. måned (1,5 m2 optil 40 m2, alt efter dit behov!)

Øvrige ledige lejemål i samme bygning:

Enkeltværelser med fælles køkken og bad
2 værelses lejligheder med eget køkken/bad
Depotrum, fra DKK 169,00 pr. måned.

Forudsætning for lejeaftalens indgåelse
Det er en forudsætning for aftalens indgåelse at lejer tilmelder betalingen til BetalingsService via lejers tildelte login på BoligManager sammen med 1. betalingen og kontraktunderskrift. Det oplyses at lejer IKKE kan tilmelde BetalingsService/PBS via egen bank. Underskrift senest 5 hverdage efter lejeren har modtaget aftalen - ellers bortfalder udlejers tilbud og lejemålet kan lejes ud til anden side. Betaling af 1. betaling senest 5 hverdage efter underskrift - ellers kan udlejer udleje lejemålet til anden side. Er der tale om overtagelse af lejemålet med kort varsel skal underskrift/betaling og tilmelding til BetalingsService være udført inden nøgler kan udleveres til lejer. Det er desuden en forudsætning at lejer ikke er registreret i RKI.",https://www.boligportal.dk/lejligheder/videb%C3%A6k/28m2-1-vaer-id-5342448
"Warmingsgade, 6000 Kolding  - Stuen",Kolding,Warmingsgade,6000,55.486887,9.467227,6.200 kr.,600 kr.,70 m²,2,Stuen,Lejlighed,Nej,Nej,Nej,Nej,Nej,Nej,Nej,Nej,A,"Lækker 2 vær. lejlighed i nyere ejendom, 5 min. gåafstand fra centrum. Indeholder alt i hvidevarer, trægulve/klinkegulve m/gulvvarme overalt",https://www.boligportal.dk/lejligheder/kolding/70m2-2-vaer-id-3156129
"Vestergade, 5000 Odense, Odense C  - 1. sal",Odense,Vestergade,5000,55.394815,10.38378,8.500 kr.,750 kr.,94 m²,2,1.,Lejlighed,Nej,Nej,Nej,Ja,Nej,Nej,Nej,Nej,C,"Charmerende ejendom fra 1947.

Ejdommen er beliggende i gågadesystemet lige i Odense bymidte, hvor Vestergade og Kongensgade mødes.

Ejendommen er i 5 etager med i alt 16 lejligheder fordelt på 2-4 værelser. I stuetagen er forretning ud til gågaden.

Der er altaner til følgende boliger:  

Vestergade 64 B, 2. dør 1.
Vestergade 64 B, 3 dør 1.
Vestergade 64 B, 4. dør 1.
Vestergade 64 B, 1, dør 4.
Vestergade 64 B, 2. dør 4.
Vestergade 64 B, 3. dør 4.
Vestergade 64 B, 4. dør 4.

Der er desuden fælles terrasse på 2. sal ud mod gården.

Udover offentlige parkeringspladser på gadeplan i de nærliggende gader er der  parkeringsmulighed i nærliggende Q-Park parkeringshus.  



For at komme i betragtning til boligerne bedes du ansøge boligen. Efterfølgende vil du blive inviteret til fremvisning. 


*****OBS: Billederne som vises er af en prøvebolig, hvorfor det ikke er sikkert disse er tilsvarende lejligheden*****

Acontoforbruget er fastsat ud fra forrige lejers forbrug.
Der tages forbehold for fejl og evt. lejereguleringer siden annoncens publicering.
Der vil blive indhentet oplysninger hos RKI og er man registreret hos RKI vil man ikke kunne leje boligen.",https://www.boligportal.dk/lejligheder/odense/94m2-2-vaer-id-5365229
"Skolegade, 5800 Nyborg  - 2. sal",Nyborg,Skolegade,5800,55.311914,10.794287,6.475 kr.,1.100 kr.,95 m²,2,2.,Lejlighed,Nej,Nej,Nej,Nej,Nej,Nej,Ja,Nej,F,"Fra hovedtrappe entré m/ludbehandlet trægulv, skoskab, dørtelefon.
Soveværelse m/ludbehandlet trægulv, skabe, vinduer mod gård.
Badeværelse m/klinkegulv og gulvvarme, vaskeskab, brusekabine.
2 stuer en suite m/ludbehandlede trægulve, palævinduer, stuklofter.
Køkken m/klinkegulv og gulvvarme, køl/frys, komfur, emhætte, opvaskemaskine.
Fra køkken adgang til 6 m2 altan og adgang til bagtrappe.
Teknikrum m/klinkegulv, vaskemaskine.
Adgang til fælles gårdareal med cykelskur.
Lejligheden er røgfri.
Henvendelse pr. mail gerne med telefonnummer.
Lejemålet har energimærket: Energiklasse F",https://www.boligportal.dk/lejligheder/nyborg/95m2-2-vaer-id-5285535
"Dannebrogsgade, 9000 Aalborg, Aalborg  - 2. sal",Aalborg,Dannebrogsgade,9000,57.052913,9.903666,9.900 kr.,0 kr.,113 m²,4,2.,Lejlighed,Nej,Ja,Ja,Ja,Nej,Nej,Ja,Ja,A,"Stor og flot lejlighed beliggende centralt i Aalborg. 

Lejligheden er i 2 plan og indeholder i stueetage:
Køkken med alt i hårde hvidevarer og i åben forbindelse med skøn lys stue, og værelse, soveværelse med skab og direkte udgang til god altan.  
1. plan
Lyst repos med udgang til privat tagterrasse samt 2 værelser

Lejligheden har gulvvarme i alle rum, samt varmegenvindingsanlæg, som sikrer frisk luft i hele lejligheden.
Lejligheden er beliggende centralt men tilbagetrukket fra byens aktiviteter, og med grønne fællesarealer lige udenfor døren

Depotrum i lun kælder, cykelparkering og fri adgang til fælles cykelværksted.

Mulighed for parkering",https://www.boligportal.dk/lejligheder/aalborg/113m2-4-vaer-id-5224706
"Brøndbyøster Boulevard, 2605 København, Brøndby  - Stuen",København,Brøndbyøster Boulevard,2605,55.660132,12.444245,9.600 kr.,1.000 kr.,37 m²,1,Stuen,Lejlighed,Ja,Nej,Nej,Ja,Nej,Ja,Ja,Nej,N/A,"(English description below)
Vi The Mark Kollegiet. Det er et fællesskab, en base, en familie – en ny hjemmebane. 

Vores værksteder og det gode håndværk er øverst på agendaen, hver dag hos os. Vi tror på det gode naboskab. Vi udfordrer altid på bæredygtighed. Og vi arbejder med fællesskab som udgangspunkt for alt, vi gør. 

Vores studieboliger er fuldt møblerede med eget badeværelse og tekøkken, så husk mulighed for boligstøtte. Og så kan du dele betalingen af dit depositum ud over de første 3 måneder du bor hos os. 

Der er adgang til alle fællesarealer og faciliteter. 
Bl.a. Fitness, bar, lounge- og caféområder med bordtennis, billiard, dart, bordfodbold, der er fælleskøkkener, reception, og værksteder som f.eks. cykelværksted, metalværksted, snedkerværksted og meget mere. 


Vi glæder os til at høre fra dig! 

OBS! Du skal være studerende på den ene eller anden måde.
Vi tror på, at forskellighed fremmer et stærkere fællesskab. Derfor satser vi på at ramme bredere, og på den måde putte flere farver på vores maleri. 
_________________________________________________

We are The Mark student housing. It's a community, a home base, a family - a new stomping ground. 

Our workshops and craftsmanship is at the top of our agenda. We believe in a strong relationship between neighbors. We have a strong focus on sustainability. And we work with the community as the focal point for everything we do. 

Our student apartments are fully furnished with their own bathroom and kitchenette, so remember the possibility of ""boligstøtte"" (housing benefit). And you can split the payment of your deposit into three parts, the first 3 months you live with us. 

There is access to all common areas and facilities. 
Fitness, bar, lounge- and café areas with table tennis, billiards, dart, foosball, common kitchens, reception and workshops including bike-, metal-, wood workshop and much more. 


We look forward to hearing from you! 

ATTENTION: You must be a student of some variety to live at The Mark. We are exclusively student accommodation. 
We believe that diversity promotes a stronger community. Because of this, we aim to have a wide variety of nationalities, schools, fields of study, etc.",https://www.boligportal.dk/lejligheder/k%C3%B8benhavn/37m2-1-vaer-id-5356291
"Smallegade, 2000 København, Frederiksberg  - 4. sal",København,Smallegade,2000,55.678971,12.529637,18.500 kr.,1.100 kr.,107 m²,3,4.,Lejlighed,Nej,Nej,Nej,Ja,Nej,Nej,Ja,Nej,N/A,"Denne skønne penthouse lejlighed er beliggende i en klassisk ejendom fra omkring 1900-tallet, som er nænsomt renoveret helt i tråd med den eksisterende stil med blandet andet nyt tag, nye vinduer og døre. Ejendommen ligger på hjørnet af Smallegade og Hospitalsvej, med front mod Frederiksberg Rådhus og udsyn til Frederiksberg hav, og der er ydermere elevator i opgangen.
Lejligheden indeholder: Entré med fordelingsgang til lejlighedens stuer, køkken og værelser. En meget smuk og lys stue mod Smallegade. Skønt køkken med alle hårde hvidevarer og god skabsplads. To lyse værelser. Rummeligt badeværelse med bruseniche.",https://www.boligportal.dk/lejligheder/k%C3%B8benhavn/107m2-3-vaer-id-5282810
"Pollenvænget, 8381 Aarhus, Tilst  - 3. sal",Aarhus,Pollenvænget,8381,56.185621,10.127004,7.300 kr.,600 kr.,57 m²,3,3.,Lejlighed,Nej,Ja,Ja,Ja,Ja,Nej,Nej,Ja,A,"Velkommen til Blomsterhaven! 

Beliggende på den tidligere GASA grund, der i sagens natur er døbt Blomsterhaven.

Her er du kun et kvarter fra Aarhus C, om det så er bus, cykel eller bil, du vælger som transportmiddel. Du får ligeledes fri parkering lige foran ejendommen!
Derudover byder boligen på en god planløsning med alt i hårde hvidevarer og et anvendeligt depotrum i ejendommens kælder.

Den flotte bebyggelse tegnet af Arkitema Architects passer med sine venlige etagespring og flotte teglstensfacader perfekt ind i områdets hyggelige landsbymiljø. Gårdrummet giver et fint sammenhæng i bebyggelsen og en fornemmelse af intimitet og nærhed, hvor der er plads til alle.
Området er særdeles attraktivt for både unge og studerende, ældre og børnefamilier, der søger en beliggenhed tæt på folkeskole, indkøb, offentlig transport og med kort afstand til midtbyen.

Kontakt os allerede i dag for en fremvisning!

Det er tilladt at have ét husdyr pr. lejlighed. Hunde må maks. veje 15 kg. som fuldvoksen og der skal søges tilladelse hertil.",https://www.boligportal.dk/lejligheder/aarhus/57m2-3-vaer-id-5362143
"Billeshavehegn, 5500 Middelfart, Billeshave",Middelfart,Billeshavehegn,5500,55.533168,9.798518,10.618 kr.,600 kr.,112 m²,4,-,Rækkehus,Nej,Ja,Ja,Nej,Nej,Nej,Ja,Ja,N/A,"Rummelige og velindrettede rækkehuse placeret i skøn natur med træer, stier, masser af plads til leg. Husene ligger ved Strib Idrætscenter og tilbyder alt hvad en moderne familie ønsker.

Der er tale om en udstykning placeret på en grund med gamle træer og buske, en mindre sø, og et spændende kuperet terræn. Vi har udvikler til rekreativt område for alle beboere og med god afstand mellem boligerne, er der også plads til privatliv. 

Alle huse har ekstra loftshøjde og akustiklofter, som dæmper lyden og skaber godt inde  akustik miljø. Alle husene er også udstyret med højkvalitets hvidvare fra Miele. 

Vi har udarbejdet et mere detaljeret prospekt, som kan fremsendes til din mail (Se video)",https://www.boligportal.dk/r%C3%A6kkehuse/middelfart/112m2-4-vaer-id-5307971
"Rødkildevej, 8930 Randers, Randers NØ",Randers,Rødkildevej,8930,56.472787,10.066248,8.495 kr.,1.200 kr.,88 m²,3,-,Lejlighed,Nej,Nej,Nej,Nej,Nej,Nej,Nej,Nej,N/A,"FLYT IND MED LEJERABAT: Underskriv lejekontrakten inden 1. August 2023 og få to måneders gratis husleje (gælder ikke aconto-udgifter).

Rødkildevej er beliggende i den vestlige del af bydelen Dronningborg, i den nordøstlige del af Randers, også kaldt Dronningeparken. Ejendommen er opført i 2019, og består af 44 lejemål som er fordelt over 3 og 4 værelses lejligheder.

I denne treværelses lejlighed får du:


To gode soveværelser
Stort køkkenalrum med alle hårde hvidevare, og i åben forbindelse med stuen
Egen have med terrasse
Badeværelse med vaskesøjle
Eget skur
Gratis parkering

Lejevilkår:


Det er ikke tilladt at have husdyr
Det er ikke muligt at leje boligen, hvis du er registreret i RKI.

* Bemærk at billederne ikke nødvendigvis er taget af/fra den pågældende bolig, og at udsigt m.v. derfor kan variere.

Området:

Rødkildevej er beliggende i den vestlige del af bydelen Dronningborg, i den nordøstlige del af Randers, også kaldt Dronningeparken.

Nærområdet tilbyder et bredt udvalg af indkøbsmuligheder, heriblandt Netto & Rema 1000.

Området tæller blandt andet både Østervangsskolen & Rismølleskole, samt børnehaven Skovly. Derudover er Regionshospitalet Randers beliggende blot få hundrede meter fra ejendommen.

Der er hurtig adgang til Randers centrum , blot 5 minutters kørsel i bil, og gode busforbindelser .

OBS. Der er ikke elevator til lejlighederne i nr. 46,48,50 & 52.

Læs mere om ejendommen herunder.",https://www.boligportal.dk/lejligheder/randers/88m2-3-vaer-id-5242646
