Adress,City,Street name,Postal code,Latitude,Longitude,Monthly rent,Aconto,Square meters,Rooms,Floor,Property type,Furnished,Shareable,Pets allowed,Elevator,Senior frendly,Only for students,Balcony/Terrace,Parking,Energy label,Description,Link
"Rosengade, 9550 Mariager  - 2. sal",Mariager,Rosengade,9550,56.651311,9.979593,4.500 kr.,640 kr.,80 m²,4,2.,Lejlighed,Nej,Ja,Nej,Nej,Nej,Nej,Nej,Ja,D,"Hyggelig lejlighed beliggende i gåafstand til centrum og tæt på indkøbsmuligheder.  Lejligheden består af entre/mellemgang , køkken , bad , 3 værelser , samt en stue. i kælderen er der et opbevaringsrum og i gården er der mulighed for parkering.

Ring for en fremvisning",https://www.boligportal.dk/lejligheder/mariager/80m2-4-vaer-id-5355568
"Fredensgade, 9870 Sindal",Sindal,Fredensgade,9870,57.47248,10.203228,4.306 kr.,1.000 kr.,79 m²,3,-,Rækkehus,Nej,Nej,Nej,Nej,Nej,Nej,Nej,Nej,N/A,"Lejligheden er beliggende centralt på hovedgaden i Sindal tæt på indkøbs- og transportmuligheder.
Hårde hvidevarer: komfur og emhætte.
El afregnes direkte til Energi Nord.",https://www.boligportal.dk/r%C3%A6kkehuse/sindal/79m2-3-vaer-id-5038748
"Niels Brocks Gade, 8900 Randers, Randers C  - 1. sal",Randers,Niels Brocks Gade,8900,56.461965,10.044523,2.750 kr.,700 kr.,54 m²,2,1.,Lejlighed,Nej,Nej,Nej,Nej,Nej,Nej,Nej,Nej,N/A,"Lejesagsnummer 1-107-2

Tæt ved centrum, men alligevel roligt beliggende i Tøjhushavekvarteret, forefindes denne 2-vær. lejlighed.

Lejligheden er indrettet med entré, god stue, lille toilet, soveværelse med bruseniche samt godt køkken. 
Fælles baghave.

Vaskeri: kr. 95,- mdl.

Der er indgået aftale med Norlys Fiber om installation af fiber i ejendommen. Dette forventes klart i løbet af året.",https://www.boligportal.dk/lejligheder/randers/54m2-2-vaer-id-4826599
"Drejergårdshaven, 8722 Hedensted",Hedensted,Drejergårdshaven,8722,55.761784,9.694412,10.695 kr.,300 kr.,109 m²,4,-,Hus,Nej,Nej,Ja,Nej,Nej,Nej,Nej,Nej,N/A,"Super fint pyramidehus i mursten med stor carport og skur. Boligen er opført i 2022 med gulvvarme i alle rum. Boligen indeholder bryggers, køkken/alrum med Svane køkken, soveværelse, 2 værelser og stue. Der er udgang til have og terrasse fra stuen. Fra bryggers er der udgang til carport med redskabsrum.


Obs. billederne og plantegninger er vejledende

Området:

I Hedensted er du tæt på både byliv, butikker, skole og daginstitutioner. Byens togstation, Hedensted Station, ligger midt i byen, og skal du på motorvejen, når du E45 på knap 10 min.

Rigt byliv Hedensted danner grundlag for et rigt butiks- og byliv, hvor man kan finde alt fra både dagligvarebutikker til detailbutikker til både mænd, kvinder og børn. Herudover er der et bredt udvalg inden for bogforretninger, blomster, apotek og sport tilbehør. Herudover er der Hedensted Centret, hvor du finder både fitness, svømmehal samt flere idrætsforeninger.

Uddannelse i fokusHedensted nyder borgerne godt af de uddannelses-, job- og kulturtilbud, som de store byer i nærheden byder på, og på det handelsliv og aktivitetsniveau, der er i Hedensted by.

Byen med sving iHedensted kalder sig selv for ’Byen med sving i’ - en dobbeltbetydning, der henviser til både borgernes aktivitetsniveau og den fysiske fremtoning med den gamle hovedlandevej A10, der snoede sig gennem Hedensted. Herudover er Hedensted kendt for sit golfmiljø, hvor mange af borgerne i byen samt gæster ofte besøger Hedensted Golf Klub.

Skoler og børnepasning Hedensted finder du 2 skoler - Stjerneskolen & Hedensted Skole. Herudover er der flere pasningstilbud til de mindre børn, både i form af børnehaver og dagplejere.

Daugårdstrand - offentlig badestrand Denne strand har været nævnt i flere bøger over Danmarks seværdigheder på grund af dets kuperede bakketerræn ned til Vejle Fjord - og stranden har flere år i træk fået tildelt det Blå Flag. Der er ca. 5 km fra Hedensted by til Daugårdstrand.

Værd at videDe lokale anbefaler følgende steder i Hedensted: - Put & Take fiskesøerne - Hedensted søerne - Sepperup statsskov- Majfesten (årets byfest)",https://www.boligportal.dk/huse/hedensted/109m2-4-vaer-id-5373915
"Vestergade, 8600 Silkeborg  - 1. sal",Silkeborg,Vestergade,8600,56.167996,9.544624,8.500 kr.,1.500 kr.,120 m²,3,1.,Lejlighed,Nej,Nej,Nej,Nej,Nej,Nej,Ja,Nej,N/A,"Lejligheden ligger i hjertet af Silkeborg.  Alt er tæt på - gågade, cafeer, indkøbsmuligheder, gåture ved søen, offentlig transport mv. 

Der er en stor stue med plads til både sofagruppe og spisebord og med udgang til en lille altan med skønt kig mod vest, øst og nord. Stuen har store vinduer og masser af lys og udsigt til Lunden og Odden. 

Der er 2 store værelser der er lette at møblere - et mod Vestergade og et mod Hostrupsgade. 

Køkkenet er stort med opvaskemaskine, der er et velindrettet badeværelse med plads til vaskemaskine og tørretumbler og der er en dejlig rummelig entre med masser af indbyggede skabe.

Lejligheden er nymalet, har nye gulve og er i god stand. Der er en lille altan og der er ingen genboer, så der er masser af lys og udsigt til by, villaer og skov.

Lejligheden udlejes kun til ikke-rygere.

Interesserede bedes skrive til os med henblik på fremvisning.",https://www.boligportal.dk/lejligheder/silkeborg/120m2-3-vaer-id-4826610
"Skovparken, 6000 Kolding  - 2. sal",Kolding,Skovparken,6000,55.503635,9.477764,7.408 kr.,1.450 kr.,122 m²,5,2.,Lejlighed,Nej,Nej,Nej,Nej,Nej,Nej,Ja,Nej,N/A,"Vi kan nu tilbyde denne bolig på 122 m2 beliggende i Kolding
For at kunne leje denne bolig, kræver det man er medlem af boligforeningen. På BoligPortal annonceres kun reelt ledige boliger uden eksisterende venteliste på annonceringstidspunktet. Venligst kontakt udlejer hvis du er interesseret i lejemålet.",https://www.boligportal.dk/lejligheder/kolding/122m2-5-vaer-id-5329514
"Sommerlystgade, 8700 Horsens  - Stuen",Horsens,Sommerlystgade,8700,55.865902,9.858612,5.680 kr.,600 kr.,71 m²,3,Stuen,Lejlighed,Nej,Nej,Nej,Nej,Nej,Nej,Nej,Nej,N/A,"Stue etage Lejlighed som ligger i et rolig område i Horsens city. Denne lejlighed passer bedst til en enkel person, et par voksne eller et voksen og et barn.
Lejligheden ligger tæt på musseet, svømehallen, Casa Arena, 3 gode skole, Learnmark Horsens, mm. For eksempel på 10 minutter gåben kan man nå Byens By hvor der er mange indkøbs muligheder, frisører, restauranter og læge. Horsens togstationen og trafikterminallen er også på en gå afstand.

Lejligheden består af:
- Et soveværelse m. en suite badeværelse 
- Et sprit nyt køkken med en nyt køkkenvask med en drypbakke, nyt køleskab, Komfur/oven, emhætte og vaskemaskine/tørretumbler. 
- Stue
- Alrum
- Inedørs cykelrum
- Opbevaringskælder
- Adgang til en god Fælles baghaven
- Har man en bil, kan man parkere den ved gaden. 

Vil du gerne se lejligheden? Kontak mig her i Boligportal eller ring/skriv en sms besked til det oplyste mobil nr.",https://www.boligportal.dk/lejligheder/horsens/71m2-3-vaer-id-5235958
"Langstrømpevej, 8600 Silkeborg  - 1. sal",Silkeborg,Langstrømpevej,8600,56.193145,9.517568,8.795 kr.,N/A,126 m²,4,1.,Lejlighed,Nej,Nej,Ja,Nej,Nej,Nej,Nej,Nej,N/A,"FLYT IND MED RABAT:Netop nu tilbyder vi en særlig lejerabat på en lejebolig på langstrømpevej. Underskriver du lejekontrakt inden 1. September 2023, får du to måneders gratis husleje (gælder ikke a conto-udgifter)..
Her finder du 84 moderne rækkehuse og lejligheder med skøn placering i Silkeborg som især er kendt for Søhøjlandets mange outdooroplevelser og unikke kulturelle events.Lejeboligerne er indrettet moderne og har gode, funktionelle værelser og stort køkkenalrum.
I denne bolig med 4 værelser får du:

Rummeligt køkkenalrum med hvide HTH -elementer og alt i hårde hvidevarer

Flotte egetræsgulve

     Lyst badeværelse

Stor stue med udgang til altan/have

Rummeligt bryggers vaskemaskine og tørretumbler

     HTH-elementer i værelser

Boligen ligger 5 km fra Silkeborg centrum. Ca. 1 km. til den nye motorvej og herfra er der under en halv times transport til Aarhus og Herning.Både i bil, på cykel og med offentlig transport har du let adgang til centrum af byen og andre indkøbsmuligheder i nærheden.

Området:

Buskelund-området ligger i et naturskønt og kuperet område mellem Balle og Hvinningdal med en naturlig sammenhæng mellem de tre byområder. Denne attraktive og forholdsvis nye bydel har alt, hvad der er brug for i hverdagen: skoler, daginstitutioner, idrætsfaciliteter og indkøbsmuligheder.

Via stisystem er det muligt at nå til skole uden at skulle krydse Nordre Højmarksvej. Området er generelt roligt og børnevenligt med legepladser og et godt stisystem.

Med kun 1 km til motorvejen, kan man nå til Aarhus eller Herning på kun ½ time.

Kort afstand til skov og natur giver mulighed for gode naturoplevelser og en aktiv fritid.

Med kun 5 kilometer til Silkeborg centrum er der nem adgang til bylivets faciliteter som café, restauranter og specialbutikker.

ÅBENT HUS:
 - Søndag den 20. august 2023, kl. 14:40-15:10

OBS: Venligst hold dig opdateret, da der godt kan forekomme ændringer.",https://www.boligportal.dk/lejligheder/silkeborg/126m2-4-vaer-id-5363905
"Torvet, 4100 Ringsted  - 2. sal",Ringsted,Torvet,4100,55.445012,11.789394,11.500 kr.,1.000 kr.,110 m²,3,2.,Lejlighed,Nej,Nej,Nej,Nej,Nej,Nej,Nej,Nej,D,"Dejlig 4 vær. lejlighed midt i centrum med god udsigt til Torvet og Sct. Bendts kirke.

Lejligheden indeholder : Indgang med trappe til 2.sal fra 1.sal - entre - gang - pænt badeværelse med brusekabine, wc og skabsarrangement med håndvask, lyst hvidt køkken - soveværelse, opholdsstue, værelse samt stort disponibelt rum på 3.sal via smal trappe fra opholdstuen.

Der er fælles gårdhave og dørtelefonanlæg.",https://www.boligportal.dk/lejligheder/ringsted/110m2-3-vaer-id-5023487
"Huslodsvej, 7000 Fredericia  - 1. sal",Fredericia,Huslodsvej,7000,55.574884,9.760694,8.000 kr.,0 kr.,67 m²,3,1.,Lejlighed,Ja,Nej,Nej,Nej,Nej,Nej,Ja,Ja,A,"KONTAKT OS FOR AT BOOKE EN FREMVISNING ELLER MELD DIG TIL ÅBENT HUS HVER TORSDAG FRA 15-16.

Denne bolig er beliggende på 1. sal og rummer 2 værelser og køkken/stue/alrum, badeværelse samt skøn altan. Du har mulighed for at tage din lille hund eller kat med, skal dog godkendes af udlejer. 

Nymarkshaven er stilrene, velindrettede lejeboliger tæt på det hele. Størrelserne på boligerne er fra 56-136 m2, og selve indretningen gør dem velegnede til både singler, seniorer og små og store familier. 
Alle lejlighederne er velindrettede med bl.a. flot hvidt køkken i åben forbindelse med stuen, lækkert badeværelse med vaskesøjle. Der er masser af lysindfald i lejlighederne, og alle har adgang til egen lille terrasse eller altan.

Materialevalget understøtter bebyggelsens generelle moderne nordiske stil. Opholdsrummene har rustikke asketrægulve, som er både smukke og praktiske.
Køkkenelementer er i minimalistisk design fra Invita i modehvid. Grebene er indfræsede og optager dermed ikke plads, men giver i stedet både rene linjer og høj funktionalitet. Alle hårde hvidevarer er fra Siemens.

Badeværelserne er enkelt og tidløst indrettede med god plads til de installerede vaskemaskiner og tørretumblere fra Siemens. Badeværelserne har flotte klinker på gulv og i bruseniche. Vægge og lofter er malet hvide, så du let kan sætte dit eget individuelle præg på rummet.
Hver lejlighed har eget depotrum, der er fælles parkeringsplads samt fælles orangeri/væksthus, som indbyder til at mødes og hygge sig i hinandens selskab, mens børnene leger og bruger deres energi i trygge omgivelser. 

Området fremstår meget indbydende og veletableret med grønne arealer, træer og hyggelige kroge. I området er der nemt afgang til både Brugsen samt Netto – og så er der kort afstand til Øster Strand, Volden samt gågaden. 

Så med en beliggenhed i Nymarkshaven er du tæt på mange ting og ikke mindst et godt naboskab. Det er også værd at fremhæve, at motorvejene E45 og E20 gør det nemt at komme videre til sit destinationsmål.  

OBS. billederne viser vores udstillingslejlighed og ikke nødvendigvis den pågældende lejlighed. 
**Plantegningen er vejledende og uden ansvar.",https://www.boligportal.dk/lejligheder/fredericia/67m2-3-vaer-id-5246696
"Lysmosevænget, 8600 Silkeborg",Silkeborg,Lysmosevænget,8600,56.156303,9.506439,8.900 kr.,0 kr.,117 m²,4,-,Lejlighed,Nej,Ja,Ja,Nej,Nej,Nej,Nej,Ja,A,"Dejlig energivenlig bolig på 117 m2, i naturskønne omgivelser i Lysbro - 3 km fra Silkeborg centrum. Ca. 1,5 km til motorvej.
 
Boligen ligger på 1. sal og indeholder soveværelse med 4 faste skabe, 2 værelser med skab, køkken-alrum i åben forbindelse med stuen, stort badeværelse, samt kombineret entré/bryggers.

Boligen har loft til kip, en fransk altan samt en lille repos ved opgangstrappen.

Alt i hårde hvidevarer. 

Boligen vil, med de hvide HTH elementer, hvide vægge, ege trægulve, lyse trælofter og store vinduespartier - komme til at fremstå meget lys og indbydende.

Forbruget afregnes direkte til forsyningsværkerne. Varmekilde er fjernvarme.

Husdyr tilladt op til 2 stk. efter aftale.

Netop opført legeplads på et af områdets grønne arealer.",https://www.boligportal.dk/lejligheder/silkeborg/117m2-4-vaer-id-5294126
"Otiumsvej, 4700 Næstved  - 1. sal",Næstved,Otiumsvej,4700,55.2333,11.747248,3.850 kr.,950 kr.,38 m²,1,1.,Lejlighed,Nej,Nej,Nej,Nej,Nej,Nej,Nej,Nej,E,"I Herlufsholmkvarteret tæt på centrum ( på Otiumsvej ) udlejes 1. vær. nyistandsat lejlighed på ca. 40kvm.
Lejligheden indeholder entré med et mindre skab, køkken med hårde hvidevarer, toilet og pæn stor stue med parketgulv. Indtil planlagt ombygning er afsluttet, er der fælles bad i kælderen.
Vaskemaskine forefindes i kælderen, tillige med tørrepladser inde og ude.
Der kan yderligere lejes et kælderrum efter nærmere aftale.
Ejendommen er beliggende i et roligt kvarter, tæt på indkøbsmuligheder, svømmehal og offentlige transportmuligheder.
Der er endvidere kort afstand til skov og Susåen mv.
Inden en evt. fremvisning kan aftales - finde sted, så send venligst en mail til udlejer om lejemålet, hvorefter du vil få tilsendt et spørgeskema, som skal besvares.
SMS-beskeder besvares ikke!",https://www.boligportal.dk/lejligheder/n%C3%A6stved/38m2-1-vaer-id-2159890
"Hollænderen, 5250 Odense, Odense SV  - 3. sal",Odense,Hollænderen,5250,55.362706,10.375831,12.619 kr.,850 kr.,113 m²,4,3.,Lejlighed,Nej,Ja,Nej,Ja,Ja,Nej,Ja,Ja,N/A,"25% byggepladsrabat af huslejen til og med september 2023, hvor vi forventer et mere færdigudviklet område samtidigt med at Netto åbner til september.
Lejligheden indeholder 3 rummelige værelser, stort køkkenalrum med adgang til den sydvendte altan samt et godt badeværelse. 

Boligen på Dalum Papirfabrik kommer til at være en del af en ny fantastisk grøn bydel i Odense med plads til alle generationer. Boligområdet ligger tæt på centrum, motorvejen E20, skole/idræts faciliteter masser af indkøbsmuligheder og grønne arealer.

De 93 lejelejligheder er fordelt på tre karakteristiske bygninger i gule sten fra Egernsund. Arkitekturen er med faste facaderytmer, tegldetaljer og genkendelige industrielle facadegrid, der fortæller områdets historie.

Lejlighederne er lyse og imødekommende i gedigne materialer og alle med sydvendt altan eller for så vidt angår stueetagen terrasseareal. Bygningerne er placeret med retning mod åen og lige ud til sydvendte, grønne arealer, der fletter boliger og natur sammen på fineste vis.

Alle lejeboligerne opføres for Niam med henblik på bæredygtighedscertificering til DGNB Guld fra Green Building Council Denmark.",https://www.boligportal.dk/lejligheder/odense/113m2-4-vaer-id-5368538
"Arresøvej, 8240 Aarhus, Risskov  - 1. sal",Aarhus,Arresøvej,8240,56.204172,10.230122,8.300 kr.,650 kr.,66 m²,3,1.,Lejlighed,Nej,Ja,Ja,Ja,Nej,Nej,Ja,Ja,N/A,"BOLIGERNE:
På Arresøvej 31-33 i Risskov Engby udlejer vi 167 lækre lejligheder fordelt på 2 separate bygninger. Lejlighederne varierer i størrelsesordenen 40-71 m2, og de 167 lejligheder er fordelt på 81 stk. 3-værelses lejligheder, 81 stk. 2-værelses lejligheder og 5 stk. 1-værelses lejligheder.

GRATIS HUSLEJE OG GAVEKORT TIL REMA 1000:
Der bliver eksklusivt givet 2 måneders gratis husleje samt et gavekort på 3000 kr. til Rema 1000 ved kontrakter der underskrives på lejlighed med overtagelse ""Snarest"".

INDE:
Alle lejligheder er opført med et lyst køkken/alrum med god plads til både at indrette sig med et lækkert køkken- og stueområde. I de 1-værelses boliger fungerer køkken/alrummet også som soveværelse, mens der i de 2- og 3-værelses lejligheder er mulighed for at indrette sig med et eller flere separate værelser. I alle typer lejemål er der rummelige og lyse badeværelser.

UDE:
Alle lejemål har egen terrasse eller altan - et overblik herover kan fås her.  

Ejendommen er opført som etagebyggeri bestående af henholdsvis 4 og 5 etager. På grunden er der etableret en dejlig og grøn gårdhave med god plads til hyggeligt samvær og grillarrangementer. Her er der blandet andet basketballbane og en balancebane, og der er plantet hække, buske og træer for at skabe det grønne miljø. 

HÅRDE HVIDEVARER:
Alle lejligheder indeholder køle- og fryseskab, opvaskemaskine, indbygningsovn, indbygningskogeplader med induktion, vaskemaskine og tørretumbler. 

HUSDYR:
Hund: Det er tilladt at holde hund i boligerne.*
Indekat: Det er tilladt at holde indekat i boligerne.*
Øvrige husdyr: Se vores samlede husdyrsregler her.

*Der skal altid udarbejdes en husdyrserklæring til det pågældende husdyr. Kontakt os for mere info, hvis du ønsker at holde husdyr i din bolig.

PARKERING:
Til ejendommen hører der 75 parkeringspladser + 2 handicappladser i overdækket parkeringsareal. Hvis du ikke har bil kan du trygt parkere din cykel i stueplan, hvor der er 222 cykelparkeringspladser. Der er elevator til parkeringskælderen i alle opgange pånær nr. 33. 

LEJEPRISER:
De viste lejepriser er de aktuelle lejepriser pr. dags dato. Go’Bolig forbeholder sig retten til at ændre lejepriserne på de udbudte lejligheder. For udlejede lejemål vil lejekontrakten bestemme den gældende leje og vilkår for lejemålet.",https://www.boligportal.dk/lejligheder/aarhus/66m2-3-vaer-id-5356418
"Myremalmsvej, 3060 Espergærde  - Stuen",Espergærde,Myremalmsvej,3060,55.986338,12.521524,13.745 kr.,1.000 kr.,96 m²,4,Stuen,Lejlighed,Nej,Nej,Ja,Nej,Nej,Nej,Nej,Ja,N/A,"Kom med indenfor i vores attraktive nyopførte lejeboliger i Espergærde. Boligerne er ideel til børnefamilien, såvel som seniorerne, der ønsker en hverdag i en moderne lejebolig i naturskønne omgivelser. 

Lejeboligerne er designet med jeres komfort i fokus. Moderne arkitektur og stilfuldt interiør skaber et indbydende og afslappende hjemmemiljø, hvor I kan skabe skønne familieminder. Hver lejlighed er rummelig og veludnyttet, og der er tænkt på en hver detalje.

Med den ideelle beliggenhed, fantastiske natur og komfortable boliger er vores nybyggede lejeboliger i Espergærde det perfekte hjem for både børnefamilier og seniorer. Tag det første skridt mod et liv fuld af glæde, fællesskab og naturskønne oplevelser!

Kontakt os i dag og lad os hjælpe jer med at finde jeres drømmebolig i Espergærde. Velkommen hjem!

Skovstykket er nyopførte og moderne lejeboliger, der er skræddersyet til børnefamilien såvel som seniorer. Ejendommen er beliggende i den nye ""by i byen"" i det charmerende område i Espergærde. Her forenes naturens skønhed med moderne bekvemmeligheder, hvilket skaber den perfekte ramme om jeres næste hjem. Med kort afstand til både skov og strand er der rig mulighed for at nyde naturen og den friske luft.

Vores skønne ejendom i Espergærde byder på tre- og fireværelses lejligheder samt 5- og 6-værelses rækkehuse. Boligerne er opført i lækre lyse og moderne materialer. Alle boliger har rummelige værelser, et skønt køkkenalrum, depotrum samt indbyggede skabe. Yderligere har alle boliger solrig altan eller terrasse. 

Ejendommen er klar til indflytning pr. 1. oktober 2023.",https://www.boligportal.dk/lejligheder/esperg%C3%A6rde/96m2-4-vaer-id-5376493
"Tøjhushavevej, 8900 Randers, Randers C  - Stuen",Randers,Tøjhushavevej,8900,56.463942,10.049261,6.850 kr.,800 kr.,64 m²,2,Stuen,Lejlighed,Nej,Nej,Ja,Ja,Ja,Nej,Ja,Ja,A,"Her kan I glæde jer til at flytte ind i en nyetableret lejlighed et stenkast fra lystbådehavnen, på en sjælden beliggenhed centralt i byen, men alligevel midt i fantastiske, grønne omgivelser og tøjhushaven lige ved døren. Byggeriet er opført i 2022, og forventes DGNB-certificeret. Materialer er af høj kvalitet. 

Denne fine 2-værelseslejlighed i stueetagen byder på et super indbydende køkken-alrum med Invita køkken. Herfra har man udgang til sin egen private terrasse. Herudover er der i lejligheden et super godt soveværelse og et stort badeværelse.  

Bemærk: Der opvarmes med fjernvarme og varmeforbruget er lavt.

Som noget helt særligt for dette byggeri, er der etableret gæsteværelser med plads til 4-8 sengepladser samt fælles bad og toilet (Mod gebyr). Dette giver en unik mulighed for ekstra plads, når familier og venner kommer på besøg. 

Til lejligheden hører brugsret til egen parkeringsplads samt et skur til opbevaring.

''Tøjhushavekvarteret'' er utrolig attraktivt grundet sin centrale beliggenhed i perfekt kombination med lokalmiljø, natur og vand.

El, vand og varme afregnes direkte med forsyningsvirksomheden, som også fastsætter acontobeløbene. De i annoncen oplyste beløb, er derfor blot anslået.

Kontakt ejendomsmægler EDC Trio for at høre nærmere om lejligheden og bestille en fremvisning.",https://www.boligportal.dk/lejligheder/randers/64m2-2-vaer-id-5343257
"Truevej, 8220 Aarhus, Brabrand  - Stuen",Aarhus,Truevej,8220,56.153782,10.100885,8.195 kr.,300 kr.,70 m²,3,Stuen,Lejlighed,Nej,Ja,Nej,Nej,Nej,Nej,Nej,Nej,A,"På Truevej i Gl. Brabrand har vi her fornøjelsen af at udbyde en skøn 3'er til leje.

Lejligheden som er opført i ultimo 2018, byder på 2 gode værelser, et stort køkken alrum, et godt badeværelse og en flisebelagt terrasse. Lejligheden byder endvidere på alt i hårde hvidevare. 

Materialerne er nøje udvalgt med bl.a. Svane køkken og egetræsgulve med zoneinddelt gulvvarme. Terrassen kan tilgås fra begge værelser samt køkken alrum.

Skal du være den nye lejer af denne skønne bolig? Så kontakt os allerede i dag for en fremvisning!",https://www.boligportal.dk/lejligheder/aarhus/70m2-3-vaer-id-4740143
"Degnejorden, 4320 Lejre, Højby",Lejre,Degnejorden,4320,55.598979,11.976192,13.905 kr.,0 kr.,103 m²,3,-,Rækkehus,Nej,Nej,Ja,Nej,Ja,Nej,Ja,Ja,N/A,"Degnejorden – en moderne landsby med fællesskaber som omdrejningspunkt. Nyt byggeri skyder op af jorden i Lejre.

Landskabet imellem boligklyngerne på Degnejorden, er tænkt som et naturområde med varieret beplantning i form af forskellige træer og buske på en bund af enggræsser og urter. Igennem naturområdet etableres der trampestier og mindre opholds- og aktivitetsområder.

82 lejeboliger fordelt på 3 forskellige boligtyper i ét eller 2 plan. Udover lejeboligerne bliver der frasolgt 13 huse. 

I området bliver der bygget 1 forsamlingshus og 5 fælleshuse. Der etableres der 143 parkeringspladser til fri afbenyttelse inkl. handicappladser. Der opsættes tilmed 2 el-lade standere, således at der kan oplades 4 elbiler ad gangen.

Der er indflytning i 3 etaper og indflytningen for den enkelte bolig vil fremgå af den pågældende annonce. 

Der er ikke noget a conto beløb der skal betales via udlejer, da vand leveres af FORS og husene opvarmes med varmepumpe, hvor lejer selv skal tilmelde sig en el leverandør. 

Alle hårde hvidevarer medfølger. 

Boligerne kan reserveres ved at deltage på åbent hus. Vi holder åbent hus ca. én gang om ugen indtil alt er udlejet. Ønsker du at deltage i det åbne hus, så kan du sende en besked via annoncen og vil modtage en invitation til det næstkommende åbne hus.
Indflytningsprisen skal betales umiddelbart efter modtagelsen af lejekontrakten.

Det vil ikke være muligt at besigtige andre boliger end prøveboligen inden indflytning og det er under ingen omstændigheder tilladt at opholde sig på byggepladsen uden en invitation til åbent hus.

Billeder, plantegning og tekst er vejledende.

Hvis du er registreret i RKI kan vi desværre ikke tilbyde dig lejligheden. Dette kontrolleres ved udarbejdelse af lejekontrakt.",https://www.boligportal.dk/r%C3%A6kkehuse/lejre/103m2-3-vaer-id-5347002
"Hovedgaden, 9640 Farsø, V Hornum  - 1. sal",Farsø,Hovedgaden,9640,56.830689,9.360684,3.100 kr.,1.000 kr.,60 m²,2,1.,Lejlighed,Nej,Nej,Nej,Nej,Nej,Nej,Nej,Ja,N/A,"Lejligheden  er renoveret december 2016. 
Entreen, som man kommer ind i, er der plads til at hænge overtøj og sætte fodtøj.
Fra entreen kommer man via skydedør ind i køkken-alrum, som fremstår lyst og med nyt lyst laminatgulv. Der er nyere køkken, med køle/fryseskab, emhætte, kogeplade og varmluftsovn.
Fra entreen er der adgang til soveværelset, der ligeledes fremstår lyst med nyt lyst laminatgulv og skabsplads. 
Fra soveværelset er der adgang til badeværelset med bruser.
En god lejlighed, der fremstår lyst og indbydende og som er praktisk indrettet.
I Vester Hornum er der købmand, og der er gode busforbindelser til Farsø og Aars, der begge ligger i en afstand af 11 km fra Vester Hornum.",https://www.boligportal.dk/lejligheder/fars%C3%B8/60m2-2-vaer-id-4850394
