Adress,City,Street name,Postal code,Latitude,Longitude,Monthly rent,Aconto,Square meters,Rooms,Floor,Property type,Furnished,Shareable,Pets allowed,Elevator,Senior frendly,Only for students,Balcony/Terrace,Parking,Energy label,Description,Link
"Jyllingevej, 2720 København, Vanløse",København,Jyllingevej,2720,55.690755,12.475397,5.100 kr.,0 kr.,15 m²,1,-,Værelse,Nej,Nej,Nej,Nej,Nej,Nej,Nej,Nej,N/A,"Skønt stort værelse tæt på Vanløse station i bofælleskab. Der er 3 afdelinger. Hver afdeling har ca. 6 værelser og deles om køkken, bad og fællesareal.",https://www.boligportal.dk/v%C3%A6relser/k%C3%B8benhavn/15m2-1-vaer-id-5364339
"Kristrupvej, 8960 Randers, Randers SØ  - 1. sal",Randers,Kristrupvej,8960,56.451272,10.045722,6.083 kr.,950 kr.,90 m²,3,1.,Lejlighed,Nej,Ja,Ja,Nej,Nej,Nej,Nej,Nej,N/A,"Stor lejlighed på Kristrupvej i renoveret ejendom, pænt og lyst køkken og badeværelse, trægulve, store og værelser. 

En indekat er tilladt.",https://www.boligportal.dk/lejligheder/randers/90m2-3-vaer-id-1474894
"Anna Anchers Gade, 8220 Aarhus, Brabrand  - 3. sal",Aarhus,Anna Anchers Gade,8220,56.157415,10.141021,5.495 kr.,450 kr.,41 m²,1,3.,Lejlighed,Nej,Nej,Nej,Ja,Nej,Nej,Nej,Ja,A,"Vi afholder Åbent hus i vores prøvebolig hver søndag fra kl. 11:45 - 12:15. Adressen er: Elna Munchs Gade 3, st. 1.


Ved Ringvejen ikke langt fra Aarhus C, er en helt ny urban, pulserende og attraktiv bydel ved at tage form, og i bygningerne har studie- og ungdomslivet de helt perfekte rammer.  
 
Bo til leje i en af bygningens 165 lejeboliger i de bedste materialer og kvaliteter, fordelt på 1-, 2- og 3-værelses lejligheder. Her er lækkert køkken og badeværelse, og plads til både sove-, hygge- og studiemiljø. I lejlighederne er der kælet for alle detaljer, så der kan stilles skarpt på studierne i helt nye og cool rammer.   

Alle lejeboligerne har udsigt til lyst, grønt gårdrum – og så er der altaner eller terrasser til næsten alle boliger. Bygningen er tegnet af Rambøll Arkitekter, er i fire etager og opført i sektioner af både lyse og mørke tegl, som giver bebyggelsen et eksklusivt og markant udtryk. Tre mørke og elegante taghældninger skaber depotrum til lejlighederne på toppen og giver huset sit helt eget look.  
 
GLÆD DIG til din nye, kommende studiebolig, midt i et innovativt og nyudviklet område med genial infrastruktur og masser af liv – tæt på storbyen
 
INDRETNING:
Denne lejlighed byder velkommen i en funktionel entré med plads til opbevaring af overtøj og sko. Køkkenet er åbent og integreret i opholdsområdet, der kommer med moderne materiale og tilstrækkelig opbevaringsplads. Badeværelset er funktionelt med separat bruseniche. Stuen er det centrale opholdsområde, indrettet med en behagelig sofa og underholdningsenheder. 
 
OBS! Billeder er fra lignende lejemål",https://www.boligportal.dk/lejligheder/aarhus/41m2-1-vaer-id-5367028
"Nørregade, 6580 Vamdrup  - 1. sal",Vamdrup,Nørregade,6580,55.430365,9.284882,6.300 kr.,1.100 kr.,100 m²,3,1.,Lejlighed,Nej,Nej,Nej,Nej,Nej,Nej,Nej,Nej,N/A,"Dejlig lys centralt beliggende lejlighed med adgang til lukket haven
Lejligheden har grebsfrit køkken , stort nyt badeværelse samt 3 værelser, stor gang og dejligt lyst køkken alrum.
Der er nye trægulve I alle rum",https://www.boligportal.dk/lejligheder/vamdrup/100m2-3-vaer-id-2947457
"Stadionvej, 6000 Kolding  - Stuen",Kolding,Stadionvej,6000,55.495144,9.453533,9.875 kr.,250 kr.,85 m²,4,Stuen,Lejlighed,Nej,Ja,Ja,Ja,Ja,Nej,Ja,Ja,A,"Ny og energivenlig fireværelses lejlighed med alt i hårde hvidevarer, lyst inventar og den skønneste natur lige i baghaven.

Køkken-alrum og stue
Den lyse fireværelses lejlighed er centreret omkring det åbne køkken-alrum, som forbinder både det lyse og moderne køkken med stuen. Køkkenet indeholder alt i hårde hvidevarer.

Værelser
Lejligheden er indrettet med tre gode værelser. Soveværelset indeholder tre faste garderobeskabe, mens de resterende værelser begge har et enkelt garderobeskab. Afhængigt af behov kan værelserne indrettes som soveværelser, børneværelser, gæsteværelse og kontor.

Badeværelse
Fra entréen er der adgang til et flot og moderne badeværelse, der indeholder bruseniche, toilet, håndvask med skabsplads samt vaskesøjle med vaskemaskine og tørretumbler.

Uderum
Lejligheden er opført med egen terrasse/altan, som ligger i forlængelse af køkken-alrummet.

El, vand og varme
El og varme afregnes direkte med forsyningsselskaberne.
Aconto vand kr. 250,00 pr. md.

Boligen opvarmes med fjernvarme og der er gulvvarme i alle rum. 
Der er installeret ventilationsanlæg til et bedre indeklima og boligen har trelags vinduer. Alt dette for at sikre at boligen har et lavt energiforbrug. 

Parkering
Der er mulighed for at parkere sin bil på den nærliggende fælles p-plads. Der etableres en el-ladestander med to udtag ved fællesparkeringspladsen. 

Antenne og netværk 
Boligerne opføres med fibernet. Der er frit valg af udbydere. 

Husdyr
To husdyr er tilladt efter forudgående aftale med udlejer.

N:B Billederne fra fra et andet projekt , som vi har opført. Der kan være forskel på placering af vinduer, døre  og materiale på loftet.",https://www.boligportal.dk/lejligheder/kolding/85m2-4-vaer-id-5351613
"Østre Havnegade, 9000 Aalborg, Aalborg  - 6. sal",Aalborg,Østre Havnegade,9000,57.047749,9.937506,7.800 kr.,911 kr.,81 m²,3,6.,Lejlighed,Nej,Ja,Nej,Nej,Nej,Nej,Ja,Nej,N/A,"Havnehusene byder på 72 lejeboliger med en perfekt placering i centrum af den nye spirende bydel, Østre Havn, der ligger lige ud til fjorden og samtidig tæt på byen og det pulserende liv.

Størstedelen af lejlighederne er 3-værelses, men du kan også vælge en af de lidt mindre med to værelser.

Alle lejligheder er lyse og imødekommende og indrettet i nordisk stil med hvide vægge, hvide lofter og flotte parkettrægulve, så du nemt kan sætte dit eget personlige præg med farver, møbler og design.

De største lejligheder har deres egne altaner, hvor du kan nyde udsigten over fjorden, mens de mindre lejligheder giver mulighed for at indrette en hyggelig udekrog på de solrige altangange, der fører ind til lejlighederne.

Med deres størrelse og placering er lejlighederne i Havnehusene den ideelle base for unge – både studerende og nyuddannede – eller par, der drømmer om deres eget sted tæt på både vand og byliv.

OBS: Billederne er fra prøveboligen, hvorfor de kan variere fra boligerne.",https://www.boligportal.dk/lejligheder/aalborg/81m2-3-vaer-id-4575030
"Engløbet, 2730 København, Herlev  - 3. sal",København,Engløbet,2730,55.721772,12.429926,11.700 kr.,850 kr.,76 m²,3,3.,Lejlighed,Nej,Nej,Ja,Ja,Nej,Nej,Ja,Ja,N/A,"Velkommen til englunden
Velkommen til denne charmerende 3-værelses lejlighed beliggende i en rolig og attraktiv del af Herlev. Med sin fine indretning, hyggelige atmosfære og bekvemme beliggenhed er denne lejlighed perfekt for dig, der ønsker et funktionelt hjem.
Lejligheden byder velkommen med en hyggelig stue i åben forbindelse med køkkenet, hvor du kan slappe af og nyde dit daglige liv. Den åbne planløsning skaber en rummelig fornemmelse, samtidig med at den rummer områder til spisning og afslapning. De store vinduer lader lyset strømme ind, og skaber en behagelig atmosfære i rummet.
Lejligheden har også to soveværelser. Begge værelser er tilstrækkeligt rummelige til at rumme en seng og opbevaringsløsninger til dine ejendele. Badeværelset er moderne og velindrettet med en bruseniche og vaskemaskine og tørretumbler.
Lejligheden ligger i et roligt kvarter i Herlev, der tilbyder en fredelig tilbagetrukkenhed. Samtidig er der let adgang til lokale butikker, restauranter, offentlig transport og cykelafstand til København.
Denne 3-værelses lejlighed i Herlev er ideel til en enkelt person, et par eller en lille familie, der ønsker et praktisk og hyggeligt hjem.
Derudover:
- Elevator i bygningen
- Depotrum til alle lejligheder
- Det er muligt at leje en p-plads i kælderen eller i terræn
Det med småt:
- Det er ikke tilladt at stå i RKI
- Kæledyr skal godkendes af udlejer
- Bemærk, at billedmaterialet ikke nødvendigvis stammer fra den pågældende bolig.",https://www.boligportal.dk/lejligheder/k%C3%B8benhavn/76m2-3-vaer-id-5376005
"Hovborgvej, 7200 Grindsted, Tofterup  - Stuen",Grindsted,Hovborgvej,7200,55.647949,8.820771,4.200 kr.,1.000 kr.,67 m²,2,Stuen,Lejlighed,Nej,Nej,Nej,Nej,Nej,Nej,Nej,Ja,E,"Dejlig lejlighed udlejes med Egen Garage og lille have kun til denne lejlighed.
Fra baggården kan man komme ind i lejligheden via lille baggang hvor man på højre hånd har badeværelse med bruseplads m.m.
Til venstre fra baggang kommer køkken med spiseplads og herfra adgang til den stor lyse stue hvorfra der også er en lille forgang som føre ud mod vejen.
Alt i alt en fin lejlighed som er indflytningsklar og som er beliggende i rolige omgivelser.
Fra køkken også adgang til det store soveværelse.
Der kan ikke sms på tlf men ring istedet eller skriv herinde på boligportalen.
Aconto dækker over varme og vand
El afregnes direkte til forsyningsværk",https://www.boligportal.dk/lejligheder/grindsted/67m2-2-vaer-id-5348681
"Hegnet, 4000 Roskilde, Himmelev",Roskilde,Hegnet,4000,55.657745,12.139771,17.800 kr.,1.200 kr.,141 m²,5,-,Lejlighed,Nej,Ja,Ja,Nej,Nej,Nej,Ja,Ja,N/A,"Velkommen til Ro’s Rækker!
Velkommen til Ro’s Rækker!
20 arkitekttegnede og familievenlige rækkehuse finder nu vej til Trekroner. Husene er opført efter energieffektive principper og byggeriet Svanemærkes. Boligerne har en moderne funktionalitet og opførtes med tidløse materialer. Sådan skaber Ro’s Rækker boliger for fremtiden.
Boligen byder på inventar fra HTH, hvor flotte, grebsfri flader skaber et neutralt udtryk. Det samme gør det lyse klinkevalg, som har matchende fuger for en flot sammenhæng. De slidstærke lamelplankegulve fra Moland er udført i egetræ, som er et holdbart materiale med et levende præg. Boligen opvarmes af gulvvarme, som kan justeres fra rum til rum.
Den moderne planløsning tilbyder et stort opholdsområde med køkken og stue i åben forbindelse. Der er spiseplads i køkkenet, mens stuen er nem at indrette, og I har udgang til have eller terrasse på begge sider af huset. Bryggerset udgør et selvstændigt rum i stueplan, mens førstesalen samler fire værelser omkring en repos. Ligeledes på første sal finder I boligens badeværelse, som byder på nøje udvalgt inventar fra Grohe, Danmixa, Danivit og Geberit. Endelig byder stueplan på et praktisk toilet, så førstesalen kan holdes helt privat, når I har gæster.
Udenfor finder I to parkeringspladser, som er forberedt til el-bil – helt i tråd med byggeriets kvalitet. Desuden kan I glæde jer til en dejlig have, der er etableret med flest mulige sydvendte kvadratmeter, så I har masser af sol op ad dagen. Her får I også et praktisk udhus.
Indflytning kan ske efter aftale.
Husdyr kan tillades med ansøgning.
*Bemærk at billederne ikke nødvendigvis er taget af/fra den pågældende lejlighed, og at udsigt m.v. derfor kan variere.",https://www.boligportal.dk/lejligheder/roskilde/141m2-5-vaer-id-5370155
"Torsøvej, 8240 Aarhus, Risskov  - 1. sal",Aarhus,Torsøvej,8240,56.204646,10.226479,7.900 kr.,500 kr.,59 m²,3,1.,Lejlighed,Nej,Ja,Nej,Ja,Ja,Nej,Ja,Nej,A,"Boligbebyggelsen er anden del af den ambitiøse og fremadskuende masterplan og lokalplan som der er udarbejdet for hele området.

I denne etape opføres der 92 private udlejningsboliger i varierende størrelser og typer fra 35 m² til 145 m².

Lejlighederne er fordelt på 1 værelses boliger, delevenlige 2-3 rums boliger, Town houses i 2 plan samt 3-, 4- og 5-værelses familieboliger.

Området er et nyt og eksklusivt område beliggende på en ny sidevej til Nordlandsvej i Risskov. Herfra er der kort afstand til natur, skov og strand, Egå Engsø, indkøbsmuligheder, skoler og daginstitutioner.

P-kælder under bygningen, med mulighed for leje
Tæt på bus og letbane
Opvarmet cykelkælder
Cykelværksted til fri afbenyttelse
Fælles gårdareal
Eget depotrum i opvarmet kælder
Elevator
Husdyr efter aftale
Kreaktivt værksted til fri afbenyttelse
Fællesrum/studie læserum
På få minutter kan man hurtigt via den nye letbane, som har stop kun 150 meter fra Hoveddøren, stå nede i centrum af Århus.

Bygningerne opføres i henholdsvis 3 og 4 etager.

For at skabe variation i byggeriet, vil byggeriet skiftevis være med tag med ensidig taghældning samt fladt tag. Desuden vil tagfladerne blive udført som grønne Sedumtage.

Facaderne mures op i 4 forskellige murstenstyper og med forskellig fugefarve. Ydermere forskydes facaderne ind og ud, samt der vil blive lavet forskellige murstensmønstre i murværket.

Vinduespartier udføres i vedligeholdelsesfri træ/alu-vinduer og hvor de er sorte udvendig og hvide indvendig.

Som en del af planen vil der blive etableret opholdsarealer oppe i det hævede gårdrum. Under gårdrummet placeres alle parkeringspladser, cykelparkering samt 3 m² depotrum tilhørende hver bolig.

Hver bolig har enten terrasse eller en stor altan. Til Penthouse lejlighederne tilhører der lukket gårdhave eller meget stor tagterrasse hvor der etableres udekøkken og Orangeri.",https://www.boligportal.dk/lejligheder/aarhus/59m2-3-vaer-id-5291387
"Ågade, 9000 Aalborg, Aalborg  - 2. sal",Aalborg,Ågade,9000,57.043746,9.921462,6.571 kr.,900 kr.,115 m²,3,2.,Lejlighed,Nej,Ja,Nej,Nej,Nej,Nej,Nej,Nej,N/A,"Rummelig 3-værelses lejlighed beliggende på Ågade, 9000 Aalborg. 

Lejligheden er beliggende centralt i Aalborg med kort afstand til gågaderne, Kennedy Arkaden, Kildeparken, diverse handlemuligheder samt offentlig transport. 

Lejligheden indeholder en stue, to værelser samt køkken og bad. 

Lejemålet overtages som beset.",https://www.boligportal.dk/lejligheder/aalborg/115m2-3-vaer-id-5370558
"Grønnegade, 9240 Nibe  - 1. sal",Nibe,Grønnegade,9240,56.984502,9.63546,6.950 kr.,1.150 kr.,88 m²,4,1.,Lejlighed,Nej,Nej,Nej,Nej,Nej,Nej,Ja,Ja,N/A,"Skøn bolig i roligt kvarter og handlemuligheder lige i nærheden.
Boligen indeholder stort køkken/alrum i forbindelse med stue, stort badeværelse og 3 værelser.
Der er egen p-plads og egen afskærmet terrasse (se billede)
Til boligen følger der et lille opbevaringsskur.",https://www.boligportal.dk/lejligheder/nibe/88m2-4-vaer-id-5257119
"Stadfeldtsvej, 8930 Randers, Randers NØ  - 2. sal",Randers,Stadfeldtsvej,8930,56.467586,10.053442,4.457 kr.,660 kr.,78 m²,2,2.,Lejlighed,Nej,Nej,Nej,Nej,Nej,Nej,Nej,Nej,N/A,"Lejemålet er beliggende på Stadfeldtsvej og består af 2 værelser samt køkken og bad. Lejemålet er 78 m2 og er klar til overtagelse snarest. Månedlig husleje er 4457 kr. og indskud beløber sig til 15900 kr. 

Send en besked, hvis lejemålet har fanget din interesse.
For at kunne leje denne bolig, kræver det man er medlem af boligforeningen. På BoligPortal annonceres kun reelt ledige boliger uden eksisterende venteliste på annonceringstidspunktet. Venligst kontakt udlejer hvis du er interesseret i lejemålet.",https://www.boligportal.dk/lejligheder/randers/78m2-2-vaer-id-5374849
"Søren Møllers Gade, 8900 Randers, Randers C  - 1. sal",Randers,Søren Møllers Gade,8900,56.462586,10.026038,5.700 kr.,700 kr.,102 m²,3,1.,Lejlighed,Nej,Nej,Nej,Nej,Nej,Nej,Nej,Nej,N/A,"I en meget flot og velholdt ejendom udlejer vi en 3 vær. lejlighed med fantastisk lysindfald og udsigt. Lejligheden er indrettet med  køkken inkl. opvaskemaskine samt keramisk komfur, varmluftsovn og kølefryseskab - vaskemaskine/ tumbler.

Flotte synlige stuk i stue. 

Desuden er der et stort badeværelse. 1 soveværelse og stor spisestue / stue. Lejligheden overtages nymalet og med nybehandlede gulve. 

Gode parkeringsforhold, dejlig baggård med eftermiddags- og aftenssol.

En lejlighed som parret perfekt til parret som ønsker massere af plads og fortsat bo i centrum. 

Kontakt os på boligportalen for yderligere info eller fremvisning. 

Obs. Billeder er taget af 2 forskellige lejere i lejligheden hvilket er grunden til den forskellige indretning.",https://www.boligportal.dk/lejligheder/randers/102m2-3-vaer-id-4436380
"Søren Frichs Vej, 8230 Aarhus, Åbyhøj  - 4. sal",Aarhus,Søren Frichs Vej,8230,56.150119,10.168749,5.950 kr.,350 kr.,34 m²,1,4.,Lejlighed,Nej,Nej,Nej,Ja,Nej,Nej,Ja,Ja,N/A,"På Søren Frichs Vej i Aarhus udlejer vi 156 skønne 1- og 2-værelses lejligheder i varierende størrelser mellem 34 og 54 m2.

INDE:
De 1-værelses lejligheder er funktionelle med et regulært rum med køkken- og spiseplads. Her er også plads til at indrette soveområde. De 2-værelses lejligheder har udover køkken/alrummet et separat værelse, som kan bruges til soveværelse. 

UDE:
Alle boligerne har - uanset størrelse - en privat altan.

HÅRDE HVIDEVARER:
Der er køleskab, komfur, ovn og opvaskemaskine samt kombineret vaskemaskine og tørretumbler i alle lejemål.

HUSDYR:
Katte: Lejere kan ansøge om tilladelse til at holde én indekat på adressen. Udekatte er ikke tilladt.
Hund: Det er ikke tilladt at holde hund.
Andre dyr: Kontakt os.

PARKERING:
P-pladser ved ejendommen kan tilkøbes for DKK 500 pr. måned.

FÆLLESAREALER:
På toppen af ejendommen findes en lækker, unik tagterrasse med fælleshus og lukket boldbane.

ELEVATOR:
Der er elevator i opgangen.

Området 
Ejendommen er en del af Åbyen - et helt nyt boligområde, der i disse år skyder op i Aarhus. Som navnet indikerer, ligger området i umiddelbar nærhed af Aarhus Å langs dens indløb fra Brabrandsøen mod Midtbyen. Området er placeret tæt på Åbyhøj, og fra Åbyen er der således ikke langt til rekreative områder som eksempelvis Åbyhøj Park, boldbanerne ved Åby Skole osv. 

Bor du i Åbyen, kan du på kort tid komme rundt i hele det centrale Aarhus. På gåben eller cykel kan du hurtigt tilbagelægge de knap 3 km til Midtbyen, ligesom der kun er et par kilometer til Aarhus BSS og lidt under 4 km til Universitetets hovedbygninger. Tilsvarende er der nem adgang til offentlig transport med et væld af buslinjer, der afgår i umiddelbar nærhed fra ejendommen. Er du i bil, er Åbyen ligeledes praktisk placeret med kort afstand til motorvejen.",https://www.boligportal.dk/lejligheder/aarhus/34m2-1-vaer-id-5053934
"Dyrehavevej, 5800 Nyborg  - Kælder",Nyborg,Dyrehavevej,5800,55.300892,10.780577,5.400 kr.,900 kr.,74 m²,2,Kælder,Lejlighed,Nej,Nej,Nej,Nej,Nej,Nej,Nej,Ja,N/A,"Fin lejlighed med køkken, badeværelse, værelse og stor stue.
Direkte adgang til terrasse og fælles have.

I udkanten af Nyborg, tæt på skov, vand og 15 minutters cykeltur til Nyborg station og centrum.",https://www.boligportal.dk/lejligheder/nyborg/74m2-2-vaer-id-4793807
"Saxogade, 4180 Sorø  - 1. sal",Sorø,Saxogade,4180,55.43309,11.560254,5.750 kr.,1.000 kr.,54 m²,2,1.,Lejlighed,Nej,Nej,Nej,Nej,Nej,Nej,Nej,Nej,D,"Med yderst central beliggenhed i Sorø, udlejes denne 2-vær lejlighed.

Indeholder entre, værelse, stue, pænt køkken og nyrenoveret badeværelse.

Lejligheden overtages nyistandsat og skal afleveres nyistandsat.

Hyggelig gårdhave.

Det er ikke tilladt at holde husdyr. 

3 mdr. depositum og 1 mdr. forudbetalt leje kan ikke fraviges/ afdrages.",https://www.boligportal.dk/lejligheder/sor%C3%B8/54m2-2-vaer-id-5259412
"Dalgasgade, 9000 Aalborg, Aalborg  - 1. sal",Aalborg,Dalgasgade,9000,57.049719,9.913653,6.900 kr.,700 kr.,96 m²,4,1.,Lejlighed,Nej,Ja,Nej,Nej,Nej,Nej,Ja,Nej,C,"Velholdt og nymalet lejlighed med egen altan midt i Aalborg ved Sygehus Nord. 
Velegnet til roligt par eller som delelejlighed for 2 eller 3 studerende. 
Indeholder 2 stuer, 2 værelser, bad, entre og køkken med vaskemaskine/tørretumbler, komfur, emhætte og kølskab.
Opbevaringsrum og cykelrum i kælderen. 
Hyggelig gårdhave.
Lavenergivinduer, så billig i varme. 
Lejligheden overtages nymalet.",https://www.boligportal.dk/lejligheder/aalborg/96m2-4-vaer-id-4447668
"Strucksalle, 6270 Tønder  - 1. sal",Tønder,Strucksalle,6270,54.93536,8.855349,3.800 kr.,1.000 kr.,52 m²,2,1.,Lejlighed,Nej,Nej,Nej,Nej,Nej,Nej,Nej,Nej,N/A,"Lejlighed Strucksalle på ca 52 m2 udlejes straks, lejligheden er nymalet og i god stand tæt på by, skole og indkøbsmuligheder der vil ikke blive givet tilladelse til husdyr 
Leje 3.800,00 kr
Forbrug a' conto varme 800,00 kr vand 200,00 kr mdr.",https://www.boligportal.dk/lejligheder/t%C3%B8nder/52m2-2-vaer-id-2708337
"Horsensvej, 8653 Them, Salten  - 1. sal",Them,Horsensvej,8653,56.08421,9.570283,6.700 kr.,0 kr.,108 m²,3,1.,Lejlighed,Nej,Nej,Nej,Nej,Nej,Nej,Ja,Nej,B,"Dejliglækker lejlighed tæt ved skole og handlemuligheder som består af stor stue, soveværelse, værelse. Køkken med plads til spisebord samt stort  badeværelse. Plads til vaskemaskine og tørretumbler i teknikrummet samt godt med skabsplads. Der er trægulve i hele lejligheden og gulvvarme i badeværelset. Ligger i en klynge med flere lejligheder hvor der er samvær med andre.
Der er udgang til en altan i stuen.
Fortjener at blive set",https://www.boligportal.dk/lejligheder/them/108m2-3-vaer-id-5365926
"Vittrup Hedevej, 9480 Løkken",Løkken,Vittrup Hedevej,9480,57.391338,9.794244,6.300 kr.,200 kr.,121 m²,4,-,Hus,Nej,Nej,Ja,Nej,Nej,Nej,Nej,Nej,N/A,"Huset ligger for enden af 300 m grusvej, med marker på alle sider og en skøn udsigt Der er en lille sø på grunden.
Den samlede beboelse er på 121m2
Stuehuset er på 80 m2 og består af bryggers,  badeværelse  stor lys sydvendt stue med  brændeovn. Lyst  køkken og soveværelse mod nord. I en del af ejendommens tidligere stald- og ladebygning er der indrettet en værelsesafdeling på42 m2, som består af en forstue, et lille toilet , et tekøkken, et pænt værelse samt en sydvendt stue. Der er desuden et 80 m2 stort disponibelt rum hvor der er mange anvendelsesmuligheder, eks mindre dyrehold, hobbyrum, garage, værksted mm Boligen opvarmes med luft til luft varmepumper, centralvarme (olie), samt brændeovn. Der er fibernet.
Grunden er på ca 4000 m2
Lejes ud, gerne til modent par eller enlig som har interesse i såvel huset som grunden. Husleje 6300 kr. Derudover betales vand aconto 200 kr. El afregnes direkte til Energi selskab.
Ikkerygere foretrækkes.",https://www.boligportal.dk/huse/l%C3%B8kken/121m2-4-vaer-id-4938115
"Peder Nielsens Gade, 9700 Brønderslev  - 1. sal",Brønderslev,Peder Nielsens Gade,9700,57.271452,9.944206,8.018 kr.,1.470 kr.,105 m²,3,1.,Lejlighed,Nej,Ja,Ja,Nej,Nej,Nej,Nej,Nej,N/A,"Lejemålet er beliggende på Peder Nielsens Gade, er 105 m2 og er klar til overtagelse. Månedlig husleje er 8018 kr. og indskud beløber sig til i alt 42420 kr. Send en besked, hvis lejemålet har fanget din interesse.",https://www.boligportal.dk/lejligheder/br%C3%B8nderslev/105m2-3-vaer-id-5211055
