Adress,City,Street name,Postal code,Latitude,Longitude,Monthly rent,Aconto,Square meters,Rooms,Floor,Property type,Furnished,Shareable,Pets allowed,Elevator,Senior frendly,Only for students,Balcony/Terrace,Parking,Energy label,Description,Link
"Hundige Stationsvej, 2670 Greve  - 5. sal",Greve,Hundige Stationsvej,2670,55.596593,12.33132,17.700 kr.,1.300 kr.,133 m²,4,5.,Lejlighed,Nej,Nej,Ja,Ja,Nej,Nej,Ja,Nej,N/A,"Lejligheden
                            Spændende 4-værelses lejlighed i 2 plan, hvor du bliver budt ind i lejligheden gennem en mindre entré med plads til overtøj. I lejlighedens nedre plan findes i øvrigt to soveværelser med skabsplads i hver sin ende af lejligheden, hvoraf det ene soveværelse har walk-in closet. Det tredje værelse i lejlighedens øvre plan og er oplagt som opholdsrum. Badeværelset er i tidløst minimalistisk design med fliser på gulv og i brusenichen, gulvvarme og vaskesøjle. Resten af lejligheden har flotte egetræsgulve og gulvvarme.  Lejligheden har køkken/alrum med moderne hvidt Svane køkken og med alt i hårde hvidevarer. Her er plads til kombineret spise- og stuearrangement, som ligger i åben forbindelse til 2 altaner, hvor kaffen kan nydes. 
Tanken bag lejlighederne er Simple Living, som først og fremmest handler om, at du får ro og overskud til at fokusere på de få, men vigtige ting i livet. Det handler om at leve med så få ting som muligt og kun eje det, du har brug for i dit daglige liv. Netop dette kan vi tilbyde dig i vores effektive og velindrettede lejligheder. Det handler om at leve med så få ting som muligt og kun eje det, du har brug for i dit daglige liv.

Det er muligt at ansøge om husdyrtilladelse til et husdyr i alle lejemål, som skal godkendes af udlejer.

                                      NB: Billederne viser derfor ikke den pågældende lejlighed, men i stedet billeder fra prøveboligen. Billedernes formål er at give en fornemmelse af stil og materialevalg. Ift. planløsning henviser vi til plantegningen. Kom gerne forbi til et åbent hus, eller ring og book en personlig fremvisning.

                                                      Ejendommen
                            Strandby Høje  er en helt ny og elegant boligejendom, som kendetegnes ved de lyse nuancer samt de skrånende, begrønnede tagflader. Her får du de bedste muligheder for at nyde hverdagen med dine kære og ikke mindst det gode naboskab og fællesskab.

                                      Lokalområdet
              Strandby Højes centrale beliggenhed gør det nemt at få hverdagen til at gå op i en højere enhed. I Hundige Strandby bor du tæt på skole, fritidsaktiviteter, shopping og kultur. 

Her er du omgivet af flere grønne områder og ikke mindst Hundige Strands 8 km lange børnevenlige sandstrand og smukke natur – en oplagt oase til gåture, sommerdage med vandsport eller løbeturen.

Kulturhuset Portalen lokker med koncerter og teaterforestillinger og på ARKEN kan du opleve kunst og udstillinger i verdensklasse. 

Waves ligger lige ved siden af og byder på både shopping og de daglige indkøb, foruden en biograf og et stort udvalg af hyggelige caféer og restauranter. 

Strandby Høje ligger centralt i forhold til både motorvej og offentlig transport med både bus og S-tog station lige uden for døren. S-toget kører dig både til Køge og København på kun 20 minutter.

                      
Bofællesskab ikke muligt.",https://www.boligportal.dk/lejligheder/greve/133m2-4-vaer-id-5368174
"Torvegade, 5000 Odense, Odense C  - 5. sal",Odense,Torvegade,5000,55.397015,10.389817,11.475 kr.,1.008 kr.,93 m²,3,5.,Lejlighed,Nej,Ja,Ja,Ja,Ja,Nej,Nej,Nej,N/A,"I de lyse lejligheder, hvor der virkelig er kræset om detaljerne. Oplev det fantastisk leverum, hvor køkken-alrum og stue er forenet på harmonisk vis. Køkkenet er stilrent og veludstyret med Bosch hårde hvidevarer, der skaber de bedste betingelser for dine kulinariske udfoldelser.

I de lyse lejligheder, hvor der virkelig er kræset om detaljerne. Oplev det fantastisk leverum, hvor køkken-alrum og stue er forenet på harmonisk vis. Køkkenet er stilrent og veludstyret med Bosch hårde hvidevarer, der skaber de bedste betingelser for dine kulinariske udfoldelser.

Gulvene er strømlinede og stilrene i Tarkett egetræ. Badeværelset er holdt minimalistisk med smukke klinker og simple elementer, så der i hele lejligheden er stor mulighed for at sætte eget præg.

Her skal du ikke lede længe for at finde, lige det du har brug for. Udenfor døren er midtbyens mange muligheder, og inden for kort afstand findes skoler, daginstitutioner, indkøbsmuligheder og fritidsaktiviteter.

Lyder denne lejlighed som noget for dig, så kontakt os for at høre mere!",https://www.boligportal.dk/lejligheder/odense/93m2-3-vaer-id-5195799
"Sivmose, 5856 Ryslinge",Ryslinge,Sivmose,5856,55.228484,10.532291,9.995 kr.,N/A,105 m²,4,-,Rækkehus,Nej,Nej,Ja,Nej,Ja,Nej,Ja,Ja,A,"Moderne og lyst rækkehus med masser af naturligt lysindfald fra store vinduespartier. Man træder ind i særskilt entre med videre adgang til to gode værelser. Fra entreen finder man husets store opholdsrum med lyst køkken samt god plads til spisebord. Her er ligeledes mulighed for indretning af hyggeligt sofahjørne. Fra alrummet finder man særskilt bryggers med vask samt plads til vaskemaskine og tørretumbler, herfra finder man et stort moderne badeværelse. Ydermere forefindes et stort soveværelse med indbygget skabsvæg. Fra stue er der direkte udgang til bagvedliggende terrasse samt dejlig have.

Bebyggelsen vil bestå af 44 energivenlig og moderne kvalitetsrækkehuse i størrelsen 85, 95, 105 og 115 m² – alle i et plan tegnet i en moderne og enkel streg.

Alle boligerne opføres på selvstændige grundstykker. Til hvert hus hører egen parkering, stort redskabsrum, dejlig have, stor flisebelagt terrasse på begge sider af huset samt flisebelagt gangsti til boligens entre, hvor der udføres niveaufri adgang. Haven omkranses og lukkes af ligusterhæk.

Husene er beliggende på to lukkede vænger, hvorfor der er begrænset med trafik, og børn kan derfor trygt slippes løs og finde legekammerater i den nye bebyggelse. Hunden kan ligeledes luftes på de etablerede stier i området.

Husrækkerne udføres med murede facader af morderne lys beige mursten og sort sadeltag med 25 graders hældning. Stern af træ i farven antracit og mindre hvidmalet udhæng af træ.

Husene monteres med moderne træ/alu vinduer og døre (3-lags vinduer) i mørk farve udvendig og hvid indvendig i. Sålbænke under vinduespartierne i mørk skifer.

Husenes materialevalg er gennemtænkt og harmonisk, så husene vil fremstå smuk, tidløs og velholdt i mange år fremover.

Åbne og lyse huse

Alle husene indrettes lyse og venlige, med hvide glatte lofter og vægge. Store oplukkelige vinduer for ekstra godt lysindfald overalt. Fælles opholdsrum (køkken/alrum/stue) indrettes med store vinduespartier på flere sider for maksimalt lysindfald. Gulve af egeplank (laminat) i køkken/alrum, stue og værelser. Entre, bryggers, badeværelse og brus udføres med lækre klinkegulve i lysgrå. Alle døre i glat hvid finish med rustfri stålgreb og uden dørtrin for optimal betjening. Vindueskarme mures og vandskures i hvid. Vægge mod gulv afsluttes med hvide glatte fodpaneler.

Fine detaljer overalt

Alle boliger indrettes med bryggers med bordplade og vask. Boligens badeværelse ligger i forbindelse med bryggerset. Køkken, bad, bryggers og soveværelse monteres med moderne moduler i glat hvid afslutning og med linje greb i farven antracit grå. Bordplader i praktisk laminat i farven ’rustik skifer’ med rummelige stålvaske. Stænkplade bag kogepladen, for nem rengøring. Vask i badeværelse af formstøbt materiale. Væghængt toilet fra Ifö Sign, kvalitetsarmaturer fra tyske Hans Grohe og linjeafløb i bruseniche.

Kvalitetshvidevarer

Alle hvidevarer medfølger i anerkendt kvalitet herunder integreret køl/frys, integreret opvaskemaskine, kogeplade med induktionsteknologi, emhætte og indbygningsovn i højden med pyrolyse-teknologi. Der medfølger ligeledes vaskemaskine og tørretumbler placeret i bryggers.

Fast og god belysning

Der er etableret lyskilde i bad og bryggers, samt ved ventilation på loft. I køkken er der spot i overskabene.

Forberedt for el-bil

Der er forberedt tomrør til ladestation for el-køretøj.

Sundt indeklima og gulvvarme

Der er gulvvarme i hele huset. Dette styres via separate termostater i alle rum. Boligen er udført med ventilationsanlæg, der sikrer et sundt og godt indeklima.

Individuelle forbrugsmålere

Forbrug til varme, el, vand og spildevand afregnes direkte mellem lejer og forsyningsselskaberne. Opvarmning via fjernvarme.

Udvendig monteres der stikkontakt og vandhane samt væglampe ved entredør.

Illustrationer er modelfotos. Der tages forbehold for rettelser.",https://www.boligportal.dk/r%C3%A6kkehuse/ryslinge/105m2-4-vaer-id-5345648
"Galstersgade, 9400 Aalborg, Nørresundby  - Stuen",Aalborg,Galstersgade,9400,57.059981,9.927201,6.006 kr.,700 kr.,70 m²,2,Stuen,Lejlighed,Nej,Nej,Nej,Nej,Nej,Nej,Nej,Ja,D,"Søger du efter en lejlighed i Nørresundby som er beliggende tæt ved centrum af Aalborg. Efter kun 5 min er du inde i Aalborg centrum og du kan holde din bil lige uden for ejendommen. 

Du vil få en 2 værelses lejlighed som indeholder en rummelig entre plads til overtøjet. Stue er lys og med en hyggelig karnap. Du vil få gode indretningsmuligheder i stuen. Fra vinduerne har man udsigt til parken  i nærheden. Soveværelset giver adgang til lejlighedens altan hvor der er plads til møbler, så man kan nyde solsiden.  Køkkenet er i hvide elementer med opvaskemaskine og øvrige hårde hvidevarer. Badeværelset er  2 dele hvor man kan have opbevaring i den ene del. Den anden del indeholder toilet og bad. Badeværelset har som en luksus eget vindue uden indkig, hvilket gør at man kan få fuglesang ind, mens man bader
Ejendommen er særdeles velholdt og udlejer vil altid sørge for at ejendommen opretholder denne standard. Yderligere giver udlejer vinduespudsning 2 gange om året. 
Hvis man er til motion, er der den skønne Skansepark få meter fra ejendommen, hvor der er en pragtfuld udsigt og skønne løbe/gangstier. 
Ikke langt derfra er Nørresundby torv hvor der hver fredag er det skønneste marked med mange lækre friske fristelser.
Der er tæt til motorvejen. 
Ejendommen har en lækker baggård og luksus vaskeri med hele 4 vaskemaskiner og tørrerum som har varme. 

Der er vicevært som løbende holder tingene i den stand som udlejer ønsker.",https://www.boligportal.dk/lejligheder/aalborg/70m2-2-vaer-id-5171422
"Spotorno Alle, 2630 København, Taastrup  - Stuen",København,Spotorno Alle,2630,55.643992,12.270561,12.700 kr.,800 kr.,109 m²,4,Stuen,Lejlighed,Nej,Ja,Nej,Ja,Nej,Nej,Ja,Ja,N/A,"På Spotorno Allé 14-34 udlejer 145 nybyggede lejligheder på 43-111 m2. Lejlighederne er primært 2-, 3- og 4-værelses, men der er også et mindre antal 1- og 5-værelses boliger. Lejlighederne er fordelt på tre bygninger i varierende højder mellem fire og seks etager.


INDE:
Alle lejemål består af en entré, et stort opholdsrum med køkken og stue i åben forbindelse, et lækkert badeværelse og et eller flere værelser.

UDE:
Der er en lækker altan eller terrasse til alle boliger.

HÅRDE HVIDEVARER:
Køkkenet er udstyret med hårde hvidevarer i form af køle- og fryseskab, opvaskemaskine, indbygningsovn og kogeplade. Badeværelset har kombineret vaskemaskine og tørretumbler

HUSDYR:
Katte: Lejere kan ansøge om tilladelse til at holde én indekat på adressen. Udekatte er ikke tilladt.
Hund: Det er ikke tilladt at holde hund.
Andre dyr: Se vores samlede husdyrsregler her.

PARKERING:
Ved ejendommen er der etableret 145 p-pladser til fri afbenyttelse af lejerne.

FÆLLESAREALER:
Mellem bygningerne er der anlagt grønne fællesarealer med beplantning, som giver mulighed for spil, leg, picnic og solbadning.

ELEVATOR:
Der er elevator i opgangen.",https://www.boligportal.dk/lejligheder/k%C3%B8benhavn/109m2-4-vaer-id-5348791
"Hovedgaden, 4270 Høng",Høng,Hovedgaden,4270,55.511683,11.291033,9.970 kr.,1.400 kr.,116 m²,4,-,Lejlighed,Nej,Nej,Nej,Nej,Nej,Nej,Nej,Ja,C,"Boligen ligger dejlig ugenert bag Tinghuset og byens gadekær. Indkøb kan foregå hos SPAR-købmanden der er nabo til ejendommen eller i det nærliggende Høng-centeret.
Til boligen hører der skur og egen lille lukket have.
Indgang til entre, gang, toilet, badeværelse, 3 værelser, stor stue og separat køkken - i alt 116 kvm.
Aconto dækker vand og varme. EL afregnes direkte med forsyningsselskabet.",https://www.boligportal.dk/lejligheder/h%C3%B8ng/116m2-4-vaer-id-5355081
"Ramsvej, 8800 Viborg  - Stuen",Viborg,Ramsvej,8800,56.450578,9.399974,7.950 kr.,1.250 kr.,118 m²,4,Stuen,Lejlighed,Nej,Nej,Nej,Ja,Nej,Nej,Ja,Ja,N/A,"Stor nyistandsat 4 værelses lejlighed med elevator og afhøvlet gulve. Indeholder: Entre, 2 stuer samt stort soveværelse med faste skabe, et værelse med faste skabe. Dejlig køkken med køl/frys, komfur, emhætte og opvaskemaskine samt udgang til altan og elevator. Badeværelse med bruser samt mulighed for egen vaskemaskine. Der er et lille depotrum til lejemålet samt dørtelefon. Til ejendommen er der fælles gårdanlæg samt fælles vaskeri med de øvrige beboere. Der kan tilkøbes parkeringsmuligheder.",https://www.boligportal.dk/lejligheder/viborg/118m2-4-vaer-id-5372447
"Finsensvej, 2000 København, Frederiksberg  - 2. sal",København,Finsensvej,2000,55.681188,12.51862,7.700 kr.,750 kr.,25 m²,1,2.,Lejlighed,Nej,Nej,Nej,Ja,Nej,Nej,Nej,Nej,A,"Velkommen til Blækhus Frederiksberg!
Blækhus Frederiksberg tilbyder 188 fantastiske og fuldt servicerede lejeboliger med eget tekøkken og badeværelse.
Bliv en del af Blækhus-fællesskabet.
Flotte fællesområder skræddersyet efter fællesskabets behov – her er der både plads til at studere og hygge sig.
Alle fællesrum er naturligvis udstyret med højhastighedsinternet!
En række fordele, der gør Blækhus Frederiksberg til et skønt sted at bo:
- Tagterrasse, perfekt til hyggelige stunder og med udsigt over København
- Fælleskøkkener, hvor du kan lave mad med dine venner
- Lounge- og arbejdsområder, hvor du kan fordybe dig i arbejdet eller studierne
- Gode fælleslokaler, hvor du kan hænge ud med dine naboer og venner
- Et yogalokale, hvor du kan pleje krop og sind
- Et moderne vaskeri med 5 vaskemaskiner og 3 tørretumblere",https://www.boligportal.dk/lejligheder/k%C3%B8benhavn/25m2-1-vaer-id-5302661
"Vesterbro, 9000 Aalborg, Aalborg  - 5. sal",Aalborg,Vesterbro,9000,57.049271,9.91669,8.600 kr.,700 kr.,82 m²,2,5.,Lejlighed,Nej,Nej,Nej,Ja,Nej,Nej,Ja,Nej,A,"Lækker lejlighed, beliggende centralt i Aalborg i nyere ejendom opført i 2014. Lejligheden indeholder fordelingsgang med adgang til dejligt badeværelse med brus og kombi vaskemaskine/tørretumbler. Lækkert køkken og stue i ét med fantastisk lysindfald og smuk udsigt. Fra stuen er der udgang til en fin altan. Dejligt soveværelse med god skabsvæg. Der er i lejligheden flotte parketgulve.
Der er brugsret til én af byens bedst beliggende tagterrasser med smuk udsigt over Aalborg og omegn, herunder brugsret til fælles gasgrill.
 
 
 Lejemålet er fra lejers side uopsigelig de første 12 måneder. Husdyrhold tillades ikke. Bofællesskab tillades ikke. Der er rygeforbud i hele ejendommen, herunder i lejligheden.",https://www.boligportal.dk/lejligheder/aalborg/82m2-2-vaer-id-5127389
"Hvidkildevej, 2400 København, København NV  - 1. sal",København,Hvidkildevej,2400,55.697875,12.519315,5.200 kr.,0 kr.,15.5 m²,1,1.,Værelse,Ja,Nej,Nej,Nej,Nej,Nej,Nej,Nej,N/A,"*The ad is in English and Danish 
*Annoncen er på engelsk og dansk!

------------------------------------------------------------

Furnished room for a single female +35 for rent...
In the attractive Copenhagen NV area, with best locating where there is quiet, safe and central. 
 
There is only 4 km to Copenhagen town hall square, 
5 min. walk to the nearest bus stop, train station (Fuglebakken) and grocery shopping (Netto). 
Grøndal MultiCenter (sport center) and green park with sports fields is just around the corner. 
   
•	The room is approx. 15,5 m2.
•	It is vacant now or as soon as possible.
•	DKK 5,200,- per month incl. water, heat, electricity      and laundry.
•	Deposit 2 month rent.
•	Min. 6 month lease. – Period flexible up till two years in total.
•	Min 2 month written mutual termination.
•	CPR-registration.
•	Non smoking apartment.
•	We share the bathroom, kitchen with oven, microwave and refrigerator excl. kitchenware.
• 	We share cleaning in joint areas.
•	No couple or men please and no respond if you write! 

If you’re my future tenant, you would be… 
a single woman +35, calm and tidy, respecting the house policy. You are employed worker, studying or you can have a commuter status. 

If you’ll like to know a little about me…
I am a single woman and have a loving and calm little Chihauhau dog. I'll be living in my summerhouse most of the summer. I speak both English and Danish.

If the room could be of your interest, please contact me and briefly describe yourself with name and age.
If there’s a match, I will invite you to an interview and view of my apartment. 
It is important to find the best match between my new tenant and me and I’ll be continuously evaluating inquiries. 

Looking forward hearing from you!

------------------------------------------------------------

Møbleret værelse til single kvinde +35 udlejes...
I det attraktive København NV område, med bedst beliggenhed hvor der er roligt, trygt og centralt.
 
Der er kun 4 km til Københavns Rådhusplads, 5 min. gang til nærmeste busstoppested, togstation (Fuglebakken) og dagligvareindkøb (Netto). 
Grøndal MultiCenter (sportscenter) og lige rundt om hjørnet er der grøn park med sportsbaner. 

• Værelse ca. 15,5 m2.
• Lokalet er ledigt nu eller gerne hurtigst muligt.
• DKK 5.200,- om måneden inkl. vand, varme, el og tøjvask.
• Depositum 2 måneders husleje.
• Min. 6 måneders lejekontrakt. – Fleksibel periode op til to år i alt.
• Min 2 måneders skriftlig gensidig opsigelse.
• CPR-registrering.
• Ikke-ryger lejlighed.
• Vi deler badeværelset, køkken med ovn, mikroovn og køleskab ekskl. køkkenudstyr.
• Vi deler rengøring i fællesarealer.
• Ingen par eller mand, ingen svar, hvis du skriver!

Hvis du er min fremtidig lejer, forventer...
at du er single kvinde +35, rolig og ordentlig, med respekt for hus regler.
Du er ansat i et arbejde, studerer eller du kan have pendlerstatus.

Lidt information om mig...
Jeg er en single kvinde og har en kærlig og rolig lille Chihauhau hund. Jeg bor i mit kolonihavehus noget af sommeren. Jeg taler både engelsk og dansk. 

Hvis værelset kunne have din interesse, så kontakt mig og beskriv kort om dig selv.
Er der er et match, vil jeg invitere dig til et interview og visning af min lejlighed.
Det er vigtigt at finde det bedste match mellem min nye lejer og mig, og jeg vil løbende vurdere henvendelser.

Ser frem til at høre fra dig!",https://www.boligportal.dk/v%C3%A6relser/k%C3%B8benhavn/15m2-1-vaer-id-5353956
"Løjtertoft, 6430 Nordborg  - 1. sal",Nordborg,Løjtertoft,6430,55.057335,9.748556,5.010 kr.,1.275 kr.,75 m²,2,1.,Lejlighed,Nej,Nej,Nej,Nej,Nej,Nej,Nej,Nej,N/A,"Lejemålet er beliggende på Løjtertoft og består af 2 værelser samt køkken og bad. Lejemålet er 75 m2 og er klar til overtagelse snarest. Månedlig husleje er 5010 kr. og indskud beløber sig til 16100 kr. 

Send en besked, hvis lejemålet har fanget din interesse.
For at kunne leje denne bolig, kræver det man er medlem af boligforeningen. På BoligPortal annonceres kun reelt ledige boliger uden eksisterende venteliste på annonceringstidspunktet. Venligst kontakt udlejer hvis du er interesseret i lejemålet.",https://www.boligportal.dk/lejligheder/nordborg/75m2-2-vaer-id-5343304
"krusbjergvej , 6870 Ølgod",Ølgod,krusbjergvej ,6870,55.778367,8.700282,3.000 kr.,200 kr.,72 m²,3,-,Lejlighed,Nej,Nej,Ja,Nej,Nej,Nej,Nej,Nej,C,pæn 3 værsels udlejes,https://www.boligportal.dk/lejligheder/%C3%B8lgod/72m2-3-vaer-id-5330397
"Rynkeby Bygade, 5350 Rynkeby  - 1. sal",Rynkeby,Rynkeby Bygade,5350,55.40013,10.613011,6.300 kr.,600 kr.,84 m²,3,1.,Lejlighed,Nej,Ja,Nej,Nej,Nej,Nej,Nej,Ja,D,"dejlig nyistandsat 3 værelses lejlighed ved Spar købmanden i Rynkeby udlejes. Kort afstand til indkøb, skole, daginstitution og busforbindelser. lejligheden indeholder stort køkken/alrum,  2 værelser samt bad/ toilet med brus.",https://www.boligportal.dk/lejligheder/rynkeby/84m2-3-vaer-id-4951310
"Urtehaven, 2640 København, Hedehusene  - Stuen",København,Urtehaven,2640,55.644931,12.20176,9.950 kr.,1.100 kr.,69 m²,2,Stuen,Lejlighed,Nej,Nej,Ja,Nej,Nej,Nej,Nej,Nej,A,"Ejendommen
Moderne murstensejendom med store vinduespartier, der sikre det optimale lysindfald. 
 
Lejligheden
Lys og rummelig bolig med plads til livet. Her får du høj funktionalitet med moderne planløsninger, der blandt andet byder på køkkenalrum og store badeværelser. 
 
Området
Området omkring Urtehaven og Kongelysvej byder på rekreative områder med blandt andet Sejlbjerg Mose og Hedehusene Idrætspark. Små 2 kilometer fra området har du Hedehusene Station og diverse dagligvarebutikker.",https://www.boligportal.dk/lejligheder/k%C3%B8benhavn/69m2-2-vaer-id-5318650
"Østergade, 6000 Kolding  - 2. sal",Kolding,Østergade,6000,55.489445,9.474393,8.000 kr.,900 kr.,125 m²,3,2.,Lejlighed,Nej,Ja,Nej,Nej,Nej,Nej,Ja,Nej,C,"Lejligheden som er hele m125 kvm. har et nyt flot køkkenalrum/stue, med HTH-elementer og alt i hårde hvidevarer. I stuen er der store flotte vinduespartier med flot lysindfald.
Der er 2 store separate værelser og badeværelset har vaskemaskine og tørretumbler.
Derudover har lejligheden genveksanlæg, som gør at luften bliver udskiftet en gang i timen.

Lejligheden har super flotte gulve og top isoleret vægge, nyere vinduer og døre.
Der er fælles gård- og tagterrasse.
Lejligheden er delvenlig af 2 personer.",https://www.boligportal.dk/lejligheder/kolding/125m2-3-vaer-id-5282611
"Vestergade, 9800 Hjørring",Hjørring,Vestergade,9800,57.461657,9.980638,3.434 kr.,322 kr.,45 m²,2,-,Lejlighed,Nej,Ja,Ja,Nej,Nej,Ja,Nej,Nej,N/A,"Lejemålet er beliggende på Vestergade, er 45 m2 og er klar til overtagelse. Månedlig husleje er 3434 kr. og indskud beløber sig til i alt 10302 kr. Send en besked, hvis lejemålet har fanget din interesse.

Dette er en ungdomsbolig, som er til unge under uddannelse, og man skal være studerende for at komme i betragtning.",https://www.boligportal.dk/lejligheder/hj%C3%B8rring/45m2-2-vaer-id-5015573
"Alexandragade, 5000 Odense, Odense C  - 2. sal",Odense,Alexandragade,5000,55.392529,10.39542,8.575 kr.,500 kr.,85 m²,3,2.,Lejlighed,Nej,Nej,Nej,Nej,Nej,Nej,Ja,Nej,D,"Lejligheden er 85 kvm. og indeholder entré, 2 stuer mod gaden med de oprindelige stuklofter bevaret, soveværelse mod gården med udgang til altan, køkken og badeværelse. 
Lejligheden er i 2001 blevet totalrenoveret med nyt køkken m. hvidevarer (komfur, opvaskemaskine, køl/frys), nyt badeværelse m. varme i gulvet og nye elinstallationer. Lejligheden er overalt nymalet og gulvene er afslebet og lud/sæbebehandlet.
Der er monteret nye vinduer i den oprindelige udformning som palævinduer i koblede rammer med energiglas. Lejligheden er tilsluttet Glentevejens antennelaug, der også har mulighed for internetforbindelse via antennetilslutningen. 
Ejendommen er monteret med dørtelefon.

Der er adgang til ejendommens fælles gård og have.

Det er ikke tilladt at holde husdyr.

Der er fællesvaskeri i ejendommens kælder. En vask koster kr. 25,- og tørretumbling koster kr. 2,- pr. 7 min.

Huslejen udgør kr. 8.575,00 + a/c varme kr. 350,- + a/c vand kr. 150,- + antennebidrag kr. 185,- (kan fravælges eller ændres til anden programpakke) i alt kr. 9.260,- pr. mdr.. 
Varme- og vandforbrug afregnes efter måler. Forbrugsregnskaber udarbejdes af Brunata.",https://www.boligportal.dk/lejligheder/odense/85m2-3-vaer-id-3134401
"Michael Strunges Vej, 2300 København, København S  - 4. sal",København,Michael Strunges Vej,2300,55.637921,12.581371,13.300 kr.,700 kr.,65 m²,3,4.,Lejlighed,Nej,Ja,Ja,Ja,Ja,Nej,Ja,Ja,A,"Velkommen til boligen
BEMÆRK VENLIGST:
Ejendom med butikker og lejligheder boligen er tegnet af Praksis Arkitekter og er kendetegnet ved sin lyse teglkonstruktion med forskellige stentyper, som skaber spil i facaderne og giver bygningen sit eget unikke udtryk. I byggeriets stueetage finder du butikker, cafeer samt bydelens kultur- og beboerhus, mens resten af ejendommen indeholder private boliger.
Lyse og moderne boliger Fra 1. sal består boligen består af 2-4-værelses lejligheder. I alle boliger er der taget udgangspunkt i at sikre gode dagslysforhold og fleksible indretningsmuligheder til de primære opholdsrum. Materialerne i boligerne er lyse, og køkkenet er hvidt og moderne fra Invita.
Indbydende gårdrum Midt i boligen er der skabt et stort grønt gårdrum med plads til ophold og leg. Gårdrummet får tæt beplantning med forskellige græsser, buske og træer og i den nordøstlige del placeres en legeplads med omkringliggende bænke. Midt i gårdrummet er der mulighed for at aflevere sit affald i affaldsstandere, som omkranses af en pergola med klatreplanter.
Husdyr: Kan ansøges
*Bemærk at billederne ikke nødvendigvis er taget af/fra den pågældende lejlighed, og at udsigt m.v. derfor kan variere.",https://www.boligportal.dk/lejligheder/k%C3%B8benhavn/65m2-3-vaer-id-5363645
