Adress,City,Street name,Postal code,Latitude,Longitude,Monthly rent,Aconto,Square meters,Rooms,Floor,Property type,Furnished,Shareable,Pets allowed,Elevator,Senior frendly,Only for students,Balcony/Terrace,Parking,Energy label,Description,Link
"Vintervej, 8210 Aarhus, Aarhus V  - 1. sal",Aarhus,Vintervej,8210,56.175773,10.150256,6.995 kr.,0 kr.,54 m²,2,1.,Lejlighed,Nej,Ja,Nej,Nej,Nej,Nej,Nej,Ja,A,"Lækker og lys lejlighed på 1. sal i nyopført byggeri fra 2018.

Lejlighederne ligger i et naturskønt område tæt på skov og park og kun 10 minutter på cykel fra Aarhus Universitet. 

Indeholder lys entré med klinker med direkte adgang til badeværelse, soveværelse og køkken/alrum/stue. 

På badeværelset er der plads til installation af egen vaskesøjle. 

Det flotte køkken har hårde hvidevarer, lyse tidløse elementer fra Svane Køkkenet og der er mulighed for installation af opvaskemaskine. 

Der er lyse laminatgulve i både stue/alrum/køkken og på værelset. 

Vi skal gøre opmærksom på, at billederne er vejledende. 

Lejligheden danner rammen om et fælles gårdmiljø med skure. Der tilhører ét uisoleret skur til hver lejlighed. 

Parkering skal ske på pladserne rundt om bygningen. Dette er gratis.

Huslejen er + forbrug. Forbrug af el, vand og varme afregner lejer direkte til værkerne. 

Husdyr/kæledyr er ikke tilladt. 

Kontakt os for fremvisning.",https://www.boligportal.dk/lejligheder/aarhus/54m2-2-vaer-id-5128831
"Gammel Køge Landevej, 2500 København, Valby  - 1. sal",København,Gammel Køge Landevej,2500,55.659056,12.514381,15.200 kr.,875 kr.,95 m²,3,1.,Lejlighed,Nej,Ja,Ja,Ja,Nej,Nej,Ja,Nej,A,"Lejligheden byder på en entré med adgang til lejlighedens badeværelse, samt et rummeligt soveværelse.

Yderligere byder lejligheden på et meget stort køkkenalrum med nyere køkken og adgang til lejlighedens altan, samt lejlighedens andet soveværelse.

Det nye Valby er beliggende i gåafstand i forhold til Valbys mange muligheder, som for eksempel det pulserende cafémiljø, Valby Station og Spinderiet med masser af indkøbsmuligheder. Endvidere er der kort afstand til idrætsfaciliteter, skoler, daginstitutioner og til Ny Ellebjerg Station, hvorfra S-toget bringer dig til Hovedbanegården på under ti minutter.",https://www.boligportal.dk/lejligheder/k%C3%B8benhavn/95m2-3-vaer-id-4724899
"Vesterbro, 9000 Aalborg, Aalborg  - 2. sal",Aalborg,Vesterbro,9000,57.050465,9.916269,6.295 kr.,550 kr.,81 m²,3,2.,Lejlighed,Nej,Ja,Nej,Ja,Ja,Nej,Nej,Nej,D,"Mulighed for dejlig dele-venlig lejlighed.
Dette er en stor og lys 3-værelses lejlighed, som er indrettet med en lille entre, et køkken med køle-/fryseskab, ovn, komfur og emhætte. Desuden indeholder lejligheden badeværelse med god plads. Herudover indeholder lejligheden en skøn stue, der har et rigtig godt lysindfald, og hvorfra der er adgang til et værelse. Fra fordelingsgangen er der adgang til lejlighedens soveværelse. Herudover er der et godt depotrum.
Ejendommen har en skøn tagterrasse, hvor der er sol det meste af dagen.
Der er en ny elevator i ejendommen fra 2022, og ejendommen ligger lige oven på en Netto-butik, så man nemt og hurtigt kan få handlet ind.
Der medfølger et kælderrum til lejligheden, og der er en stor og lun cykelkælder, hvor man trygt kan lade sin cykel stå.
Ejendommen ligger i hjertet af Aalborg og med busstoppested lige uden for døren. Desuden er der mulighed for at parkere tæt ved ejendommen.",https://www.boligportal.dk/lejligheder/aalborg/81m2-3-vaer-id-5249155
"Blomsterlunden, 8381 Aarhus, Tilst",Aarhus,Blomsterlunden,8381,56.187787,10.127558,9.495 kr.,0 kr.,73 m²,3,-,Lejlighed,Nej,Ja,Nej,Nej,Nej,Nej,Ja,Ja,A,"1 SAL MED SKØN ALTAN..

INDFLYTNINGSPRIS PÅ KUN 1 MDR. DEPOSTIUM. 

HUSDYR TILLADT
FRI PARKERING
GRØNNE OMGIVELSER, TÆT PÅ AARHUS C.

Indbydende treværelses lejlighed, hvor små familier, par og studerende vil kunne se potentialet i den moderne bolig med flot lysindfald og en optimale planløsning:
-Dejlig stort køkken
-Stue med udgang til terrasse eller altan
-To storeværelser
-Dejlig stor altan
-Rummeligt badeværelse med bruseniche og   væghængt toilet
-Køkken fra Kreum i hvide moduler, med indbygget skabsplads til opbevaring

Ved indflytning medfølger alt i hårde hvidevarer, mens en ekstra lækker detalje er gulvvarmen, der er indlagt under de flotte trægulve

Søhusene tager – som navnet antyder – udgangspunkt i en smuk, lille sø og den omkringliggende natur. Byggeriet har en lang række gode faciliteter, som kommer beboerne til gode:

•	Ingen forudbetalt leje
•	Grønne fællesarealer med legeplads
•	Mulighed for at holde husdyr
•	Eget skur
•	Fjernvarme – ejendommen er energimærke A
•	Gratis parkering

Lejligheden er  tæt på supercykelstien ind mod selve Aarhus C, hvor man hurtigt når diverse uddannelsesinstitutioner og det bugnende kulturliv i Smilets By. Busstoppestedet 5 min gang  og E45 er under fem kilometer fra matriklen, så også pendlerne tilgodeses.

Velkommen til Søhusene!",https://www.boligportal.dk/lejligheder/aarhus/73m2-3-vaer-id-5360653
"Danmarksgade, 9000 Aalborg, Aalborg  - 3. sal",Aalborg,Danmarksgade,9000,57.045754,9.916718,6.995 kr.,850 kr.,67 m²,2,3.,Lejlighed,Nej,Nej,Ja,Nej,Nej,Nej,Ja,Nej,N/A,"th.
i Aalborg.
Velkommen til Aalborgs absolutte centrum.
Denne 2-værelses lejlighed er indrettet med entré, stor stue, soveværelse, køkken samt badeværelse.
Lofter og vægge er lavet i lyse materialer, mens køkken og badeværelse er i flot stand.
Der er derudover hems, hvor der er adgang til altanen med en flot udsigt.
Der er opvaskemaskine i køkkenet og bruseniche i badeværelset mens der er vaskemaskine ved den aflukkede bagtrappe.
Mindre husdyr kan tillades mod godkendelse.
Ejendommen er beliggende i Aalborgs absolutte centrum med gåafstand til alt det Aalborg midtby kan tilbyde, og som man har behov for.
Offentlig transport, mange forskellige handlemuligheder, gågader og shoppingcentre, barer, natklubber, gågader, specialbutikker mm. er således lige ved hånden.
Derudover over er der også gåafstand til Østre Anlæg, der er en af Aalborgs absolut største parker med løbe- og gåruter, flot anlæg med fisk og ænder, udendørs træningsfaciliteter, fodbold- og beachvolleybaner og enormt store græsarealer, der i sommerhalvåret bliver flittigt brugt til solbadning, grillfester og socialt samvær generelt.
Der er også gåafstand til Musikkens Hus, Nordkraft og Karolinelunden, der er blandt byens førende kulturelle samlingssteder for både musik, stand-up, foredrag, træning, restauranter m.
m.
Der er desuden gode og i øvrigt utallige parkeringsmuligheder i nærområdet.",https://www.boligportal.dk/lejligheder/aalborg/67m2-2-vaer-id-5297916
"Dalgas Boulevard, 2000 København, Frederiksberg  - 1. sal",København,Dalgas Boulevard,2000,55.67956,12.509225,5.500 kr.,500 kr.,8 m²,1,1.,Værelse,Nej,Nej,Nej,Nej,Nej,Nej,Nej,Nej,N/A,"Jeg lejer et værelse ud til den ikke så pladstrængende. Der er adgang til køkken, bad og to store stuer som kan benyttes. Det samlede areal er 118 m2. 
Lejligheden er nyrenoveret for små to år siden og er udover værelset fuldt møbleret. (værelset kan også møbleres på forhånd med en enkeltmandsseng og tøjskab m. 3 skuffer og knagerække) 
Jeg bor alene i lejligheden, arbejder fuldtid og studerer lidt ved siden af. Jeg opholder mig derfor ikke særligt meget i lejligheden, men sætter pris på ro, madlavning og lidt sport eller film på fjernsynet, når jeg endelig er hjemme.",https://www.boligportal.dk/v%C3%A6relser/k%C3%B8benhavn/8m2-1-vaer-id-5286554
"Nordre Teglkaj, 2450 København, København SV  - 2. sal",København,Nordre Teglkaj,2450,55.653776,12.550076,6.200 kr.,0 kr.,10 m²,1,2.,Værelse,Nej,Nej,Nej,Nej,Nej,Nej,Nej,Nej,N/A,"Hej

Vi er så heldige at få tilbudt en fire-værelses lejlighed i Sydhavnen, og mangler derfor en tredje roomie der har lyst til at flytte ind sammen med os d. 15.06 (evt. 01.07). 

Lidt om os:
Vi er to venner der har kendt hinanden siden 2016. Peter (31) læser en kandidat i historie og skal til at skrive speciale til sommer, og Daniel læser til datamatiker. Udover at Peter synes Daniel (30) er en proletar fra landet, og Daniel synes Peter er en kultursnob, så nyder vi hinandens selskab, og laver mange ting sammen, og håber du vil være en del af dette fællesskab.
Vi kan begge godt lide at være aktive i vores fritid, hvor vi blandt andet begge spiller fodbold på hyggeniveau (på hver vores hold!) eller hopper i træningscentret. Derudover tager vi fra tid til anden en øl i byen, laver mad sammen, ser en film på sofaen, osv. Generelt er vi begge udadvendte og sociale typer, der selvfølgelig også altid respekterer en lukket dør. 

Om dig:
Om du er M/K er underordnet. Vi ser gerne du er nogenlunde samme sted i livet og har lyst til at være en del af fællesskabet og bidrage til de huslige pligter samt til hyggen.

Om værelset: 
Værelset er ca. 10-11 kvm stort, med et gulv-til-loft vindue og skabe. Værelset er umøbleret, så du kan sætte dit eget præg på rummet som det passer dig. 

Om lejligheden:
Kvm: 122
Leje (inklusiv aconto): 6.200
Depositum: 18.600
Indflytning: 15.06.23 (evt. 01.07.23)

Generelt ligger lejligheden et rigtig fint sted i Sydhavnen, meget tæt på det lækre havnebad og tæt på indkøbsmuligheder. Derudover tager det kun 10-15 min. at cykle til centrale steder i København. Derudover er også den store tv-pakke fra YouSee og internet inkluderet i huslejen. 

Skriv gerne et par linjer om dig selv til en af os, så vender vil tilbage og holder løbende samtaler. Vi håber at finde en roomie hurtigst muligt. 

Med venlig hilsen Peter og Daniel.",https://www.boligportal.dk/v%C3%A6relser/k%C3%B8benhavn/10m2-1-vaer-id-5361940
"Trygsvej, 8230 Aarhus, Åbyhøj",Aarhus,Trygsvej,8230,56.156873,10.165579,5.564 kr.,450 kr.,37 m²,1,-,Lejlighed,Nej,Nej,Nej,Nej,Nej,Nej,Nej,Nej,C,"Skønt beliggende i attraktivt villakvarter i Åbyhøj på kanten af Aarhus C. Her er du lige udenfor ringgaden og kun ca. 2 km til rådhuset og indenfor 1,5 km fra universitetet og handelshøjskolen.
Lejligheden har egen indgang, entre, stue-alrum med  ugenert udsigt. Toilet med egen bruseniche, egen vaskemaskine og tørretumbler.
Selvstændigt depotrum i gåden.
Egen parkering i gården.",https://www.boligportal.dk/lejligheder/aarhus/37m2-1-vaer-id-5370581
"Peder Nielsens Gade, 9700 Brønderslev  - 1. sal",Brønderslev,Peder Nielsens Gade,9700,57.271452,9.944206,6.755 kr.,1.204 kr.,86 m²,2,1.,Lejlighed,Nej,Ja,Ja,Nej,Nej,Nej,Nej,Nej,N/A,"Lejemålet er beliggende på Peder Nielsens Gade, er 86 m2 og er klar til overtagelse. Månedlig husleje er 6755 kr. og indskud beløber sig til i alt 34744 kr. Send en besked, hvis lejemålet har fanget din interesse.",https://www.boligportal.dk/lejligheder/br%C3%B8nderslev/86m2-2-vaer-id-5178100
"Thoras Vænge, 2950 København, Vedbæk  - Stuen",København,Thoras Vænge,2950,55.833737,12.528428,28.200 kr.,1.900 kr.,176 m²,4,Stuen,Lejlighed,Nej,Nej,Ja,Ja,Ja,Nej,Ja,Ja,A,"Velkommen til boligen!
Velkommen til denne fantastiske 4-værelses lejlighed med en veldisponeret planløsning som er beliggende i Magdaleneparken.
Lejligheden byder på et stort køkken alrum, hvor der medfølger komfur, emhætte, ovn, køle/fryseskab og opvaskemaskine. Lejligheden har 3 gode soveværelser. Ydermere er der 2 gode badeværelser med separat bruseniche og vaskesøjle i det ene badeværelse. Der opvarmes med gulvvarme i hele lejligheden. I boligen er der opført 63 smukke og æstetiske boliger i naturskønne og historiske omgivelser, langs den smukke Kohave Skov, i udkanten af Vedbæk.
boligen er et hyggeligt boligområde som danner rammen om et indbydende og trygt nabolag, hvor hverdagen og livet leves på bedste vis.
Fælles for alle boligerne er, at de er opført med øje for eksklusivitet og kvalitet. Alt fra materialevalg, køkken til badeværelser med mere, er etableret i et tidsløst design. Her nydes det gode liv hjemme og i nærområdet, med rige muligheder for udfoldelse, sjov, fordybelse og hygge for alle aldre.
Ønsker man at bo i naturskønne omgivelser tæt på København og Øresund, med et enestående nærmiljø, historisk islæt og utallige muligheder, er boligen i Vedbæk et oplagt valg.
*Bemærk at billederne ikke nødvendigvis er taget af/fra den pågældende bolig, og at udsigt m.v. derfor kan variere.",https://www.boligportal.dk/lejligheder/k%C3%B8benhavn/176m2-4-vaer-id-5378782
"Toldbodhusevej, 5000 Odense, Odense C  - 4. sal",Odense,Toldbodhusevej,5000,55.406074,10.378622,11.950 kr.,800 kr.,118 m²,4,4.,Lejlighed,Nej,Ja,Nej,Ja,Ja,Nej,Ja,Ja,N/A,"Denne dejlige 4-værelses lejlighed på 118m2 er nu tilgængelig til leje på Landemærket, som er placeret ved Odense Havn.

Lejligheden inkluderer en rummelig entré med plads til opbevaring af sko og overtøj. Køkkenet er åbent og veludstyret med en opvaskemaskine. Der er adgang fra køkkenet til to værelser med indbygget skabsplads, og et lækkert badeværelse med bruseniche og kombimaskine.

Fra køkkenet er der også adgang til en stor og åben stue med både spise- og opholdsplads, samt en vidunderlig solrig altan. Hele lejligheden har gulvvarme installeret.

Der er grønne områder i nærheden af lejligheden, herunder Åløkkeskoven. UCL Erhvervsakademi og Professionshøjskole, letbanen samt SDU er også inden for cykelafstand. Desuden er der en række rekreative aktiviteter i nærheden, såsom padeltennis, bådudlejning, Fodboldfabrikken og det smukke havnemiljø.

Der er et depotrum i kælderen til lejligheden, og det er muligt at leje parkeringspladser i ejendommens aflåste parkeringskælder.

Hvis du er interesseret, er du velkommen til at kontakte os!",https://www.boligportal.dk/lejligheder/odense/118m2-4-vaer-id-5378326
"Bakkeborgdalen, 8600 Silkeborg",Silkeborg,Bakkeborgdalen,8600,56.203773,9.614149,9.395 kr.,N/A,110 m²,4,-,Rækkehus,Nej,Nej,Ja,Nej,Nej,Nej,Nej,Nej,N/A,"FLYT IND MED LEJERABAT: Underskriv lejekontrakten på en lejlighed og få 1 måneders gratis husleje (gælder ikke aconto-udgifter).
Kampagne udløber 1.8.2023

Velkommen til Helleparken.

I denne bolig med 4 værelser får du


Alt i hårde hvidevarer
Stort og lyst køkken
3 gode værelser
2 badeværelser
Rummelig have med flise terasse og plads til leg
Stort udhus
Solceller
Carport
Stort udhus

Området:



ÅBENT HUS:
 - Søndag den 20. august 2023, kl. 13:15-13:35

OBS: Venligst hold dig opdateret, da der godt kan forekomme ændringer.",https://www.boligportal.dk/r%C3%A6kkehuse/silkeborg/110m2-4-vaer-id-5369917
"Brænderigården, 7500 Holstebro  - 2. sal",Holstebro,Brænderigården,7500,56.354445,8.618483,6.995 kr.,700 kr.,86 m²,3,2.,Lejlighed,Nej,Nej,Ja,Nej,Nej,Nej,Ja,Ja,N/A,"Midt i centrum af Holstebro finder du Brænderigården, ejendommen fremtræder særdeles velholdt, og indeholder 68 lejligheder. Boligerne fordeler sig

Ejendommen fremtræder særdeles velholdt, og indeholder 68 lejligheder 1-4-værelses.

I denne tre værelses lejlighed får du:


to gode værelser med indbyggede skabe
Stort køkkenalrum med alle hårde hvidevare
Badeværelse med vaskemaskine
Stue med adgang til altan
Gratis parkering på ejendommen
Eget kælderrum

Lejevilkår:


Det er tilladt at holde 1 stk. hund på max 35 kg eller under 40 cm i højden (med forbehold). Katte er ikke tilladt.
Det er ikke muligt at leje boligen, hvis du er registreret i RKI.

* Bemærk at billederne ikke nødvendigvis er taget af/fra den pågældende bolig, og at udsigt m.v. derfor kan variere.

Området:

Holstebro er en by i det nordlige Vestjylland, og kanbyde på lidt af det hele, hav, fjord natur & kultur.

Byen er en handelsby og gågaden er kåret som Danmarks hyggeligste, der danner rammer om charmerende caféer og et stort antal shopping-muligheder.

Der er 2 indkøbscentre i byen, Nørreport Centret samt Nyholm Centret med bl.a. Bilka. 

Brænderigården er beliggende midt i byen langs gågaden og består af 2 parallelle langhuse til 2. sals højde med parkringsarealer imellem.

Nogle lejligheder har altan ( fra nr 1-19), og der forefindes affaldsskakt, depotrum i kælderen, vaskeri og festlokale.

Deleboliger er ikke tilladt.


Det er ikke muligt at leje en bolig, såfremt du er registreret i RKI.

ÅBENT HUS:
 - Søndag den 13. august 2023, kl. 12:00-12:30
 - Søndag den 20. august 2023, kl. 12:00-12:30
 - Søndag den 27. august 2023, kl. 12:00-12:30
 - Søndag den 3. september 2023, kl. 12:00-12:30

OBS: Venligst hold dig opdateret, da der godt kan forekomme ændringer.",https://www.boligportal.dk/lejligheder/holstebro/86m2-3-vaer-id-5298943
"Halsskovvej, 4220 Korsør  - 2. sal",Korsør,Halsskovvej,4220,55.34056,11.134658,5.800 kr.,1.200 kr.,88 m²,4,2.,Lejlighed,Nej,Ja,Nej,Nej,Nej,Nej,Nej,Nej,N/A,"Vi har en dejlig lejlighed til leje på Halsskovvej i Korsør. 
Lejligheden er rummelig og byder på 88 kvadratmeter, der er fordelt på fire værelser. Hvis du leder efter en komfortabel og velindrettet lejlighed, så er dette stedet for dig.

Lejemålet byder på et funktionelt køkken, hvor madlavningen bliver en leg. Du vil finde masser af skabsplads og gode arbejdsflader, der gør det nemt at tilberede dine yndlingsmåltider. Badeværelset er rummeligt og indrettet med alt det nødvendige for din daglige pleje.

Lejlighedens stue er en suite og skaber en hyggelig atmosfære. Den kan også opdeles, hvis du har behov for et ekstra soveværelse eller en separat stue. Mulighederne er mange, og du kan tilpasse lejligheden efter dine behov. Derudover tilbyder lejligheden et rummeligt soveværelse og et mindre værelse/kontor, der giver dig fleksibilitet og plads til at udfolde dig.

Beliggenheden er central og bekvem, med nem adgang til indkøbsmuligheder, skoler og smukke grønne områder. Du vil have alt lige ved hånden og kan nyde bekvemmeligheden ved at bo i dette populære område.

Hvis du har yderligere spørgsmål eller ønsker at se lejligheden, er du velkommen til at kontakte os her. Vi står til rådighed for at besvare alle dine spørgsmål og arrangere en fremvisning.

Tidligere overtagelse kan muligvis aftales, så hvis du er klar til at flytte ind i din nye drømmelejlighed, skal du ikke tøve med at kontakte os. Vi ser frem til at høre fra dig og byde dig velkommen til denne skønne lejlighed på Halsskovvej.

Tidligere overtagelse kan muligvis aftales.",https://www.boligportal.dk/lejligheder/kors%C3%B8r/88m2-4-vaer-id-4915760
"Niels Kjeldsens Vej, 7500 Holstebro  - 1. sal",Holstebro,Niels Kjeldsens Vej,7500,56.352712,8.608479,3.600 kr.,600 kr.,44 m²,2,1.,Lejlighed,Nej,Nej,Nej,Nej,Nej,Nej,Nej,Nej,N/A,"1 sals lejlighed på 44m2, bestående af, trappeopg, stue, vær, køkken og badevær.
Fælles have, cykelskur og vaskerum..
Aconto vand og varme. El afregnes direkte med elværket.",https://www.boligportal.dk/lejligheder/holstebro/44m2-2-vaer-id-4602124
"Stigsborg Brygge, 9400 Aalborg, Nørresundby  - 1. sal",Aalborg,Stigsborg Brygge,9400,57.055698,9.935422,8.595 kr.,650 kr.,89 m²,3,1.,Lejlighed,Ja,Ja,Nej,Ja,Ja,Nej,Ja,Nej,A,"Ved det nye Stigsborg Havnefront finder du denne skønne lejlighed fra 2018 med et unik lysindfald og fantastisk udsigt mod fjorden og Aalborg. Boligen er lys og indbydende med flotte trægulve og gulvvarme, hvide vægge og eksklusivt køkken og bad, garderobeskab med skydelåger fra gulv til loft - her er der kræset for alle detaljer. Lejligheden består af en entré, køkken, stue/alrum, badeværelse, 1 værelse og soveværelse. Derudover har lejligheden et fantastisk lysindfald fra de store vinduespartier så du kan nyde dine opholdsrum i masser af dagslys.

Boligen har sit private uderum i form af en stor solrig altan som vender mod vest, her kan du nyde eftermiddags- og aftensolen i en afslappende stund, alene eller med dine nærmeste. Ligeledes er der mulighed for at indrette en hyggelig krog på altangangen der leder ind til lejligheden.

På ejendommen finder du god plads til parkering af cykel både ude såvel som overdækket, en stor tilhørende parkeringsplads med fri parkering for beboer samt depotrum.

Til ejendommen er tilknyttet en vicevært som holder rent og pænt på området, han sørger naturligvis også for at stå til rådighed hvis noget mod forventning ikke er som det skal være.

Fra lejligheden er der 200 meter til vandet og den hyggelige havnefront, som med tiden vil blive udviklet til en ny bydel.

Billederne på denne annonce er fra ejendommens prøvebolig, hvorfor indretningen kan variere.",https://www.boligportal.dk/lejligheder/aalborg/89m2-3-vaer-id-5379341
"Duftrankevej, 5200 Odense, Odense V  - 3. sal",Odense,Duftrankevej,5200,55.396532,10.359256,7.150 kr.,600 kr.,62 m²,2,3.,Lejlighed,Nej,Ja,Ja,Ja,Ja,Nej,Ja,Nej,N/A,".

Du kommer til at have ekstremt kort til indkøb, da der ligger en Coop365 lige overfor!
Derudover kommer der til at være et letbanestop lige i nærheden, så du hurtigt kan komme til SDU, banegården m.m.

🐶 Mht. husdyr: Hund er tilladt. Hunden må veje op til 10 kg, og det er altid på baggrund af en individuel vurdering, så skriv til os, hvis du gerne vil have en vurdering. Du kan sende et billede og en kort beskrivelse af din hund. 
Har du et husdyr skal du betale en måneds forudbetalt leje.

🚗 Mulighed for tilkøb af eksklusiv parkeringsret for 400 kr/md",https://www.boligportal.dk/lejligheder/odense/62m2-2-vaer-id-5309565
"Kongeskrænten, 2765 København, Smørum",København,Kongeskrænten,2765,55.746914,12.288361,17.150 kr.,350 kr.,134 m²,4,-,Rækkehus,Nej,Nej,Ja,Nej,Nej,Nej,Ja,Ja,A,"Fra boligens flisebelagte forhave er der indgang til husets entre / bryggers. Vel inde i boligen kommer du fra bryggers direkte ind til huset moderne lyse Invita køkken, der selvfølgelig indeholder alt i hårde hvidevarer. I bryggers finder du såvel vaskemaskine som tørretumbler. 

I forbindelse med køkkenet er der gæstetoilet, men ikke mindst her får du adgang til husets lyse og åbne stue / alrum samt udgang til husets flisebelagte terrasse. Samtidig finder du trappen til husets 1. sal, hvor du finder badeværelse, soveværelse og ikke mindst 3 børneværelser.

Huset opvarmes med fjernvarme og alle rum har gulvvarme. Boligen har solceller på taget og lever op til lavenergi-2020.

I forbindelse med husets store skur er der privat vognly til familiens bil. 

Huset står indflytningsklart.

Fra huset er der en kort gåtur til Kildedal S-Togstation.",https://www.boligportal.dk/r%C3%A6kkehuse/k%C3%B8benhavn/134m2-4-vaer-id-5374240
"Æbeløvænget, 7000 Fredericia, Skærbæk",Fredericia,Æbeløvænget,7000,55.524734,9.638609,9.160 kr.,0 kr.,85 m²,4,-,Rækkehus,Nej,Ja,Ja,Nej,Ja,Nej,Ja,Ja,N/A,"Køkken-alrum og stue
Det nye rækkehus’ hjerterum er det lyse køkken-alrum, som ligger i åben forbindelse med stuen. Køkkenet er opført i lyse og stilfulde elementer og indeholder alt i hårde hvidevarer. Fra alrummet er der direkte udgang til egen store terrasse.

Værelser
Boligen er opført med et dejligt soveværelse samt to gode værelser, der har en ideel størrelse til f.eks. børneværelse eller gæsteværelse. Soveværelset indeholder tre faste garderobeskabe og har god plads til en stor seng. De to værelser har begge et enkelt fast garderobeskab samt plads til enkeltseng og skrivebord.

Badeværelse
Rækkehuset har et lyst og moderne badeværelse, som er opført med bruseniche, toilet, håndvask samt god opbevaringsløsning.

Entré/Bryggers
Rækkehuset har en rummelig entré. I entréen er der både vaskemaskine, tørretumbler samt et fast skab.

Uderum
Med til boligen følger skønne udearealer. Udover en skøn terrasse, er der på forsiden af boligen et større flisebelagt areal med egen p-plads samt opbevaringsskur.",https://www.boligportal.dk/r%C3%A6kkehuse/fredericia/85m2-4-vaer-id-5368886
"Peder Nielsens Gade, 9700 Brønderslev  - 2. sal",Brønderslev,Peder Nielsens Gade,9700,57.271091,9.944184,8.528 kr.,1.470 kr.,105 m²,3,2.,Lejlighed,Nej,Ja,Ja,Nej,Nej,Nej,Nej,Nej,N/A,"Lejemålet er beliggende på Peder Nielsens Gade, er 105 m2 og er klar til overtagelse. Månedlig husleje er 8528 kr. og indskud beløber sig til i alt 42420 kr. Send en besked, hvis lejemålet har fanget din interesse.",https://www.boligportal.dk/lejligheder/br%C3%B8nderslev/105m2-3-vaer-id-5211075
"Kongevej, 6900 Skjern  - Stuen",Skjern,Kongevej,6900,55.944075,8.494724,5.300 kr.,400 kr.,81 m²,2,Stuen,Lejlighed,Nej,Ja,Nej,Nej,Ja,Nej,Ja,Ja,D,"Lækker lejlighed på 81m2 centralt beliggende i Skjern. Der er egen lukket terrasse, forgang med mulighed for tilslutning af vaskemaskine og tørretumbler. Stort soveværelse, samt værelse og stor stue.",https://www.boligportal.dk/lejligheder/skjern/81m2-2-vaer-id-5378296
"Græse Strandvej, 3600 Frederikssund",Frederikssund,Græse Strandvej,3600,55.856668,12.071482,"10.804,34 kr.",600 kr.,86 m²,4,-,Hus,Nej,Nej,Ja,Nej,Nej,Nej,Nej,Nej,A,"Rækkehus i 2 plan med egen lille have samt parkering og stort skur. 
Indeholder i stueplan, entre, badeværelse med plads til vaskesøjle, stue og køkken ud i et. på 1. sal er der 3 værelser. 
Bygget i 2014.
Varme betales direkte til varmeleverandør.",https://www.boligportal.dk/huse/frederikssund/86m2-4-vaer-id-2775081
"Jernbanegade, 5550 Langeskov",Langeskov,Jernbanegade,5550,55.359209,10.590569,6.250 kr.,750 kr.,78 m²,3,-,Lejlighed,Nej,Ja,Nej,Nej,Nej,Nej,Ja,Ja,C,"Dejlig lys 3-værelseslejlighed på 78 m2 beliggende på første sal og med adgang til fælles gårdhave.
Inden indflytning installeres nyt køkken med alt i hårde hvidevarer (billeder viser det nuværende køkken, som udskiftes).
Tæt på indkøb, togstation og skole/fritidsaktiviteter.
Lejligheden er nyistandsat ved overtagelsen.
Depotrum i kælder.
Parkering ved lejligheden.",https://www.boligportal.dk/lejligheder/langeskov/78m2-3-vaer-id-5307314
