Adress,City,Street name,Postal code,Latitude,Longitude,Monthly rent,Aconto,Square meters,Rooms,Floor,Property type,Furnished,Shareable,Pets allowed,Elevator,Senior frendly,Only for students,Balcony/Terrace,Parking,Energy label,Description,Link
"Duftrankevej, 5200 Odense, Odense V",Odense,Duftrankevej,5200,55.396941,10.360821,7.800 kr.,244 kr.,65 m²,2,-,Lejlighed,Nej,Nej,Nej,Nej,Ja,Nej,Ja,Ja,N/A,"I Gartnerbyen finder du større 4 værelses rækkehuse på 97 til 121 kvm på første og anden sal, mens der i stueetagen er velindrettede 2 og 3 værelses lejelejligheder på 65 til 79 kvm. Her er der tænkt over at skabe boliger med naturligt lysindfald, da du i det store køkkenalrum kan nyde solen fra begge sider af rummet. Alle boligerne er moderne indrettet med en perfekt kombination af hvide flader og træ, der giver boligen et naturligt og varmt udtryk. Samtidig er der gjort en dyd ud af at udnytte kvadratmeterne optimalt, hvilket giver dig så meget anvendelig boligplads som muligt.


Alle boligerne er indrettet med parketgulv i eg, køkken fra Svane og alt i hårde hvidevarer. Badeværelset er udstyret med vaskemaskine og varme i gulvet, ligesom du kan nyde godt at boligernes altan eller have.



Bygningerne er orienteret i forhold til verdenshjørnerne, så de giver bedst mulige lysforhold. Gårdhaver og tagterrasserne er alle sydvestvendte, så du kan nyde solen fra morgen til aften. I områderne omkring bygningerne har der været fokus på at skabe små grønne opholdsområder, smukke vejtræer og grønne hække omkring haverne, så der er masser af grønt at se på.



Attraktiv bydel for både børnefamilier, unge, par og seniorer 



Som beboer på Duftrankevej i Gartnerbyen har du alt, hvad du skal bruge inden for 5 minutter fra din bolig. Her kan du handle ind på butikstorvet, shoppe i de små buikker og tage en frisk gå- eller løbetur i den smukke omkringliggende natur i skoven. Skal du ud på en større shoppetur, ligger Odense gågade kun få kilometer væk, hvor du kan finde mange specialbutikker, caféliv og kulturelle oplevelser.



Lige ved rækkehusene ligger en lille, hyggelig legeplads for de små børn, mens der et par hundrede meter længere væk er etableret en større park, hvor de større børn kan løbe og lege, spille fodbold og boltre sig i klatrestativerne.



Ikke langt fra boligerne ligger der også et stort udvalg af skoler, børnehaver og vuggestuer, hvor børnene trygt og sikkert kan komme til og fra via stisystemerne. Skal du ud af byen, har du let adgang til ringvejen og motorvejen, ligesom den nye letbane også er inden for kort afstand. Det er desuden heller ikke et problem med parkering, da du har mulighed for at få egen parkeringsplads.



Velkommen til Gartnerbyen, Duftrankevej 160-206, 5000 Odense 



De 72 lejeboliger i Gartnerbyen har den bedst mulige beliggenhed i grønne omgivelser, men kun en smuttur væk fra byens puls og oplevelser. Vi glæder os til at byde dig velkommen til Duftrankevej!



Beløbet for a conto forbrug er fastsat ud fra forrige lejers forbrug.
Der tages forbehold for fejl og evt. lejereguleringer.
Der vil blive indhentet oplysninger hos RKI, og er man registreret hos RKI, vil man ikke kunne leje boligen.",https://www.boligportal.dk/lejligheder/odense/65m2-2-vaer-id-5357383
"Capellavænget, 7000 Fredericia",Fredericia,Capellavænget,7000,55.565178,9.717233,10.500 kr.,0 kr.,160 m²,4,-,Hus,Nej,Nej,Ja,Nej,Nej,Nej,Nej,Nej,N/A,"Dejlig stor villa med masser af plads.
4 værelser. 160M2 beboelse samt stort godt kælderrum på ca. 35 M2
dejligt køkken med hvidevarer, stor spisestue med udgang til terrasse , stor nedsænket stue med brændeovn
Stort badeværelse samt mindre badeværelse. ligger i lukket vænge god p plads samt stor carport med stort depotrum.
terrasse er delvis overdækket og der er en dejlig men have. En fin villa til den pladskrævende familie. Opvarmning med fjernvarme.
Der er en brændeovn i stuen.
Huset vil indvendigt være malet i hvid farve ved overtagelse. 
Lejer betaler forbrug direkte til værker .",https://www.boligportal.dk/huse/fredericia/160m2-4-vaer-id-3131107
"Nørregade, 9800 Hjørring  - 2. sal",Hjørring,Nørregade,9800,57.463543,9.983235,4.456 kr.,923 kr.,87 m²,2,2.,Lejlighed,Nej,Ja,Ja,Nej,Nej,Nej,Nej,Nej,N/A,"Lejemålet er beliggende på Nørregade, er 87 m2 og er klar til overtagelse. Månedlig husleje er 4456 kr. og indskud beløber sig til i alt 17824 kr. Send en besked, hvis lejemålet har fanget din interesse.",https://www.boligportal.dk/lejligheder/hj%C3%B8rring/87m2-2-vaer-id-5111266
"Teisensvej, 9400 Aalborg, Nørresundby  - 2. sal",Aalborg,Teisensvej,9400,57.056658,9.935553,9.208 kr.,400 kr.,96 m²,3,2.,Lejlighed,Nej,Nej,Nej,Nej,Nej,Nej,Ja,Nej,A,"Skal du være en af de første, til at bo i den nye populære bydelStigsborg Brygge?

Denne ejendom er opført i det nye område Stigsborg Brygge i Nørresundby. 
Ejendommen er opført med 7 lejemål i forskellige størrelser, og med dertilhørende stor lækker fælles tagterrasse med fjordkig og udsigt til Aalborg. Tagterrassen er til fri afbenyttelse for alle ejendommens beboere.

Ejendommen består af 2 boliger på 50m2, 3 boliger på 70 m2 samt 2 boliger på 96 m2. Ud over tagterrassen, er der til de største af lejemålene også egen overdækket altan. Der er eget opvarmet depotrum til alle lejemålene.

Ejendommen er centralt beliggende, tæt på Nørresundby centrum og med hurtigt forbindelse til Aalborg Centrum.

Området er ved at gennemgå en stor forvandling, hvor der skal opbygges et helt nyt område med mange nye boliger, samt ny skole og børnehave hen over de næste 5-0 år. Der er altså talte om en helt ny bydel, der så småt begynder at tage sin form.

Fakta om ejendommen.
- 2 og 3- værelses lejligheder.
- Store og flotte lejemål med overdækkede altaner
- Skøn tagterrasse med fjordkig til fri afbenyttelse for beboerne
- Elevator i ejendommen
- Tæt på byens liv, offentlig transport og nemt til Aalborg Centrum
- Indflytningsklare i april 202
- Alt i Hårde Hvidevarer i alle lejemål
- Genvex-anlæg
- Gulvvarme



Varme afregnes direkte til forsyningen.",https://www.boligportal.dk/lejligheder/aalborg/96m2-3-vaer-id-5178837
"Marbækvej, 6700 Esbjerg, Esbjerg  - Stuen",Esbjerg,Marbækvej,6700,55.47284,8.437681,5.050 kr.,500 kr.,72 m²,2,Stuen,Lejlighed,Nej,Nej,Nej,Nej,Ja,Nej,Ja,Nej,N/A,"Stor 2. værl. høj stue lejlighed, god beliggenhed i vesterbyen,
udlejes snarest, til enlig moden rolig lejer. Dejligt lyst Invita køk. med
spiseplads. Stort lyst flise bad/toilet. Stort sov m/ garderope-
skabe. Afslebne gulve. Adgang til vaskeri, gård/haveanlæg.
Dørtelf.-anlæg, bynet og altan.
Ved henvendelse oplys venligst mobil nr. Tak",https://www.boligportal.dk/lejligheder/esbjerg/72m2-2-vaer-id-5203136
"Højmarksvej, 8723 Løsning",Løsning,Højmarksvej,8723,55.804969,9.647597,7.466 kr.,500 kr.,89 m²,3,-,Rækkehus,Nej,Nej,Ja,Nej,Ja,Nej,Ja,Ja,C,"Særdeles velbeliggende rækkehus.
Dejligt, lyst og regulært hus. 2 værelser, stor køkken-alrum-stue. Der er gulvvarme og i bryggerset er der plads til vaskemaskine og tørretumbler. Lille have og terrasse. Dertil et lille aflåst skur. Der bliver installeret fjernvarme i løbet af efteråret. 
Det er tilladt med 1 stk. kæledyr/hund.",https://www.boligportal.dk/r%C3%A6kkehuse/l%C3%B8sning/89m2-3-vaer-id-4154804
"Vestre Stationsvej, 5000 Odense, Odense C  - 2. sal",Odense,Vestre Stationsvej,5000,55.398655,10.377872,5.350 kr.,400 kr.,46 m²,1,2.,Lejlighed,Nej,Nej,Nej,Ja,Nej,Nej,Nej,Ja,A,"Her har du muligheden for at bo helt centralt i Odense City tæt på gågademiljøet, Odense Banegård, og letbanen så du nemt kan komme til byens uddannelsessteder. Lejlighederne er veludnyttet med rummeligt badeværelse og funkionelt køkken.
Til lejlighederne tilhører der også en stor og hyggelig fælles tagterrasse, hvor der er mulighed for at nyde solen hele dagen og som skaber et unikt fællesskab. I ejendommen er der desuden mulighed fornem parkering i parkeringskælderen samt cykelparkering. Der er ligeledes tilknyttet et depotrum med til lejlighederne i kælderen.",https://www.boligportal.dk/lejligheder/odense/46m2-1-vaer-id-5331954
"Tobisvænget, 5500 Middelfart, Skrillinge",Middelfart,Tobisvænget,5500,55.483072,9.765955,9.949 kr.,N/A,101 m²,4,-,Rækkehus,Nej,Nej,Ja,Nej,Nej,Nej,Nej,Nej,N/A,"Boligerne på 80 m2 indeholder entre/bryggers med mulighed for installation af vaskemaskine og tørretumbler. Lyst badeværelse med skabe, åbent køkken, stue med adgang til terrasse og 2 værelser. Alt forbrug tilmeldes direkte ved leverandørerne.

Boligerne på100 m2 indeholder entre/bryggers med mulighed for installation af vaskemaskine og tørretumbler. Lyst badeværelse med skabe, åbent køkken, stue med adgang til terrasse og3 værelser. Alt forbrug tilmeldes direkte ved leverandørerne.

Indvendigt fremstår boligerne i lyse farver med klinkegulve i køkken, entre/bryggers og bad. Stue er med laminat og værelserne med gulvtæppe.

Alle boligerne indeholder opvaskemaskine, emhætte, indbygningsovn og kogeplade.

Endvidere er der fjernvarme og Genvexanlæg i boligerne.

* Bemærk at billederne ikke nødvendigvis er taget af/fra den pågældende bolig, og at udsigt m.v. derfor kan variere.

Området:

Tobisvænget er et boligområde i Middelfart. Boligområdet består af 64 boliger i to størrelser - 80 m2 og 100 m2. Alle boligerne ligger i rolige lukkede vænger og med egen have.

Tobisvænget er beliggende tæt ved Hyllehøjskolen, Middelfart Friskole og gode sportfaciliteter. Området er etableret med gode stiforbindelser, og der er nem adgang til bustransport og motorvej E20.

Boligerne er opført i gode klassiske byggematerialer som dobbelthuse i flere varianter adskilt af carport og redskabsskur. Boligerne er opført efter de nyeste krav til bl.a. energiforbrug og indeklima.",https://www.boligportal.dk/r%C3%A6kkehuse/middelfart/101m2-4-vaer-id-5369194
"Kedelsmedgangen, 6000 Kolding  - 1. sal",Kolding,Kedelsmedgangen,6000,55.492371,9.470774,5.995 kr.,800 kr.,81 m²,3,1.,Lejlighed,Nej,Nej,Nej,Nej,Nej,Nej,Nej,Nej,N/A,Skøn lejlighed ved Kolding Slotssøen og Kolding Hus med godt lysindfald og pæne trægulve. Centralt beliggende i velholdt ejendom (1 sal) i hyggelige omgivelser ved Slotssøen på rolig vej.,https://www.boligportal.dk/lejligheder/kolding/81m2-3-vaer-id-5182798
"Absalonsgade, 9000 Aalborg, Aalborg  - 3. sal",Aalborg,Absalonsgade,9000,57.050967,9.907598,6.118 kr.,1.150 kr.,87 m²,3,3.,Lejlighed,Nej,Nej,Nej,Nej,Nej,Nej,Nej,Nej,N/A,"3-værelses lejlighed beliggende på Absalonsgade, 9000 Aalborg. 

Lejemålet er placeret i Aalborg Vestby med kort afstand til midtbyen, Stadion, diverse handlemuligheder samt offentlig transport. 

Lejligheden består af en stue, to værelser samt eget køkken og bad. 

Lejemålet overtages som beset.",https://www.boligportal.dk/lejligheder/aalborg/87m2-3-vaer-id-5187890
"Middagshøjvej, 8800 Viborg  - 1. sal",Viborg,Middagshøjvej,8800,56.447537,9.395562,8.600 kr.,N/A,101 m²,4,1.,Lejlighed,Nej,Nej,Ja,Ja,Nej,Nej,Ja,Nej,N/A,"Brofæstet ligger som et hævet, grønt plateau med forskudte ejendomme, der blender naturligt sammen med det eksisterende byrum. Udover de fem Townhouses i 2 plan rummer Brofæstet også forskellige etageejendomme. Lejlighederne har 2-4 værelser som fordeler sig på 59-109 m2. Lejlighederne har en ideel placering mellem banegade og midtbyen. Alle lejlighederne vil have en skøn altan eller terrasse, der gør det let at lufte ud og få ekstra meget lys ind i boligen. Udover dette er der en stor fælles tagterrasse med udsigt over byen. Brofæstet er svanemærket. Under skabelsen af Brofæstet har bæredygtighed og biodiversitet også været centrale nøgleord. Derfor er Brofæstets tage beklædt med grønt sedum, der smukt ændrer farve med årstiderne, men også optager regnvandet som en effektiv skybrudssikring. De grønne tage spiller flot sammen med den store gårdhave, hvor den vilde, varierede beplantning sikrer optimal biodiversitet. I gården findes også flere regnvandsbede, der optager overskydende regnvand. At bo i en bolig hvor bæredygtighed, Svanemærket og grøn natur er gennemgående principper, fra de indvendige materialer til de nyplantede træer i gården, kan naturligvis mærkes på den daglige livskvalitet.",https://www.boligportal.dk/lejligheder/viborg/101m2-4-vaer-id-5270400
"Gammel Vartov Vej, 2900 København, Hellerup  - 2. sal",København,Gammel Vartov Vej,2900,55.723808,12.576305,6.206 kr.,500 kr.,43 m²,1.5,2.,Lejlighed,Nej,Nej,Nej,Nej,Nej,Nej,Ja,Nej,N/A,"Lejligheden har stort lysindfald og flot istandsat, samt tilhørende altan. 

Lejligheden er tæt på vandet samt handle og transport muligheder.

For en fremvisning 
Send os venligst en fyldestgørende ansøgning.",https://www.boligportal.dk/lejligheder/k%C3%B8benhavn/43m2-1-vaer-id-5193804
"Sankt Helene Vej, 8700 Horsens  - 2. sal",Horsens,Sankt Helene Vej,8700,55.859238,9.845132,8.700 kr.,1.043 kr.,107 m²,4,2.,Lejlighed,Nej,Ja,Ja,Ja,Nej,Nej,Nej,Nej,N/A,"Lækker og lys velindrettet 4 værelses lejlighed, på 2. Sal midt i Horsens by.

Boligen har god entré, med adgang til 2 værelser og badeværelse med plads til vaskesøjle samt depot. Køkken/alrum med plads til egen opvaskemaskine i åben forbindelse med stuen, som har udgang til nordvest vendt altan. Fra stuen er der adgang til stort soveværelse.
Her har du alting helt tæt på.

Der er elevator til boligen.

Det er tilladt at medbringe 1 hund eller 1 kat.

Der er ikke parkeringsplads til boligen, men det er muligt at leje en plads.

Kontakt os for en fremvisning.

Huslejestigning pr. 01-10-2023 til kr. 8.873,-

Energimærke: a2015.",https://www.boligportal.dk/lejligheder/horsens/107m2-4-vaer-id-5166292
"Middagshøjvej, 8800 Viborg  - 3. sal",Viborg,Middagshøjvej,8800,56.44796,9.39466,9.300 kr.,N/A,109 m²,4,3.,Lejlighed,Nej,Nej,Ja,Ja,Nej,Nej,Ja,Nej,N/A,"Brofæstet ligger som et hævet, grønt plateau med forskudte ejendomme, der blender naturligt sammen med det eksisterende byrum. Udover de fem Townhouses i 2 plan rummer Brofæstet også forskellige etageejendomme. Lejlighederne har 2-4 værelser som fordeler sig på 59-109 m2. Lejlighederne har en ideel placering mellem banegade og midtbyen. Alle lejlighederne vil have en skøn altan eller terrasse, der gør det let at lufte ud og få ekstra meget lys ind i boligen. Udover dette er der en stor fælles tagterrasse med udsigt over byen. Brofæstet er svanemærket. Under skabelsen af Brofæstet har bæredygtighed og biodiversitet også været centrale nøgleord. Derfor er Brofæstets tage beklædt med grønt sedum, der smukt ændrer farve med årstiderne, men også optager regnvandet som en effektiv skybrudssikring. De grønne tage spiller flot sammen med den store gårdhave, hvor den vilde, varierede beplantning sikrer optimal biodiversitet. I gården findes også flere regnvandsbede, der optager overskydende regnvand. At bo i en bolig hvor bæredygtighed, Svanemærket og grøn natur er gennemgående principper, fra de indvendige materialer til de nyplantede træer i gården, kan naturligvis mærkes på den daglige livskvalitet.",https://www.boligportal.dk/lejligheder/viborg/109m2-4-vaer-id-5270459
"Østerbro, 7800 Skive",Skive,Østerbro,7800,56.564459,9.033923,5.400 kr.,900 kr.,63 m²,2,-,Lejlighed,Nej,Nej,Ja,Nej,Nej,Nej,Ja,Ja,B,Fin 2 vær lejlighed i rolige omgivelser i et godt miljø,https://www.boligportal.dk/lejligheder/skive/63m2-2-vaer-id-5270999
"Gejsingvej, 6600 Vejen, Andst",Vejen,Gejsingvej,6600,55.481558,9.234995,5.822 kr.,N/A,67 m²,2,-,Rækkehus,Nej,Nej,Nej,Nej,Nej,Nej,Nej,Nej,N/A,"Vi kan nu tilbyde denne bolig på 67 m2 beliggende i Vejen
For at kunne leje denne bolig, kræver det man er medlem af boligforeningen. På BoligPortal annonceres kun reelt ledige boliger uden eksisterende venteliste på annonceringstidspunktet. Venligst kontakt udlejer hvis du er interesseret i lejemålet.",https://www.boligportal.dk/r%C3%A6kkehuse/vejen/67m2-2-vaer-id-3753091
"Tofteparken, 9600 Aars",Aars,Tofteparken,9600,56.795965,9.520631,6.474 kr.,N/A,100 m²,4,-,Rækkehus,Nej,Ja,Ja,Nej,Nej,Nej,Nej,Nej,N/A,"Lejemålet er beliggende på Tofteparken og består af 4 værelser samt køkken og bad. Lejemålet er 100 m2 og er klar til overtagelse snarest. Månedlig husleje er 6474 kr. og indskud beløber sig til 20400 kr. 

Send en besked, hvis lejemålet har fanget din interesse.
For at kunne leje denne bolig, kræver det man er medlem af boligforeningen. På BoligPortal annonceres kun reelt ledige boliger uden eksisterende venteliste på annonceringstidspunktet. Venligst kontakt udlejer hvis du er interesseret i lejemålet.",https://www.boligportal.dk/r%C3%A6kkehuse/aars/100m2-4-vaer-id-5354469
"Kongefolden, 8660 Skanderborg  - 1. sal",Skanderborg,Kongefolden,8660,56.047864,9.92711,14.450 kr.,500 kr.,162 m²,4,1.,Lejlighed,Nej,Nej,Nej,Ja,Nej,Nej,Ja,Ja,C,"Skøn lejlighed i Skanderborg Bakker udbydes nu til leje.

Lejligheden er i 2 plan, hvor i entré plan, finder man 2 gode værelser, hertil er der gæstebadeværelse m. vaskemaskine og tørretumbler. Fortsætter man af entréen kommer man til forældreafdelingen, hvor man får et stort soveværelse med eget badeværelse og lækkert walk-in closet.

Fra den lyse entré er der trappeopgang til 1. salen, som byder på ét stort rum, hvor der er samtalekøkken med alt i hårde hvidevarer, og en lys og rummelig opholdsstue. Fra stuen er der kig udover de grønne arealer og ned til Skanderborg by, samt udgang til kæmpe solorienteret tagterrasse. 
Området er enormt hyggeligt, med gode grønne arealer, legeplads, daginstitution, og togstationen er kun få minutters gang fra bebyggelsen.  

Bemærk at billeder er fra en lignende lejlighed i anden bygning.",https://www.boligportal.dk/lejligheder/skanderborg/162m2-4-vaer-id-4680392
"Ribevej, 6650 Brørup",Brørup,Ribevej,6650,55.476679,9.017947,6.650 kr.,0 kr.,75 m²,2,-,Rækkehus,Nej,Nej,Ja,Nej,Nej,Nej,Nej,Nej,A,"Lækkert byggeri med 4 rækkehuse. Husene er bygget med de høje krav til energibesparelse. Store panoramavinduer i stuen alt glas er 3-lags, for energibesparelsens skyld. Stort køkken alrum, med sammenhængende stue, stort badeværelse, et Soveværelse samt forgang. Opbevaringsrum med særskilt adgang til hver lejlighed. Trægulv i stue og værelse. Granitbordplade i køkken og på halvmur. Badeværelse med glasstens bruseniche, samt granitplade bord og designer vask. Til hver lejlighed hører egen 16m2 terrasse samt lille græsplæne.
RKI tjek foretages på alle kommende lejere.",https://www.boligportal.dk/r%C3%A6kkehuse/br%C3%B8rup/75m2-2-vaer-id-5283354
"Emma Gads Gade, 8220 Aarhus, Brabrand  - 3. sal",Aarhus,Emma Gads Gade,8220,56.156685,10.141548,8.895 kr.,800 kr.,93 m²,4,3.,Lejlighed,Nej,Ja,Ja,Ja,Ja,Nej,Ja,Ja,A,"Nu kan vi tilbyde denne flotte 4-værelses lejlighed. Perfekt som delelejlighed for 3 venner - her får I virkelig noget for pengene!

Ejendommen, som hedder Pionérhusene ligger i Brabrand og grænser op til Åbyhøj.

Lejligheden indeholder:

- Rummelig entré,

- Flot badeværelse i nordisk stil med vaskemaskine og tørretumbler.

- Flot køkken fra HTH med alt i hårde hvidevarer inklusiv integreret opvaskemaskine, i åben forbindelse med stuen.

- 3 gode værelser med skabe indsat.

Der er fælles parkering til lejlighederne.

På få minutter kommer du på cykel til Åbyhøjs handelsgade og der er ca. 5 km. til universitetet.
Ønsker du lidt grønne omgivelser, ligger den nye bypark lige om hjørnet.

Billederne er fra en anden lejlighed, men materialevalg er de samme.

Vi udlejer IKKE til personer registreret i RKI.",https://www.boligportal.dk/lejligheder/aarhus/93m2-4-vaer-id-5379276
"Infanterivej, 8930 Randers, Randers NØ  - 2. sal",Randers,Infanterivej,8930,56.481894,10.040101,4.450 kr.,1.020 kr.,80 m²,3,2.,Lejlighed,Nej,Nej,Nej,Nej,Nej,Nej,Ja,Ja,D,"Lækker renoveret og lys 3 værelses lejlighed på Infanterivej med nyere køkken - 80 m2. Lejligheden er beliggende på 2. sal med en dejlig altan, hvor man kan nyde eftermiddagssolen og en fin udsigt. Lejligheden indeholder en stor stue, to gode værelser og et praktisk pulterrum til opbevaring. Der kan ydermere etableres mulighed for tilslutning af vaskemaskine i badeværelset efter aftale.",https://www.boligportal.dk/lejligheder/randers/80m2-3-vaer-id-5371480
"Olfert Fischers Gade, 9000 Aalborg, Aalborg  - Stuen",Aalborg,Olfert Fischers Gade,9000,57.055699,9.901522,6.350 kr.,300 kr.,71 m²,3,Stuen,Lejlighed,Nej,Ja,Nej,Nej,Ja,Nej,Nej,Ja,C,"3-værelses stuelejlighed med store rum og attraktiv beliggenhed i Vestbyen udlejes:

- 3-værelses lejlighed
- Olfert Fischers Gade, stuen
- 71 kvm
- Stort køkken m. opvaskemaskine
- Store beboelsesrum og god entre
- Vaskemaskine i kælder (gratis)
- Der medfølger stort loftrum som depot
- Gode og gratis parkeringsforhold i området
- Kr. 6.350,00 i månedlig husleje
- Kr. 300,00 i aconto varme
- Husdyr er ikke tilladt
- Gåafstand til bl.a. Fjorden, fitness, indkøb m.m.

Lejligheden er indflytningsklar, men der tilbydes fleksibilitet ift. overtagelse. 

Der opkræves 5x husleje i samlet indflytningspris i forbindelse med underskrift af lejeaftalen: 3x husleje i depositum + 1x husleje i forudbetalt leje + første måneds leje.",https://www.boligportal.dk/lejligheder/aalborg/71m2-3-vaer-id-5335995
"Lille Kongensgade, 9000 Aalborg, Aalborg  - 2. sal",Aalborg,Lille Kongensgade,9000,57.049311,9.922521,6.995 kr.,875 kr.,91 m²,3,2.,Lejlighed,Nej,Nej,Ja,Nej,Nej,Nej,Nej,Nej,C,"Dejlig lejlighed på 91 m2, rolig ejendom med få lejere. Lejligheden er beliggende i absolut centrum af Aalborg, tæt på alle byens faciliteter og transportmuligheder. Dejlig fransk altan med udsigt til Aalborg Slot og slotshaven. Skøn gårdhave, en lille oase i byens travlhed. Der er opvaskemaskine, vaskemaskine og tørretumbler.  Lejligheden er desværre IKKE delevenlig. 
Det er tilladt at holde kat eller mindre hund (under 15 kg.). 
Ud over lejen og aconto forbrug, skal man selv betale direkte for tv/internet og el (vi har aftale med Ewii, men der kan vælges andet) 
Ring for at aftale nærmere ang. en fremvisning.",https://www.boligportal.dk/lejligheder/aalborg/91m2-3-vaer-id-3136495
"Gøteborg Allé, 8200 Aarhus, Aarhus N  - Stuen",Aarhus,Gøteborg Allé,8200,56.182301,10.192749,12.500 kr.,1.100 kr.,100 m²,4,Stuen,Lejlighed,Nej,Ja,Nej,Ja,Nej,Nej,Ja,Ja,N/A,"Lejligheden indeholder 3 gode soveværelser, et lyst og åbent køkken/alrum med udgang til skøn altan Køkkenet er fra Invita og indeholder alt i hårde hvidevare. Hertil et dejligt rummeligt badeværelse med separat bruseniche og vaskesøjle. 

HI:LIFE ligger tæt på alt dét, du kan, skal, vil og elsker. Her i det skønne område omkring Christiansbjerg.

På få minutter kan du gå fra at være hjemme til at være fremme i bymidtens puls – på arbejde på Skejby Sygehus eller på studiet på Aarhus Universitet, Aarhus Business College, Aarhus Tech eller en af byens mange andre uddannelser – til en husleje, der giver dig luft. 

Daginstitutioner, indkøbsmuligheder og grønne områder gør også området ekstra attraktivt.

Bygningen slanger sig med sjove fremspring for at lukke mest lys ind i din hverdag. Samtidig lader de store vinduer dig også nyde den fantastiske udsigt. 

Alt er skabt i enkle linjer og med gennemtænkte materialer, der er lette at holde pæne. På byen, måske største tagterrasse, giver de grønne taghaver hver dag mange muligheder for ophold og afslapning.

HI:LIFE er gennemtænkt. Derfor er der også cykelvaskesteder, overdækket cykelparkering og gode parkeringspladser på ejendommen.",https://www.boligportal.dk/lejligheder/aarhus/100m2-4-vaer-id-5369496
"Færeøgade, 9000 Aalborg, Aalborg  - 2. sal",Aalborg,Færeøgade,9000,57.041722,9.939168,4.668 kr.,550 kr.,66 m²,2,2.,Lejlighed,Nej,Nej,Nej,Nej,Nej,Nej,Nej,Nej,F,"2-værelses lejlighed beliggende på Færøgade, 9000 Aalborg 

Lejligheden ligger i Ø-gadekvarteret med kort afstand til grønne områder ved Østre Anlæg, midtbyen, diverse handlemuligheder samt offentligt transport 

Lejligheden består af et værelse, stue samt eget bad og køkken. 

Lejligheden overtages som nyistandsat.",https://www.boligportal.dk/lejligheder/aalborg/66m2-2-vaer-id-5336268
"Sundevedsgade, 1751 København, København V  - Stuen",København,Sundevedsgade,1751,55.67024,12.544751,15.500 kr.,850 kr.,68 m²,3,Stuen,Lejlighed,Nej,Nej,Ja,Ja,Nej,Nej,Ja,Nej,N/A,"På Sundevedsgade centralt på Vesterbro finder du denne flotte og næsten nybyggede lejlighed. Lejligheden er en del af projektet Tovesgaard. 

Lejligheden byder på et flot lyst køkkenalrum med udgang til en store terrasse der byder på flot udsigt over foreningens grønne gårdmiljø. Fra entreen er der adgang til lejlighedens to soveværelser og badeværelse med vaskesøjle. 

Bygningen byder på aflåst cykelkælder og depotrum til hver lejlighed. 

Her er der mulighed for at blive en del af charmerende Vesterbro i en moderne lejlighed og samtidig komme hurtigt ind til byen med Metroen.",https://www.boligportal.dk/lejligheder/k%C3%B8benhavn/68m2-3-vaer-id-5378508
