Adress,City,Street name,Postal code,Latitude,Longitude,Monthly rent,Aconto,Square meters,Rooms,Floor,Property type,Furnished,Shareable,Pets allowed,Elevator,Senior frendly,Only for students,Balcony/Terrace,Parking,Energy label,Description,Link
"Vestergade, 7080 Børkop  - 1. sal",Børkop,Vestergade,7080,55.641932,9.649095,9.300 kr.,750 kr.,114 m²,4,1.,Lejlighed,Nej,Nej,Nej,Ja,Ja,Nej,Ja,Ja,N/A,"Lys og lækker lejlighed med elevator.

Lejligheden byder på et dejligt køkkenalrum med et moderne køkken, hvor der er opvaskemaskine.

Der er også vaskemaskine/tørretumbler i lejligheden - installeret i et flot badeværelse.",https://www.boligportal.dk/lejligheder/b%C3%B8rkop/114m2-4-vaer-id-5379116
"Danmarksgade, 9900 Frederikshavn  - 3. sal",Frederikshavn,Danmarksgade,9900,57.443345,10.538189,3.300 kr.,750 kr.,55 m²,1,3.,Lejlighed,Nej,Nej,Nej,Nej,Nej,Nej,Nej,Nej,N/A,"Nydelig lejlighed i danmarksgade udlejes. Lejligheden er med nyere køkken og bad, lyse vægge og trægulve. 3 måneders dep. ingen husdyr.",https://www.boligportal.dk/lejligheder/frederikshavn/55m2-1-vaer-id-1792759
"Olof Palmes Allé, 8200 Aarhus, Aarhus N  - 1. sal",Aarhus,Olof Palmes Allé,8200,56.185543,10.18822,4.995 kr.,350 kr.,29 m²,1,1.,Lejlighed,Nej,Nej,Nej,Ja,Ja,Nej,Nej,Nej,A,"2 MÅNEDERS HUSLEJEFRI!

Som kommende beboer i Blækhus Aarhus, tilbydes du lige nu de 2 første måneder huslejefrit. Altså - INGEN husleje de første 2 måneder af din lejeperiode! 

Vi afholder åbent hus med tilmelding hver søndag i ulige uger fra kl. 12:00 - 13:00. 

I Blækhus Aarhus tilbydes du følgende: 
- Entré med skabsarrangement
- Køkken m. kogeplade, emhætte, køleskab, mikroovn med grill samt skabsplads
- Stue med plads til spisebord og sovesofa el. seng
- Garderobe til tøj & sko
- Fransk altan
- Badeværelse med gulvvarme og skabsplads
- Lejligheden leveres med gardiner 
- Eget depotrum i kælderen
- Vaske- og tørrerum samt indendørs cykelparkering
- Mulighed for leje af p-plads

Områdets værdier:
Blækhus Aarhus ligger tæt på offentlig transport, uddannelsesinstitutioner, indkøb, fitness og meget mere. Det gør det let for studerende at bosætte sig i området. Både busser og Letbanen kører lige ude foran hoveddøren. supercykelstien lige rundt om hjørnet, og etableret direkte ind til Aarhus C. 

Fællesskabet bliver vægtet højt i Blækhus – derfor har man etableret 10 fælleslokaler hvor man kan mødes til spisning, der er tagterrasser hvor solen kan nydes, og så er der adgang til “Kulturbunkeren” ved siden af ejendommen. Der er skønt fællesskab, mulighed for deltagelse i foredrag, fællesaktiviteter samt leje af større lokaler. 

Lejerabat:
Lige nu kan du leje en lejlighed i Blækhus Aarhus, og samtidig få de første 2 måneders husleje gratis. Lejer betaler selv for forbrug i den huslejefriperiode.

Har du behov for et lån til indskud? Så kan vi også hjælpe med det. Betal indskuddet med hjælp fra vores samarbejdspartner, og afdrag i stedet løbende.

Vi afholder åbent hus med tilmelding hver søndag i ulige uger fra kl. 12:00 - 13:00. 

Kontakt os allerede i dag, for aftale om fremvisning :-)",https://www.boligportal.dk/lejligheder/aarhus/29m2-1-vaer-id-5378563
"Slangerupgade, 3400 Hillerød",Hillerød,Slangerupgade,3400,55.929768,12.294791,10.195 kr.,900 kr.,67 m²,2,-,Lejlighed,Nej,Nej,Nej,Nej,Nej,Nej,Nej,Nej,N/A,"Kom indenfor i denne topmoderne bolig, der er opført i lækre lyse materialer. Boligen rummer en stor entre med klinker, et rummeligt køkkenalrum, stort soveværelse samt et lyst og pænt badeværelse. Fra boligens køkkenalrum har du adgang til en bred altan, hvorfra du kan nyde solen hele dagen. 

Ejendommen er placeret i hjertet af Hillerød. Her har du Føtex som nabo og Slotsarkaderne samt Hillerød gågade i baghaven. Blot en kilometer fra ejendommen ligger Hillerød Station, hvorfra der er direkte S-togsforbindelse til København. Indenfor 10 minutter er du ved det smukke Frederiksborg Slot og Frederiksborg Slotshave, hvor du kan nyde en dejlig gå- eller løbetur. 

Ejendommen er opført i 2015 og indeholder 14 moderne lejligheder, der alle er 2 eller 3 værelser. Det er muligt at leje en privat p-plads foran ejendommen.",https://www.boligportal.dk/lejligheder/hiller%C3%B8d/67m2-2-vaer-id-5372778
"Rødegårdsvej, 5000 Odense, Odense C  - Stuen",Odense,Rødegårdsvej,5000,55.394015,10.402189,8.800 kr.,600 kr.,85 m²,3,Stuen,Lejlighed,Nej,Ja,Nej,Ja,Nej,Nej,Ja,Ja,A,"Moderne 3 værelses lejlighed med en skøn terrasse og godt lysindfald. 

Lejlighederne er indrettet med Svane-køkken, lækre hvidevarer, badeværelse med gulvvarme og vaskesøjle, to gode værelser med indbyggede skabe, stor lys stue med udgang til en lækker altan.
Ejendommen er opført med elevator, depotrum i alle lejligheder og mulighed for parkering.

Lejligheden ligger midt i den rivende byudvikling og får bla. nem adgang til letbane, cykelsti mod universitetet og centrum. Lige om hjørnet er flere dagligvarebutikker, caféer og grønne områder som Eventyr haven og Skt. Jørgens Parken.

Billederne er vejledende og kan stamme fra en anden, men lignende lejlighed.",https://www.boligportal.dk/lejligheder/odense/85m2-3-vaer-id-5336621
"Merkurvej, 8800 Viborg  - 1. sal",Viborg,Merkurvej,8800,56.4505,9.448641,1.830 kr.,407 kr.,21 m²,1,1.,Værelse,Nej,Nej,Nej,Nej,Nej,Ja,Nej,Nej,N/A,"Lejemålet er beliggende på Merkurvej, er 21 m2 og er klar til overtagelse 15-07-2022. Månedlig husleje er 1830 kr. og forudbetalt husleje og indskud beløber sig til i alt 2240 kr. 

Send en besked, hvis lejemålet har fanget din interesse.

Da dette er en almen bolig, skal der betales et ventelistegebyr på 150 kr.",https://www.boligportal.dk/v%C3%A6relser/viborg/21m2-1-vaer-id-4784008
"Hasserisgade, 9000 Aalborg, Aalborg  - 3. sal",Aalborg,Hasserisgade,9000,57.046402,9.912487,5.795 kr.,900 kr.,64 m²,2,3.,Lejlighed,Nej,Nej,Nej,Nej,Nej,Nej,Nej,Nej,N/A,"Boligen er rummelig og har en fin plantegning, hvor der også er plads til en masse opbevaring.  Kommer man ind fra entreen har man at stort og velholdt køkken på højre hånd. Herinde finder du blandt andet opvaskemaskine og vaskesøjle. Videre ned af fordelingsgangen har vi til venstre en stor stue med god plads til både sofaarrengement og spiseplads. Her overfor findes der et mindre toilet, der har det nødvendige. I bunden af fordelingsgangen finder man det store soveværelse. Her er der ligeledes rig mulighed for at have en stor seng og der er god plads til opbevaring. Fra soveværelset er der indgang til lejlighedens badeværelse.",https://www.boligportal.dk/lejligheder/aalborg/64m2-2-vaer-id-5378510
"Suensonsgade, 9000 Aalborg, Aalborg  - 3. sal",Aalborg,Suensonsgade,9000,57.05576,9.898103,5.249 kr.,500 kr.,62 m²,2,3.,Lejlighed,Nej,Nej,Ja,Nej,Nej,Nej,Nej,Ja,D,"2-værelses lejlighed, i Aalborg Vestby, udlejes:

- 2-værelses lejlighed: 62 m²
- Suensonsgade, tredje sal
- Velholdt køkken & bad
- Vaskemaskine og tørretumbler i ejendommens kælder
- Tilladt at holde kat (men ikke hund)
- Gå-afstand til cafeer, park og fjorden
- Kr. 5.249,- i månedlig husleje
- Kr. 500,- i aconto varme & vand (el afregnes direkte)
- Overtagelse fra 01.09.2023

Bemærk: Billerne er fra forrige lejers indretning, men fra den faktiske lejlighed.

Boligen udlejes af en lokal, privat udlejer i Aalborg, hvor man kan forvente en god behandling og professionel administration af lejemålet. Fremvisning sker igennem nuværende lejer.

I forbindelse med underskrift af lejeaftalen opkræves 5x husleje i samlet indflytningspris fordelt på 3x leje i depositum + 1x leje i forudbetalt husleje + første måneds husleje.",https://www.boligportal.dk/lejligheder/aalborg/62m2-2-vaer-id-5363380
"Skanderborgvej, 8000 Aarhus, Aarhus C  - 1. sal",Aarhus,Skanderborgvej,8000,56.142727,10.187584,9.950 kr.,760 kr.,108 m²,3,1.,Lejlighed,Nej,Ja,Nej,Nej,Nej,Nej,Ja,Nej,N/A,"Denne pæne lejlighed består af entré, to store stuer, som kan deles, soveværelse, lækkert køkken og rummeligt badeværelse. Desuden har lejligheden to store altaner. Særdeles velegnet som delebolig, men også til par eller lille familie. Beliggende tæt ved dagligvareforretninger, busforbindelser, gode parkeringsmuligheder og grønne områder. I ejendommen er der adgang til fælles vaskeri, eget depotrum, cykelparkering og hyggelig gårdhave. Ejendommen har fået helt nye vinduer. OBS! Billederne er fra et sammenligneligt lejemål i ejendommen, med samme rumfordeling. Dog kan forskelle forekomme. Billederne af køkkenet er fra en faktiske lejlighed.",https://www.boligportal.dk/lejligheder/aarhus/108m2-3-vaer-id-5377684
"Ringen, 8200 Aarhus, Aarhus N  - 3. sal",Aarhus,Ringen,8200,56.233432,10.203562,19.800 kr.,750 kr.,197 m²,4,3.,Lejlighed,Nej,Ja,Ja,Ja,Ja,Nej,Ja,Ja,A,"SVINGET

Svinget er tegnet af C.F Møller Architects, der har været involveret i design af boligerne siden etapens spæde start. Byggeriet består af 62 boliger, et nyt fælleshus til Nyes beboere og den lokale købmand NYMA.
 
Sammen med nabobebyggelsen Sneglehusene, udformet af arkitekt firmaet BIG, danner planen en spiralformet bevægelse ind mod det fælles gårdrum og det store regnvandsbassin Sneglehussøen.
 
NYE
Svinget ligger i Nye, smukt placeret med udsigt over Aarhus, Aarhus Bugt og Egå Engsø. Terrænet er bakket og skrånende mod syd, omkranset af mark og skov.
 
Boligerne kombinerer det bedste fra den tætte midtby med det bedste fra forstaden i et grønt og aktivt byliv. Nye udspringer fra et ønske om at tænke og leve anderledes, bevidst og bæredygtigt. Kerneværdier som liv, variation og balance er en bærende del af byens identitet.
 
BOLIGEN
Boligen er indrettet i ét plan og indeholder entré med adgang til stort og åbent køkken-alrum samt stue, som adskilles af en atriumgård i midten. Herudover er der 3 værelser, to badeværelser, hvoraf det ene er udstyret med vaskefaciliteter, et depotrum og hele tre altaner så solen kan fanges hele dagen. 

Lejer betaler a´conto vand, mens forbrug af el og varme afregnes af lejer direkte med forsyningsselskaberne.",https://www.boligportal.dk/lejligheder/aarhus/197m2-4-vaer-id-5342964
"Vestergade, 6040 Egtved  - 1. sal",Egtved,Vestergade,6040,55.616127,9.306134,5.200 kr.,800 kr.,81 m²,2,1.,Lejlighed,Nej,Ja,Ja,Nej,Nej,Nej,Ja,Ja,C,"Gang-Soveværelse-stue-badeværelse og køkkenalrum med plads til spisebord. Lille altan. 

Mulighed for vaskemaskine i badeværelset (eller kælder hvis det ønskes). Der er opvaskemaskine i køkkenet.

Der er nyt køkken og badeværelse. Nye gulve i gang-stue-køkken og soveværelse. Ligger centralt med busholdeplads lige uden for døren til Kolding-Billund og Vejle. 

Der er profiber i lejlighed som lejer kan overtage. 

Aconto er  Varme-vand. 

Husdyr er kun tilladt efter aftale ! 

Udlejes til rolig lejer. 

For at kunne leje en af vores lejligheder, må man ikke stå registeret i RKI- og debitorregister, som dårlig betaler.",https://www.boligportal.dk/lejligheder/egtved/81m2-2-vaer-id-3953196
"Jens Baggesens Gade, 4220 Korsør  - 2. sal",Korsør,Jens Baggesens Gade,4220,55.328066,11.141835,7.450 kr.,1.000 kr.,86 m²,3,2.,Lejlighed,Nej,Ja,Nej,Nej,Nej,Nej,Ja,Nej,D,"På den bedste beliggenhed i Korsør ligger denne flotte lejlighed i halvandet plan med udsigt over byens tage fra den privat tagterrasse. Ligeledes er der brugsret til haven med husets to andre beboere.

Selve lejligheden blev totalt istandsat for nogle år siden og byder på et stort køkkenalrum i åben forbindelse med stuen og gangen, som skaber en fantastisk pladsfølelse. Herudover er der et badeværelse og to soveværelser, foruden en stor hems der kan bruges som et tredje værelse.

Der er desuden egne vaskefaciliteter og opvaskemaskine.",https://www.boligportal.dk/lejligheder/kors%C3%B8r/86m2-3-vaer-id-5000299
"Arresøvej, 8240 Aarhus, Risskov  - 2. sal",Aarhus,Arresøvej,8240,56.20274,10.234978,8.300 kr.,1.100 kr.,63 m²,3,2.,Lejlighed,Nej,Nej,Ja,Nej,Nej,Nej,Ja,Nej,N/A,"Tag del I fællesskabet

De moderne lejeboliger fordeler sig på 33-107 m2 og med 1-4 værelser. Variationen i boligerne og den gennemgående funktionelle indretning betyder, at der med garanti er en bolig, der matcher dine behov og dit sted i livet.Arresøhave henvender sig til dig, der er studerende, eller som lige har fundet din vej ud på arbejdsmarkedet. Det er både til dig, der er single, eller er en del af et boligsøgende par.Et hjem i rolige omgivelser med kort vej til altingI Risskov får du det bedste af alle verdener. Et bymiljø, der indbyder til ro og socialt nærvær med dine nærmeste – med kort vej til rekreative, grønne oaser og et dyp i havet. Alt sammen blot få kilometer fra Aarhus C.",https://www.boligportal.dk/lejligheder/aarhus/63m2-3-vaer-id-5317076
"Vilhelm Ehlerts Alle, 8800 Viborg  - 1. sal",Viborg,Vilhelm Ehlerts Alle,8800,56.447324,9.390657,7.700 kr.,0 kr.,79 m²,3,1.,Lejlighed,Nej,Ja,Ja,Ja,Ja,Nej,Ja,Ja,A,"Type E-75-3-2  
Skøn energivenlig treværelses lejlighed med lyst og åbent køkken-alum med direkte udgang til en hyggelig altan. Stort soveværelse, dejligt værelse, bad i tidløst design og praktisk entré.

Fra entréen træder du ind i lejlighedens køkken-alrum. Rummet indbyder til at invitere gæster over til brætspil og god mad, der kan nydes enten ved stue- eller spisebordsområdet. I lejeboligen har du nemlig fin plads til både spisebord, sofa og TV-møbel.

Boligens lyse soveværelse inkluderer to faste garderobeskabe, som sikrer dig masser af opbevaringsplads. Lejlighedens andet værelse er placeret i modsatte ende af soveværelset, hvilket gør det oplagt til både kontor, hobbyrum eller måske gæsteværelse.

Med direkte adgang fra køkken-alrummet finder du badeværelset, som er opført med enkle og tidløse kvalitetsmaterialer. Her kan vasketøjet nemt klares, da du både har egen vaskemaskine og tørretumbler.

Fra stuen kan du træde direkte ud på lejlighedens altan, hvor du kan nyde de lange, lyse sommeraftener. Her kan du glæde dig over plads til cafesæt, dekorative planter eller krukker med velsmagende krydderurter.

Den energivenlige bolig har gulvvarme i alle rum og ventilationsanlæg for et bedre indeklima.
Forbruget betales direkte til forsyningsselskaberne.

Elevator i hver opgang, gratis p-plads, cykelparkering og depotrum i kælderen.

Husdyr er tilladt efter aftale.

Billeder og illustrationer er vejledende.",https://www.boligportal.dk/lejligheder/viborg/79m2-3-vaer-id-5369040
"Niels Brocks Gade, 8900 Randers, Randers C  - 2. sal",Randers,Niels Brocks Gade,8900,56.462193,10.045194,7.970 kr.,1.068 kr.,97 m²,3,2.,Lejlighed,Nej,Nej,Ja,Nej,Nej,Nej,Nej,Nej,N/A,"Stor 3. Værelses lejlighed på 97 m2, beliggende på 2 sal i Randers centrum. Med til lejemålet hører komfur, emhætte og der er forberedt til installation af vaskemaskine. Der er altan, samt fælles tagterrasse.
Der er fuld hårde hvidevarer pakke i lejemålet.

Husdyr er tilladt.",https://www.boligportal.dk/lejligheder/randers/97m2-3-vaer-id-4569715
"Kirkebjerg Parkvej, 2605 København, Brøndby  - 2. sal",København,Kirkebjerg Parkvej,2605,55.657001,12.39624,10.915 kr.,995 kr.,74 m²,3,2.,Lejlighed,Nej,Nej,Ja,Ja,Ja,Nej,Ja,Ja,N/A,"156 lejeboliger fordelt på 2-, 3- eller 4-værelses lejligheder. 

Den nyligt opførte rødstensejendom præsenterer sig flot i nabolaget med store vinduespartier, grå detaljer og glasafskærmede altaner, der har en behagelig afstand imellem sig. Alle lejligheder fremstår med regulære værelser, lyse stuer, pæne køkkener og rummelige badeværelser, og når først gårdhavemiljøet er færdiganlagt, får I endnu flere udendørsarealer til rådighed. 

I bosætter jer i et nyetableret kvarter, hvorfra I får korte afstande til alle hverdagens fornødenheder - og det gælder alt fra skolefaciliteter, dagtilbud og indkøbsmuligheder, som tæller både Rema1000, SuperBrugsen, Lidl og Netto. Glostrup Station er ligeledes inden for nær rækkevidde, og her kan I komme til Indre By med S-toget på cirka 20 minutter. Det er derfor ganske nemt at pendle til og fra Indre By, hvilket gør denne adresse ekstra attraktiv. I kommer ligeledes hurtigt til Høje Taastrup, hvorfra regionaltogene fører jer videre rundt på Sjælland. Derudover tager det under fem minutter i bil at komme på motorvejsnettet

Der er 94 parkeringspladser i parkeringskælderen + 62 parkeringspladser i terræn. En parkeringsplads kan lejes for 300 dkk pr. måned i terræn og 350 dkk i parkeringskælderen. Der opsættes tilmed 2 el-lade standere, således at der kan oplades 4 elbiler ad gangen. 

Alle hårde hvidevarer der forefindes i prøveboligen medfølger i alle lejlighederne.

Der er Stofa fibernet og boligerne opvarmes med fjernvarme.

Lejlighederne kan reserveres ved at deltage på åbent hus. Vi holder åbent hus ca. én gang om ugen indtil alt er udlejet. 

Ønsker du at deltage i det åbne hus, så kan du sende en besked via annoncen og modtage en invitation til det næstkommende åbne hus. 

Indflytningsprisen skal betales umiddelbart efter modtagelsen af lejekontrakten. 

Det vil ikke være muligt at besigtige andre boliger end prøveboligen inden indflytning og det er under ingen omstændigheder tilladt at opholde sig på byggepladsen uden en invitation til åbent hus. 

Billeder, plantegning og tekst er vejledende. 

Hvis du er registreret i RKI kan vi desværre ikke tilbyde dig lejligheden. Dette kontrolleres ved udarbejdelse af lejekontrakt.",https://www.boligportal.dk/lejligheder/k%C3%B8benhavn/74m2-3-vaer-id-5349233
"Gadelandet, 2700 København, Brønshøj  - 3. sal",København,Gadelandet,2700,55.711466,12.479679,13.600 kr.,1.350 kr.,93 m²,4,3.,Lejlighed,Nej,Nej,Ja,Ja,Ja,Nej,Ja,Ja,A,"Boliger til singler, par og familier
361 nye boliger
En unik og spændende ny bæredygtig bydel med et stort potentiale. Projektet er en omdannelse og revitalisering af et gammelt industrikvarter til et levende og mangfoldigt beboelses- og erhvervsområde.
Bebyggelsen indeholder 361 nyopførte boliger med en stor variation af indretning. Der er 170 1-værelses Micro Living boliger, som er velegnet til singler og studerende. Derudover er der 167 familiebolig/delevenlige boliger med 2- til 5 værelser. Langs gårdhavens midterstrøg er der 24 rækkehuse, hvoraf 12 af dem er i to plan.
Boligerne er centralt placeret i bydelen ved Husum Torv med ­mangfoldige indkøbsmuligheder og tæt på offentlig transport og skole. Tæt på ligger Utterslev Mose, et fantastisk rekreativt område med sø og natur, samt Vestvolden, som er en 17 km lang rekreativ cykel- og gårute fra Utterslev Mose til Brøndby Havn.
Derudover:
- Energivenlig
- Delevenlig
- Elevator i bygningen
- Kælderrum
- Cykelparkering
- Det er muligt at leje en p-plads i kælderen
- Ét husdyr er tilladt
- Det er ikke tilladt at stå i RKI
Bemærk, at billedmaterialet ikke stammer fra den pågældende bolig.",https://www.boligportal.dk/lejligheder/k%C3%B8benhavn/93m2-4-vaer-id-5370622
"Smedevænget , 8830 Tjele, Vorning",Tjele,Smedevænget ,8830,56.52567,9.729673,6.800 kr.,0 kr.,134 m²,5,-,Hus,Nej,Nej,Nej,Nej,Nej,Nej,Nej,Nej,N/A,"Din og velholdt hus udlejes eller sælges.
Der er monteret hent ny Panasonic luft til vand varmepumpe.
Lækker stor have.
Fin garage med redskabsrum.

Alt henvendelse kun på tlf 
Mail besvares ikke.",https://www.boligportal.dk/huse/tjele/134m2-5-vaer-id-5313459
"Hvidkløvervænget, 2625 København, Vallensbæk",København,Hvidkløvervænget,2625,55.655,12.362262,17.500 kr.,0 kr.,132 m²,5,-,Rækkehus,Nej,Ja,Ja,Nej,Nej,Nej,Ja,Ja,N/A,"I et dejligt kvarter i Vallensbæk udlejer vi 61 rækkehuse. Boligerne kaldes Hollænderhusene og henviser til boligernes unikke arkitektur, som er inspireret af Amsterdams flotte kanalhuse. Disse er bl.a. kendetegnet ved stor variation i boligernes facade og taghældning. Der er tale om 4- og 5-værelses rækkehuse i varierende størrelse på 114-138 m2. Alle rækkehuse er i to plan.

 

INDE:

Boligerne er opført i materialer af høj kvalitet og er alle udstyret med lyse Invita-køkkener, hårde hvidevarer fra Siemens og trægulve i ahorn. Træder du ind af hoveddøren, møder du i stueetagen en entré, køkken- og opholdsstue i ét samt et gæstetoilet. På første sal finder du husets dejlige badeværelse, hvor brusekabinen er opført med ”rainshower”, der skruer op for følelsen af luksus. På 1. sal findes desuden tre eller fire separate værelser afhængig af husets størrelse. 

UDE:
Hvert rækkehus har egen have og terrasse. Til hver bolig findes desuden et skur til opbevaring.

HÅRDE HVIDEVARER:
Boligerne er etableret med en fuld hvidevarepakke fra Siemens. 

PARKERING:
Der er parkering foran hver bolig med plads til to biler. Derudover finder du også gæsteparkeringspladser i området.

HUSDYR:
Katte: Lejere kan ansøge om tilladelse til at holde én indekat på adressen. Udekatte er ikke tilladt.
Hunde: Lejere kan ansøge om tilladelse til at holde hund. 
Andre dyr: Kontakt os for vores samlede husdyrsregler. 

FÆLLESAREALER:
Mellem boligerne er der anlagt grønne arealer, som skaber rammerne om hyggelige stunder blandt beboerne – unge som ældre.",https://www.boligportal.dk/r%C3%A6kkehuse/k%C3%B8benhavn/132m2-5-vaer-id-5342094
"Englandsgade, 6700 Esbjerg, Esbjerg  - 1. sal",Esbjerg,Englandsgade,6700,55.467015,8.454474,7.500 kr.,1.000 kr.,81 m²,3,1.,Lejlighed,Nej,Ja,Ja,Nej,Nej,Nej,Nej,Ja,N/A,"Velindrettet 3-værelses bolig i Esbjerg
Boligen inkluderer entré, badeværelse, gang, køkken, stue, soveværelse samt et værelse.
Lejligheden er installeret HTH inventar, opvaskemaskine, køl-fryseskab, ovn, induktions kogeplade, vaskemaskine samt tørretumbler.
Laminat gulve i røget eg og betonfarvede keramiske fliser på WC-badegulve og vægge i brusenichen.
Mulighed for leje af fast parkeringsplads.",https://www.boligportal.dk/lejligheder/esbjerg/81m2-3-vaer-id-4954162
"Englandsgade, 5000 Odense, Odense C  - 3. sal",Odense,Englandsgade,5000,55.407905,10.383464,6.495 kr.,500 kr.,52 m²,2,3.,Lejlighed,Nej,Nej,Nej,Ja,Nej,Nej,Ja,Nej,A,"Med bedste beliggenhed på Odense Havn, udbydes denne 2-værelses lejlighed, til leje. 

Lejemålet er indrettet: entre med adgang til 1 stort soveværelse samt direkte adgang til køkken/alrum. Endvidere flot badeværelse med toilet og brus.

På badeværelse er der fliser og sokkelklinker. I de andre rum er der flotte parketgulve. Der er gulvvarme i alle rum. 

Køkkenet har følgende hvidevarer: Kogeplader, emhætte, ovn, køle-/fryseskab, vaskemaskine og kondenstørretumbler samt opvaskemaskine. Alle hvidevarer leveres i høj kvalitet, med god energiklasse og lavt lydniveau. 

Det er ikke tilladt at holde husdyr. Der er kælder og elevator. 

Fremvisning efter aftale.",https://www.boligportal.dk/lejligheder/odense/52m2-2-vaer-id-5263682
"Fredericiagade, 7100 Vejle  - 2. sal",Vejle,Fredericiagade,7100,55.702899,9.531986,4.480 kr.,900 kr.,40 m²,1,2.,Lejlighed,Nej,Nej,Nej,Nej,Nej,Nej,Nej,Nej,N/A,"Dejlig lys 40 m2 lejlighed til leje i Vejle C.

Nye tæpper i  stue og vinyl i køkken  nymalet i hvidt overalt , nyere køkken og bad.
have med græsplæne og brolagt gårdhave 

mulighed for parkering foran ejendommen ingen p- zone afgift 

huslejen er inklusiv  eget depotrum i gården 

Beløbet kr 1100  pr mdr på koldt vand og varme er fast  pr.  måned .

Der er egen vaske/tørresøjle  og opvaskemaskine i køkken i lejligheden 

5 min gang til strøget og  til søndermarksskoven",https://www.boligportal.dk/lejligheder/vejle/40m2-1-vaer-id-2468034
"Stålstræde , 5000 Odense, Odense C  - 2. sal",Odense,Stålstræde ,5000,55.396807,10.388204,7.900 kr.,800 kr.,95 m²,2,2.,Lejlighed,Nej,Nej,Ja,Ja,Nej,Nej,Ja,Nej,B,"OBS udlejes uden møbler.	
Tæt på centrum og banegård udlejes flot ny lejlighed, beliggende i flot præsentabel ejendom.
Lejlighedens indretning: Entre/køkken, badeværelse og stue/soveværelse med adgang til egen lille altan med plads til lille cafe bord og stole, der er endvidere adgang til fælles tagterrasse med bord bænke sæt som alle i ejendommen må anvende.
Lejligheden er bygget for ca. 2 år siden og er bygget i rigtig fin og moderne stil, lejligheden er udstyret med alt i hårde hvidevarer, bla. egen vaskemaskine og tørretumbler, der er eget depotrum til hvert lejemål, der forefindes elevator i ejendommen.
Lejligheden skal ses for at få det rette indtryk af de kvaliteter den har, det er muligt at arrangere fremvisning efter nærmere aftale.
Det er en ikke ryger ejendom, det er tilladt som en af de få ejendomme i Odense at holde skikkelige husdyr af en vis størrelse.
A conto forbrug udgør pr mdr. varme kr. 500,00- vand kr. 300,00- leje reguleres efter netto prisindeks for september, første gang 1 januar 2025.
Der udføres kredit tjek på alle vore kommende lejere.",https://www.boligportal.dk/lejligheder/odense/95m2-2-vaer-id-4102541
"Fynsgade, 6700 Esbjerg, Esbjerg  - 2. sal",Esbjerg,Fynsgade,6700,55.464447,8.460584,6.900 kr.,580 kr.,74 m²,3,2.,Lejlighed,Nej,Ja,Nej,Nej,Nej,Nej,Nej,Nej,B,"Nyrenoveret lys og venlig lejlighed.
Nyrenoveret stort badeværelse med plads til egen vaskemaskine.
køkken med spiseplads og nyere HTH elementer
Stort soveværelse med faste skabe.
Fra stuen er der adgang til stor sydvest vendt terrasse.
Ejendommen er ren og rolig trods den centrale placering i byen.
Der medfølger rum i kælderen og en parkeringsplads.",https://www.boligportal.dk/lejligheder/esbjerg/74m2-3-vaer-id-4755155
