Adress,City,Street name,Postal code,Latitude,Longitude,Monthly rent,Aconto,Square meters,Rooms,Floor,Property type,Furnished,Shareable,Pets allowed,Elevator,Senior frendly,Only for students,Balcony/Terrace,Parking,Energy label,Description,Link
"Nørretorv, 8700 Horsens  - Stuen",Horsens,Nørretorv,8700,55.868759,9.845833,5.585 kr.,700 kr.,56 m²,2,Stuen,Lejlighed,Nej,Nej,Ja,Nej,Nej,Nej,Nej,Ja,B,"Boligen er indrettet med badeværelse med plads til vaskemaskine og tørretumbler, køkken med lille spiseplads, stue og soveværelse med indbyggede skabe. Der er adgang til lukket gårdrum med et lille grønt areal.
Depot rum i kælderen.",https://www.boligportal.dk/lejligheder/horsens/56m2-2-vaer-id-4613262
"Arresøvej, 8240 Aarhus, Risskov  - Stuen",Aarhus,Arresøvej,8240,56.204268,10.230495,7.950 kr.,650 kr.,68 m²,3,Stuen,Lejlighed,Nej,Ja,Ja,Ja,Nej,Nej,Ja,Ja,A,"På Arresøvej 31-33 i Risskov Engby nær Aarhus udlejer vi 167 lækre lejligheder fordelt på 2 separate bygninger. Lejlighederne varierer i størrelsesordenen 40-71 m2, og de 167 lejligheder er fordelt på 81 stk. 3-værelses lejligheder, 81 stk. 2-værelses lejligheder og 5 stk. 1-værelses lejligheder.

GRATIS HUSLEJE OG GAVEKORT TIL REMA 1000:
Der bliver eksklusivt givet 2 måneders gratis husleje samt et gavekort på 3000 kr. til Rema 1000 ved kontrakter der underskrives på lejlighed med overtagelse ""Snarest"".

INDE:
Alle lejligheder er opført med et lyst køkken/alrum med god plads til både at indrette sig med et lækkert køkken- og stueområde. I de 1-værelses boliger fungerer køkken/alrummet også som soveværelse, mens der i de 2- og 3-værelses lejligheder er mulighed for at indrette sig med et eller flere separate værelser. I alle typer lejemål er der rummelige og lyse badeværelser.

NB: Se billeder og plantegning for at få et indtryk af lejligheden. 

UDE:
Lejemålet har en dejlig terrasse. 

Ejendommen er opført som etagebyggeri bestående af henholdsvis 4 og 5 etager. På grunden er der etableret en dejlig og grøn gårdhave med god plads til hyggeligt samvær og grillarrangementer. Her er der blandet andet basketballbane og en balancebane, og der er plantet hække, buske og træer for at skabe det grønne miljø. 

HÅRDE HVIDEVARER:
Alle lejligheder indeholder køle- og fryseskab, opvaskemaskine, indbygningsovn, indbygningskogeplader med induktion, vaskemaskine og tørretumbler. 

HUSDYR:
Hund: Det er tilladt at holde hund i boligerne.*
Indekat: Det er tilladt at holde indekat i boligerne.*
Øvrige husdyr: Kontakt os.

*Der skal altid udarbejdes en husdyrserklæring til det pågældende husdyr. Kontakt os for mere info, hvis du ønsker at holde husdyr i din bolig.


PARKERING:
Til ejendommen hører der 75 parkeringspladser + 2 handicappladser i overdækket parkeringsareal. Hvis du ikke har bil kan du trygt parkere din cykel i stueplan, hvor der er 222 cykelparkeringspladser. Der er elevator til parkeringskælderen i alle opgange pånær nr. 33.",https://www.boligportal.dk/lejligheder/aarhus/68m2-3-vaer-id-5354423
"Jenny Kammersgaards Vej, 8700 Horsens  - 1. sal",Horsens,Jenny Kammersgaards Vej,8700,55.859003,9.86753,9.850 kr.,1.150 kr.,108 m²,4,1.,Lejlighed,Nej,Ja,Ja,Ja,Ja,Nej,Ja,Ja,A,"Ønsker du at kombinere det pulserende byliv med nærhed til natur og et skønt maritimt miljø, så er Kanalhusene lige noget for dig.

HUS 2 er beliggende i Horsens Havn ved den nye kanal og med udsigt til Horsens Fjord og udbydes nu som eksklusive lejeboliger.

Horsens Havn skal i de kommende år udvikles og forvandles til en helt ny bydel med attraktive boliger, arbejdspladser, butikker, restauranter samt rekreative områder med plads til kultur- og fritidsaktiviteter for hele familien placeret i et unikt maritimt miljø. Herudover planlægges der opførelse af legepladser, et havnebad, samt muligheder for søsportsaktiviteter og meget mere, så alle aldersgrupper kan få glæde af den nye havn.

Køkken-alrum og stue er i direkte forbindelse med de store flotte altaner, hvor der tillige er depotrum. Med denne indretning er der både udsigt til Havnen, når du tilbereder mad, underholder gæster – eller bare slapper af i sofaen. Indretningen er yderst funktionel men samtidig er hensynet til udsigten og solens placering tænkt ind i lejlighedernes plantegning på fineste vis. Adgang til p-kælder direkte fra opgangen.

Kontakt os endelig for en fremvisning af projektet.",https://www.boligportal.dk/lejligheder/horsens/108m2-4-vaer-id-4737856
"Rolighedsvej, 1958 København, Frederiksberg C  - 6. sal",København,Rolighedsvej,1958,55.685178,12.539701,5.995 kr.,500 kr.,37 m²,1,6.,Lejlighed,Nej,Nej,Nej,Nej,Nej,Nej,Nej,Nej,C,"Du har nu muligheden for at leje denne skønne 1-værelseslejlighede i Frederiksberg C. 

Lejligheden ligger i et skønt område, med handle og transportmuligheder lige ved døren. 

Skriv på Boligportalen for en fremvisning.",https://www.boligportal.dk/lejligheder/k%C3%B8benhavn/37m2-1-vaer-id-5377812
"Ellekratvej, 5200 Odense, Odense V",Odense,Ellekratvej,5200,55.40481,10.265918,8.800 kr.,0 kr.,116 m²,5,-,Rækkehus,Nej,Nej,Nej,Nej,Nej,Nej,Nej,Nej,N/A,"Dejligt rækkehus i 2 etager beliggende i rolige naturskønne omgivelser, ud til grønne områder.

Husets stueplan består af dejlig stue i åben forbindelse med køkken, værelse og bryggers/toilet.
På 1. sal består af soveværelse og 2 værelser samt stort badeværelse.

Redskabsrum med god plads til cykler etc.

Ellekratvej er en rolig gade uden meget trafik, og der er gode fortove, cykelstier og offentlig transportforbindelser til andre områder af Odense. Der er også flere grønne områder i nærheden af gaden, herunder Munkebjerg Skov og Ellekildehave Skov.

Billeder fra lignende lejemål.",https://www.boligportal.dk/r%C3%A6kkehuse/odense/116m2-5-vaer-id-5378041
"Engtoften, 8260 Aarhus, Viby J  - Stuen",Aarhus,Engtoften,8260,56.123405,10.167685,8.950 kr.,700 kr.,76 m²,3,Stuen,Lejlighed,Nej,Ja,Nej,Nej,Nej,Nej,Ja,Ja,C,"Bemærk at billeder er fra et lignende lejemål

Der udbydes nu disse velbeliggende 3 værelses lejligheder i Viby J. Her er kort afstand til Aarhus C via Viby Station samt kort gåafstand til Aarhus Business College. Ejendommen er en spændende arkadeejendom fra 2004, hvor man har et overdækket gårdrum med adgang til alle lejligheder og tilhørende depotrum. 

Lejligheden ligger i stueplan, og har adgang til egen solorienteret have. Lejligheden byder på 2 fine værelser, rummeligt badeværelse samt stort stue med køkken og udgang til haven. 

Lejligheden er derfor oplagt som delelejlighed for 2 eller for parret, som ønsker lidt ekstra plads.

Husdyr er ikke tilladt.",https://www.boligportal.dk/lejligheder/aarhus/76m2-3-vaer-id-5361477
"Dortheavej, 2400 København, København NV  - 3. sal",København,Dortheavej,2400,55.707584,12.531084,6.200 kr.,600 kr.,41 m²,1,3.,Lejlighed,Nej,Nej,Nej,Nej,Nej,Ja,Nej,Nej,N/A,"Velkommen til Frederiksborggade/Dortheavej – kollegie på Nørrebro!

Kollegiet er beliggende på ydre Nørrebro, mellem Nørrebro og Bispebjerg station. Lejlighederne er fordelt på 4 etager og indeholder alle:

- Badeværelse

- Køkken med 2 kogeplader, emhætte og køleskab med en lille fryseboks

- Alle boliger udlejes umøbleret

I ejendommen findes et fællesvaskeri og en fælles tagterrasse.

Der gøres opmærksom på, at boligerne er studieboliger og det er dermed et krav at du er aktiv studerende eller optaget på et godkendt studie, være fyldt 18 år samt du skal have min. et års studie tilbage fra ønsket indflytningsdato for at kunne komme i betragtning til en bolig i ejendommen.


Husdyr er ikke tilladt.
Du kan ikke leje boligen, hvis du er registreret i RKI.


For at kunne komme i betragtning til en studiebolig skal du opfylde et af nedenstående krav:

Du er i gang med en SU-berettiget uddannelse.

Du er i lære, traniee eller har en elevplads.

Du kan dokumentere minimum 20 timers ugentlig skolegang i dagtimerne. Det gælder også uddannelser, der ikke er SU-berettigede (fx. produktionsskole og sprogskole).

Du er i gang med et praktikophold eller lignende, hvor dette er et krav for optagelse på en uddannelse. Praktikophold og andet kan dog kun godkendes som dokumentation for 1 år.

Du er ung og har et særligt behov (dokumenteres af fx. en sagsbehandler ved kommunen).

ÅBENT HUS:
 - Tirsdag den 15. august 2023, kl. 14:30-14:40

OBS: Venligst hold dig opdateret, da der godt kan forekomme ændringer.",https://www.boligportal.dk/lejligheder/k%C3%B8benhavn/41m2-1-vaer-id-5225492
"Karlsbergvej, 8940 Randers, Randers SV",Randers,Karlsbergvej,8940,56.399586,10.069435,2.800 kr.,0 kr.,32 m²,1,-,Værelse,Nej,Nej,Nej,Nej,Nej,Nej,Ja,Ja,E,"Stort værelse udlejes i hus med fælles arealer, som er:
et fælles køkken, et badeværelse med sauna, et stort fællesrum med bla. bordtennis, et træningsrum i kælder, i løbet af sommeren kommer der en pool i haven 4x8 meter som også kan benyttes.  Bussen kører lige til døren, vand, varme, el, brænde, vask, stor tv-pakke, internet er med i huslejen",https://www.boligportal.dk/v%C3%A6relser/randers/32m2-1-vaer-id-5321738
"Fjordbrynet, 6000 Kolding  - 1. sal",Kolding,Fjordbrynet,6000,55.486475,9.498191,9.200 kr.,1.426 kr.,114 m²,4,1.,Lejlighed,Nej,Ja,Ja,Ja,Nej,Nej,Ja,Ja,A,"KONTAKT OS FOR AT BOOKE EN FREMVISNING ELLER MELD DIG TIL ÅBENT HUS HVER TORSDAG FRA 15-16.

Boliger i første række. To boligtårne med i alt 104 boliger har rejst sig ud mod Kolding Fjord hvor de står i smukt samspil med naturen. Fokus er på høj kvalitet, den skønne beliggenhed med fantastisk udsigt samt indretning, der passer til en bred målgruppe. 

Denne bolig på 114m2 består af en entré, badeværelse med vaskemaskine og tørretumbler, køkken/stue (med opvaskemaskine) med direkte adgang til en altan samt 3 værelser. 
Det har været et klart ønske at skabe et fællesskab for beboerne i Fjordbrynet. Derfor er der indrettet et helt fantastisk Orangeri med 2 store tagterrasser øverst og nederst i den flotte foyer bydes beboerne velkommen hjem.  

- Der er en parkeringsplads pr. lejemål og fri parkering til gæster.
- Du har mulighed for at tage din lille hund eller kat med (op til 15 kg) - skal godkendes af udlejer først. 
- Der er vicevært tilknyttet bygniggerne.
- Mulighed for fibernet. 
- Gulvvarme i badeværelset.
- Depotrum i sidebygningen. 

De spændende lejligheder har fokus på lys for de kommende livsnydere i Fjordbrynet. Der vil være udsigt til de grønne trækroner, Kolding by og Kolding Fjord. Lejlighederne opføres med stor variation i størrelserne med et spænd fra 77 til 157 m2 og med altaner, hvorfra udsigten virkelig kan nydes. Det har desuden været et ønske at gøre området til et inviterende og rekreativt område, som forbinder byen, skoven og fjorden, hvilket må siges at være lykkedes rigtig godt. Fjordbrynet vil med sin attraktive og naturskønne placering i Kolding kunne tiltrække og være en boligdrøm for de fleste.

**Billeder/plantegninger er vejledende og uden ansvar.",https://www.boligportal.dk/lejligheder/kolding/114m2-4-vaer-id-5289960
"Samsøvej, 6000 Kolding, Drejens",Kolding,Samsøvej,6000,55.50344,9.555151,8.900 kr.,N/A,92 m²,4,-,Rækkehus,Nej,Nej,Ja,Nej,Ja,Nej,Ja,Ja,A,"Dejlig og rummelig bolig med entré og bryggers i ét, hvor der er plads til vaskemaskine og tørretumbler. Fra entréen tilgår man boligens rummelige stue og det moderne køkkenalrum i ét, med rig mulighed for plads til både sofa og spisebord. På 1. salen tilgår man moderne badeværelse, det store soveværelse samt to værelser.

Bebyggelserne består af 87 energivenlige moderne rækkehuse/lejligheder i størrelsen 85 til 165m² – I et til tre plan, tegnet i en moderne og enkel streg. Rækkehusene er opdelt på hhv. Farøvej, Samsøvej & Langøvej.

Til hvert hus tilhører enten p-plads eller carport, samt cykelparkering og et lille skur. Arealet foran husene er flisebelagt, således at det er let tilgængeligt og har niveaufri adgang. Udvendigt er rækkehusene opført i en moderne stil, med enten røde, brune, grå eller gule nuancer. Indvendigt er husene ligeledes også opført i en moderne stil, med stort og moderne køkken og badeværelse.

Husene er beliggende på lukkede vænger, hvorfor der er begrænset med trafik, og børn kan derfor trygt slippes løs og finde legekammerater i området. Hunden kan ligeledes luftes på de grønne fællesarealer i området.

Åbne og lyse huse

Alle husene er indrettet lyse og venlige, med hvide glatte lofter og vægge. Store oplukkelige vinduer for ekstra godt lysindfald overalt. Fælles opholdsrum (køkken/alrum/stue) indrettes med store vinduespartier på flere sider for maksimalt lysindfald. Gulve af egeplank (laminat) i køkken/alrum, stue og værelser. Bryggers/entre og badeværelse og brus udføres med lækre klinkegulve i grå nuancer. Alle døre i glat hvid finish med rustfri stålgreb og uden dørtrin for optimal betjening. Vægge mod gulv afsluttes med hvide glatte fodpaneler.

Fine detaljer overalt

Boligens badeværelse er udført i moderne stil. Køkken, bad, bryggers og soveværelse monteres med moderne moduler i glat hvid afslutning. Vask i badeværelse af formstøbt materiale med kvalitetsarmaturer og stort spejl.

Kvalitetshvidevarer

Alle hvidevarer medfølger i anerkendt kvalitet herunder køl/frys, opvaskemaskine, kogeplade med induktionsteknologi, emhætte og indbygningsovn. Der medfølger ligeledes vaskemaskine og tørretumbler.

Sundt indeklima

Boligen er udført med ventilationsanlæg, der sikrer et sundt og godt indeklima.

Individuelle forbrugsmålere

Forbrug til varme, el og vand afregnes direkte mellem lejer og forsyningsselskaberne. Opvarmning via fjernvarme.

Illustrationer er modelfotos. Der tages forbehold for rettelser.",https://www.boligportal.dk/r%C3%A6kkehuse/kolding/92m2-4-vaer-id-5377465
"Sjællandsgade, 7400 Herning  - Stuen",Herning,Sjællandsgade,7400,56.139615,8.990102,5.325 kr.,700 kr.,65 m²,2,Stuen,Lejlighed,Nej,Nej,Nej,Nej,Nej,Nej,Nej,Ja,N/A,"Hyggelig 2-værelses lejlighed med en dejlig, stor stue, lyst soveværelse med skabe; lakerede trægulve, ludbehandlet træloft. Badeværelset er med bruseniche. Adgang t/vaskekælder, have og pulterrum. Der er gode muligheder for at parkere en bil.  Skal ses!!!",https://www.boligportal.dk/lejligheder/herning/65m2-2-vaer-id-5086578
"C.F. Møllers Allé, 2300 København, København S  - 1. sal",København,C.F. Møllers Allé,2300,55.635319,12.578239,14.239 kr.,700 kr.,70 m²,3,1.,Lejlighed,Nej,Nej,Nej,Ja,Nej,Nej,Ja,Nej,N/A,"Emmahus består af 154 splinternye lejeboliger på 2-5 værelser beliggende i den sydlige del af Bellakvarter i København. Bygningen er udformet som en klassisk københavnerkarré med fire fløje omkring et gårdrum og opført i en ikonisk rød murstensfarve.

Lyse og moderne boliger

Emmahus er tegnet af Praksis Arkitekter, der har skabt et varieret udbud af boliger fra hyggelige 2-værelses til rummelige 5-værelses lejligheder, så der både er plads til singler, par og børnefamilier. Alle boliger er opført med store vinduespartier og er indrettet, så de primære opholdsrum har det bedste dagslys. Materialerne er lyse og køkkenet er hvidt og moderne fra Invita. Stort set alle boliger har altaner eller terrasser i gården eller på taget.

Grønne områder og aktiviteter

Det store gårdrum i Emmahus bliver indrettet med et opholds- og legeområde samt træer, buske og planter. Du bliver nabo til den grønne park Sydhaven og i forlængelse af den Bellakvarters aktivitetstag med træningsfaciliteter, basketballbane, legeplads og meget mere. Rundt om hjørnet finder du desuden Byparken, hvor der er mulighed for at gå en tur eller benytte den offentlige fodboldbane og beachvolleybane, og så er du tæt på Amager Fælled.

Tæt på indkøb og centrum

Emmahus er placeret tæt på alt det, du har brug for. Der er gode parkeringsmuligheder i p-huset ved siden af og længere nede af gaden ligger nærmeste indkøbsmulighed. Har du brug for en større indkøbstur er Field’s på den anden side af Byparken, hvor du også finder biograf og restauranter. Metrostationen Bella Center ligger desuden 500 meter fra ejendommen, hvorfra det kun tager 10 minutter at komme til Kongens Nytorv.

Et bæredygtigt byområde

Bellakvarter er bæredygtighedscertificeret indenfor DGNB og har som det første byområde i Danmark fået en Guld-midtvejscertificering.

* Bemærk at billederne ikke nødvendigvis er taget af/fra den pågældende bolig, og at udsigt m.v. derfor kan variere.",https://www.boligportal.dk/lejligheder/k%C3%B8benhavn/70m2-3-vaer-id-5370923
"Refsvej, 7700 Thisted  - Stuen",Thisted,Refsvej,7700,56.961824,8.696328,4.223 kr.,537 kr.,90 m²,4,Stuen,Lejlighed,Nej,Ja,Nej,Nej,Nej,Nej,Nej,Nej,N/A,"Afdelingen består af ialt 186 stk. lejligheder 1, 2, 3 og 4 vær. boliger i størrelsen 36-93 m2, med god udsigt ud over området og byen. Boligerne fik i 2017 etableret nye altaner og mellem ejendommene ligger et stort fællesareal med legeplads og beach-volley bane.
Afdelingen råder også over et festlokale, som indimellem bruges til fælles aktiviteter (bla. bankospil og, fællesmad mv.). Man har mulighed for at leje dette lokale til evt. fødselsdag eller lignende, når man bor i afdelingen.
Refsvej ligger godt placeret med gåafstand til bymidten, uddannelsesinstitutioner, busforbindelser og indkøb.
For at kunne leje denne bolig, kræver det man er medlem af boligforeningen. På BoligPortal annonceres kun reelt ledige boliger uden eksisterende venteliste på annonceringstidspunktet. Venligst kontakt udlejer hvis du er interesseret i lejemålet.",https://www.boligportal.dk/lejligheder/thisted/90m2-4-vaer-id-5378920
"Skolevej, 4171 Glumsø",Glumsø,Skolevej,4171,55.353211,11.686907,7.200 kr.,1.500 kr.,84 m²,4,-,Lejlighed,Nej,Nej,Nej,Nej,Nej,Nej,Nej,Nej,N/A,"Superflot og velindrettet 4-værelses lejlighed centralt beliggende i Glumsø.

Lejligheden er nyindrettet med lækkert køkken og flisebadeværelse m.v.

Til lejemålet hører udendørs terrasse samt adgang til hyggelig fælles have.

Acontoforbrug indeholder: Varme, vand samt kontingent til beboerrepræsentation.

Et lejemål der skal ses - udlejes nyistandsat.

Bemærk venligst, at du bedes oplyse dit telefonnummer ved henvendelse på annoncen.

Vores sagsnr. 13-1307-7",https://www.boligportal.dk/lejligheder/glums%C3%B8/84m2-4-vaer-id-2415495
"Dagmar Hansens Gade, 8240 Aarhus, Risskov",Aarhus,Dagmar Hansens Gade,8240,56.195801,10.205761,8.695 kr.,800 kr.,76 m²,3,-,Lejlighed,Nej,Ja,Nej,Ja,Nej,Nej,Ja,Ja,N/A,"Velkommen indenfor i disse nyopførte lejligheder i Skejbyen. Med en lejlighed i Skejbyen er du tæt på både daginstitutioner, sportsfaciliteter, spisesteder, indkøbsmuligheder, skov og meget mere! Du har med andre ord mulighed for et hjem, der passer til lige netop dine behov – hvad end du er til liv og hygge, eller ro og afslapning.

I Punkthuset finder du i alt 30 lejligheder fra stuen til 5. etage. Til stuelejlighederne får du terrasse og til de øvrige etager får du altan. Denne 3-værelses lejlighed rummer 76 kvadratmeter og er med gulvvarme i hele boligen, store vinduespartier, grebsfrit hvidt køkken, lamelparketgulve i egetræ og hårde hvidevarer fra Siemens.

Lejlighederne indeholder alt i hårde hvidevarer og der medfølger depotrum til alle boliger.

OBS. Billederne er fra den etablerede prøvebolig. Plantegningen er gældende.

Kontakt os endelig for en fremvisning!",https://www.boligportal.dk/lejligheder/aarhus/76m2-3-vaer-id-5360712
"Rantzausbakke, 8700 Horsens",Horsens,Rantzausbakke,8700,55.874079,9.80305,7.475 kr.,250 kr.,65 m²,2,-,Lejlighed,Nej,Nej,Ja,Ja,Nej,Nej,Ja,Ja,A,"Lys og rummelig toværelses lejlighed med stort køkken-alrum og stue, stort soveværelse og egen altan.

Køkken og stue
I denne nye toværelses lejlighed ligger det lyse og moderne køkken i åben forbindelse med stuen. Køkkenet er opført i stilrene HTH-elementer og indeholder alt i hårde hvidevarer. I stuen er der god plads til sofaområde med TV.

Soveværelse
Lejligheden indeholder et stort og skønt soveværelse med to faste garderobeskabe samt plads til en stor seng.

Badeværelse
Det enkle og moderne badeværelse er opført med bruseniche, toilet, håndvask samt opbevaringsplads.

Entré
I lejlighedens entré er der et fast skab til opbevaring. Herfra er der adgang til boligens store leverum, der forbinder både køkken og stue.

Uderum
Fra stuen er der direkte udgang til egen altan, hvor der er fin plads til et cafésæt, der indbyder til hyggelige udendørs stunder.

Depot/skur
Til lejligheden hører der et skur med. Skuret er ikke isoleret.

Husdyr
Det er tilladt at have op til max. 2 husdyr i lejemålet. 

Fibernet
Der er lagt fibernet i boligen. 

Parkering
Der er mulighed for at parkere sin bil på de fælles p-områder, som er gratis. 

Forbrug / Aconto
Der opkræves 250 kr. vand i aconto. 
El og varme afregnes direkte med forsyning",https://www.boligportal.dk/lejligheder/horsens/65m2-2-vaer-id-5344759
"Gåser Engvej, 9362 Gandrup, Gåser",Gandrup,Gåser Engvej,9362,57.0081,10.202879,6.000 kr.,1.000 kr.,88 m²,3,-,Hus,Nej,Ja,Ja,Nej,Nej,Nej,Ja,Ja,N/A,"Unik landejendom udlejes fra 01.09-23. Ejendommen ligger i landlige omgivelser ud til åben mark, tæt på Limfjorden. Hyggelig have med flere terrasser og bålplads. Til boligen tilhører der udhus på 4,6m2  samt et udhus mere på 131m2. I det ene udhus er der hyggerum med bar.
mulighed for plads til heste",https://www.boligportal.dk/huse/gandrup/88m2-3-vaer-id-5372152
"Skt. Jørgens Engen, 5000 Odense, Odense C",Odense,Skt. Jørgens Engen,5000,55.399366,10.400228,11.128 kr.,0 kr.,100 m²,4,-,Rækkehus,Nej,Nej,Nej,Nej,Nej,Nej,Ja,Ja,A,"Kun 4 af etapens 25 2-etages rækkehuse er solgt til udlejning.
Til alle medfølger der egen P-plads.
Rækkehuset er taget i brug sent i 2021, så alt er nyt.
Hvis man er interesseret bedes man svare med en lille præsentation af sig selv + et telefonnummer og en mailadresse.",https://www.boligportal.dk/r%C3%A6kkehuse/odense/100m2-4-vaer-id-5238218
"Byparken, 5700 Svendborg  - 1. sal",Svendborg,Byparken,5700,55.075169,10.633374,7.689 kr.,3.139 kr.,128.5 m²,6,1.,Lejlighed,Nej,Ja,Ja,Nej,Nej,Nej,Ja,Ja,N/A,"6-værelses lejlighed i etagebebyggelse. Alle afdelingens boliger har gennemgået en renovering i 2011-2013. Der forefindes komfur og køleskab i boligen, og lejligheden har 2 toiletter. 
 
Det er tilladt at holde 2 indekatte.
 
Afstande: Off. transport 100 m., dagligvarebutik 100-500 m., folkeskole 1 - 2 km., centrum 2,5 - 3 km.",https://www.boligportal.dk/lejligheder/svendborg/128m2-6-vaer-id-5338047
"St. Sct. Hans Gade, 8800 Viborg  - 2. sal",Viborg,St. Sct. Hans Gade,8800,56.451865,9.409145,4.500 kr.,1.250 kr.,50 m²,2,2.,Lejlighed,Nej,Nej,Nej,Nej,Nej,Nej,Nej,Ja,N/A,"Lille Hyggelig 2. værelses lejlighed med synlig bjælker indeholder: Entre, stue / køkken allrum. Soveværelse med skabe, badeværelse med bruser og mulighed for egen vaskemaskine. Der er trægulve i entre, stue/ køkken og gulvtæppe i soveværelset. Lejligheden er central beliggende og er med kort afstand til Viborg gågade. Til lejligheden hører fælles vaskeri og cykelrum.",https://www.boligportal.dk/lejligheder/viborg/50m2-2-vaer-id-5355410
"Gladsaxe Møllevej, 2880 København, Bagsværd  - Stuen",København,Gladsaxe Møllevej,2880,55.750451,12.471462,8.823 kr.,600 kr.,60 m²,3,Stuen,Lejlighed,Nej,Nej,Nej,Nej,Nej,Nej,Nej,Nej,F,"Veldisponeret lejlighed centralt i Bagsværd. På en god placering i Bagsværd ligger denne lejlighed nu klar til overtagelse. I bosætter jer tæt på både dagligdagens gøremål og hyggelige fritidsaktiviteter, i har bl.a. Bagsværd Fortet indenfor gåafstand.
På denne placering er I altså nær det meste. Således standser bussen blot få skridt uden for hoveddøren, og I er i gåafstand til indkøbsmuligheder, daginstitution, Gladsaxe Skole og Gladsaxe Gymnasium. Cyklen fører jer nemt til både tog og S-tog samt idræt og svømmehal. Ønsker I at tage en gåtur i grønne områder, kan i cykle til Gammelmosen og hvis I pendler på arbejde, er I nær motorvejen.

I kan se frem til en veldisponeret lejlighed på første sal, hvor hver en kvadratmeter er udnyttet. Her får I en stue, et køkken, et værelse og et badeværelse samt brugsret til privat parkeringsplads. Lejlighedens to værelser er oplagt at indrette som henholdsvis stue og soveværelse.

Begge værelser er rummelige, således at der er plads til et stort skab i soveværelset og stuen kan indrettes med spisebord eller kontorplads såvel som sofahjørne. Desuden kan der på altanen nydes solens stråler og fuglefløjt.",https://www.boligportal.dk/lejligheder/k%C3%B8benhavn/60m2-3-vaer-id-5379407
