Adress,City,Street name,Postal code,Latitude,Longitude,Monthly rent,Aconto,Square meters,Rooms,Floor,Property type,Furnished,Shareable,Pets allowed,Elevator,Senior frendly,Only for students,Balcony/Terrace,Parking,Energy label,Description,Link
"Oluf Bagers Gade, 5000 Odense, Odense C  - 1. sal",Odense,Oluf Bagers Gade,5000,55.389466,10.390736,6.895 kr.,600 kr.,66 m²,2,1.,Lejlighed,Nej,Nej,Nej,Ja,Nej,Nej,Nej,Nej,N/A,"Velkommen til vores lejelejlighed, der tilbyder et behageligt og praktisk hjem i et roligt miljø. Beliggende på anden sal og spændende over 66 kvadratmeter, er denne lejlighed ideel for dem, der søger komfort og bekvemmelighed.

En af de største fordele ved denne lejlighed er dens placering. Den er beliggende i et fredeligt område, hvor du kan nyde roen og samtidig have nem adgang til handlemuligheder og skoler. Du kan nemt nå frem til butikker, supermarkeder og andre faciliteter inden for kort afstand. Samtidig er der også gode muligheder for offentlig transport i nærheden.

Når du træder ind i lejligheden, byder en dejlig gang dig velkommen. Gangen er udstyret med opbevaringsmuligheder, der giver dig plads til at organisere dit tøj og sko, så du kan holde orden og have alt lige ved hånden.

Køkkenalrummet er en åben og indbydende plads, der forbinder til soveværelset. Lejligheden er udstyret med faciliteter, herunder en opvaskemaskine, som vil gøre din daglige rutine mere bekvem. Der er også en vaske- og tørretumbler, så du kan tage dig af dit vasketøj uden besvær.

For de cykelentusiaster er der mulighed for cykelparkering i gården. Dette giver dig en sikker og bekvem måde at opbevare dine cykler på og gør det nemt for dig at udforske området på to hjul.

Vi er sikre på, at denne lejlighed vil give dig et behageligt hjem og en praktisk livsstil. Hvis du er interesseret i at se lejligheden eller har yderligere spørgsmål, er du velkommen til at kontakte os. Vi står klar til at hjælpe dig og besvare eventuelle spørgsmål, du måtte have.",https://www.boligportal.dk/lejligheder/odense/66m2-2-vaer-id-5374603
"Storegade, 6100 Haderslev",Haderslev,Storegade,6100,55.251521,9.478824,6.000 kr.,1.000 kr.,90 m²,3,-,Lejlighed,Nej,Ja,Ja,Nej,Nej,Nej,Nej,Nej,N/A,"Dejlig 3 værelses lejlighed i god ejendom udlejes.

Lejligheden indeholder 2 gode værelser, en gang, stor stue / køkken i et rum og dejligt stort badeværelse hvor der kan tilsluttes vaskemaskine og tørretumbler.

Der er laminat gulve i hele lejligheden og flot hvidt køkken.

P-plads i gården kan tilkøbes.",https://www.boligportal.dk/lejligheder/haderslev/90m2-3-vaer-id-4951698
"Svendsgade, 9000 Aalborg, Aalborg  - 5. sal",Aalborg,Svendsgade,9000,57.051199,9.912957,8.195 kr.,800 kr.,105 m²,3,5.,Lejlighed,Nej,Ja,Nej,Nej,Nej,Nej,Nej,Nej,N/A,"Velkommen indenfor i denne store, delevenlige 3-værelses lejlighed beliggende i Svendsgade i starten af Vestbyen af Aalborg.

Lejlighedens 105 kvadratmeter er fordelt fantastisk til en delelejlighed eller til et par, da der er masser af plads i opholdsrummene. Lejligheden består af et entréområde, et lyst køkken med god plads og opvaskemaskine samt en yderst rummelig stue med masser af muligheder for indretning af stort sofaarrangement, hyggekrog m.m.

Derudover byder lejligheden på 2 gode værelser samt et fint badeværelse med seperat bruseniche og vaske-/tørremaskine.

Kontakt os endelig, hvis du ønsker en fremvisning!",https://www.boligportal.dk/lejligheder/aalborg/105m2-3-vaer-id-4976250
"Overgade, 5000 Odense, Odense C  - 1. sal",Odense,Overgade,5000,55.396878,10.389593,7.875 kr.,685 kr.,60 m²,2,1.,Lejlighed,Nej,Ja,Ja,Ja,Ja,Nej,Nej,Nej,N/A,"I de lyse lejligheder, hvor der virkelig er kræset om detaljerne. Oplev det fantastisk leverum, hvor køkken-alrum og stue er forenet på harmonisk vis. Køkkenet er stilrent og veludstyret med Bosch hårde hvidevarer, der skaber de bedste betingelser for dine kulinariske udfoldelser.

I de lyse lejligheder, hvor der virkelig er kræset om detaljerne. Oplev det fantastisk leverum, hvor køkken-alrum og stue er forenet på harmonisk vis. Køkkenet er stilrent og veludstyret med Bosch hårde hvidevarer, der skaber de bedste betingelser for dine kulinariske udfoldelser.

Gulvene er strømlinede og stilrene i Tarkett egetræ. Badeværelset er holdt minimalistisk med smukke klinker og simple elementer, så der i hele lejligheden er stor mulighed for at sætte eget præg.

Her skal du ikke lede længe for at finde, lige det du har brug for. Udenfor døren er midtbyens mange muligheder, og inden for kort afstand findes skoler, daginstitutioner, indkøbsmuligheder og fritidsaktiviteter.

Lyder denne lejlighed som noget for dig, så kontakt os for at høre mere!",https://www.boligportal.dk/lejligheder/odense/60m2-2-vaer-id-5364743
"Olof Palmes Allé, 8200 Aarhus, Aarhus N  - 2. sal",Aarhus,Olof Palmes Allé,8200,56.185543,10.18822,5.050 kr.,350 kr.,29 m²,1,2.,Lejlighed,Nej,Nej,Nej,Ja,Ja,Nej,Nej,Nej,A,"2 MÅNEDERS HUSLEJEFRI!

Som kommende beboer i Blækhus Aarhus, tilbydes du lige nu de 2 første måneder huslejefrit. Altså - INGEN husleje de første 2 måneder af din lejeperiode! 

Vi afholder åbent hus med tilmelding hver søndag i ulige uger fra kl. 12:00 - 13:00. 

I Blækhus Aarhus tilbydes du følgende: 
- Entré med skabsarrangement
- Køkken m. kogeplade, emhætte, køleskab, mikroovn med grill samt skabsplads
- Stue med plads til spisebord og sovesofa el. seng
- Garderobe til tøj & sko
- Fransk altan
- Badeværelse med gulvvarme og skabsplads
- Lejligheden leveres med gardiner 
- Eget depotrum i kælderen
- Vaske- og tørrerum samt indendørs cykelparkering
- Mulighed for leje af p-plads

Områdets værdier:
Blækhus Aarhus ligger tæt på offentlig transport, uddannelsesinstitutioner, indkøb, fitness og meget mere. Det gør det let for studerende at bosætte sig i området. Både busser og Letbanen kører lige ude foran hoveddøren. supercykelstien lige rundt om hjørnet, og etableret direkte ind til Aarhus C. 

Fællesskabet bliver vægtet højt i Blækhus – derfor har man etableret 10 fælleslokaler hvor man kan mødes til spisning, der er tagterrasser hvor solen kan nydes, og så er der adgang til “Kulturbunkeren” ved siden af ejendommen. Der er skønt fællesskab, mulighed for deltagelse i foredrag, fællesaktiviteter samt leje af større lokaler. 

Lejerabat:
Lige nu kan du leje en lejlighed i Blækhus Aarhus, og samtidig få de første 2 måneders husleje gratis. Lejer betaler selv for forbrug i den huslejefriperiode.

Har du behov for et lån til indskud? Så kan vi også hjælpe med det. Betal indskuddet med hjælp fra vores samarbejdspartner, og afdrag i stedet løbende.

Vi afholder åbent hus med tilmelding hver søndag i ulige uger fra kl. 12:00 - 13:00.",https://www.boligportal.dk/lejligheder/aarhus/29m2-1-vaer-id-5378564
"Strandlodsvej, 2300 København, København S  - Stuen",København,Strandlodsvej,2300,55.665913,12.62255,17.400 kr.,1.400 kr.,124 m²,4,Stuen,Lejlighed,Nej,Ja,Ja,Ja,Ja,Nej,Ja,Ja,A,"Velkommen til boligen!
Lejligheden består af 3 gode soveværelser, et moderne badeværelse med vaskesøjle samt et skønt køkken/alrum, hvor du nemt kan få plads til både sofaarrangement og spiseområde. Fra køkken/alrummet er der ligeledes adgang til lejligheden 2 terrasser.
GRØNT ETAGELIV VED AMAGER STRANDPARK
Flyt ind i et grønt fællesskab, tæt på havet og Ørestad Metro. Her får du egen altan, tagterrasse eller privat have, lyst interiør med vaskesøjle, p-kælder og gårdrum med legeplads og udefitness.
TIL FAMILIEN OG STORBYLIVET
Bad med gulvvarme og vaskesøjle, hvidt, stilrent INVITA-køkken, kvalitetshvidevarer fra Siemens, indbyggede garderobeskabe, sundt indeklima og egen altan, have eller terrasse. Når du flytter ind i en af de 313 lækre lejeboliger i Greensquare Garden, får du alle muligheder for at skabe et skønt hjem med masser af lys, luft og grønne omgivelser ved vandet – inklusive p-kælder til elbil, gårdmiljø til leg og udefitness samt beboerhotel til overnattende gæster.
10 MINUTTER TIL STRANDEN
I Greensquare Gardens gårdrum er der plads til boldspil og klatreaktiviteter, solbadning og hygge med naboerne. Her kan du spille bordtennis eller dyrke udendørsfitness – eller besøge Amager Strandparks sand for en dag med picnic, strandhygge, kajaksejlads, tidlige morgendukkerter eller slentreture ved vandkanten.
LIGE I NÆRHEDEN
Velbrygget baristakaffe. En lækker middag. Drinks i solen. I Strandlodsvej-kvarteret bor du i et hipt boligområde, hvor gamle, industrielle bygninger er bevaret i skøn forening med områdets hyggelige butikker, caféer og restauranter.
AMAGER STRANDS VILDE NATUR
Hvis du tager cyklen, kan du være på Christianshavn eller Nyhavn på ingen tid. Eller nyde den hyggelige stemning omkring Sundbys traditionsrige sejlklub, de fine kolonihaver – og mange muligheder for friluftsaktiviteter omkring Amager Strandpark. Eller hvad med en tur i Kløvermarken, med de kendte fodboldbaner og grønne omgivelser, så langt øjet rækker?
Husdyr: Med ansøgning
*Bemærk at billederne ikke nødvendigvis er taget af/fra den pågældende bolig, og at udsigt m.v. derfor kan variere.",https://www.boligportal.dk/lejligheder/k%C3%B8benhavn/124m2-4-vaer-id-5371382
"Ørestad Boulevard, 2300 København, København S  - Stuen",København,Ørestad Boulevard,2300,55.640281,12.583101,11.100 kr.,650 kr.,66 m²,2,Stuen,Lejlighed,Nej,Nej,Nej,Nej,Nej,Nej,Nej,Nej,A,"Ejendommen
Bellakvarters nye pejlemærke Bella Tower er tegnet af COBE og Vilhelm Lauritzen Arkitekter, og er et markant islæt for indgangen til Bellakvarter. 
det 60 meter høje boligtårn er designet i et hvidt grid af rå betonelementer, som er placeret på en mørk murstensbase, der danner rammen omkring et grønt, naturrigt gårdmiljø. Boligerne i basen går op til 5. sal og har altaner og tilbagetrukne terrasser ud til gården, mens tårnet skyder 19 etager op og har altaner hele vejen rundt. 
Ejendommen består af i alt 199 lejligheder med 2-6 værelser. Udsigt over hele Ørestad og Amager Fælled. 
Tårnet er tegnet med 360 graders altaner i forskellige dybder, som varierer fra franske altaner til opholdsaltaner. Det giver mulighed for et rigt udeliv, hvor man kan gå udenfor fra alle værelser og nyde den ubrudte udsigt ud over Ørestad og ind over Amager Fælled til Københavns Skyline. 
 
Boligerne
Boligerne har et stilrent og nordisk look og er opført i lækre materialer såsom flotte egetræsgulve og store vinduespartier. De store vinduespartier giver et dejligt lysindfald og en ubeskrivelig flot udsigt fra tårn-lejlighederne. 
Køkkenet er et kvalitetskøkken fra Invita og i et tidløst design med integrerede hårde hvidevarer såsom indbygningsovn, induktionskogeplade, køle/fryseskab og opvaskemaskine. Alle badeværelser er opført i lyse materialer og bruseniche med ekstra stort brushoved der indbyder til lange bade og som giver et indtryk af kvalitet og velvære. 
Alle boliger har egen vaskemaskine og tørretumbler. 
 
Området
Bellakvarter er bæredygtighedscertificeret inden for DGNB og har som det første byområde i Danmark fået en Guld-midtvejscertificering. DGNB bygger på en helhedsorienteret forståelse af bæredygtighed, der tager højde for både miljømæssige, økonomiske, tekniske, processuelle og sociale faktorer. Bellakvarter er et mangfoldigt kvarter, hvor bæredygtigheden kommer i spil i blandt andet håndtering af regnvand, affaldshåndtering og grønne områder. 
 
Bellakvarter er tæt på naturen. Bydelen ligger klods op ad Amager Fælled og er designet, så naturen kan mærkes i kvarteret. De mange grønne pladser og lommeparker i Bellakvarter bindes sammen af frodige alléer, og vandet er nærværende i bydelens avancerede regnvandshåndteringssystem i kanaler og søer.",https://www.boligportal.dk/lejligheder/k%C3%B8benhavn/66m2-2-vaer-id-5357926
"Strandgade, 8700 Horsens  - Stuen",Horsens,Strandgade,8700,55.862023,9.864061,5.250 kr.,750 kr.,55 m²,2,Stuen,Lejlighed,Nej,Nej,Nej,Nej,Nej,Nej,Nej,Nej,D,"Nu har du mulighed for at leje denne dejlige 2-værelses lejlighed med gode, lyse rum og udsyn til dejligt grønt gårdmiljø. Der er etableret helt nyt badeværelse i lejligheden og køkkenet er renoveret og der er indsat nye hårde hvidevarer.

Lejligheden er indrettet med en lille entre/fordelingsgang, hvor der er adgang til stort køkken med mulighed for spiseplads. Fra fordelingsgangen er der adgang til stuen, og herfra videre til soveværelse og badeværelse.

Der er adgang til fælles vaskekælder og fælles grønt gårdmiljø. Brug af vaskemaskinen er inkl. i huslejen. Lejligheden er beliggende i Strandgade – Østbyen – hvor der er gode naturområder med kort afstand til havnen samt Lunden og Rådhusparken.

Overtages nymalet og med nyt badeværelse og nyrenoveret køkken.",https://www.boligportal.dk/lejligheder/horsens/55m2-2-vaer-id-5357379
"Poul Anker Bechs Vej, 9200 Aalborg, Aalborg SV",Aalborg,Poul Anker Bechs Vej,9200,57.019294,9.870208,12.250 kr.,0 kr.,133 m²,5,-,Rækkehus,Nej,Ja,Ja,Nej,Ja,Nej,Ja,Ja,A,"Rækkehus i topklasse, i populære Sofies Have på Poul Anker Bechs Vej i Aalborg, udlejes. Sofies Have er ekslusive, arkitekttegnede rækkehuse, opført i kvalitetsmaterialer. Fakta:

- Femværelses lejebolig
- 133 kvm fordelt på 2 etager 
- Stort køkken alrum + 4 store værelser
- Kr. 12.250,00 i husleje 
- Al forbrug afregnes til forsyningen
- Moderne køkken & to badeværelser i dansk design 
- Alt i hårde hvidevarer medfølger
- Gulvvarme 
- 15 kvm stor carport og 5 kvm stort skur 
- Husdyr tilladt, men efter aftale 
- Gåafstand til natur og grønne områder 
- Overtagelse fra 01.09.2023

I forbindelse med underskrift af lejekontrakt, opkræves man indflytningsprisen på 5x husleje, der dækker over 3x leje i depositum, 1x leje i forudbetalt leje og første måneds husleje.

Huset udlejes til rette lejer.",https://www.boligportal.dk/r%C3%A6kkehuse/aalborg/133m2-5-vaer-id-4813061
"Thorsø Skovvej, 8600 Silkeborg  - Stuen",Silkeborg,Thorsø Skovvej,8600,56.125278,9.559977,5.950 kr.,850 kr.,73 m²,3,Stuen,Lejlighed,Nej,Ja,Nej,Nej,Nej,Nej,Ja,Ja,N/A,"Meget flot 3 værelses stue lejlighed med egen have/ terrasse og med udsigt ud over Thorsø,  HTH køkken med alt i hvidevare, stort bad/toilet med helt nyt skabsarangement,m. vask mm. stue med brandeovn,stue, værelse og soveværelse, fra stuen og soveværelset er der udsigt over Thorsø. Der er også adgang til fælles stor baghave, vaskemaskine og tørretumbler, egen forhave. 
OBS Lejligheden kan overtages med det samme. 
Henvendelse til Jakob mellem 7.30-16.30",https://www.boligportal.dk/lejligheder/silkeborg/73m2-3-vaer-id-5020069
"Jomfrustien, 6100 Haderslev  - 4. sal",Haderslev,Jomfrustien,6100,55.250897,9.491433,4.800 kr.,400 kr.,97 m²,2,4.,Lejlighed,Nej,Nej,Nej,Nej,Nej,Nej,Nej,Nej,N/A,"På 4. sal finder man denne prægtige lejlighed med udsigt over byens tage, kæmpe stue, stort soveværelse, spisekøkken, renoveret badeværelse - et sted man føler sig godt tilpas og rammer som gør at man har det godt",https://www.boligportal.dk/lejligheder/haderslev/97m2-2-vaer-id-3551307
"Æbeløvænget, 7000 Fredericia, Skærbæk",Fredericia,Æbeløvænget,7000,55.524535,9.6385,9.100 kr.,0 kr.,99 m²,3,-,Rækkehus,Nej,Ja,Ja,Nej,Ja,Nej,Ja,Ja,N/A,"Køkken-alrum og stue
Rækkehuset er centreret omkring et lyst og rummeligt køkken-alrum, hvor køkkenet er placeret for sig. Køkkenet er i stilrene elementer med alt i hårde hvidevarer. I det store alrum er der god plads til både spiseplads samt en hyggelig stue.

Værelser
De to værelser har begge en god indretning med optimal udnyttelse af pladsen. Soveværelset er indrettet med tre faste garderobeskabe, mens det andet har et enkelt fast skab.

Badeværelse
Det stilrene badeværelse indeholder bruseniche, toilet, håndvask samt god opbevaringsløsning.

Entré/Bryggers
Rækkehuset byder velkommen via en rummelig entré med plads til både opbevaring af overtøj og fodtøj. I entréen er der desuden egen vaskemaskine og tørretumbler.

Uderum
Der er uderum på både for- og bagside af boligen. Den store terrasse har plads til et havemøbelsæt, mens den flisebelagte forhave både har egen parkeringsplads, opbevaringsskur samt et areal med plads til ophold.",https://www.boligportal.dk/r%C3%A6kkehuse/fredericia/99m2-3-vaer-id-5368895
"Hjedsbækvej, 9541 Suldrup",Suldrup,Hjedsbækvej,9541,56.849674,9.701643,6.500 kr.,0 kr.,160 m²,5,-,Lejlighed,Nej,Ja,Ja,Nej,Nej,Nej,Ja,Ja,F,"Dejlig stor og lys lejlighed med indgang i stueplan, hvor der er toilet med plads til vaskemaskine m.m.
Trappe op til fordelings gang med stort værelse mod vejen, soveværelse med skabsvæg, badeværelse med brus, køkken alrum, 2 værelser og dejligt stue med udgang til overdækket terrasse, med udsigt mod søen.
Svalegang udenfor soveværelse og køkken.
Nyt køkken, ny malet, der er efter isoleret på loft og i ydervægge.
Nyt gulv i køkkenalrum og de 2 værelser.
Vand og varme afregnes direkte med egen måler til forsyningen.
Aconto el
Lille have og parkering til 2 biler bag ved huset.",https://www.boligportal.dk/lejligheder/suldrup/160m2-5-vaer-id-5339591
"Thorsgade, 8900 Randers, Randers C  - 3. sal",Randers,Thorsgade,8900,56.463747,10.038624,4.014 kr.,N/A,47 m²,2,3.,Lejlighed,Nej,Nej,Nej,Ja,Nej,Ja,Nej,Nej,N/A,"Lejemålet er beliggende på Thorsgade og består af 2 værelser samt køkken og bad. Lejemålet er 47 m2 og er klar til overtagelse 15-08-2023. Månedlig husleje er 4014 kr. og indskud beløber sig til 23600 kr. 

Send en besked, hvis lejemålet har fanget din interesse.
Denne bolig er en ungdomsbolig – for at du kan leje den, skal du være studerende.
For at kunne leje denne bolig, kræver det man er medlem af boligforeningen. På BoligPortal annonceres kun reelt ledige boliger uden eksisterende venteliste på annonceringstidspunktet. Venligst kontakt udlejer hvis du er interesseret i lejemålet.",https://www.boligportal.dk/lejligheder/randers/47m2-2-vaer-id-5379077
"Thit Jensens Gade, 8000 Aarhus, Aarhus C  - 4. sal",Aarhus,Thit Jensens Gade,8000,56.164196,10.229665,17.400 kr.,500 kr.,140 m²,5,4.,Lejlighed,Nej,Ja,Nej,Nej,Nej,Nej,Nej,Nej,A,"Ejendommen
Byggeriet falder i tråd med en grønnere fremtid, og er naturligvis et lavenergiklasse-byggeri. Området holdes bilfrit og anlægges på fodgængeres og cyklisters præmisser med en nedkørsel til underjordisk p-kælder med bl. a. over 300 pladser samt cykelparkering.     
 
Lejligheden
Lejlighederne indeholder et lækkert opholdsrum med sofa- og spiseafdeling i åben forbindelse med køkken, soveværelser med fast skabsvæg, badeværelse med både gulvvarme, separat bruseniche og vaskesøjle.     
 
Alle lejligheder fra 1. sal og opefter har en dejlig syd- eller vestvendt altan på 7m² eller derover.  Vælger du en lejlighed i stueetagen, har du adgang til terrasse.     
 
De flotte og slidstærke gulve i lejlighederne i ask er gennemgående, og gulvvarme sikrer en stabil temperatur på badeværelset. Alle elementer er fra JKE Design i et stilrent design.   
 
Området 
Med en bolig i Havneholmen får du en hverdag med et sundt indeklima, generøse mængder dagslys og i grøn balance med plads til hverdag og livsnyderi.     
 
Andre vilkår
OBS! Billederne er fra et sammenligneligt lejemål",https://www.boligportal.dk/lejligheder/aarhus/140m2-5-vaer-id-3558933
"Gl. Kappendrupvej, 5450 Otterup",Otterup,Gl. Kappendrupvej,5450,55.538038,10.3465,4.350 kr.,500 kr.,60 m²,2,-,Lejlighed,Nej,Nej,Nej,Nej,Ja,Nej,Nej,Ja,D,"Pæn lejlighed – et kvarter fra Odins Bro. 
Stort køkken og stue i åben forbindelse – masser af skabe
Soveværelse.
Pænt flisebadeværelse med gulvvarme.
Velordnet ejendom med fællesvaskeri og eget depotrum i udhus. 
Gode parkeringsforhold. Egen indgang direkte fra gårdspladsen.
Ejendommen opvarmes med luft-til-vand varmepumpe.
Fibernet tilgængeligt.",https://www.boligportal.dk/lejligheder/otterup/60m2-2-vaer-id-4036092
"Barfredsvej, 9900 Frederikshavn  - Stuen",Frederikshavn,Barfredsvej,9900,57.443534,10.530511,3.325 kr.,1.050 kr.,48 m²,2,Stuen,Lejlighed,Nej,Nej,Nej,Nej,Nej,Nej,Nej,Ja,N/A,"Nyistandsat og hyggelig 2-værelses lejlighed på 48 kvm.

Indeholder: Entré, nyt Kvik køkken med alt i hvidevarer bl.a. opvaskemaskine, stor lys stue, soveværelse samt toilet og bad.

Afhøvlede og lakerede gulve.

Egen vaske-tørremaskine.

Parkering på gårdspladsen.

Vejledende plantegning.",https://www.boligportal.dk/lejligheder/frederikshavn/48m2-2-vaer-id-5254242
"Akvavitvej, 9000 Aalborg, Aalborg  - 11. sal",Aalborg,Akvavitvej,9000,57.055431,9.90883,16.800 kr.,700 kr.,117 m²,4,11.,Lejlighed,Nej,Nej,Nej,Ja,Ja,Nej,Ja,Nej,A,"Do You want to live at Spritfabrikken in the apartment with the best panoramic view over Aalborg and the fiord.
Luxurious apartment with 117 square meters at 11th floor in Høkergården which has two balconies at 14 square meters and 5 square meters. 
The apartment has a washing machine, a dryer and a dishwasher which is upgraded to Miele.
The apartment has a fantastic layout which include a master bedroom with directly access to a big built-in cupboard and bathroom with combined washing machine and dryer. Other than that, the apartment has two more rooms (one of them can be used as an extra living room), one more bathroom and two big private balconies.
You enter from the hall into the kitchen which has an open connection to the living room, and from the living room you have directly access to the west-facing balcony. From the balcony you have the view over the western part of the city’s red roof, Fjordparken and Limfjorden. You can enter the other balcony from one of the rooms, and from this balcony you can see directly to the fiord which give you an opportunity to follow the life in the water from morning to evening. 
The kitchen is upgraded in relation to the tender material with kitchen units and a “kitchen island”.",https://www.boligportal.dk/lejligheder/aalborg/117m2-4-vaer-id-5003155
"Møllehatten, 8240 Aarhus, Risskov  - Stuen",Aarhus,Møllehatten,8240,56.186037,10.210468,7.950 kr.,600 kr.,67 m²,2,Stuen,Lejlighed,Nej,Ja,Ja,Ja,Ja,Nej,Ja,Nej,A,"BILLIG INDFLYTNINGSPRIS!
Kun 2*md. leje i depositum og 0 kr. i forudbetalt leje! VED HURTIG OVERTAGELSE TILBYDER VI FØRSTE MÅNED HUSLEJEFRI!

Super 2'er med egen terrasse - perfekt til parret, men kan også deles.

I Risskov, den smukkeste forstad i Aarhus kan du leje en af disse fantastisk godt beliggende lejligheder på Møllehatten.

På Møllehatten får du en super beliggenhed med alt i indkøb, spisesteder, Riisskoven og dens flotte natur, vandet og ikke mindst meget nær Aarhus C.

Velkommen indenfor i denne lejlighed;
•	Flot køkken med masser af skabsplads
•	Spiseplads i køkkenet
•	Alt i hårde hvidevarer
•	2 store rum, som nemt kan indrettes som et soveværelse og stue.
•	Begge værelser med udgang til terrassen
•	Gulvvarme i alle rum
•	Depotrum i kælderen
•	Mulighed for leje af privat p-plads

Som lejer på Møllehatten får du adgang til en masse gode fællesfaciliteter såsom; delebil, tagterrasser, grill-områder, aktivitetsområder og meget mere.
Der er gode muligheder for at blive en del af et stort fællesskab med lokale aktiviteter.

Ydermere tillades ét husdyr på max 10 kg.

Internet og tv-udbyder i ejendommen er Stofa.

Billeder er fra en anden lejlighed magen til med samme materialevalg og plantegning.

Kontakt os allerede i dag for fremvisning af denne lejlighed eller en anden lejlighed, der passer til netop dine behov.


Der udlejes ikke til personer registreret i RKI.",https://www.boligportal.dk/lejligheder/aarhus/67m2-2-vaer-id-5363868
"Vestervej, 4960 Holeby  - 1. sal",Holeby,Vestervej,4960,54.709915,11.468835,8.400 kr.,800 kr.,83 m²,3,1.,Lejlighed,Ja,Nej,Nej,Nej,Nej,Nej,Nej,Nej,N/A,"2 bedroom apartment. Renovated and fully furnished.

The apartment has an amazing location in a quietly neighborhood. In the apartment you find a cozy livingroom, dining room, bedroom, newer kitchen with dishwasher and bathroom with shower.

There are access to a green shared back yard.

The apartment are located 9 km from the Femern Project. 

No animals allowed.

If you wish to visit the apartment kindly write your name, email and phone number so that we can contact you directly.",https://www.boligportal.dk/lejligheder/holeby/83m2-3-vaer-id-5358746
"Fenrisvej, 8920 Randers, Randers NV  - 2. sal",Randers,Fenrisvej,8920,56.471959,10.0247,6.680 kr.,1.257 kr.,82 m²,3,2.,Lejlighed,Nej,Nej,Ja,Nej,Nej,Nej,Nej,Nej,N/A,"Lejemålet er beliggende på Fenrisvej og består af 3 værelser samt køkken og bad. Lejemålet er 82 m2 og er klar til overtagelse snarest. Månedlig husleje er 6680 kr. og indskud beløber sig til 16700 kr. 

Send en besked, hvis lejemålet har fanget din interesse.
For at kunne leje denne bolig, kræver det man er medlem af boligforeningen. På BoligPortal annonceres kun reelt ledige boliger uden eksisterende venteliste på annonceringstidspunktet. Venligst kontakt udlejer hvis du er interesseret i lejemålet.",https://www.boligportal.dk/lejligheder/randers/82m2-3-vaer-id-4141207
