Adress,City,Street name,Postal code,Latitude,Longitude,Monthly rent,Aconto,Square meters,Rooms,Floor,Property type,Furnished,Shareable,Pets allowed,Elevator,Senior frendly,Only for students,Balcony/Terrace,Parking,Energy label,Description,Link
"Stenagervej, 4000 Roskilde",Roskilde,Stenagervej,4000,55.64183,12.11209,15.995 kr.,1.200 kr.,104 m²,4,-,Rækkehus,Nej,Nej,Nej,Nej,Nej,Nej,Nej,Ja,N/A,"Flot bolig, netop ved at blive opført i samarbejde med Eurodan Huse.
Boligerne er indflytningsklar cirka 1/9 og udlejes ubegrænset.
De er opført i 2 plan hvor du i stueplan finder god entre med skabe, lækkert åbent Svane køkken med alle hårde hvidevarer. Åben forbindelse til stue med udgang til privat terrasse og have. Ydermere finder du et gæstetoilet i stueplan.
Boligens første sal indeholder 3 soveværelser samt lækkert brusebadeværelse.
Til alle husene hører privat skur.
Fælles grønt område med lille legeplads, cykelparkering samt gode parkeringsforhold.

OBS! 2 boliger klar 1/9 og 5 boliger senest 1/10.",https://www.boligportal.dk/r%C3%A6kkehuse/roskilde/104m2-4-vaer-id-5373589
"Stjernepladsen, 9000 Aalborg, Aalborg  - 4. sal",Aalborg,Stjernepladsen,9000,57.048688,9.937919,10.875 kr.,950 kr.,98 m²,3,4.,Lejlighed,Nej,Nej,Nej,Ja,Nej,Nej,Ja,Nej,N/A,"Stjernehuset byder på 78 lejeboliger med en perfekt placering midt i Aalborgs nye spirende bydel, Østre Havn. Stjernehuset ligger i først parket ud mod Limfjorden på den ene side og ud mod Stjernepladsen på den anden side.

Stjernehuset er designet i rødbrune tegl med springende højder og uden en eneste ret vinkel. Det skaber et interessant udtryk og giver boligerne mere kant i deres indretning. Der er også lagt vægt på store vinduespartier med iøjnefaldende hjørnevinduer, der giver et lækkert lysindfald.

Stueetagen byder på en række spændende 1-, 2- og 3-værelses lejligheder på 47 til 101 kvadratmeter.

I alle lejligheder er der – uanset størrelsen – lagt vægt på kvalitet. Glæd dig til at lave mad i et stilsikkert, gråt HTH-køkken med stålgreb, og nyd den fulde hvidevarepakke fra Bosch med opvaskemaskine, vaskemaskine og tørretumbler.

Lejlighederne har et lyst nordisk look med trægulve og hvide vægge, mens vinduesrammerne har fået en smuk nøddebrun nuance, der også går igen på facade, indgangsparti og altaner. 

Alle lejlighederne har udgang til en skøn altan eller terrasse, hvorfra du kan nyde udsigten over fjorden eller det summende liv på Stjernepladsen.

OBS. Billederne er fra den etablerede 2-værelses prøvebolig. Plantegningen er gældende.",https://www.boligportal.dk/lejligheder/aalborg/98m2-3-vaer-id-5375197
"Østerbyvænget, 5642 Millinge",Millinge,Østerbyvænget,5642,55.132343,10.212807,7.800 kr.,N/A,101 m²,4,-,Rækkehus,Nej,Nej,Ja,Nej,Nej,Nej,Ja,Ja,N/A,"Lejemålet ligger i Østerbyvænget i Millinge. De 16 boliger er opført som 1-plans rækkehuse.

Dette 4 værelses lejemål er indrettet med entré, hvorfra der er adgang til et værelse, samt til stuen som ligger i åben forbindelse med køkkenet. Værelse med indbygget skab og dejligt lyst badeværelse med plads til vaskemaskine. Lækkert soveværelse ligeledes med indbyggede skabe . Fra soveværelset er der udgang til terrasse. Der er gulvvarme i hele boligen pånær i værelserne. Redskabsskur samt egen carport.

Området:

Østerbyvænget ligger i Millinge. Millinge ligger på det sydvestlige Fyn og er en lille by med ca. 533 indbyggere. Der er ca. 4 km til Fåborg, hvor der er et stort udvalg af butikker mm.

Østerbyvænget ligger i et stille og roligt område tæt på Dagli`Brugsen i Millinge. Svanninge skole ligger kun 500m derfra. Børnehave findes ca. 3.5 km derfra.

I alle boligerne er der installeret fibernet. Fibernet giver mulighed for op til 100/100 Mbit internet, telefoni og HD TV.",https://www.boligportal.dk/r%C3%A6kkehuse/millinge/101m2-4-vaer-id-5330437
"Ejby Møllevej, 5000 Odense, Odense C  - 1. sal",Odense,Ejby Møllevej,5000,55.398205,10.413978,7.880 kr.,800 kr.,70 m²,3,1.,Lejlighed,Nej,Ja,Nej,Nej,Nej,Nej,Ja,Ja,N/A,"Hyggelig 3-værelses lejlighed på 70 m2 helt ned til Odense å i Centrum udlejes.

Lejligheden består af en entre med adgang til et værelse på venstre hånd og et stort badeværelse på højre hånd. Derefter følger et stort køkken med direkte udsigt ned til de smukke områder ved åen. Slutteligt følger gennem køkkenet endnu et lyst og rummeligt værelse på venstre hånd. 

Der er tale om en lejlighed der i 2019 har gennemgået en istandsættelse. Lejligheden kommer med nyere køkken samt badeværelse, som ligger i en ejendom med nyere vinduer, nyere malet facade og nyere tag. Alt i alt en rigtig lækker lejlighed, som er perfekt indrettet som delelejlighed. Lejligheden står ved indflytning nymalet og med smukke nyslebne gulve. 

Til lejligheden følger en vaskekælder samt en fælles lille have som deles med ejendommens øvrige beboere. 

Lejligheden er som beskrevet beliggende nøjagtigt ud til Odense Å samt park - altså en fantastisk beliggenhed, og en lejlighed der skal ses. 

Se gerne vedhæftet video. 

Lyder det som noget for dig/jer eller en du kender? Så tøv endelig ikke med at kontakte os for en fremvisning. 
_______________________________________________________________________________________________________________________________________________________________________________________________________________

Cozy 3-room apartment of 70 m2 right down to the Odense river in the city center for rent.

The apartment consists of an entrance hall with access to a room on the left and a large bathroom on the right. Then follows a large kitchen with a direct view down to the beautiful areas by the stream. Finally, another bright and spacious room follows through the kitchen on the left.

This is an apartment that underwent renovation in 2019. The apartment comes with a newer kitchen and bathroom, which is located in a property with newer windows, a newer painted facade and a newer roof. All in all, a really nice apartment, which is perfectly furnished as a shared apartment. The apartment is newly painted and with beautiful freshly sanded floors upon moving in.

The apartment comes with a laundry cellar and a small garden which is shared with the property's other tenants.

As described, the apartment is located exactly next to Odense Å and the park - in other words, a fantastic location and an apartment that must be seen.

Please see the attached video.

Does this sound like something for you or someone you know? So don't hesitate to contact us for a viewing.",https://www.boligportal.dk/lejligheder/odense/70m2-3-vaer-id-4088562
"Ellebrinken, 8520 Aarhus, Lystrup  - 1. sal",Aarhus,Ellebrinken,8520,56.231717,10.22184,7.995 kr.,0 kr.,60 m²,3,1.,Lejlighed,Nej,Ja,Ja,Nej,Nej,Nej,Ja,Ja,B,"Nu har du mulighed for at leje en af disse eksklusive lejligheder, beliggende i det naturskønne Lystrup, nord for Aarhus.

I bydes velkommen af den flotte lyse entre, med masser af skabsplads til bl.a. overtøj og sko.
I forlængelse af entreen, finder I lejlighedens badeværelse, her kan nævnes de flotte lyse klinker, masser af skabsplads, det store flotte fulddækkende spejl, Geberit hængetoilet samt en kombineret vaske/tørremaskine.
I lejlighedens køkken/alrum, finder I det store flotte HTH køkken, med alt i hårde hvidevarer som keramisk kogeplade med fingertouch system, varmluftsovn, emhætte, opvaskemaskine samt køle/fryseskab.
I forlængelse af køkken/alrummet, finder I lejlighedens to store værelser, hvor det ene af værelserne, er udstyret med 3 store skydedørsskabe fra gulv til loft. Fra begge værelser er der udgang til den store altan, der indbyder til hygge og nærvær hele dagen lang.

Til lejligheden medfølger et depotrum.

Kongslunden ligger i et dejligt naturskønt område i Lystrup, hvor du har let adgang til E45 via Djurslandmotorvejen, samt kort vej til både Aarhus og Grenå. Der findes desuden gode busforbindelser til Aarhus, stig på bus 9 eller 53 eller tag Letbanen, der bringer dig ind til Aarhus C på bare 10 min.

I området finder du flere velfungerende vuggestuer, børnehaver og skolefritidsordninger og bare 1 km væk fra Kongslunden, ligger Lystrup Skole.
Tæt på Kongslunden finder du også Lystrup Idrætscenter og Lystrup Svømmehal, der er således gode muligheder for at dyrke et bredt udvalg af forskellige sportsgrene.",https://www.boligportal.dk/lejligheder/aarhus/60m2-3-vaer-id-5088253
"Søndergade, 6200 Aabenraa  - 2. sal",Aabenraa,Søndergade,6200,55.04197,9.419017,3.665 kr.,290 kr.,37 m²,2,2.,Lejlighed,Nej,Nej,Nej,Nej,Nej,Ja,Nej,Nej,N/A,"Lejemålet er beliggende på Søndergade og består af 2 værelser samt køkken og bad. Lejemålet er 37 m2 og er klar til overtagelse 01-09-2023. Månedlig husleje er 3665 kr. og indskud beløber sig til 10491 kr. 

Send en besked, hvis lejemålet har fanget din interesse.

Boligen er en ungdomsbolig.
For at kunne leje denne bolig, kræver det man er medlem af boligforeningen. På BoligPortal annonceres kun reelt ledige boliger uden eksisterende venteliste på annonceringstidspunktet. Venligst kontakt udlejer hvis du er interesseret i lejemålet.",https://www.boligportal.dk/lejligheder/aabenraa/37m2-2-vaer-id-4772954
"Vestergade, 8660 Skanderborg  - Stuen",Skanderborg,Vestergade,8660,56.032657,9.928961,7.300 kr.,800 kr.,100 m²,3,Stuen,Lejlighed,Nej,Nej,Nej,Nej,Ja,Nej,Nej,Nej,N/A,"Stor lækker lejlighed i stueplan med direkte udgang fra køkken til en lille terrasse. Lejligheden er centralt beliggende i Midtbyen, med få minutters gang til bus, indkøb, skov og søbad. 
Lejligheden har trægulve, dejlig stor stue med åben adgang til et velfungerende køkken med stort køl/frys, opvaskemaskine og komfur med ovn og egen vaskemaskine.
Huset er ældre men velisoleret. 
Der er mulighed for cykelparkering
Ejendommen har fire lejemål, og en ukompliceret lejer sammensætning.
skriv lidt om dig/Jer, og I vil hurtigst muligt efterfølgende blive kontaktet, for at træffe aftale om en besigtigelse af lejemålet.
Venligst Udlejer",https://www.boligportal.dk/lejligheder/skanderborg/100m2-3-vaer-id-4119776
"Åløkke Allé, 5000 Odense, Odense C  - Stuen",Odense,Åløkke Allé,5000,55.400025,10.367494,7.350 kr.,700 kr.,104 m²,4,Stuen,Lejlighed,Nej,Nej,Nej,Nej,Nej,Nej,Nej,Nej,D,"Renoveret 3.vær. lejlighed på 104 m2. Lejligheden består af stort soveværelse samt 2 sammenhængende stuer og lille værelse.
Adgang til vaskeri i kælder. 
Leje pr. mdr. kr. 7.350,00 + forbrug.
3 mdr. depositum + 1 mdr. forudbetalt leje. 
Ledig pr. 01.09.23
Skriv hvem der skal bo i lejemålet, hvad i laver og jeres kontaktoplysninger (mail + tlf.nr.)",https://www.boligportal.dk/lejligheder/odense/104m2-4-vaer-id-561699
"Vidarsvej, 8920 Randers, Randers NV  - 1. sal",Randers,Vidarsvej,8920,56.47183,10.021888,5.148 kr.,1.040 kr.,79 m²,4,1.,Lejlighed,Nej,Nej,Ja,Nej,Nej,Nej,Nej,Nej,N/A,"Lejemålet er beliggende på Vidarsvej og består af 4 værelser samt køkken og bad. Lejemålet er 79 m2 og er klar til overtagelse snarest. Månedlig husleje er 5148 kr. og indskud beløber sig til 16000 kr. 

Send en besked, hvis lejemålet har fanget din interesse.
For at kunne leje denne bolig, kræver det man er medlem af boligforeningen. På BoligPortal annonceres kun reelt ledige boliger uden eksisterende venteliste på annonceringstidspunktet. Venligst kontakt udlejer hvis du er interesseret i lejemålet.",https://www.boligportal.dk/lejligheder/randers/79m2-4-vaer-id-5362485
"Nørrebrogade, 7000 Fredericia  - 1. sal",Fredericia,Nørrebrogade,7000,55.56999,9.749974,5.995 kr.,1.100 kr.,84 m²,3,1.,Lejlighed,Nej,Nej,Ja,Nej,Nej,Nej,Nej,Nej,N/A,"beliggende lige udenfor voldene mellem centrum og banegården. Der er stue med døråbning til spisestue, soveværelse og mindre værelse. 

Ældre badeværelse med badekar og ældre køkken med nyere hårde hvidevarer. Lejligheden bliver udlejet nymalet

Beliggende på 1. sal.

Lejen er inkl. vandforbrug

Den kan lejes møbleret til kr 6896 + forbrug",https://www.boligportal.dk/lejligheder/fredericia/84m2-3-vaer-id-4718516
"Markusgade, 9000 Aalborg, Aalborg  - 1. sal",Aalborg,Markusgade,9000,57.044382,9.943603,4.824 kr.,750 kr.,61 m²,2,1.,Lejlighed,Nej,Nej,Nej,Nej,Nej,Nej,Nej,Nej,N/A,"2-værelses lejlighed beliggende på Markusgade, 9000 Aalborg. 

Lejligheden er placeret i Ø-gadekvarteret med kort afstand til Østre Anlæg, diverse handlemuligheder samt offentlig transport. 

Lejligheden består af en stue, et værelse samt eget bad og køkken. 

Lejemålet overtages som beset.",https://www.boligportal.dk/lejligheder/aalborg/61m2-2-vaer-id-5300427
"Elmelundsvej, 5200 Odense, Odense V",Odense,Elmelundsvej,5200,55.381575,10.307395,7.500 kr.,1.000 kr.,87 m²,3,-,Lejlighed,Nej,Ja,Ja,Nej,Nej,Nej,Nej,Ja,D,"3 værelses lejlighed i smuk gammel ejendom udlejes.

Lejligheden fremstår ny med nyt køkken, nyere bad, ny vaskemaskine og tørretumbler og er med flotte sildebengulve. 

Lejligheden er på 1 sal. med flot udsigt til natur.

Stort soveværelse, værelse, stor stue, stort køkken-alrum og en fordelingsgang og entre.

Elmelunds området ligger tæt på Bolbro og Sanderum og er populært at gå ture i ca 5km til Odense C.
Der er gratis parkering til ejendommen, samt mulig for parkering af større biler.",https://www.boligportal.dk/lejligheder/odense/87m2-3-vaer-id-5360035
"Trelleborggade, 2630 København, Taastrup  - 4. sal",København,Trelleborggade,2630,55.646194,12.274172,11.350 kr.,900 kr.,82 m²,2,4.,Lejlighed,Nej,Nej,Ja,Ja,Nej,Nej,Ja,Nej,N/A,"Boligerne har et lækkert og tidløst køkken fra HTH udstyret med alt i hårde hvidevarer. Køkkenet er i åben forbindelse med boligens opholdsareal, og der er gennemgående gulve i egetræ. Badeværelserne med tidløse klinker er rummelige og udstyret med vaskemaskine. I kælderen under boligerne er der adgang til depotrum.

Her bor du desuden på unik beliggenhed langs det kommende grønne parkstrøg med masser af liv, og stadig så centralt, at du kan køre til København på et kvarter - eller Odense på en time. 

BEMÆRK: aconto El pr. måned 525 kr. 

OBS: Billeder er fra prøvebolig",https://www.boligportal.dk/lejligheder/k%C3%B8benhavn/82m2-2-vaer-id-5323381
"Herluf Trolles Gade, 9000 Aalborg, Aalborg  - 1. sal",Aalborg,Herluf Trolles Gade,9000,57.05548,9.900667,4.378 kr.,500 kr.,59 m²,2,1.,Lejlighed,Nej,Nej,Nej,Nej,Nej,Nej,Ja,Nej,D,"2-værelses lejlighed beliggende på Herluf Trolles Gade, 9000 Aalborg. Lejemålet er placeret i det eftertragtede Vestbyen.

Lejemålet er tæt beliggende på gode handle- og offentlig transportmuligheder. Herudover er lejemålet placeret tæt på Haraldslund Vand- og kulturhus, hvor der både er svømmehal, fitness mv. Ydermere er der kun 10 minutter på cykel ind til det pulserende café- og byliv inde i Aalborg Midtby, samt 10 minutter på cykel til det dejlige område omkring Aalborg Bådhavn og Vestre Fjordpark.

Lejemålet indeholder eget bad og køkken samt en stue og et værelse.

Lejemålet overtages som beset.",https://www.boligportal.dk/lejligheder/aalborg/59m2-2-vaer-id-5178757
"Stockholmsgade, 8200 Aarhus, Aarhus N  - Stuen",Aarhus,Stockholmsgade,8200,56.179042,10.198895,8.400 kr.,400 kr.,68 m²,2,Stuen,Lejlighed,Nej,Ja,Ja,Ja,Ja,Nej,Ja,Ja,A,"Nordbjerg er holdt i en moderne, nordisk byggestil i materialer, der kan holde til det danske klima og kun bliver smukkere med tiden. Hver blok har sin egen sammensætning af forskellige teglblandinger med udgangspunkt i en smuk gylden nuance, der skaber sammenhæng i byggeriet, mens stålpladetagene får bjergkædeformationen til at fremstå tydeligere.

Projektet byder på 172 boliger fordelt på 3 etaper og har 1-4 værelses lejligheder. Lejlighederne har alle gulvvarme i alle rum, fuld hvidevarepakke i køkken og på badeværelse samt adgang til fransk altan og altan/terrasse. Derudover findes der depotrum til alle lejligheder, i kælder eller i lejligheden, der er mulighed for at leje parkeringsplads i kælderen og der er til ejendommen legeplads, multibane til boldspil samt gårdhave med borde og bænke.

Mulighed for gratis parkering frem til 31-12-2023.

Bemærk, billederne er fra en prøvebolig.",https://www.boligportal.dk/lejligheder/aarhus/68m2-2-vaer-id-5285245
"Ladegårdsgade, 9000 Aalborg, Aalborg  - Stuen",Aalborg,Ladegårdsgade,9000,57.048195,9.913908,5.875 kr.,800 kr.,63 m²,2,Stuen,Lejlighed,Nej,Nej,Nej,Nej,Nej,Nej,Nej,Nej,N/A,"Flot, nyere renoveret 2-vær. ved Gåsepigen i Aalborg C, tæt ved butikker, busser, cafeer m.m.

Alt i hvidevarer, adgang til fælles gård, cykelparkering, dørtelefon m.m.

Forbrug: ac varme kr. 500,-/md+ ac. vand kr. 300,-/md. + el",https://www.boligportal.dk/lejligheder/aalborg/63m2-2-vaer-id-4993809
"Jernbanegade, 6000 Kolding  - 1. sal",Kolding,Jernbanegade,6000,55.490441,9.479296,2.900 kr.,0 kr.,15 m²,1,1.,Værelse,Nej,Ja,Nej,Ja,Ja,Ja,Nej,Ja,F,"Vi har fornøjelsen af at byde på enkelte værelser med fælles køkken og bad o centrum af kolding, samt har vi også lejligheder i 2-3 værelser til udlejning.
>belligenhed bla. Jernebanegade samt ved gågaden. 
Kontakt os gerne på mail",https://www.boligportal.dk/v%C3%A6relser/kolding/15m2-1-vaer-id-5330920
"Gl. Hadsundvej, 8900 Randers, Randers C  - 1. sal",Randers,Gl. Hadsundvej,8900,56.466562,10.040656,4.909 kr.,1.581 kr.,75 m²,3,1.,Lejlighed,Nej,Nej,Nej,Nej,Nej,Nej,Nej,Nej,N/A,"Lejemålet er beliggende på Gl. Hadsundvej og består af 3 værelser samt køkken og bad. Lejemålet er 75 m2 og er klar til overtagelse snarest. Månedlig husleje er 4909 kr. og indskud beløber sig til 15300 kr. 

Send en besked, hvis lejemålet har fanget din interesse.
For at kunne leje denne bolig, kræver det man er medlem af boligforeningen. På BoligPortal annonceres kun reelt ledige boliger uden eksisterende venteliste på annonceringstidspunktet. Venligst kontakt udlejer hvis du er interesseret i lejemålet.",https://www.boligportal.dk/lejligheder/randers/75m2-3-vaer-id-5190806
"Bredgade, 7470 Karup J",Karup J,Bredgade,7470,56.307121,9.164669,4.950 kr.,700 kr.,164 m²,3,-,Hus,Nej,Nej,Ja,Nej,Nej,Nej,Nej,Nej,N/A,"Hyggeligt hus/lejlighed med terrasse.
Ligger i Karup midtby. 
Meget charmerende.",https://www.boligportal.dk/huse/karup-j/164m2-3-vaer-id-5354020
"Storegade , 6560 Sommersted  - 1. sal",Sommersted,Storegade ,6560,55.321305,9.310228,4.275 kr.,850 kr.,72 m²,2,1.,Lejlighed,Nej,Ja,Ja,Nej,Nej,Nej,Ja,Ja,C,"Udlejes 2 værelses lejlighed på 72 m2 med egen trappeopgang. Beliggende i Sommersted, nær Haderslev.
Nye vinduer, gode parkeringsmulighed.
Bestående af indgang, badeværelse, køkken med alle Hård hvidevarer og stor stue samt stort soveværelse.
Egen altan.

Der er kommet nyt badeværelse i 2023.

Udlejes efter aftale..
Klar til udlejning fra 15. august 2023.",https://www.boligportal.dk/lejligheder/sommersted/72m2-2-vaer-id-5144244
"Pogensvej, 7160 Tørring  - 1. sal",Tørring,Pogensvej,7160,55.888475,9.564682,5.370 kr.,800 kr.,61 m²,2,1.,Lejlighed,Nej,Nej,Nej,Nej,Nej,Nej,Nej,Nej,N/A,"Super lækker 2-vær. lejlighed beliggende på 1. sal i nyere ejendom i Åle. Altan, skur, egen p-plads samt store fællesarealer. Udlejes snarest. Ingen husdyr.",https://www.boligportal.dk/lejligheder/t%C3%B8rring/61m2-2-vaer-id-5107375
"Østergade, 5900 Rudkøbing",Rudkøbing,Østergade,5900,54.935876,10.712111,5.500 kr.,900 kr.,110 m²,5,-,Lejlighed,Nej,Nej,Nej,Nej,Nej,Nej,Nej,Ja,N/A,"Rudkøbing - Østergade, 2 sal:
5-værelses lejlighed midt i Rudkøbing (på gågaden) til leje. 
Månedlig leje: DKK 5.500 - + forbrug.
Depositum: 3 måneders leje.",https://www.boligportal.dk/lejligheder/rudk%C3%B8bing/110m2-5-vaer-id-5377297
"Damagervej, 8260 Aarhus, Viby J  - Stuen",Aarhus,Damagervej,8260,56.131938,10.152235,5.000 kr.,0 kr.,65 m²,2,Stuen,Lejlighed,Nej,Ja,Nej,Nej,Nej,Nej,Nej,Nej,N/A,"65 m2 - 2 værelses lejlighed i stueplan, beliggende ca. 10 min. gang fra Viby Torv - kan deles. Fælles vaskehus med vaskemaskine og tørretumbler forefindes i ejendommen. Husleje 5.100 kr. pr. måned inkl. vandforbrug. Der betales for el og varme herudover.
Fremvisning efter aftale. kun telefoniske henvendelser behandles. - SMS, mails og telefonsvarerbeskeder besvares/behandles IKKE",https://www.boligportal.dk/lejligheder/aarhus/65m2-2-vaer-id-4913065
"Fussingsvej, 8700 Horsens  - 1. sal",Horsens,Fussingsvej,8700,55.871565,9.840508,4.350 kr.,850 kr.,54 m²,2,1.,Lejlighed,Nej,Nej,Nej,Nej,Nej,Nej,Nej,Nej,E,"Denne to værelses lejlighed er super godt indrettet og ligger helt centralt i Horsens.
Lejligheden indholder : stue, værelse. badeværelse  og køkken.
.Lejligheden ligger i den nordlige del af midtbyen (tæt på Fængslet), med Netto 200 meter,rema1000 500 meter herfra. 20 minutter på gåben til Nørrestrand, eller Bygholm Park/Sø.Boligen ligger perfekt for dig/det par, som bruger Banegården eller motorvejsnettet i det daglige pendlerliv.
Adgang til fælles vaskeri
Adgang til fælles gård/have
Depotrum til hver lejlighed.
Ikke rygere foretrækkes. Ingen husdyr.
Vi søger lejere der behandler både ejendom og med-beboere godt og ansvarsbevidst.
Lejemålet har energimærket: Energiklasse E",https://www.boligportal.dk/lejligheder/horsens/54m2-2-vaer-id-5350515
"Simonivej, 9490 Pandrup  - Stuen",Pandrup,Simonivej,9490,57.220315,9.673242,5.332 kr.,249 kr.,71 m²,2,Stuen,Lejlighed,Nej,Nej,Nej,Nej,Nej,Nej,Nej,Nej,N/A,"Stor 2.Værelses lejlighed på 71 m2., beliggende i stueetagen med udgang til en dejlig terrasse fra lejlighedens opholdsstue.

Afdelingen ligger i et roligt kvarter, tæt på indkøbsmuligheder.
Der er gode parkeringsforhold, og udhus til opbevaring til lejemålet.

Det er ikke tilladt at holde husdyr i afdelingen.

Energimærke: d.",https://www.boligportal.dk/lejligheder/pandrup/71m2-2-vaer-id-5346149
"Rønnebærvænget, 4300 Holbæk  - 1. sal",Holbæk,Rønnebærvænget,4300,55.715921,11.741707,10.900 kr.,N/A,77 m²,3,1.,Lejlighed,Nej,Nej,Ja,Ja,Nej,Nej,Ja,Nej,N/A,"I Viggohaven findes der både toværelses og treværelses boliger. Vi kalder de toværelses for Type A og de treværelses for Type B. Både de toværelses og de treværelses har forskellige variationer. Disse variationer består hovedsageligt i størrelsen på altanen/terrassen, placeringen af vinduerne og enkelte afvigelser i kvadratmeter. Uanset hvad du vælger, får du en lys, moderne og nybygget bolig med store vinduer. Og hvor du næsten ikke skal tænke på vedligeholdelse. Alle boliger har enten udendørs altan eller terrasse, og et smalt for-areal, som vender ind på atriumhaven. Her er der plads til en bænk, eller et lille cafésæt af metal, hvor du har mulighed for at forlænge ""udesæsonen"", nyde stemningen og møde naboerne i den grønne have.",https://www.boligportal.dk/lejligheder/holb%C3%A6k/77m2-3-vaer-id-5344143
"Godthåbsgade, 9400 Aalborg, Nørresundby  - 2. sal",Aalborg,Godthåbsgade,9400,57.05763,9.933923,6.800 kr.,800 kr.,90 m²,3,2.,Lejlighed,Nej,Ja,Nej,Nej,Nej,Nej,Nej,Nej,N/A,Lækker stor lejlighed med adgang til stor have både fra bagtrap og fortrap. Der er vaskemaskine/tørretumbler og opvaskemaskine. Helt nye vinduer og dørtelefon bla. PS. Lejligheden fremstår nymalet med nylakerede gulve. Der kan gives tilladelse til en lille hund.,https://www.boligportal.dk/lejligheder/aalborg/90m2-3-vaer-id-5252876
"Njalsgade, 2300 København, København S  - Stuen",København,Njalsgade,2300,55.664039,12.59013,9.222 kr.,400 kr.,34 m²,1,Stuen,Lejlighed,Ja,Nej,Nej,Ja,Nej,Nej,Nej,Ja,A,"Vores Premium Studios er på 22-25m2 (30-34m2 BBR) og ligger i stueetagen. Vores standardværelser er den perfekte løsning, hvis du foretrækker eget værelse. Du kan selvfølgelig stadig bruge alle vores fællesarealer og deltage i vores events, så du kommer ikke til at føle dig alene. Du får det bedste fra to verdener. Vælg blandt vores forskellige værelser i hele ejendommen, og find din perfekte base. Alle værelser hos Nido Bryggen er fuldt møblerede med seng, skrivebord, stol, morgenmadsbarstol(e), ekstra sæde(r), garderobeskab, spejl, knager, integreret belysning og masser af stikkontakter praktiske steder. Nido Bryggen giver dig også adgang til nedenstående faciliteter: Cykelopbevaring, så din cykel kan stå sikkert, når du ikke anvender den som hurtigt og ”grønt” transportmiddel Vaskefaciliteter på stedet, så du ikke behøver at skulle bruge tid på at tage på møntvaskeri. Studierum med plads til at fordybe sig i studierne Fællesrum til afslappende socialt samvær og opbygning af nye venskaber Lynhurtigt internet overalt i bygningen Eget Nido-træningscenter, der har åbent hele døgnet Flot indrettet tagterrasse Privat spisestue, hvor du kan invitere venner og familie på middag",https://www.boligportal.dk/lejligheder/k%C3%B8benhavn/34m2-1-vaer-id-5309351
"Færøgade, 7430 Ikast",Ikast,Færøgade,7430,56.138557,9.171641,5.150 kr.,350 kr.,52 m²,2,-,Rækkehus,Nej,Nej,Ja,Nej,Nej,Nej,Nej,Ja,D,"Nyistandsat rækkehus med central placering i Ikast. Rækkehuset har fået helt nyt køkken og badeværelse med ny vaskemaskine samt gulvvarme. Derudover er der lagt nyt gulv i hele huset. Hertil hører gratis parkering. Rækkehuset ligger tæt på skole og indkøb, men giver alligevel en dejlig ro med gårdhave miljø. Den består af køkken, badeværelse, indgang, stor stue, værelse samt walk-in.
NB. på billeder mangler der stadig enkelte istandsættelser samt køleskab. Det er lavet og den er klar til indflytning. Indflytningsdato kan forhandles, men senest d. 01/09/2023
NB. i huslejen bliver tillagt 150 kr. i gebyr for vand så huslejen bliver 5.300 inkl. vand. Og så kan man tage uendeligt lange bade ;)
Ring eller skriv for spørgsmål!",https://www.boligportal.dk/r%C3%A6kkehuse/ikast/52m2-2-vaer-id-5323684
