Adress,City,Street name,Postal code,Latitude,Longitude,Monthly rent,Aconto,Square meters,Rooms,Floor,Property type,Furnished,Shareable,Pets allowed,Elevator,Senior frendly,Only for students,Balcony/Terrace,Parking,Energy label,Description,Link
"Reberbansgade, 9000 Aalborg, Aalborg  - 2. sal",Aalborg,Reberbansgade,9000,57.049235,9.914376,4.975 kr.,800 kr.,59 m²,2,2.,Lejlighed,Nej,Nej,Nej,Nej,Nej,Nej,Nej,Nej,G,"God 2-vær. lejlighed i Reberbansgade, Aalborg C, tæt ved Gågade, butikker, busser, Cafeer m.m.

Adgang til lille fælles gård, cykelparkering, dørtelefon m.m.

Forbrug: ac varme kr. 500,-/md + ac vand kr. 300,-/md + el. 

Lejligheden har ny fjernvarme, nye gulve og nymalet.",https://www.boligportal.dk/lejligheder/aalborg/59m2-2-vaer-id-5375708
"Asagården, 7500 Holstebro  - 2. sal",Holstebro,Asagården,7500,56.368876,8.59658,6.114 kr.,1.008 kr.,105 m²,5,2.,Lejlighed,Nej,Nej,Nej,Nej,Ja,Nej,Nej,Nej,N/A,"Afdelingen består af 336 stk. 2-5 rums lejligheder i 3 etager samt 42 stk. 2-5 rums seniorboliger forbeholdt 50+ uden hjemmeboende børn. Endelig er der nyopført 22 stk. 2-5 rums rækkehuse.
Der er løbende blevet renoveret i afdelingen, og senest er der bl.A. Inddækket altaner, udskiftet vinduer og opgangsdøre samt totalrenoveret køkkener, badeværelser og vaskerier.
Asagården/jættegården ligger tæt på daginstitutioner, skoler, ungdomsuddannelserne og ca. 2,5 km. Fra nørreport-centret. Der er buskørsel fra området 4 gange i timen. Der er pr. 15. Marts 2014 indført en p-vagtordning i afdelingen, der kontrollerer færdslen i afdelingens områder.
Til afdelingen hører der fællesvaskerier, en gildesal.
Der er mulighed for leje af én af afdelingens 94 stk. Garager(venteliste). Tæt på afdelingen ligger et velfungerende trivselshus med alsidige aktiviteter, foredrag mv og et fitnesscenter.
Hårde hvidevarer: komfur, køleskab, fryser, emhætte og brus.
Varme og vand bliver opkrævet aconto sammen med huslejen hver måned - el skal betales direkte til forsyningsvirksomheden.
Det er ikke tilladt at holde husdyr i afdelingen.

Vi kan oplyse, at afdelingen har ladestanderne til hybrid- og elbiler.

Der er indledningsvis en ladestander, der hver kan betjene to opladninger ad gangen.

Derudover har vi klargjort med forberedelsesbokse til at idriftsætte yderligere et antal ladestandere, som vi kan sætte i drift, når der bliver behov for flere ladepladser.

Ladestanderne er monteret:
·,,en ladestander med to ladestik på p-pladsen hvor containergården er placeret.
Ladeboks 1 kan anvendes til både afdelingens beboere og gæster udefra.
Ladeboks 2 kan kun anvendes af afdelingens beboere.

Prisen for beboere i afdelingen er 2.50 kr. Pr. Kwh. For nuværende.
Prisen for gæster i afdelingen er 3.50 kr. Pr. Kwh. For nuværende.

Det er muligt at oplade sin hybrid- eller elbil i op til 4 timer ad gangen.

Det er tilladt at benytte parkeringspladserne i tidsrummet 21.00 - 07.00 til almindelig parkering til opladning over natten, ligesom det er muligt at oplade uden tidsbegrænsning i dette tidsrum. I tidsrummet 07.00 - 21.00 må pladserne kun benyttes i forbindelse med påladning.

Vejledning ""kom godt i gang"" fra homecharge, beskriver hvorledes du nemt kommer i gang med at benytte ladestanderne. Denne vejledning kan afhentes på viceværtkontoret.

God fornøjelse hvad enten du allerede har en hybrid- eller elbil, eller du påtænker at anskaffe én.",https://www.boligportal.dk/lejligheder/holstebro/105m2-5-vaer-id-5206321
"Jens Kromanns Vej, 7000 Fredericia, Snoghøj",Fredericia,Jens Kromanns Vej,7000,55.52156,9.711364,20.000 kr.,1.500 kr.,121 m²,4,-,Hus,Nej,Nej,Nej,Nej,Ja,Nej,Ja,Ja,E,"Hus beliggende direkte til vandet i Snoghøj med den mest fantastiske udsigt. 
Huset er komplet nyrenoveret i 2022 og er fantastisk charmerende. 
Køkken-stue i et med fantastisk udsigt. Mindre værelse/kontor og 2 pæne soveværelser. 2 badeværelser med brus. Lille have som ikke kræver det store. 
Perfekt for det lidt modne par uden hjemmeboende børn som vil forkæle sig lidt og opleve livet på og i Lillebælt på nærmeste hold. 
Kan lejes møbleret efter aftale. 
Ikke-ryger hus - husdyr efter aftale",https://www.boligportal.dk/huse/fredericia/121m2-4-vaer-id-5378672
"Bjørnsager, 8940 Randers, Randers SV",Randers,Bjørnsager,8940,56.417612,10.021706,10.295 kr.,N/A,127 m²,5,-,Rækkehus,Nej,Nej,Ja,Nej,Nej,Nej,Nej,Nej,N/A,"DerI Haslund ved Randers finder man Bjørnsager som består af 79 rækkehuse, fra 2 til 5 værelses boliger. Boligerne er opført i 2019 og har energimærker A2015.

Mellem rækkehusene er der åbent med græs og legeplads.

I denne femværelses lejlighed får du:


Fire gode værelser
Stue i åbent forbindelse med køkkenet
HTH køkken med alt i hvidevare
Stue med højt til loftet
Bryggers med vaskemaskine og tørretumbler
Gulvvarme i alle rum
Egen have
Adgang til Stofa fiber

Lejevilkår:


Det er tilladt at holde 1 stk. hund på max 35 kg eller under 40 cm i højden (med forbehold). Katte er ikke tilladt.
Det er ikke muligt at leje boligen, hvis du er registreret i RKI.

* Bemærk at billederne ikke nødvendigvis er taget af/fra den pågældende bolig, og at udsigt m.v. derfor kan variere.

Vand, varme og el afregnes direkte med forsyningsselskaber.

Området:

Haslund er karakteriseret ved rolige villakvarterer og et godt foreningsliv, men stadig kort afstand til Randers.

Haslund ligger i kort afstand til Randers Storcenter, Motorvej E45, Ulvehøj idrætsanlæg og Vorup. Randers Centrum ligger ca. 6 km. herfra. Der er cykelsti fra Haslund mod Randers.

Her er stor aktivitet i Ulvehøjhallen og sport af al slags i Vorup FB.

Der er dagpleje i Haslund, børnehave i Vorup og Kristrup, og Søndermarksskolen, Vorup, går fra 0. – 6. klasse og Tirsdalens Skole, Kristrup, går fra 7. – 9. klasse.

ÅBENT HUS:
 - Lørdag den 26. august 2023, kl. 16:00-16:15

OBS: Venligst hold dig opdateret, da der godt kan forekomme ændringer.",https://www.boligportal.dk/r%C3%A6kkehuse/randers/127m2-5-vaer-id-5293190
"Lønnebergvej, 8600 Silkeborg",Silkeborg,Lønnebergvej,8600,56.193137,9.512004,12.500 kr.,0 kr.,130 m²,3,-,Lejlighed,Nej,Nej,Ja,Nej,Ja,Nej,Ja,Ja,A,"Sommerfugleparken består af 24 seniorvenlige boliger med lejemål i både stue og på 1 sal. Klar til indflytning 1. maj 2023. 

Konceptet med seniorbofællesskabet er, at man bor i samme område som andre seniorer, men alligevel hver for sig. I bebyggelsen skabes der plads til både det private hjem samt en god mulighed for fællesskab. Med seniorboligerne følger der rammer som fælleshus, væksthave, hobbyrum, petanquebane og drivhus og her får beboerne mulighed for at indgå i givende fællesskaber og skabe og deltage i de fælles aktiviteter, de ønsker. På den måde kan fællesskabet til- og fravælges efter den enkelte beboers ønske og behov.

Den store bolig på ca. 130 m² ligger i stueplanen af den 2 etagers bebyggelse. Man ankommer til boligen via entréen fra ankomstarealet foran boligen. Fra entréen fordeles der til et garderobeniche, bryggers, gæstetoilet og værelse, samtidigt med at man har et direkte kig ind gennem boligens opholdsrum og ud imod den private have.

Boligen er disponeret med et stort og gennemlyst køkkenalrum og stue, og rummer både soveværelse og et ekstra værelse. Køkkenalrummet er i åben forbindelse med stuen, og der er udgang til både ankomstsiden, hvor der er en privat lille niche med mulighed for cafébord, og til havesiden, med en større terrasse. Ankomstområdet vil være semiprivat, hvorimod haven vil være privat.

I boligens primære rum er der sikret plads til brug af kørestol, hvis der på sigt bliver brug for det. Boligen er udformet som en almindelig bolig, blot med den nødvendige plads til brug af kørestol. Gevinsten herved er at langtidssikre boligerne, samtidigt med at man opnår god plads i boligens rum og imellem inventaret i rummene. Til boligen hører en carport og et depotrum.

Sommerfugleparken beplantes med farvestrålende og nektarrige buske, træer og urter, der tiltrækker netop sommerfugle. På fællesarealerne etableres der sanselige bede bestående af flerårige stauder med forskellige dufte- og farvenuancer. Der er desuden mulighed for en fælles køkken- og bærhave, som Sommerfugleparkens beboerne selv skal stå for at drive.

Området
Sommerfugleparkens små haver og oaser bindes sammen af et stisystem, der kobles på de eksisterende stier i området. Hermed skabes der sikre cykelruter til indkøb ved de nærtliggende dagligvarebutikker. 

Indkøb
Lønnebergvej er beliggende tæt på hele 3 store fødevarebutikker i form af Netto, REMA 1000 og SuperBrugsen. De daglige indkøb kan dermed ordnes nemt og bekvemt.",https://www.boligportal.dk/lejligheder/silkeborg/130m2-3-vaer-id-5362414
"Frederiksbro Torv, 3400 Hillerød  - Stuen",Hillerød,Frederiksbro Torv,3400,55.92999,12.288806,11.900 kr.,1.128 kr.,90 m²,3,Stuen,Lejlighed,Nej,Nej,Nej,Nej,Nej,Nej,Nej,Nej,N/A,"3-værelses stuelejlighed med et stort køkken-alrum med direkte udgang til egen terrasse, hvor du kan nyde en hyggelig udestund. Lejligheden har derudover et værelse samt et master bedroom med walk-in-closet. Kvalitetskøkkenet er fra Invita og har hårde hvidevarer fra Siemens. På badeværelset er Siemens-vaskesøjle i energiklasse A++, og der er installeret skabe i begge soveværelser. Lejligheden har desuden gulvvarme i alle rum og et depotrum.

Frederiksbro er en helt ny bydel i Hillerød, hvor du kan være det bedste sted i livet. Her opføres ca. 1.300 lejeboliger i varierende typer og størrelser, så uanset hvor i livet, du befinder dig, kan du finde en bolig, der passer til dig.

Midt i bydelen ligger Frederiksbro Parken og Svanesøen, hvor du kan lade batterierne op i grønne omgivelser samtidig med, at der er plads til leg og aktiviteter. Derudover får du som beboer glæde af legeområder, multibane, udendørs fitnessområde, privat badepavillon og bekvemme indkøbsmuligheder i områdets Coop 365.

Fra Roskildevej og Trollesmindealle er der gode busforbindelser, herunder til Hillerød Station, som også kun er en 6 minutters cykeltur væk. Fra stationen kan du nemt komme til landsdelens øvrige store byer, og du er i København på kun 40 minutter. Hillerød Station er under udvidelse og bliver forbundet med den nye Favrholm Station nær det kommende Nyt Hospital Nordsjælland.

Der er på området mulighed for op til to parkeringslicenser pr. bolig.

Karrébygningen Rønnebærgården på 6 etager huser i alt 89 lyse lejligheder på 66-131 m2 fordelt på 2-5 værelser. Størstedelen af boligerne har egen hyggelig altan, og bygningen har også en fælles tagterrasse, hvor Rønnebærgårdens beboere kan nyde udsigten over Frederiksbro og områdets grønne arealer.

I bygningens gårdrum er et hyggeligt og grønt miljø med et lille legeområde og overdækket cykelparkering. Herfra er direkte adgang til Frederiksbro Parken, hvor der er plads til både afslapning og aktiviteter ved Svanesøen.

Som beboer i Rønnebærgården har du både fredfyldt natur og levende bystemning lige i nærheden. Med bydelens grønne hjerte, Frederiksbro Parken, lige uden for hoveddøren og Frederiksbro Torv rundt om hjørnet får du det bedste fra begge verdener.",https://www.boligportal.dk/lejligheder/hiller%C3%B8d/90m2-3-vaer-id-5377674
"Poul Anker Bechs Vej, 9200 Aalborg, Aalborg SV  - 1. sal",Aalborg,Poul Anker Bechs Vej,9200,57.021895,9.868197,8.995 kr.,600 kr.,88 m²,3,1.,Lejlighed,Nej,Ja,Ja,Nej,Nej,Nej,Nej,Nej,A,"BEMÆRK: 1. og 6. måneds husleje er gratis til denne bolig

Skøn lejelejlighed med spændende rumdeling og store vinduer, med udsigt over det omkringliggende landskab og den grønne park. 

Lejligheden er super velindrettet med 2 soveværelser, et badeværelse, en stor stue og et rummeligt køkken. I stuen er der udgang til lejlighedens sydvendte altan. 

Hver lejlighed får et tilhørende depotrum, adgang til teknik rum, og mulighed for at bruge de tilhørende p-pladser samt cykelparkering.

- Lejligheden er indrettet med lækkert hvidt Svane køkken og Siemens integrerbare hvidevare.

- Gulvene er belagt med smukt asketræ fra Tarkett og de flotteste grå fliser på badeværelset.

- Siemens vaskemaskine og tørretumbler. 

- Lejlighederne har kvalitetsrige træ/alu vinduer og døre, murede ind - og udvendig vægge samt en stor rum højde.

- Der er Grohe blandingsbatterier i hele lejligheden.

Husdyr: Forhør nærmere

Der opkræves ved indflytning et beløb på kr. 950 for dørskilt, udover indflytningsprisen.",https://www.boligportal.dk/lejligheder/aalborg/88m2-3-vaer-id-4916024
"Helgolandsgade, 6700 Esbjerg, Esbjerg  - 1. sal",Esbjerg,Helgolandsgade,6700,55.473473,8.433194,5.300 kr.,500 kr.,66 m²,2,1.,Lejlighed,Nej,Nej,Nej,Nej,Nej,Nej,Nej,Nej,N/A,Mere info ved henvendelse til ejer.,https://www.boligportal.dk/lejligheder/esbjerg/66m2-2-vaer-id-5371807
"Miliegræsset, 5220 Odense, Odense SØ",Odense,Miliegræsset,5220,55.360459,10.500843,9.100 kr.,N/A,111 m²,5,-,Lejlighed,Nej,Nej,Ja,Nej,Nej,Nej,Ja,Ja,N/A,"I attraktive Fraugde udlejes dette dejlige 2 plans rækkehus. Boligerne er beliggende centralt i Fraugde tæt på daginstitution, indkøbsmuligheder, fritidsaktiviteter samt motorvejen. Boligerne er i 2-plan og der findes 3-, 4- og 5-vær. boliger. Der er skabe på samtlige værelser. Boligen overtages med indbygnings-ovn, kogeplade, emhætte, køle/frys og opvaskemaskine. Lejer skal selv medbringe vaskemaskine og evt. kondens tørretumbler. Installationer er forberedt. Billederne er fra lignende bolig i bebyggelsen. Der medfølger et lille redskabsskur til boligen samt adgang til fælles arealer og parkeringsplads. Husdyr skal godkendes. Huslejen er angivet excl. forbrug (el, varme, vand og spildevand). Forbrug afregnes af lejer direkte til forsyningsstederne.",https://www.boligportal.dk/lejligheder/odense/111m2-5-vaer-id-5371154
"Østergade , 6100 Haderslev  - 1. sal",Haderslev,Østergade ,6100,55.249594,9.494729,8.100 kr.,500 kr.,90 m²,3,1.,Lejlighed,Nej,Ja,Nej,Nej,Nej,Nej,Ja,Ja,A,"Velkommen til denne skønne 3-værelses lejlighed på 90 kvadratmeter, centralt beliggende i hjertet af Haderslev. Denne imponerende bolig byder på både komfort og bekvemmelighed i en fantastisk pakke.

Lejligheden byder på moderne bekvemmeligheder, herunder et genveksanlæg, der sikrer dig frisk luft og et behageligt indeklima hele året rundt. Med mulighed for tilslutning af egen vaskemaskine får du fuld kontrol over din hverdag. Du kan nyde din egen private terrasse, hvor du kan slappe af med en kop kaffe eller invitere venner og familie til hyggelige stunder under åben himmel.

Beliggenheden er intet mindre end ideel. Lejligheden er placeret i en stille gård, der giver dig fred og ro, samtidig med at du er kun få skridt væk fra byens pulserende liv. Med alt inden for rækkevidde – fra butikker og restauranter til kulturelle oplevelser – bliver din daglige tilværelse både praktisk og spændende.

Som en ekstra bonus medfølger et depotrum til lejemålet, så du nemt kan opbevare dine ejendele sikkert og organiseret.

Tøv ikke med at tage kontakt for at arrangere en besigtigelse. Denne unikke lejlighed er klar til at byde dig velkommen til det næste kapitel i dit liv i charmerende Haderslev.",https://www.boligportal.dk/lejligheder/haderslev/90m2-3-vaer-id-5264623
"Brassøvej, 8240 Aarhus, Risskov  - 3. sal",Aarhus,Brassøvej,8240,56.20336,10.233034,10.495 kr.,600 kr.,80 m²,4,3.,Lejlighed,Nej,Nej,Ja,Nej,Nej,Nej,Ja,Nej,N/A,"2 måneders huslejefrihed


Risskov er en forstad, der ligger nord for Aarhus, og som strækker sig ca. 5,5 km langs kysten ved Aarhus Bugt. Området inkluderer Vejlby og huser ca. 27.000 indbyggere

De to områder, Vejlby og Risskov, er opdelt af Grenåvej, der er en af hovedindfaldsvejene til Aarhus midtby, og som er forbundet med Djurslandsmotorvejen. I den sydlige del af Risskov ligger skoven, Riis Skov, som bydelen er opkaldt efter.

 Skoven er bindeleddet mellem Aarhus midtby og Risskov og er yderst attraktiv til brug for rekreative aktiviteter såsom fx gå- og løbeture, hundeluftning og picnics. Riis Skov er ligeledes kendt for ramsløgene, som hvert forår dækker skovbunden og giver en helt speciel duft i skoven.

Ydermere ligger en af byens bedste badestrande, Bellevue Strand, i cykelafstand fra Ejendommen. Det nærmeste supermarked, Rema 1000, ligger ca. 300 meter fra Ejendommen, mens Lagkagehuset ligger ca. 650 meter fra Ejendommen.

Samtidig ligger skole, daginstitutioner, øvrigt indkøb og bibliotek indenfor kort afstand. Ndr. Strandvej, hvor der er masser af liv med tøjbutikker, restauranter, bagere og andre specialbutikker, ligger ligeledes tæt på ejendommen.",https://www.boligportal.dk/lejligheder/aarhus/80m2-4-vaer-id-5359148
"Møllergade, 5700 Svendborg  - Stuen",Svendborg,Møllergade,5700,55.065105,10.614036,3.500 kr.,200 kr.,40 m²,2,Stuen,Lejlighed,Nej,Nej,Nej,Nej,Nej,Nej,Nej,Nej,N/A,"Nu udlejes denne charmerende 2-værelses lejlighed midt i Svendborg. Lejligheden indeholder entré, elementkøkken med komfur, emhætte og køleskab, opholdsstue, soveværelse samt badeværelse med brus. Lejemålet opvarmes med elvarme.
. Alle lejligheder er istandsat, og der er et tilhørende opbevaringsskur i gården til hver lejlighed.",https://www.boligportal.dk/lejligheder/svendborg/40m2-2-vaer-id-5379288
"Torvegade, 5000 Odense, Odense C  - 3. sal",Odense,Torvegade,5000,55.397411,10.389473,7.995 kr.,640 kr.,64 m²,2,3.,Lejlighed,Nej,Ja,Ja,Ja,Ja,Nej,Nej,Nej,N/A,"I de lyse lejligheder, hvor der virkelig er kræset om detaljerne. Oplev det fantastisk leverum, hvor køkken-alrum og stue er forenet på harmonisk vis. Køkkenet er stilrent og veludstyret med Bosch hårde hvidevarer, der skaber de bedste betingelser for dine kulinariske udfoldelser.

I de lyse lejligheder, hvor der virkelig er kræset om detaljerne. Oplev det fantastisk leverum, hvor køkken-alrum og stue er forenet på harmonisk vis. Køkkenet er stilrent og veludstyret med Bosch hårde hvidevarer, der skaber de bedste betingelser for dine kulinariske udfoldelser.

Gulvene er strømlinede og stilrene i Tarkett egetræ. Badeværelset er holdt minimalistisk med smukke klinker og simple elementer, så der i hele lejligheden er stor mulighed for at sætte eget præg.

Her skal du ikke lede længe for at finde, lige det du har brug for. Udenfor døren er midtbyens mange muligheder, og inden for kort afstand findes skoler, daginstitutioner, indkøbsmuligheder og fritidsaktiviteter.

Lyder denne lejlighed som noget for dig, så kontakt os for at høre mere!",https://www.boligportal.dk/lejligheder/odense/64m2-2-vaer-id-5360564
"Teglværksvej, 5690 Tommerup  - 2. sal",Tommerup,Teglværksvej,5690,55.348686,10.17995,4.690 kr.,1.040 kr.,66 m²,2,2.,Lejlighed,Nej,Nej,Nej,Nej,Nej,Nej,Nej,Ja,D,"Rummelig 2 værelses lejlighed tæt ved togstation og indkøb. Lejligheden er med nyt køkken op alt i nye hårde hvidevarer, ny malet og med nye gulve i stue og entre. Mulighed for parkering, eget depot rum.
Adgang til vaskeri.",https://www.boligportal.dk/lejligheder/tommerup/66m2-2-vaer-id-2201239
"Købmagergade, 7000 Fredericia  - 3. sal",Fredericia,Købmagergade,7000,55.568129,9.759009,3.900 kr.,200 kr.,33 m²,1,3.,Lejlighed,Nej,Nej,Nej,Ja,Nej,Nej,Nej,Nej,N/A,"Lejen er 3900 men her er inkluderet vand + varme. Der betales derudover aconto EL 200kr. 
Depositum beregnes ud fra lejen på 3900kr. som er inkluderet med vand/varme


med nyere mindre køkken og stort dejligt badeværelse.
Lejligheden ligger på 3. sal med elevator og har skråvægge.

Lejen er inkl. vand og varme 

Der må IKKE ryges i boligen eller ejendommen",https://www.boligportal.dk/lejligheder/fredericia/33m2-1-vaer-id-4486428
"Langstrømpevej, 8600 Silkeborg  - 1. sal",Silkeborg,Langstrømpevej,8600,56.193143,9.516987,8.795 kr.,N/A,126 m²,4,1.,Lejlighed,Nej,Nej,Ja,Nej,Nej,Nej,Nej,Nej,N/A,"FLYT IND MED RABAT:Netop nu tilbyder vi en særlig lejerabat på en lejebolig på langstrømpevej. Underskriver du lejekontrakt inden 1. September 2023, får du to måneders gratis husleje (gælder ikke a conto-udgifter)..
Her finder du 84 moderne rækkehuse og lejligheder med skøn placering i Silkeborg som især er kendt for Søhøjlandets mange outdooroplevelser og unikke kulturelle events.Lejeboligerne er indrettet moderne og har gode, funktionelle værelser og stort køkkenalrum.
I denne bolig med 4 værelser får du:

Rummeligt køkkenalrum med hvide HTH -elementer og alt i hårde hvidevarer

Flotte egetræsgulve

     Lyst badeværelse

Stor stue med udgang til altan/have

Rummeligt bryggers vaskemaskine og tørretumbler

     HTH-elementer i værelser

Boligen ligger 5 km fra Silkeborg centrum. Ca. 1 km. til den nye motorvej og herfra er der under en halv times transport til Aarhus og Herning.Både i bil, på cykel og med offentlig transport har du let adgang til centrum af byen og andre indkøbsmuligheder i nærheden.

Området:

Buskelund-området ligger i et naturskønt og kuperet område mellem Balle og Hvinningdal med en naturlig sammenhæng mellem de tre byområder. Denne attraktive og forholdsvis nye bydel har alt, hvad der er brug for i hverdagen: skoler, daginstitutioner, idrætsfaciliteter og indkøbsmuligheder.

Via stisystem er det muligt at nå til skole uden at skulle krydse Nordre Højmarksvej. Området er generelt roligt og børnevenligt med legepladser og et godt stisystem.

Med kun 1 km til motorvejen, kan man nå til Aarhus eller Herning på kun ½ time.

Kort afstand til skov og natur giver mulighed for gode naturoplevelser og en aktiv fritid.

Med kun 5 kilometer til Silkeborg centrum er der nem adgang til bylivets faciliteter som café, restauranter og specialbutikker.

ÅBENT HUS:
 - Søndag den 20. august 2023, kl. 14:40-15:10

OBS: Venligst hold dig opdateret, da der godt kan forekomme ændringer.",https://www.boligportal.dk/lejligheder/silkeborg/126m2-4-vaer-id-5292569
"Seebladsgade, 5000 Odense, Odense C  - 2. sal",Odense,Seebladsgade,5000,55.403466,10.381807,6.900 kr.,600 kr.,60 m²,2,2.,Lejlighed,Nej,Nej,Nej,Ja,Nej,Nej,Ja,Nej,N/A,"Lejemålet er beliggende på Seebladsgade og består af 2 værelser samt køkken og bad. Lejemålet er 60 m2 og er klar til overtagelse snarest. Månedlig husleje er 6900 kr. og forudbetalt husleje og depositum beløber sig til i alt 20700 kr. 

Send en besked, hvis lejemålet har fanget din interesse.",https://www.boligportal.dk/lejligheder/odense/60m2-2-vaer-id-5337828
"Vindrosen, 8240 Aarhus, Risskov  - Stuen",Aarhus,Vindrosen,8240,56.185728,10.215131,11.595 kr.,800 kr.,97 m²,3,Stuen,Lejlighed,Nej,Ja,Ja,Ja,Ja,Nej,Ja,Ja,N/A,"Velkommen til VINDROSEN.

Her lejer du en skøn 3-vær. lejlighed, der er helt perfekt indrettet til enten parret eller den lille familie. 

VINDROSEN også kendt som Broloftet er beliggende i det nye område, Risskov Brynet, der er tæt på alle Aarhus' mange muligheder og tilbud. I Risskov Brynet er man blot en 10 minutters cykeltur fra Aarhus C og universitetet. Lige uden for døren er der ligeledes et utal af muligheder med offentlig transport, der kører mange gange hver time. Ydermere byder vi husdyr velkommen med et smil.

Risskov Brynet har meget at byde på, og det inkluderer blandt andet et fitnesscenter, en café og to dagligvarebutikker i form af Meny og Netto - alt dette blot 50 meter fra ejendommen. Er man til en løbeturen i skoven eller et dyp i havet, har man god mulighed for dette, da begge dele ligger blot et stenkast fra Risskov Brynet.

Alle lejligheder er helt nye og de har derfor alt, hvad man har brug for. Der er altså både opvaskemaskine, vaskesøjle, gulvvarme og altan eller terrasse, så man slet ikke skal gå på kompromis. Værelserne er rummelige og har desuden indbyggede skabe. Lejlighederne har ligeledes depotrum i kælderen, hvor der også er aflåst cykelparkering og mulighed for leje af p-plads for blot 450 kr. pr. måned.

Som lejer i Risskov Brynet er indflytningsprisen billig, idet man kun skal betale tre måneders husleje i depositum og dermed ikke skal betale én krone i forudbetalt husleje.

OBS: Billederne er fra en anden lejlighed. 

Lyder det som noget for dig? Giv os besked her i indbakken hvis du ønsker et nærmere kig på boligerne.

//

Broloftet is located in a new area, Risskov Brynet, which is close to Aarhus. In Risskov Brynet you are just a 10-minute bike ride from Aarhus C and the university. There are good transport options in the area. 

Pets are also allowed here      
 
Risskov Brynet has a lot to offer – it has a fitness center, a café and two grocery stores: Meny and Netto - all this within 50 meters from the property. If you are looking for a run in the forest or a dip in the sea, you have a good opportunity for this. 
All apartments are new and have everything you need. There is a dishwasher, washing column, floor heating and balcony or terrace. In the rooms there are wardrobes. The apartments also have storage rooms in the basement, where there is locked bicycle parking and the possibility of renting a parking space for just DKK 475 per month.

As a tenant in Risskov Brynet, the move-in price is cheap, as you only have to pay three months' rent as a deposit.

NOTE: The pictures are from another apartment.
 
Contact us today for a viewing! We look forward to hearing from you.",https://www.boligportal.dk/lejligheder/aarhus/97m2-3-vaer-id-5374976
