Adress,City,Street name,Postal code,Latitude,Longitude,Monthly rent,Aconto,Square meters,Rooms,Floor,Property type,Furnished,Shareable,Pets allowed,Elevator,Senior frendly,Only for students,Balcony/Terrace,Parking,Energy label,Description,Link
"Basunen, 5500 Middelfart, Strib",Middelfart,Basunen,5500,55.527189,9.793962,9.713 kr.,N/A,105 m²,4,-,Rækkehus,Nej,Nej,Ja,Nej,Ja,Nej,Ja,Ja,A,"Lyst og moderne rækkehus indrettet med entre med videre adgang til to store værelser samt husets køkkenalrum og stue i ét. Køkken er åbent og lyst med køkkenø samt god plads til spisebord. Her er ligeledes mulighed for at indrette hyggeligt sofahjørne. Fra alrummet finder man ligeledes særskilt bryggers med vask og plads til vaskemaskine/tørretumbler samt videre adgang til badeværelse. I forbindelse med stuen finder man stort soveværelse med skabsvæg. Fra det store vinduesparti i stuen er udgang til stor terrasse samt have.

Bebyggelsen opføres på et nyt vænge, der er døbt henholdsvis Harpen, Oboen samt Basunen. Bebyggelsen vil bestå af 98 energivenlige moderne rækkehuse i størrelsen 85 m², 95 m², 105 m² og 115 m² – alle i et plan og tegnet i en moderne og enkel streg.

Til hvert hus hører carport, stort redskabsrum, dejlig have, stor flisebelagt terrasse på begge sider af huset samt flisebelagt gangsti til boligens entre, hvor der udføres niveaufri adgang. Endvidere udføres der på begge sider af huset, læhegn mellem boligenhederne. Haven omkranses og lukkes af hæk.

Husene får murede facader af moderne mursten med variation i brune og sandfarvede nuancer samt sort sadeltag med 25 graders hældning. Stern af træ i farven antracit og mindre hvidmalet udhæng af træ.

Der monteres med moderne træ/alu vinduer og døre (3-lags vinduer) i mørk farve udvendig og hvid indvendig i. Sålbænke under vinduespartierne er udført i mørk skifer.

Husenes materialevalg er gennemtænkt og harmonisk, så husene vil fremstå smukke, tidløse og velholdte i mange år fremover.

Åbne og lyse rækkehuse

Alle rækkehuse indrettes lyse og venlige, med hvide glatte lofter og vægge. Dejlige vinduer for ekstra godt lysindfald overalt. Gulve af egeplank (laminat) i køkken/alrum, stue og værelser. Entré, bryggers, badeværelse og brus udføres med lækre klinkegulve i neutral mørkegrå. Alle døre i glat hvid finish med rustfri stålgreb og uden dørtrin for optimal og let færden. Vindueskarme mures og vandskures i hvid. Vægge mod gulv afsluttes med hvide glatte fodpaneler.

Fine detaljer overalt

Køkken, bad, bryggers og soveværelse monteres med moderne HTH-moduler/skabe i glat hvid afslutning og med rustfri greb. Bordplader i praktisk laminat i farven ’rustik skifer’ med rummelige stålvaske. Stænkplade bag kogepladen for nem rengøring. Vask i badeværelse af formstøbt materiale. Væghængt toilet fra Ifö Sign, kvalitetsarmaturer fra tyske Hans Grohe og linjeafløb i bruseniche.

Kvalitetshvidevarer

Alle hvidevarer medfølger og er i anerkendt kvalitet. Ovn med pyrolyse, der er indbygget i højskab i det omfang det er angivet på plantegninger. Kogesektion med induktion samt støjsvag emhætte og opvaskemaskine.

Der er forberedt for vaskemaskine og tørretumbler i bryggers – dette skal lejer selv medbringe. Dog medfølger disse på Basunen.

Fast og god belysning

Der er etableret lyskilde i bad og bryggers og i køkken er der spot i overskabene. Endvidere monteres lyskilde i redskabsrummet og ved ventilation på loft.

Forberedt for el-bil

Der er forberedt tomrør til ladestation for el-køretøj.

Sundt indeklima og behagelig gulvvarme

Der er gulvvarme i hele rækkehuset. Dette styres via separate termostater i alle rum. Boligen er udført med ventilationsanlæg, der sikrer et sundt og godt indeklima.

Individuelle forbrugsmålere

Forbrug til el, varme vand og spildevand afregnes direkte mellem lejer og forsyningsselskaberne. Opvarmning via fjernvarme.

Udvendig monteres der stikkontakt og vandhane samt væglampe ved entredør og terrassedør

Illustrationer er modelfotos. Der tages forbehold for rettelser.",https://www.boligportal.dk/r%C3%A6kkehuse/middelfart/105m2-4-vaer-id-5347618
"Jeppe Aakjærsvej, 7800 Skive, Skive By  - 4. sal",Skive,Jeppe Aakjærsvej,7800,56.569268,9.022085,4.745 kr.,1.089 kr.,68 m²,3,4.,Lejlighed,Nej,Nej,Nej,Nej,Nej,Nej,Nej,Nej,N/A,"Lejemålet er beliggende på Jeppe Aakjærsvej og består af 3 værelser samt køkken og bad. Lejemålet er 68 m2 og er klar til overtagelse 15-08-2023. Månedlig husleje er 4745 kr. og indskud beløber sig til 8700 kr. 

Send en besked, hvis lejemålet har fanget din interesse.
For at kunne leje denne bolig, kræver det man er medlem af boligforeningen. På BoligPortal annonceres kun reelt ledige boliger uden eksisterende venteliste på annonceringstidspunktet. Venligst kontakt udlejer hvis du er interesseret i lejemålet.",https://www.boligportal.dk/lejligheder/skive/68m2-3-vaer-id-5310350
"Rådhusgade, 4780 Stege  - 1. sal",Stege,Rådhusgade,4780,54.986822,12.285131,3.250 kr.,850 kr.,38 m²,1,1.,Lejlighed,Nej,Nej,Nej,Nej,Nej,Nej,Nej,Nej,N/A,"Nyistandsat 1-v lejlighed på Rådhusgade
Lys og indbydende lejlighed på 1. sal, indflytningsklar med blandt andet nye trægulve, beliggende helt centralt i Stege.
Lejligheden indeholder entre/fordelingsgang, mindre køkken, vinkelstue som er ideel til at opdele til soveafdeling og stue, samt lille brusebadeværelse.
Ejendommen har egen private parkeringsplads, grønne udearealer, fælles vaskefaciliteter, eget kælderrum mv.
En ejendom med kun rolige beboer.
Henvendelse skal ske via mail eller telefon (SMS besvares ikke).",https://www.boligportal.dk/lejligheder/stege/38m2-1-vaer-id-4282723
"Finderupvej, 8000 Aarhus, Aarhus C  - 3. sal",Aarhus,Finderupvej,8000,56.155237,10.180218,8.400 kr.,550 kr.,61 m²,2,3.,Lejlighed,Nej,Ja,Nej,Ja,Nej,Nej,Ja,Nej,A,"Lejligheden indeholder 2 værelser med indbyggede skabe, entré, badeværelse samt køkken/opholdsrum.

Køkkenet er med flotte hvide Invita elementer og alt i hårde hvidevarer.

Der er udgang til egen altan fra køkken/opholdsrummet.
Badeværelset har en rigtig god størrelse og er med gulvvarme samt kombineret vaske-/tørremaskine.
Der er genvækst anlæg i lejligheden, som sørger for udskiftning af luften hele tiden.

Til lejemålet hører endvidere 2 m2 depotrum i aflåst kælder.
Der er mulighed for at blive skrevet på venteliste til leje af parkeringsplads i aflåst kælder til 600,- pr. måned + moms.
OBS: Billederne er fra lign. lejemål.",https://www.boligportal.dk/lejligheder/aarhus/61m2-2-vaer-id-5378255
"Fruerstuevej, 5700 Svendborg  - Stuen",Svendborg,Fruerstuevej,5700,55.063918,10.622809,8.450 kr.,1.000 kr.,95 m²,3,Stuen,Lejlighed,Nej,Nej,Nej,Nej,Nej,Nej,Ja,Nej,D,"Flot lejlighed med stukloft og afsyrede døre.
nyrenoverede gulve i køkken, gang, stue og soveværelse. Dejlig stort badeværelse med udgang til kælder og depotrum. Der er adgang til en hyggelig lukket have med græsareal og fliser. Der forefindes komfur, køleskab, opvaskemaskine og emfang.

Vi har nyrenoveret 4 gulve. Vi har valgt at lægge gulvvarme i stue, køkken og gang. 
I køkken og gang har vi lagt fliser. I den ene stue og soveværelse har vi lagt vedligeholdelsesfrit lvt. gulv med sildebensmønster.

En lejlighed for de lidt mere kræsne.",https://www.boligportal.dk/lejligheder/svendborg/95m2-3-vaer-id-5356124
"Købmandsgården, 8680 Ry",Ry,Købmandsgården,8680,56.092082,9.756855,3.400 kr.,200 kr.,29 m²,1,-,Lejlighed,Nej,Nej,Nej,Nej,Nej,Nej,Nej,Nej,N/A,"Lækker lille lejlighed med nyt køkken og badeværelse beliggende i hjertet af Ry by.
Lejligheden ligger i Købmandsgården, som har ny vaskekælder, fælles gårdmiljø og dejlig terrasse.
Boligen har elvarme. A conto er vand.
Leligheden ligger i nærheden af tog og bus",https://www.boligportal.dk/lejligheder/ry/29m2-1-vaer-id-5229217
"Frederikssundsvej, 2700 København, Brønshøj  - 2. sal",København,Frederikssundsvej,2700,55.705392,12.49367,16.650 kr.,1.300 kr.,109.6 m²,4,2.,Lejlighed,Nej,Ja,Nej,Ja,Ja,Nej,Ja,Nej,A,"Frederikssundsvej, 2700  Brønshøj.
I ejendom opført i 2021 kan denne lejlighed på 4 værelser lejes.
Lejligheden har 2 badeværelser, delvis overdækket altan og der er adgang til fælles tagterrasse på 466 kvm med udekøkken. 
Billederne er fra prøvelejligheden i samme ejendom.
Lejer, skal binde sig i 12 måneder (med forudbetaling af 1 måneds leje og 3 måneders depositum).
Der lejes ikke ud til personer, der er registreret som dårlige betalere.",https://www.boligportal.dk/lejligheder/k%C3%B8benhavn/109m2-4-vaer-id-5202436
"Jens Baggesens Vej, 8200 Aarhus, Aarhus N  - 2. sal",Aarhus,Jens Baggesens Vej,8200,56.169551,10.191855,6.200 kr.,500 kr.,44 m²,1,2.,Lejlighed,Nej,Ja,Nej,Ja,Nej,Ja,Nej,Ja,N/A,"Lejligheden byder på et smart og effektivt layout, der maksimerer hver kvadratmeter. Det åbne opholdsområde byder på masser af plads til både afslapning og studiearbejde. 
Det veludstyrede køkken er funktionelt og stilfuldt med moderne hvidevare og smart opbevaringsplads. Her kan du let tilberede dine yndlingsmåltider eller invitere venner på middag.

Badeværelset er lækkert og rummeligt, med fokus på funktionalitet og æstetik. 

Beliggende i det populære universitetsområde tilbyder lejlighederne en ideel kombination af komfort, praktisk beliggenhed og moderne design. Med sin nærhed til Universitetet er det den perfekte boligløsning for studerende, der ønsker at være tæt på akademiske institutioner og alt det pulserende studieliv.

Området er blomstret op som universitetsparkens lillebror og serverer med sine mange boliger, butikker, fitnesscenter og grønne frirum et attraktivt alternativ til Aarhus midtby. Der er kort afstand til indkøbs- og fitnesscenter samt gode busforbindelser til både City og det øvrige Aarhus. Herudover er der kun få minutters gang til Letbanen, som hurtigt bringer dig enten ind- eller ud af Smilets by.

Bebor sammensætningen er studerende, unge mennesker og par. Meget velfungerende boligforening med ansat vicevært og gode fællesfaciliteter, herunder fælles vaskeri, depotrum til alle lejligheder, samt cykel kælder. Ligeledes bliver der mulighed for leje af privat P-plads i aflåst kælder. Der må ikke holdes husdyr i ejendommen.",https://www.boligportal.dk/lejligheder/aarhus/44m2-1-vaer-id-5377483
"Torvegade, 5000 Odense, Odense C  - 4. sal",Odense,Torvegade,5000,55.396511,10.390296,11.495 kr.,1.159 kr.,107 m²,4,4.,Lejlighed,Nej,Ja,Ja,Ja,Ja,Nej,Nej,Nej,N/A,"I de lyse lejligheder, hvor der virkelig er kræset om detaljerne. Oplev det fantastisk leverum, hvor køkken-alrum og stue er forenet på harmonisk vis. Køkkenet er stilrent og veludstyret med Bosch hårde hvidevarer, der skaber de bedste betingelser for dine kulinariske udfoldelser.

I de lyse lejligheder, hvor der virkelig er kræset om detaljerne. Oplev det fantastisk leverum, hvor køkken-alrum og stue er forenet på harmonisk vis. Køkkenet er stilrent og veludstyret med Bosch hårde hvidevarer, der skaber de bedste betingelser for dine kulinariske udfoldelser.

Gulvene er strømlinede og stilrene i Tarkett egetræ. Badeværelset er holdt minimalistisk med smukke klinker og simple elementer, så der i hele lejligheden er stor mulighed for at sætte eget præg.

Her skal du ikke lede længe for at finde, lige det du har brug for. Udenfor døren er midtbyens mange muligheder, og inden for kort afstand findes skoler, daginstitutioner, indkøbsmuligheder og fritidsaktiviteter.

Lyder denne lejlighed som noget for dig, så kontakt os for at høre mere!",https://www.boligportal.dk/lejligheder/odense/107m2-4-vaer-id-5195880
"Munkeengen, 3400 Hillerød  - 2. sal",Hillerød,Munkeengen,3400,55.929842,12.293696,9.750 kr.,1.100 kr.,75 m²,2,2.,Lejlighed,Nej,Nej,Ja,Ja,Ja,Nej,Ja,Nej,B,"Går du og drømmer om at bo centralt i Hillerød med gåafstand til alle hverdagens fornødenheder? Så er det værd at se nærmere på denne indbydende lejlighed med et skønt lysindfald, moderne interiør og en velekviperet planløsning med flere indretningsmuligheder. Her kommer du ikke til at mangle noget, da alt er i tip top stand. 

Dit kommende hjem er placeret i et nyere bygningskompleks fra 2010, hvis facader har et spændende spil af neutrale farver og brede glaspartier, der inviterer dagslyset inden døre. I de lune måneder kan du trække ud i det hyggelige gårdhavemiljø med bordbænkesæt omsluttet af hæk, hvorfor her føles helt ugeneret. Her er også gode parkeringsmuligheder. 

Fra adressen kan du spadsere til Føtex for at foretage indkøbene, og tager du cyklen, når du bymidten på ingen tid, hvilket gør placeringen meget attraktiv. Gågaden emmer af stemning, og her er et utal af butikker, caféer og spisesteder, som du kan besøge i selskab med familie og venner. Der er på samme vis ikke langt til Frederiksborg Slot og Slotsparkens smukke oase, der er vidunderlig at nyde på alle tidspunkter af året. Har du behov for skole, daginstitution eller fritidsaktiviteter, kan distancen hertil også hurtigt tilbagelægges. Fra Hillerød Station er der desuden hyppig afgang mod København. Naturen er ligeledes let at finde i nærmiljøet, da Tirsdagsskoven udfolder sig under 800 meter væk. Generelt er Hillerød et meget flot sted at bosætte sig, hvor grønne omgivelser og byens faciliteter forenes på fineste vis.

OBS! Billeder, plantegning og tekst er vejledende og kan afvige fra boligens faktiske forhold.

Hvis du er registreret i RKI kan vi desværre ikke tilbyde dig lejligheden. Dette kontrolleres ved udarbejdelse af lejekontrakt.",https://www.boligportal.dk/lejligheder/hiller%C3%B8d/75m2-2-vaer-id-5378708
"Kirkebjerg Tværvej, 2605 København, Brøndby  - 2. sal",København,Kirkebjerg Tværvej,2605,55.656717,12.395842,10.925 kr.,995 kr.,76 m²,3,2.,Lejlighed,Nej,Nej,Ja,Ja,Ja,Nej,Ja,Ja,N/A,"156 lejeboliger fordelt på 2-, 3- eller 4-værelses lejligheder. 

Den nyligt opførte rødstensejendom præsenterer sig flot i nabolaget med store vinduespartier, grå detaljer og glasafskærmede altaner, der har en behagelig afstand imellem sig. Alle lejligheder fremstår med regulære værelser, lyse stuer, pæne køkkener og rummelige badeværelser, og når først gårdhavemiljøet er færdiganlagt, får I endnu flere udendørsarealer til rådighed. 

I bosætter jer i et nyetableret kvarter, hvorfra I får korte afstande til alle hverdagens fornødenheder - og det gælder alt fra skolefaciliteter, dagtilbud og indkøbsmuligheder, som tæller både Rema1000, SuperBrugsen, Lidl og Netto. Glostrup Station er ligeledes inden for nær rækkevidde, og her kan I komme til Indre By med S-toget på cirka 20 minutter. Det er derfor ganske nemt at pendle til og fra Indre By, hvilket gør denne adresse ekstra attraktiv. I kommer ligeledes hurtigt til Høje Taastrup, hvorfra regionaltogene fører jer videre rundt på Sjælland. Derudover tager det under fem minutter i bil at komme på motorvejsnettet

Der er 94 parkeringspladser i parkeringskælderen + 62 parkeringspladser i terræn. En parkeringsplads kan lejes for 300 dkk pr. måned i terræn og 350 dkk i parkeringskælderen. Der opsættes tilmed 2 el-lade standere, således at der kan oplades 4 elbiler ad gangen. 

Alle hårde hvidevarer der forefindes i prøveboligen medfølger i alle lejlighederne.

Der er Stofa fibernet og boligerne opvarmes med fjernvarme.

Lejlighederne kan reserveres ved at deltage på åbent hus. Vi holder åbent hus ca. én gang om ugen indtil alt er udlejet. 

Ønsker du at deltage i det åbne hus, så kan du sende en besked via annoncen og modtage en invitation til det næstkommende åbne hus. 

Indflytningsprisen skal betales umiddelbart efter modtagelsen af lejekontrakten. 

Det vil ikke være muligt at besigtige andre boliger end prøveboligen inden indflytning og det er under ingen omstændigheder tilladt at opholde sig på byggepladsen uden en invitation til åbent hus. 

Billeder, plantegning og tekst er vejledende. 

Hvis du er registreret i RKI kan vi desværre ikke tilbyde dig lejligheden. Dette kontrolleres ved udarbejdelse af lejekontrakt.",https://www.boligportal.dk/lejligheder/k%C3%B8benhavn/76m2-3-vaer-id-5349383
"Smedegade, 7130 Juelsminde, Rårup",Juelsminde,Smedegade,7130,55.768336,9.930885,7.600 kr.,400 kr.,94 m²,4,-,Rækkehus,Nej,Nej,Ja,Nej,Ja,Nej,Ja,Ja,A,"Nyopført rækkehus i Rårup. 
Boligen indeholder køkken/alrum , stort soveværelse med skabsvæg, 2 fine værelser med skabe, dejlig entré i forbindelse med bryggers samt lækkert badeværelse.  
Til boligen hører carport og redskabsrum.
Mindre hund er tilladt.
Der er vaskemaskine + Tumbler i boligen",https://www.boligportal.dk/r%C3%A6kkehuse/juelsminde/94m2-4-vaer-id-5365414
"Stormgade, 7673 Harboøre",Harboøre,Stormgade,7673,56.620319,8.177555,5.190 kr.,N/A,85 m²,3,-,Rækkehus,Nej,Ja,Ja,Nej,Nej,Nej,Nej,Nej,N/A,"Rækkehusene er opført i 1984 og 1986 i den nordlige del af byen, tæt på stationen. Hver bolig har en have og et skur.
Harboøre er en alsidig stationsby med ca. 1.500 indbyggere og med havet som nabo og en pragtfuld natur.

Der er 2 supermarkeder i byen, hvoraf den ene har en bagerbutik. I byen findes også Harboøre Pizza og Grill. På Harboøre Hotel er der overnatningsmuligheder.

Der er et rigt foreningsliv i byen. Harboøre Centeret er et moderne idræts- og kulturcenter med et hav af fritidsaktiviteter både ude og inde. Her er mulighed for at dyrke bla. fitness, fodbold, squash, skydning, gymnastik, bmx cykling og meget mere. 
Hvert år afholdes sommerens festival – Haze over Haarum, som er et musikalsk hit for tusindvis af unge og voksne.

I byen er der dagplejer, børnehave og folkeskole med 0. – 9. klasse.

Afdelingen består af 46 familieboliger og 6 studieboliger.

Boligernes energimærke: C / D.

Telefonen er åben mandag - torsdag 9.00-12.00 og 13.00-15.00. Fredag fra 9.00-12.00.
For at kunne leje denne bolig, kræver det man er medlem af boligforeningen. På BoligPortal annonceres kun reelt ledige boliger uden eksisterende venteliste på annonceringstidspunktet. Venligst kontakt udlejer hvis du er interesseret i lejemålet.",https://www.boligportal.dk/r%C3%A6kkehuse/harbo%C3%B8re/85m2-3-vaer-id-5343314
"Overgade, 5492 Vissenbjerg, Skalbjerg",Vissenbjerg,Overgade,5492,55.366851,10.150387,7.375 kr.,1.860 kr.,146 m²,4,-,Lejlighed,Nej,Nej,Nej,Nej,Nej,Nej,Ja,Ja,C,Stor dejlig familievenlig 4 værelses bolig med stor terrasse og adgang til have. Særskilt vaskerum og depotrum.,https://www.boligportal.dk/lejligheder/vissenbjerg/146m2-4-vaer-id-5304947
"Lillegade, 8500 Grenaa  - 1. sal",Grenaa,Lillegade,8500,56.415617,10.870897,3.200 kr.,725 kr.,46 m²,2,1.,Lejlighed,Nej,Nej,Nej,Nej,Nej,Nej,Nej,Nej,N/A,"Rigtig pæn lejlighed på 1. sal til leje.

Velegnet for studerende. Indeholder stue , soveværelse køkken og bad toilet.

Nymaleristandsat og lige til at flytte ind i.

Lejlighed er i hus med i alt 7 lejemål med søde naboer. 


A/C er incl. adgang til vaskefaciliteter.",https://www.boligportal.dk/lejligheder/grenaa/46m2-2-vaer-id-5365282
"Birke Allé, 7100 Vejle, Ødsted",Vejle,Birke Allé,7100,55.653317,9.401694,9.995 kr.,0 kr.,101 m²,4,-,Rækkehus,Nej,Ja,Nej,Nej,Nej,Nej,Ja,Ja,N/A,"BOOK EN PERSONLIG FREMVISNING ELLER MELD DIG TIL ÅBENT HUS HVER TIRSDAG FRA 16.30 -17.00 (husk tilmelding) 
Første Åbent Hus er tirsdag d. 16. maj - Vi glæder os meget til at fremvise hvad dette spændende kvarter kan. 

HELT NYE BOLIGER - KUN 15 MIN VÆK I BIL FRA VEJLE CENTRUM 

Projektet på Birke Allé består af 14 rækkehuse som er klar til indflytning pr. 1.maj/ og løbet af sommeren. 

Disse moderne lavenergi boliger har en central placering i naturskønne omgivelser.

Birke Allé skal danne ramme om liv og glæde hvor der er plads til hverdagen og alle de gode stunder med familie og venner. 

I boligerne er der fokus på funktionalitet og enkelthed således, at der bliver mere luft i hverdagen. Rækkehusene rummer hele 101m2, som er fordelt på enten tre eller fire værelser.  

Indretningen af boligerne er flot og gennemtænkt. Fra den flisebelagte parkeringsplads bevæger du dig ind i den klinkebelagte entre. Herfra er der adgang til bryggers med håndvask. 

På modsatte side finder du et lyst soveværelse med en fast monteret skabsvæg. Badeværelset er i tidløst design med flotte mørkegrå fliser, hvide vægge samt elementer.

Centralt i boligerne finder du det sore lyse alrum. Her er et lyst vinkelkøkken i stilrent design samt hvidevarer af god kvalitet. Dette giver rig mulighed for at indrette et hyggeligt spiseområde samt sofa/stue areal.

På begge sider af alrummet e der store vinduespartier med udgang til flisebelagt terrasser. Ikke nok med, at dette giver mulighed for at vælge terrasse alt efter sol og vind, giver de stor vinduer ligeledes et dejligt naturligt lysindfald i de store rum.

Fra alrummet har du ligeledes adgang til de lyse værelser, der kan indrettes som børneværelse, gæsteværelse kontor eller hobbyrum. Dertil får du et skur på cirka 4m2.

Området åbner for naturoplevelser og gåture ud gennem et rekreativt grønt område syd for boligerne. Selve boligområdet bliver udlagt i græs, træer og hæk.

Boligerne opfylder de nyeste bygningsreglementer og er opvarmet med varmepumpe hvilket gør boligerne til lavenergi boliger. For dig betyder det, at udgifterne til varme vil være lavere end ved boliger uden denne klassificering. 

Boligerne er klimavenlige i drift og har et kontrolleret indeklima, hvor ventilations-systemet selv klarer luftudskiftningen.

Ødsted er en lille by med knap 1.500 indbyggere. Byen er beliggende cirka 11 kilometer fra Vejle Kommune samt Region Syddanmark. Byen tilhører Ødsted Sogn hvor du finder både skole, idrætshal, brugsforening, bager samt pizzeria i byen.  Alt sammen under en kilometer fra Birke Allé. 

I Ødsted får du ro, smukke naturområder og livet fra lokalområdet på samme tid. Derudover er der kort afstand til større byer som Vejle og Kolding.

Afregning sker direkte via værkerne.

Mulighed for lille hund - skal godkendes af udlejer.",https://www.boligportal.dk/r%C3%A6kkehuse/vejle/101m2-4-vaer-id-5356082
"Engløbet, 2730 København, Herlev",København,Engløbet,2730,55.721763,12.431156,14.900 kr.,1.100 kr.,121 m²,4,-,Lejlighed,Nej,Nej,Ja,Ja,Nej,Nej,Ja,Ja,N/A,"Plads til familien
Velkommen til dette moderne og velindrettede rækkehus i 2 plan beliggende i et attraktivt kvarter i Herlev. Med sin rummelige planløsning, morderne udtryk og praktiske faciliteter er dette rækkehus det perfekte hjem for dig og din familie.
I stueetagen byder rækkehuset på et åbent og lyst opholdsområde, der omfatter en rummelig stue med plads til spisebord samt sofa til afslappende måltider og hygge med familie og venner. Det moderne køkken er praktisk og funktionelt indrettet med alle hårde hvidevarer.
På 1. sal finder du tre soveværelser, der alle er godt indrettet og har indbyggede skabe.
Rækkehuset har både badeværelse samt et gæstetoilet.
Udendørs har rækkehuset en dejlig terrasse. Det er det perfekte sted at skabe minder med familien eller underholde gæster på varme sommerdage.
Beliggenheden er ideel med nem adgang til offentlig transport, indkøbsmuligheder, skoler og rekreative områder. Herlev byder på et dejligt nærmiljø og et venligt nabolag, der passer perfekt til familielivet.
Dette rækkehus i 2 plan med 3 soveværelser på 1. sal er perfekt for familier, der ønsker et moderne og praktisk hjem.
Derudover:
- Elevator i bygningen
- Depotrum til alle lejligheder
- Det er muligt at leje en p-plads i kælderen eller i terræn
Det med småt:
- Det er ikke tilladt at stå i RKI
- Kæledyr skal godkendes af udlejer
- Bemærk, at billedmaterialet ikke nødvendigvis stammer fra den pågældende bolig.",https://www.boligportal.dk/lejligheder/k%C3%B8benhavn/121m2-4-vaer-id-5359617
"Bjerggade, 4600 Køge  - 1. sal",Køge,Bjerggade,4600,55.458793,12.185094,"11.983,50 kr.",1.500 kr.,126 m²,4,1.,Lejlighed,Nej,Nej,Nej,Nej,Nej,Nej,Nej,Nej,N/A,Dejlig 4 værelses lejlighed midt i centrum udlejes snarest. Mulighed for p-plads.,https://www.boligportal.dk/lejligheder/k%C3%B8ge/126m2-4-vaer-id-5369959
"Hegnet, 8700 Horsens",Horsens,Hegnet,8700,55.897197,9.772019,8.995 kr.,N/A,102 m²,4,-,Rækkehus,Nej,Ja,Ja,Nej,Ja,Nej,Ja,Ja,N/A,"Hyggeligt rækkehus, med dejlig have i Lund 
26 boliger beliggende på Hegnet i Lund tæt ved Horsens. Boligerne er opført i 2012 som dobbelthuse med gulstensfacade, ensidig taghældning med zinkinddækning og træ/aluvinduer. Der er endvidere et udhus til hver bolig. Husene er gennemmurede og fremtræder pæne og velholdte. Beliggende på lukket vænge med flere hyggelige græsarealer ned til et mindre skovareal / grønt område. Boligerne er udført med luft til vand varmepumpe. Der er fra området kort afstand til skole, indkøb, motorvej mv.
Boligen byder velkommen med en entre/bryggers, som også fungere, som fordelingsgang til badeværelset, to værelser, stue samt køkken. Fra køkkenet er der også direkte adgang til stuen, hvorfra boligens sidste værelse kan tilgås. Herudover er der fra stuen direkte udgang til haven. Til boligen hører også et skur/depotrum.
Lund er en hyggelig by med alle faciliteter for den moderne familie. Beliggenheden tæt på Horsens og motorvejen gør, at byen de senere år har oplevet en markant befolkningsfremgang og er et attraktivt sted for familier at bosætte sig. Lund har rigtig mange kvaliteter som by. Der er f.eks. et rigt foreningsliv, og byen ligger i et smørhul tæt på både smuk natur og hovedvejene til Horsens og de andre større byer omkring.",https://www.boligportal.dk/r%C3%A6kkehuse/horsens/102m2-4-vaer-id-5356513
