Adress,City,Street name,Postal code,Latitude,Longitude,Monthly rent,Aconto,Square meters,Rooms,Floor,Property type,Furnished,Shareable,Pets allowed,Elevator,Senior frendly,Only for students,Balcony/Terrace,Parking,Energy label,Description,Link
"Søndre Molevej, 4600 Køge  - 4. sal",Køge,Søndre Molevej,4600,55.451829,12.190326,10.950 kr.,837 kr.,78 m²,2,4.,Lejlighed,Nej,Nej,Nej,Nej,Nej,Nej,Nej,Nej,A,"Ejendommen
I Blåklokken skal du ikke bekymre dig om tidskrævende vedligeholdelse, men kan nyde de velfungerende, moderne rammer i et unikt arkitektonisk udtryk med fokus på fællesskab, et skønt fælles gårdrum og en attraktiv beliggenhed tæt på havet og det smukke naturområde, Almindingen. 
Blåklokkens varierede bygningshøjder optimerer sol- og dagslyset i boligerne, som næsten alle har enten terrasse, altan eller tagterrasse.  
Der er kig gennem huset til gårdrummet både ved trappeopgangene og gennem portene, og karréen har en stor åbning mod Almindingens frodige område. 
 
Glæd dig til at blive en del af det helt særlige maritime bymiljø, som de senere år har udviklet sig langs Køge Kyst - med boligkarréer, gadeforløb og grønne oaser. 
 
Lejligheden
Boligerne i Blåklokken henvender sig til både singler og familier med og uden børn, som drømmer om at slå rødder i skønne omgivelser tæt på København - og til ældre, som ønsker et rart og bekvemmeligt seniorliv.  
Lejlighederne er indrettet i god kvalitet med optimale rumdelinger, gedigne trægulve og lyse, nordiske køkkener fra Svane køkken, hårde hvidevarer fra Siemens, og badeværelser, som opfylder hverdagens funktionelle behov - i moderne og vedligeholdelsesfrie rammer. 
 
Området
Der er ikke mange skridt til hyggeligt byliv og brusende bølger fra de arkitekttegnede lejelejligheder i Blåklokken - midt i den nye, moderne bydel ved Køge Kyst. 
På Søndre Havn er der boliger, arbejdspladser, kulturtilbud og strandengen kommer helt ind mellem de mange arkitektonisk spændende bebyggelser i form af grønne almindinger. 
 
Udover den fantastiske beliggenhed på det nyetablerede boligområde på Søndre havn, ligger lejligheder tæt på det sprudlende byliv i Køge. 
Her finder du også en ny, stor biograf med seks sale. Samtidig har Køge, i forhold til sin størrelse, et blomstrende kulturliv med torvedage, musik fra baggårde sommeren igennem, små restauranter ved havnekajen og nu et rekreativt byrum på Søndre Havn.",https://www.boligportal.dk/lejligheder/k%C3%B8ge/78m2-2-vaer-id-5000635
"Ottosgade, 6000 Kolding  - 2. sal",Kolding,Ottosgade,6000,55.484151,9.470643,8.950 kr.,870 kr.,121 m²,4,2.,Lejlighed,Nej,Ja,Ja,Ja,Ja,Nej,Ja,Ja,B,"Flot 4 vær. Lejlighed  med 2 gode værelser, stue og køkkenalrum fordelt på Lejlighed på 121m2 i hjertet af Kolding C og passer derfor perfekt til dem, der ønsker at nyde godt af byens puls. Perfekt til parret eller et par roomies, der ønsker at bo i flotte omgivelser, i en moderne og prisbelønnede arkitektejendom.

Lejligheden og ejendommen kan tilbyde dig følgende.

• Støjdæmpende vinduer 
• Klimavenlig bygning med godt energimærke
• Niveaufri adgang med elevator og brede, lyse opgange
• Vaskesølje med AEG vaskemaskine og tørretumbler
• Gulvvarme i badeværelse
• Egetræsgulve i resten af boligen
• HTH-køkken i hvide elementer m. støjsvag emhætte + alt i AEG hårde hvidevarer inkl. opvaskemaskine
• Mulighed for at leje 1 parkeringsplads (375 kr./md.)
• Cykelparkering i baggården
• Recirkulationsanlæg sikrer bæredygtighed og godt indeklima
• Depotrum i varm, rummelig og ny kælder

Ejendommen og området:
Ejendommen modtog i 2009 Kolding kommunes arkitekturpris. Kan kendes på flotte hvide facade.  Cykelparkering  i ejendommens baggård, samt parkering af bil. Gode indkøbsmuligheder med Fakta, Føtex og Superbrugsen indenfor 500 meters afstand. Nyd godt af Koldingskulturliv, restaurantener, uddannelse,  m.m. alt sammen indenfor gåafstand.  Ejendommen huser en bred vifte af beboere med seniorer, børnefamilier, studerende og young-professionals. 

Lejligheden:
Kom og bo i en charmerende lejlighed med god planløsning, der gør den praktisk og komfortabel. Stilrent badeværelse med både vaskemaskine og tørretumbler og gulvvarme. Stor brusekabine med ""rainshower"". 
2 store flotte værelser som hver især kan benyttes til enten soveværelse eller et hjemmekontor. Køkkenalrummet er udstyret med store vinduespartier, som giver et dejligt naturligt lys i lejlighedens opholdsrum. Lejligheden er indrettet med et åbent HTH-Køkken i høj kvalitet med alt i hårdhvidevarer.  Det åbne køkken giver en god dynamik i lejligheden som fremstår mere åben og rummelig.  
Fremvises efter aftale. 

Boligen kan fremvises efter aftale.
Tøv ikke med at kontakte os for nærmere information.

Velkommen indenfor!",https://www.boligportal.dk/lejligheder/kolding/121m2-4-vaer-id-4283103
"Tekstilgangen, 5000 Odense, Odense C  - Stuen",Odense,Tekstilgangen,5000,55.403047,10.358153,8.473 kr.,800 kr.,65 m²,2,Stuen,Lejlighed,Nej,Nej,Ja,Ja,Ja,Nej,Ja,Ja,A,"Tekstilparken er for kvalitetsbevidste lejere, som ønsker en bolig med stilren indretning, energivenlige løsninger og private uderum, der er solrige og vedligeholdelsesfrie. Det er også for jer, som vil bo helt tæt på naturen, men som samtidig ønsker kort vej til det pulserende byliv i City.

Lejligheden har en veludnyttet planløsning, og I kan glæde jer over behagelig gulvvarme i samtlige rum. Der er en lys og let indretningsstil med stilrene kvalitetsmaterialer, og de store rum lader sig nemt indrette.

En af de primære prioriteringer har været et stort køkken/alrum, der ligger i ét med stuens areal. Køkkenet har stilrene moduler fra HTH og et komplet udvalg af kvalitetshvidevarer. Der er gulv til loft-vinduer, som lader lyset strømme ind, og I får et fantastisk samlingssted med plads til madlavning og fælles stunder om spisebordet eller i sofagruppen. Som prikken over i’et er der direkte udgang til altanen, der har god plads til sommerens måltider.

Der er grønne gårdrum mellem karréerne og et hyggeligt naboskab på tværs af generationer. For visse lejere er det helt afgørende, at man i Tekstilparken må have husdyr i sin bolig, og med skoven i baghaven er der rig mulighed for skønne gåture med hunden.

Der er parkeringsplads få meter fra hoveddøren, og for jer med elbil er der naturligvis også mulighed for opladning.

Med bare tre kilometer til hjertet af Odense og skovarealer i baghaven kan Tekstilparken tilbyde en naturskøn og idyllisk adresse, som ingen andre i Odense kan hamle op med. For børnefamilien er det en ekstrastor fordel med kort vej til skoler og daginstitutioner, ligesom beboere i alle aldre får glæde af Tekstilparkens eget supermarked; den store, nybyggede Rema100.

Tekstilparken er den perfekte kombination af byliv, natur og det gode naboskab. Få syn for sagen og book en fremvisning med det samme. Vi glæder os til at byde jer velkommen.",https://www.boligportal.dk/lejligheder/odense/65m2-2-vaer-id-5335792
"Fredensgade, 8800 Viborg",Viborg,Fredensgade,8800,56.450358,9.394807,3.200 kr.,750 kr.,30 m²,1,-,Lejlighed,Nej,Nej,Nej,Nej,Nej,Nej,Nej,Ja,N/A,"Velbeliggende lille lejlighed bestående af stue, køkken, gang og badeværelse. Lejligheden er nyrenoveret med nye hvidevarer, samt el gulvvarme i badværelse
Egen terrasse foran indgangen til lejligheden, hvor aftensolen kan nydes.
Mulige for tilslutning af egen vaskemaskine i kælderen i hovedbygningen, hvor der også er tørrerum.
Skur til cykelparkering.",https://www.boligportal.dk/lejligheder/viborg/30m2-1-vaer-id-5208686
"Edvard Thomsens Vej, 2300 København, København S  - 1. sal",København,Edvard Thomsens Vej,2300,55.633202,12.573964,15.450 kr.,1.000 kr.,98 m²,3,1.,Lejlighed,Nej,Ja,Nej,Nej,Nej,Nej,Ja,Nej,N/A,"Køkkenet har et godt lysindfald fra de store vinduespartier. Køkkenet er stort og rummer masser af bordplads. Derudover fremstår det pænt med lyse og moderne materialer. Her medfølger alt i hårde hvidevarer, både køle/fryseskab, indbygget ovn, komfur og emhætte. I stuen er der god plads til både et større spisebord og sofaarrangement, så man kan samle familie og venner. Lejligheden har en skøn altan med plads til et terrassesæt. Lejlighedens badeværelse er ligeledes pænt, lyst og moderne med hvide materialer. Til badeværelset medfølger vaskemaskine og tørretumbler. Derudover har lejligheden to gode værelser.

Til ejendommen er der fælles cykelparkering og gårdanlæg. til lejligheden medfølger også et loft/kælderrum.",https://www.boligportal.dk/lejligheder/k%C3%B8benhavn/98m2-3-vaer-id-5379138
"Østre Alle, 9000 Aalborg, Aalborg  - 1. sal",Aalborg,Østre Alle,9000,57.04392,9.948128,7.450 kr.,750 kr.,92 m²,3,1.,Lejlighed,Nej,Ja,Nej,Nej,Nej,Nej,Nej,Ja,C,"Total istandsat lejlighed i to plan, med nyt køkken nye gulve og nyt bad. I køkken er der opvaskemaskine, indbygnings ovn og koge ø. køleskab skal selv medbringes. der er vaske/tørre maskine i lejligheden. Yderligger høre der egen  parkerings plads med til lejligheden og sydvendt have. Med både græs og gård miljø",https://www.boligportal.dk/lejligheder/aalborg/92m2-3-vaer-id-5253917
"Vendsysselgade, 9000 Aalborg, Aalborg  - 3. sal",Aalborg,Vendsysselgade,9000,57.041398,9.941831,5.995 kr.,700 kr.,72 m²,3,3.,Lejlighed,Nej,Ja,Nej,Nej,Nej,Nej,Ja,Nej,N/A,"Denne smukke lejlighed er en fantastisk mulighed for alle, der søger en moderne og komfortabel lejlighed i hjertet af Øgadekvarteret. Beliggende på 3. sal i en velholdt ejendom, tilbyder denne lejlighed en ideel kombination af bekvemmelighed og hygge.Når du træder ind i lejligheden, bydes du velkommen af en indbydende entré, der fører ind i de forskellige rum. Lejlighedens rummelige stue er et perfekt sted at slappe af og nyde tid med familie og venner. Store vinduer giver masser af naturligt lys.Derudover er der et stilfuldt badeværelse med moderne faciliteter og en rummelig bruseniche.Obs. lejligheden bliver selvfølgelig malet og rengjort inden overtagelse",https://www.boligportal.dk/lejligheder/aalborg/72m2-3-vaer-id-4086973
"Kobbelvænget, 7100 Vejle  - Stuen",Vejle,Kobbelvænget,7100,55.725548,9.55193,10.200 kr.,0 kr.,114 m²,4,Stuen,Lejlighed,Nej,Ja,Ja,Ja,Ja,Nej,Ja,Ja,A,"Ny og dejlig lejlighed på hele 114 m2, 4 rum og med stor sydvendt terrasse og flot udsigt udlejes i det nordøstlige Vejle tæt på skole, børnehave, indkøb, legeplads, fitness og natur. Du har kun 3 km til Vejle centrum og 5 minutters kørsel til motorvej E45.

Boligen er lys, moderne og indrettet i tidsløse, slidstærke og rengøringsvenlige materialer. Herunder alt i hårde hvidevarer, ventilationsanlæg og gulvvarme.

Køkken og stue i ét er familiens naturlige samlingspunkt med plads til madlavning, ophold og leg.
På badeværelset er der grå klinker på gulvet, mens der i de øvrige rum er lyse laminatgulve med egetræslook. Der er gulvvarme i alle rum. Der er faste hvide HTH-elementer i køkken, bad, bryggers og på værelserne, så boligen er lige til at flytte ind i. 
Der er ventilationsanlæg i alle lejligheder, hvilket sikrer et godt indeklima.

Alle boliger har eget skur.

Der er fællesparkering i området.

Udendørs fitness-redskaber, legeplads og petanque-bane er få meter fra området.

Kontakt os for bestilling af en fremvisning!

Bemærk:
- Evt. kæledyr skal godkendes af udlejer
- Indskud: 3 mdr. depositum (forfalder 3 dage efter underskrift)
- Forbrug afregnes direkte med forsyningerne
- Det er ikke tilladt at stå i RKI
- Udlejes umøbleret
- Der tages forbehold for billed- og videomateriale, som ikke nødvendigvis stammer fra præcist det ledige lejemål ift. størrelse og planløsning",https://www.boligportal.dk/lejligheder/vejle/114m2-4-vaer-id-5331913
"Gl. Skivevej, 8800 Viborg  - 1. sal",Viborg,Gl. Skivevej,8800,56.459454,9.407834,4.090 kr.,900 kr.,55 m²,2,1.,Lejlighed,Nej,Nej,Ja,Nej,Nej,Nej,Nej,Ja,C,"- Hyggelig 2 vær., lejeligheden er på 55m2. 
- Beliggende få minutter til centrum, Animations skolen og VIA i Viborg. 
- Ejendommen har 4 lejligheder i alt, hvortil der er en dejlig stor lukket fælles have. 
- En rigtig charmerende lejlighed der skal ses. 
- Der er nyt køkken fra 2022
- Mulighed for en lille hund",https://www.boligportal.dk/lejligheder/viborg/55m2-2-vaer-id-5203939
"Søtorvet, 8600 Silkeborg  - 1. sal",Silkeborg,Søtorvet,8600,56.172834,9.554814,8.200 kr.,860 kr.,78 m²,2,1.,Lejlighed,Nej,Nej,Ja,Nej,Nej,Nej,Ja,Nej,N/A,"Dér hvor naturen møder byen, i Silkeborgs livlige midte, placeres otte skulpturelle bytårne med lejeboliger. På dette centrale punkt, hvor byen snævrer ind, og omkranses af åens levende vand og søens blanke overflade, skabes et nyt, urbant og mangfoldigt bykvarter, der forener byen, forstærker naturens skønhed og samler mennesker.
De 286 nybyggede, svanemærkede lejligheder forbinder byen med vandet, og gør fortællingen om Silkeborg som Danmarks Outdoor Hovedstad komplet. Her skabes drømmen om et aktivt, bynært liv, hvor vandet er det allestedsnærværende element, og hvor udsigten og lyset tager livskvaliteten til et helt nyt niveau.
OBS; billeder, visualiseringer og plantegninger er vejledende.",https://www.boligportal.dk/lejligheder/silkeborg/78m2-2-vaer-id-5378958
"Søndergade, 8900 Randers, Randers C  - 4. sal",Randers,Søndergade,8900,56.45717,10.038858,5.450 kr.,700 kr.,98 m²,3,4.,Lejlighed,Nej,Nej,Nej,Nej,Nej,Nej,Nej,Nej,D,"Lejligheden er en dejlig stor 3 værelses på 98 m2 i centrum af Randers og har en god udsigt udover Gudenåen. 

Den har en lang fordelingsgang, som fører ud til en stor stue, spisestue, et soveværelse, et badeværelse og et fint køkken.

Der følger alt i hårde hvidevarer med til lejligheden, det betyder at man får både vaskemaskine og tørretumbler med. 

Lejligheden overtages nymalet i alle rum og med ny slebet gulve.

Den ligger super centralt i centrum af Randers C, hvor man har alt inden for gå afstand, hvor byen, indkøbsmuligheder og busterminalen er lige ved siden af.

Kontakt os endelig hvis det har din interesse.",https://www.boligportal.dk/lejligheder/randers/98m2-3-vaer-id-5358336
"Vosnæsparken, 8541 Aarhus, Skødstrup",Aarhus,Vosnæsparken,8541,56.282574,10.324582,8.600 kr.,500 kr.,90 m²,4,-,Rækkehus,Nej,Nej,Ja,Nej,Nej,Nej,Nej,Ja,N/A,"FLYT IND MED RABAT: Underskriv lejekontrakt inden 1. september 2023 og få en månedes gratis husleje (gælder ikke a conto-udgifter).

Dette rækkehus er i 2 etager, men rigtigt godt indrettet. På 1 sal finder man 3 gode værelser med indbygningsskabe, og et mindre toilet uden bad. i stueetagen er der entre med trappe til 1 sal. badeværelse med plads til vaskemaskine og tørretumbler. Dejlig lys stue i åbent forbindelse med køkkenet. Fra stuen er der direkte udgang til egen terrasse og have.

I denne bolig får du:


2 toilletter
Egen have
Godeparkeringsmuligheder
Stort aflåst skur
Køkken i åbent forbindelse med stuen.
Mulighed for at søge om et mindre husdyr.

Der kan ansøges om husdyrhold til en mindre hund eller kat.

Bofællesskaber og delebolig er ikke tilladt.

Det er ej heller muligt at leje en bolig, såfremt du er registreret i RKI.

Området:

Vosnæsparken er beliggende i Løgten, som er en del af Skødstrup. Området ligger dels tæt på skøn natur med åbner marker og skøn skov, der indbyder til et skønt friluftsliv med lange gå og løbeture.

På de varme sommerdage kan strandkurven pakkes, og der er i løbet af få minutter mulighed for at komme til stranden.

Indkøb kan klares i enten gå eller cykelafstand med alt i dagligvarebutikker. Her er ligeledes lokalt bageri, butikker og offentlig transport lige nær.

I Skødstrup er der skole, institutioner og idrætsfaciliteter og med letbanen meget nær er det muligt at være i Aarhus C i løbet af blot 25 min.

Vosnæsparken består af rækkehuse i 4-5værelses rækkehuse i to plan med gode planløsninger og henvender sig derfor til både store, som små. Der er terrasse og lille have til boligerne, og et skur til opbevaring.

Der er parkeringsplads med til lejemålet samt gode gæsteparkeringsmuligheder.

Der kan ansøges om husdyrhold til en mindre hund eller kat.

Bofællesskaber og delebolig er ikke tilladt.

Det er ej heller muligt at leje en bolig, såfremt du er registreret i RKI.

ÅBENT HUS:
 - Lørdag den 19. august 2023, kl. 15:00-15:30
 - Lørdag den 26. august 2023, kl. 15:00-15:30

OBS: Venligst hold dig opdateret, da der godt kan forekomme ændringer.",https://www.boligportal.dk/r%C3%A6kkehuse/aarhus/90m2-4-vaer-id-5294472
"Borgergade, 6064 Jordrup  - 1. sal",Jordrup,Borgergade,6064,55.559016,9.31143,3.400 kr.,1.100 kr.,57 m²,2,1.,Lejlighed,Nej,Nej,Nej,Nej,Nej,Nej,Nej,Nej,F,"Bestående af badeværelse med brus, køkken i åben forbindelse med stue og soveværelse.",https://www.boligportal.dk/lejligheder/jordrup/57m2-2-vaer-id-5370542
"Kornmarken, 9760 Vrå, Harken  - 1. sal",Vrå,Kornmarken,9760,57.391111,9.984903,4.250 kr.,0 kr.,88 m²,3,1.,Lejlighed,Nej,Nej,Nej,Nej,Nej,Nej,Nej,Nej,C,"Flot 3 værelses lejlighed udlejes - 5 min kørsel fra Hjørring. I lejligheden forefindes vindfang, entre til køkken og stue, nyere køkken samt plads til mindre spisebord, badeværelse med bruseniche, soveværelse, 1 separat værelse, stue med luft til luft varmepumpe installeret, separat vaskerum (gratis vask), mulighed for parkering i gårdmiljø (max 1 bil pr. husstand). Leje er inklusiv vandafgift. Ring eller skriv for at bestille en fremvisning.",https://www.boligportal.dk/lejligheder/vr%C3%A5/88m2-3-vaer-id-5084460
"Axel Heides Gade, 2300 København, København S  - Stuen",København,Axel Heides Gade,2300,55.660415,12.571021,16.200 kr.,1.320 kr.,108 m²,3,Stuen,Lejlighed,Nej,Ja,Nej,Ja,Ja,Nej,Ja,Ja,C,"Velkommen til boligen!
Denne skønne bolig på 108 m2 er opført i 2004 og er efterfølgende nyistandsat. Boligen indeholder en god entre med fin plads til overtøjet, samt adgang til det store badeværelse med separat bruseniche og medfølgende vaskemaskine og tørretumbler. Køkken alrummet er godt opdelt imellem en køkken ogstue afdeling, med plads til spisebord og god opbevaringsplads i de mange køkkenskabe, samt plads til en sofaafdeling i den anden ende af det store rum, som også giver adgang til lejlighedens skønne terrasse. Til køkkenet medfølger de hårde hvidevarer, som består af komfur, ovn, emhætte, køle/fryseskab og opvaskemaskine. Der tilbydes også god opbevaringsmulighed i lejlighedens depotrum. boligen er opført i 2004 i kulbrændt rød teglsten, der skaber et spændende farvespil i facadens fremtoning. Det giver sammen med husets altaner og gavle i galvaniseret stål et imponerende helhedsindtryk. Ejendommen er på 6 etager med 10 opgange. De 170 boliger er på mellem 73 - 196 kvm. fordelt på 2 - 5 værelser. boligen har en eksklusiv placering tæt på den nye badeanstalt og Islands Brygges havnepark og masser af rekreative områder. Perfekt beliggenhed i forhold til City, Amager Fælled, Ørestad, Københavns Universitet og Metroen.
Husdyr er ikke tilladt.",https://www.boligportal.dk/lejligheder/k%C3%B8benhavn/108m2-3-vaer-id-5320960
"Nørregade, 7400 Herning  - 1. sal",Herning,Nørregade,7400,56.141025,8.980477,6.500 kr.,600 kr.,100 m²,3,1.,Lejlighed,Nej,Ja,Nej,Nej,Nej,Nej,Ja,Nej,N/A,"Central beliggende lejlighed i Herning udlejes 

Lejligheden ligger på første sal og indeholder entre, køkken, badeværelse, soveværelse medaltan samt 2 stuer opdelt med franske døre.

Der er god mulighed for at parkere foran ejendomme. 

Tlf tid 8-16

Kontakt os hvis du ønsker en fremvisning",https://www.boligportal.dk/lejligheder/herning/100m2-3-vaer-id-5252880
"Toldbodgade, 6300 Gråsten  - 3. sal",Gråsten,Toldbodgade,6300,54.919778,9.597586,6.900 kr.,800 kr.,63 m²,3,3.,Lejlighed,Nej,Nej,Ja,Ja,Ja,Nej,Nej,Ja,N/A,"Kontakt os på 42703298 for en fremvisning.

ENGLISH BELOW 

Hyggelig 2-værelses lejlighed på det gamle gigthospital i Gråsten. Det er i sandhed en smuk og majestætisk bygning, der ligger på Toldbodgade i Gråsten med smuk udsigt ud over havnen. 

Boligen kommer med fuld-kvalitets hvidevarepakke: vaskemaskine, tørretumbler, og naturligvis kogeplade, ovn, emhætte og opvaskemaskine i høj kvalitet. 

Lejligheden er kendetegnet med højt til loft og flot lysindfald i stort køkken alrum med god udsigt. Fra det store køkken alrum med optimale indretningsmuligheder er der adgang til badeværelse og værelse. Der er fuld hårde-hvidvare pakke, med opvasker, ovn, kogeplade og emhætte samt vaskermaskine og tørretumbler i badeværelse. Alle overflader er holdt i lyse farver. Der er slidstærkt laminat trægulv i køkkenalrum og værelse. Flotte 30 x 60 cm fliser på gulv i badeværelse og væg ved bruser.

Lejligheden er beliggende i Gråsten tæt på hverdagens fornødenheder, lige ned til havnen og i gåafstand til skønne grønne områder. 

OBS: Se gerne vedhæftet video. 

Kontakt os gerne for en fremvisning. 
__________________________________________________________________________________________________________________________________________

Lovely 2-room apartment at the old arthritis hospital in Gråsten. It is truly a beautiful and majestic building, located on Toldbodgade in Gråsten with a beautiful view over the harbour.

The home comes with a full-quality white goods package: washing machine, tumble dryer, and of course a high-quality hob, oven, hood and dishwasher.

The apartment is characterized by high ceilings and nice light in the large kitchen-dining room with a good view. From the large kitchen family room with optimal furnishing options, there is access to the bathroom, and bedroom. There is a full white goods package, with dishwasher, oven, hob and hood as well as a washing machine and tumble dryer in the bathroom. All surfaces are kept in light colors. There is a durable laminate wooden floor in the kitchen and living room. Beautiful 30 x 60 cm tiles on the floor in the bathroom and wall by the shower.

The apartment is located in Gråsten close to everyday necessities, right down to the harbor and within walking distance to beautiful green areas.

NOTE: Please see attached video. 

Feel free to contact us for a viewing.",https://www.boligportal.dk/lejligheder/gr%C3%A5sten/63m2-3-vaer-id-5374883
"Søtorvet, 8600 Silkeborg  - 3. sal",Silkeborg,Søtorvet,8600,56.172834,9.554814,13.600 kr.,1.220 kr.,112 m²,3,3.,Lejlighed,Nej,Ja,Ja,Ja,Ja,Nej,Ja,Ja,N/A,"Bo til leje på Søtorvet og bliv en del af den nye bypark, hvor hele Silkeborg mødes. Her bor du i forreste række, højt hævet over byen.

Den attraktive beliggenhed midt mellem natur og byliv skaber endeløse muligheder for en livsnydende tilværelse i centrum af Silkeborg.
Fra solen stiger op over søen, og farver Søtorvets tårne orange, til en aftentur i skumringen på den grønne promenade. Her handler livet udelukkende om nydelse. Nyd altanens udsigt til Silkeborgs pragtfulde natur.

Indvendigt fortsætter fortællingen om lys, luft og natur. De store vinduespartier lader lyset strømme ind på de moderne detaljer, det eksklusive, hvide køkken med hårde hvidevarer fra Electrolux, for ikke at glemme de smukke egetræsgulve, der bringer naturen helt ind i stuen.
Søtorvet er realiseringen af det komfortable liv med alt inden for rækkevidde.

NB. Billederne er fra en prøvebolig.",https://www.boligportal.dk/lejligheder/silkeborg/112m2-3-vaer-id-5379105
"Eigtveds Alle, 2630 København, Taastrup  - 2. sal",København,Eigtveds Alle,2630,55.642877,12.264571,12.000 kr.,1.100 kr.,80 m²,3,2.,Lejlighed,Nej,Ja,Nej,Ja,Nej,Nej,Ja,Ja,N/A,"På Eigtveds Allé i Høje Taastrup udlejer vi 64 nybyggede 2-, 3- og 4-værelses lejligheder i størrelsesordenen 71-103 m2.

INDE:
Der er tale om velindrettede lejligheder, der alle går på tværs af bygningskroppen, og på den måde er lejemålene kendetegnet ved et godt lysindfald fra flere sider. 

Boligen her består af et lækkert køkken/alrum, et dejligt badeværelse, to værelser med skabsplads og et depot.

UDE:
Til lejligheden hører en privat altan. 

HÅRDE HVIDEVARER:
Der er køleskab, fryser, opvaskemaskine, vaskemaskine og tørretumbler i alle boliger.

HUSDYR:
Katte: Lejere kan ansøge om tilladelse til at holde én indekat på adressen. Udekatte er ikke tilladt.
Hund: Det er ikke tilladt at holde hund.
Andre dyr: Kontakt os for vores samlede husdyrsregler.

PARKERING:
Der er fri parkering ved ejendommen.

FÆLLESAREALER:
De 64 lejligheder er fordelt på fire hovedbygninger, der omkranser et fælles gårdanlæg, hvor der er rig mulighed for leg og samvær med familie, venner og naboer. Her er blandt andet en legeplads til de mindste og en basketbane. 

ELEVATOR:
Der er elevator i opgangen.

OM OMRÅDET
Ejendommen ligger godt placeret i Taastrup, der med sine 34.000 indbyggere og er del af Høje-Taastrup Kommune.

Kommunen er en af de grønneste i Hovedstadsområdet, idet ca. 2/3 af kommunens areal udgøres af skov, eng, mark og søer. Samtidig er der nem adgang til og fra Høje-Taastrup via motorveje, regionale tog, Intercity og S-tog.

Fra ejendommen er der 900 m til stationen, 650 m til indkøb, 1 km til skole og 20 km til Københavns centrum, og med en bopæl her er du således godt placeret i forhold til hverdagens fornødenheder.",https://www.boligportal.dk/lejligheder/k%C3%B8benhavn/80m2-3-vaer-id-4789920
