Adress,City,Street name,Postal code,Latitude,Longitude,Monthly rent,Aconto,Square meters,Rooms,Floor,Property type,Furnished,Shareable,Pets allowed,Elevator,Senior frendly,Only for students,Balcony/Terrace,Parking,Energy label,Description,Link
"Bredahlsgade, 5800 Nyborg  - 1. sal",Nyborg,Bredahlsgade,5800,55.315778,10.7962,4.469 kr.,900 kr.,48 m²,2,1.,Lejlighed,Nej,Nej,Nej,Nej,Nej,Nej,Nej,Nej,D,"I pæn og velholdt ejendom beliggende i godt kvarter udlejes nu skøn 2 vær. lejlighed på 48 m² på 1. sal.

Lejligheden har lækkert køkken med bl.a. Siemens indbygningsovn, indbygningskogeplade og opvaskemaskine.

Ligeledes godt badeværelse med brus.

Dejlig lys stue samt godt soveværelse.

Der er flotte lakerede gulve, dørtelefon, fælles vaskeri i kælderen samt fælles have bag ejendommen.

Leje pr. mdr. kr. 4.469,00 + varme kr. 500,00 + vand kr. 400,00.

Depositum kr. 13.407,00.",https://www.boligportal.dk/lejligheder/nyborg/48m2-2-vaer-id-4067587
"Dalgas Avenue, 8000 Aarhus, Aarhus C  - 5. sal",Aarhus,Dalgas Avenue,8000,56.143045,10.199704,9.995 kr.,700 kr.,58 m²,3,5.,Lejlighed,Nej,Ja,Ja,Ja,Ja,Nej,Ja,Ja,A,"Disse 3-værelses lejligheder har beliggenhed i den nyopførte (2022) ejendom, Colosseum. 
Colosseum har Frederiksbjergs bedste placering, syv fælles tagterrasser med en fantastisk udsigt til både vand, by og natur, et unikt gårdmiljø med grønne områder, hængekøjer og orangeri.

Lejlighederne består af et stort køkken alrum med plads til både spisebord/stole og en stue. Derudover er der to lige store soveværelser med hver sin altan, som gør lejligheden utrolig delevenlig. Sidst men ikke mindst er der et badeværelse med alt man behøver. Der er opvaskemaskine, køle-/fryseskab, kombi tørre-/vaskemaskine i lejligheden. 

I kælderetagen er der gratis cykelparkering med rigelig plads.
Det er muligt at tilkøbe en parkeringsplads til bil/el-bil/MC for 1250kr/måned i parkeringskælderen. Med parkeringspladsen tilhører et depotrum.

Kontakt os for at høre mere om vores lejligheder på Colosseum og for at aftale en eventuel fremvisning!

Med venlig hilsen
Jessica

These 3 bedroom apartments are located in the newly built (2022) property, Colosseum.
The Colosseum has Frederiksbjerg's best location, seven shareable roof terraces with a fantastic view of the ocean, the city and nature, a unique environment with green areas, hammocks and an orangery.

The apartments consist of a large kitchen/living room with space for both a dining table/chairs and a living room. In addition, there are two equal-sized bedrooms, each with its own balcony, which makes the apartment incredibly easy to share with a roomie. Last but not least, there is a bathroom with everything you need. There is a dishwasher, fridge/freezer, combi dryer/washing machine in the apartment.

In the basement there is free bicycle parking with plenty of space.
It is possible to purchase an additional parking space for a car/electric car/MC for DKK 1,250/month in the parking garage. With the parking lot belongs a storage room.

Contact us to find out more about our apartments at the Colosseum and to arrange a possible showing!

With best regards
Jessica",https://www.boligportal.dk/lejligheder/aarhus/58m2-3-vaer-id-5379291
"Haslevgade, 2630 København, Taastrup  - 2. sal",København,Haslevgade,2630,55.650745,12.269563,14.100 kr.,1.500 kr.,119 m²,4,2.,Lejlighed,Nej,Ja,Nej,Ja,Nej,Nej,Ja,Ja,N/A,"Ejendommen på Haslevgade i Høje Taastrup er et større ejendomsprojekt fra 2017 bestående af tre bygninger, der er opført i gule teglsten med skifertag. I ejendommen findes både 3- og 4-værelses lejligheder.

INDE:
Boligerne består af køkken/alrum, stort badeværelse og 2-3 soveværelser. Til hvert lejemål hører et depotrum, der befinder sig i ejendommens kælder. Lejlighederne egner sig både til par, familier og studerende, der ønsker at bo flere sammen.

UDE:
Alle lejemål har en skøn altan.

HÅRDE HVIDEVARER:
Boligerne har køleskab, fryser, vaskemaskine og tørretumbler.

HUSDYR:
Katte: Lejere kan ansøge om tilladelse til at holde én indekat på adressen. Udekatte er ikke tilladt.
Hund: Det er ikke tilladt at holde hund.
Andre dyr: Kontakt os.

PARKERING:
Der er fællesparkering i området.

FÆLLESAREALER:
De tre bygninger danner tilsammen et hyggeligt og læfyldt gårdområde, hvor der er legeplads og fælles ophold. 

ELEVATOR:
Der er elevator i opgangen.",https://www.boligportal.dk/lejligheder/k%C3%B8benhavn/119m2-4-vaer-id-3965176
"Sandgravvej, 8000 Aarhus, Aarhus C  - 1. sal",Aarhus,Sandgravvej,8000,56.165846,10.217216,10.299 kr.,0 kr.,71 m²,3,1.,Lejlighed,Nej,Nej,Nej,Ja,Ja,Nej,Ja,Nej,N/A,"Lækker lejlighed ,opført i 2016, 3 værelses lejlighed i lyse materialer med hvidpigmenterede egetræsgulve.
Gulvvarme i badeværelse, med plads til egen vaskesøjle. Siemens køle/fryseskab, kogeplader, ovn og emhætte i køkken, med plads til egen opvaskemaskine.
Sydvendt altan 4,4m2, Nordvendt altan 5m2.
Udsigt til bugt fra stue.
Ejendommen har elevator. Depotrum i kælder
Al forbrugsafregning sker direkte til forsyningsselskab.",https://www.boligportal.dk/lejligheder/aarhus/71m2-3-vaer-id-2618772
"Østre Alle, 9000 Aalborg, Aalborg  - 1. sal",Aalborg,Østre Alle,9000,57.042281,9.945975,6.500 kr.,300 kr.,61 m²,2,1.,Lejlighed,Nej,Nej,Nej,Nej,Nej,Nej,Nej,Ja,D,Ny istandsat lejlighed.,https://www.boligportal.dk/lejligheder/aalborg/61m2-2-vaer-id-5367642
"Birkelyst, 7430 Ikast",Ikast,Birkelyst,7430,56.123434,9.125346,8.100 kr.,0 kr.,80 m²,3,-,Rækkehus,Nej,Ja,Ja,Nej,Nej,Nej,Ja,Ja,N/A,"Få én måneds gratis husleje ved indflytning i de rækkehuse med overtagelse ""Snarest"".

På Birkelyst i Ikast udlejer vi 46 skønne rækkehuse. Arealer og antal værelser varierer, men alle boliger er bygget i ét plan med 3-4 værelser i lyse nuancer.

NB: Billederne og adresse er ikke fra det eksakte lejemål, men fra et der ligner. 

INDE:
Rækkehuset er lyst og indbydende med gulve i lys eg, entré med skabe, et skønt køkken med Svane-inventar i åben forbindelse med stue, stort badeværelse og to værelser.

UDE:
Til boligen hører en privat terrasse med læhegn, hvor man som lejer kan nyde vejret ugeneret. Foran hver bygning har alle lejere eget redskabsskur på 4m2.


HÅRDE HVIDEVARER:
Boligen har køle/fryseskab, vaskemaskine, tørretumbler, opvaskemaskine, emhætte og kogeplade.

HUSDYR:
Katte: Lejere kan ansøge om tilladelse til at holde én indekat på adressen. Udekatte er ikke tilladt.
Hund: Lejere kan ansøge om tilladelse til at holde én mindre hund. Store hunde er ikke tilladt.
Andre dyr: Kontakt os for vores samlede husdyrsregler.

PARKERING:
Alle boliger har egen parkeringsplads

FÆLLESAREALER:
Boligparken er lukket om sig selv i en halvcirkel med plads til socialt samvær på de dejlige, grønne arealer.

OM OMRÅDET:
Kun 5 minutter fra boligerne finder du tilkørslen til Herningmotorvejen, hvorfra Herning kan nås på 15 minutter, Brande på 20 minutter, Silkeborg på 30 minutter og Aarhus på 55 minutter. Boligerne er dermed yderst attraktive for dem, der ønsker at bo centralt i Jylland i pendlerafstand til et væld af jyske arbejdspladser - og så endda til en lavere husleje end de store byer kan tilbyde. Foretrækker man offentlig transport er der fra boligerne kun 4 kilometer til Ikast Station, der forbinder Ikast med Skjern mod vest og Aarhus mod øst.",https://www.boligportal.dk/r%C3%A6kkehuse/ikast/80m2-3-vaer-id-5254626
"Naverhaven, 4200 Slagelse  - 2. sal",Slagelse,Naverhaven,4200,55.400007,11.356838,9.780 kr.,750 kr.,91 m²,3,2.,Lejlighed,Nej,Nej,Nej,Nej,Nej,Nej,Ja,Nej,N/A,"Lejligheden er ny istandsat med ny brucenishe og varme i badeværelses gulvet, nyt køkken og hurtigt fibernet. Lejligheden er velindrettet med minimalt gangareal. Lejligheden har altan mod sydvest.
I gården er der et mindre fælles haveareal.
Parkeringsret kan lejes for kr. 250,- pr. måned.
Naverhaven er tæt på Slagelse anlæg, sygehuset, bymidten og jernbanestationen. København og Odense kan nås indenfor en time. Skriftlig ansøgning foretrækkes.",https://www.boligportal.dk/lejligheder/slagelse/91m2-3-vaer-id-5365442
"Bredgade, 7400 Herning  - 3. sal",Herning,Bredgade,7400,56.136418,8.970711,5.800 kr.,650 kr.,64 m²,2,3.,Lejlighed,Nej,Nej,Ja,Ja,Ja,Nej,Nej,Nej,A,"I Bredgade genopstår den tidligere bankejendom, som nye seniorboliger i en gennemrenoveret og smukt ombygget ejendom midt i gågaden i Herning. 
Huset understøtter både et godt privatliv og fællesskab. 

Lejlighederne ligger fordelt på tre etager og giver mulighed for, at man kan trække sig tilbage i sin egen bolig eller være sammen med andre i husets mange fællesrum. 
På hver etage med lejligheder er der et skønt fællesrum med køkken, hvor man kan mødes med de andre beboere, eller man har mulighed for at booke rummet, hvis man får venner eller familie på besøg. 

Hver lejlighed indeholder eget køkken med alt i hårde hvidevarer, badeværelse med gulvvarme, separat bruseniche samt mulighed for installering af egen vaskemaskine og tørretumbler. Lejlighederne har også egen soveafdeling. 
Lejlighederne 1-2-værelses lejligheder på mellem 58-90 kvm. 
Der er elevator, så det er nemt at komme rundt i ejendommen. 

Fællesskaber opstår ofte om det, man laver sammen. Husets hjerte er det store fælleslokale, som ligger i stueetagen med store vinduespartier. Her er der både plads til at se landskamp, drikke formiddagskaffe eller holde store fællesspisninger, men man kan også bruge lokalet til at fejre den større familiefødselsdag. 
I fælleslokalet er der også et klaver samt en bogreol, med bøger som deles mellem beboerne i bofællesskabet. 
Til fælleslokalet er et mindre tekøkken samt badeværelse. 

På den store solrige fælles tagterrasse kan man lave mad på fællesgrillen, dyrke grøntsager og blomster udenfor i højbedene eller i væksthuset.

I kælderen findes der depotrum til alle lejligheder, der er fælles vaskeri, som er til fri afbenyttelse for beboerne uden ekstra omkostninger, derudover er cykelparkering og et fælles værksted. 
I værkstedet er der rig mulighed for at udfolde det frivillige fællesskab og sine kreative og håndværksmæssige egenskaber.   

Beboerne er selv med til at skabe og indgår selv i de aktiviteter og fællesskaber, som ønskes i seniorboligfællesskabet, men de grundlæggende rammer for fællesskabet, fælleslokalerne, tagterrassen og værkstedet er etableret på forhånd. 

I seniorboligfællesskabet møder man sine naboer i dagligdagen, og boligen kan også være base for et aktivt byliv i resten af Herning.   

PKA seniorboligfællesskab er et fællesskab for friske seniorer over 60 år uden hjemmeboende børn, som ønsker: 
-	At være mere sammen med sine naboer 
-	At være med til at skabe et lokalt fællesskab, der giver tryghed og livskvalitet i hverdagen 
-	At bo sammen med andre, men i egen bolig, så man også har mulighed for at trække sig og lukke sin egen dør. 
-	At bo på lidt færre kvm. og dermed deles om flere fællesrum med sine naboer 
-	At være med i et seniorboligfællesskab, der bygger på gensidig respekt for forskelligheder",https://www.boligportal.dk/lejligheder/herning/64m2-2-vaer-id-5363768
"Gl. Færgevej, 6700 Esbjerg, Esbjerg  - 1. sal",Esbjerg,Gl. Færgevej,6700,55.472655,8.435099,5.750 kr.,750 kr.,60 m²,2,1.,Lejlighed,Nej,Nej,Nej,Nej,Nej,Nej,Ja,Ja,N/A,"Nyistandsat lejlighed på 60 kvm med stor spisestue / stue og stort soveværelse med udgang til egen altan.
Derudover indeholder lejligheden entré, køkken med opvaskemaskine og nyere toilet med bad.
Lejligheden ligger i hjertet af Esbjerg med ca. 1 km. afstand til Gågaden, caféer, diverse dagligvarebutikker og Rybners Gymnasium. 
Fri afbenyttelse af tilhørende lukket, gårdhave med gynger, græsarealer og hyggelige kroge.
Der er mulighed for cykelparkering i aflåst cykelkælder. I kælderen forefindes vaske- og tørremuligheder.

OBS: Ingen husdyr eller rygning tilladt!",https://www.boligportal.dk/lejligheder/esbjerg/60m2-2-vaer-id-5356634
"Hadsundvej, 9575 Terndrup  - Stuen",Terndrup,Hadsundvej,9575,56.81445,10.057812,5.950 kr.,1.500 kr.,77 m²,3,Stuen,Lejlighed,Nej,Nej,Nej,Nej,Nej,Nej,Ja,Ja,N/A,Lejlighed midt i Terndrup  gå afstand til bus butikker mm tæt på. Skole børnehave og svømmehal,https://www.boligportal.dk/lejligheder/terndrup/77m2-3-vaer-id-5352007
"Seebladsgade, 5000 Odense, Odense C  - 2. sal",Odense,Seebladsgade,5000,55.403809,10.381437,6.945 kr.,600 kr.,60 m²,2,2.,Lejlighed,Nej,Nej,Nej,Ja,Nej,Nej,Ja,Nej,N/A,"Lejemålet er beliggende på Seebladsgade og består af 2 værelser samt køkken og bad. Lejemålet er 60 m2 og er klar til overtagelse snarest. Månedlig husleje er 6945 kr. og forudbetalt husleje og depositum beløber sig til i alt 20835 kr. 

Send en besked, hvis lejemålet har fanget din interesse.",https://www.boligportal.dk/lejligheder/odense/60m2-2-vaer-id-5337840
"Vestre Stationsvej, 5000 Odense, Odense C  - Stuen",Odense,Vestre Stationsvej,5000,55.397254,10.375087,8.150 kr.,800 kr.,97 m²,3,Stuen,Lejlighed,Nej,Ja,Nej,Nej,Nej,Nej,Nej,Nej,N/A,"Lejlighed med nyere køkken. 
Aconto dækker varme. 
Vand og fri vask i fælles vaskemaskine i naboejendom er inkl. i lejen. 
2 stuer og 1 soveværelse. Lejligheden har været lejet ud til delelejlighed før, da man godt kan have værelse i den en stue. 
Der må ikke ryges eller holdes dyr i lejemålet. 
Fælles gård.",https://www.boligportal.dk/lejligheder/odense/97m2-3-vaer-id-1045323
"Sølyst Strandpark, 2990 Nivå  - Stuen",Nivå,Sølyst Strandpark,2990,55.937977,12.519929,17.600 kr.,800 kr.,109 m²,4,Stuen,Lejlighed,Nej,Nej,Nej,Ja,Nej,Nej,Ja,Ja,A,"Velkommen til hyggelige Sølyst Strandpark – en familie venlig ejendom helt tæt på Øresund!
Nu udbydes denne skønne stue lejlighed i 1 plan. Her træder du indenfor i en entre med garderobe og derfra videre ud i detrummelige køkken/alrum i forbindelse med stor lys stue. I forlængelse af køkkenet ligger et bryggers med vaskemaskine og tørretumbler. Fra stuen er der adgang til de tre gode soveværelser og et flot badeværelse med bruseniche. Til boligen hører et depotrum med adgang fra stuen.
Sølyst Strandparks liebhaver-lejeboliger er alle opført med fokus på lys, rummelighed og god stil, såvel som kvalitetsmaterialer og gode planløsninger. Gulvene er lagt med smukt egetræsparket og der er gulvvarme i alle rum samt ventilationssystem i alle huse. Ydermere er der gode parkeringsmuligheder samt seks lade-standere til el-biler. Du får også adgang til et ca. 3 m2 isoleringen depotrum med plads til opbevaring.
Sølyst Strandpark-kvarteret grænser op til ca. 80.000 m² fredet og uberørt naturområde. Et frirum, hvor grønne arealer, vildtvoksende markplanter og udsigt til havet, sætter de helt rigtige rammer for stemning og naturidyl. På den anden side af Strandvejen ud mod Øresund, ligger Nivå havn og strand, som støder op til Strandengen-området, der strækker sig sydover langs kysten, og indbyder til gåture, familieliv eller tosomhed med vinden i håret og duften af natur og hav. Til ejerforeningen hører et skønt strandlod, man kan spadsere til – præcis som man kan til byens dejlige sandstrand. Sølyst Strandpark ligger smukt placeret i kystbanebyen Nivå, hvor der ikke er bopælspligt. Området ligger 15 km syd for Helsingør og hører til Region Hovedstaden. Her er der ubesværet adgang til smuk natur, såvel som by, fællesskab, gode skoler, børnepasning, idrætsfaciliteter, kulturoplevelser, og utallige shoppe- og indkøbsmuligheder.
Ved indflytning senest d. 15. juni 2023 betales der ikke husleje den første måned, der betales kun forbrug. Dette tilbud gælder kun ved underskrift af lejekontrakt inden 5. juni 2023.
*Husdyr med ansøgning
*Bemærk at billederne ikke nødvendigvis er taget af/fra den pågældende bolig, og at udsigt m.v. derfor kan variere.",https://www.boligportal.dk/lejligheder/niv%C3%A5/109m2-4-vaer-id-5359301
"Gartnerbyen, 5200 Odense, Odense V  - 2. sal",Odense,Gartnerbyen,5200,55.395001,10.356362,7.200 kr.,641 kr.,57 m²,2,2.,Lejlighed,Nej,Nej,Nej,Ja,Nej,Nej,Ja,Nej,A,"Drømmer du om en nybygget lejelejlighed i Odense med fantastisk en beliggenhed? I Gartnerbyen ligger Bykvarteret med 85 moderne lejligheder. Her er der plads til både singler, unge, seniorer, par og børnefamilien, der gerne vil bo i pulserende omgivelser, men stadig have naturen lige udenfor døren.

Bo til leje i Odense i skandinavisk design med egen altan

Denne flotte 2 værelses lejlighed har flotte larkerede parketgulv i eg og de store vinduespartier skaber dejligt lysindfald. Alle lejlighederne er udstyret med køkken fra Svane med alle hårde hvidevarer. På badeværelset har du også både vaskemaskine og gulvvarme.

Du vil som beboer i Gartnerbyen blive en del af en bydel i Odense, der er i rivende udvikling. Her er alt, hvad du skal bruge inden for en radius af fem minutter. Du kan handle ind på butikstorvet, shoppe i de små butikker eller tage en frisk gå- eller løbetur i den smukke Tusindårsskoven.
Skal du ud af byen, har du nem adgang til både letbanen og motorvejen. Som lejer har du også mulighed for at leje en parkeringsplads i området.


Velkommen til Gartnerbyen, 5000 Odense



Beløbet for a conto forbrug er fastsat ud fra forrige lejers forbrug.

Der tages forbehold for fejl og evt. lejereguleringer.

Der vil blive indhentet oplysninger hos RKI, og er du registreret hos RKI, vil vi ikke kunne udleje boligen til dig. 

Vi gør opmærksom på at billederne er fra en lignende prøvebolig.",https://www.boligportal.dk/lejligheder/odense/57m2-2-vaer-id-5369098
"Skejbyvej, 8240 Aarhus, Risskov",Aarhus,Skejbyvej,8240,56.199242,10.197207,8.665 kr.,N/A,77 m²,2,-,Lejlighed,Nej,Nej,Ja,Nej,Nej,Nej,Nej,Nej,N/A,"Kordegarden ligger i den nordlige del af Aarhus ca. 5 km nord for Aarhus centrum i 8240 Risskov, med gode busforbindelser og indkøbsmuligheder. Kordegarden består af 181 lejemål beliggende i klynger af bygninger omkring 5 torpe. En ""torp"" er en gammel nordisk betegnelse for en klynge gårde. Herudover forefindes et fælleshus med vaskeri.

Bebyggelsen er opført i gule teglsten og tagsten og med hvidmalede vinduespartier i træ. Der er anlagt P-pladser i forbindelse med boligerne. Disse er placeret således, at torverummene og de smalle gader til dagligt er bilfri. Såvel børn som voksne kan derfor færdes sikkert rundt i bebyggelsen.I forbindelse med hver torp er der anlagt legepladser og opholdsarealer. Alle boliger har let adgang til de grønne fællesarealer.

Læs mere om ejendommen herunder",https://www.boligportal.dk/lejligheder/aarhus/77m2-2-vaer-id-5378387
"Borgergade, 9000 Aalborg, Aalborg  - 3. sal",Aalborg,Borgergade,9000,57.051096,9.917257,5.500 kr.,500 kr.,64 m²,3,3.,Lejlighed,Nej,Nej,Nej,Nej,Nej,Nej,Nej,Nej,E,"Nyligt renoveret 3-vær. lejlighed i Aalborg C, tæt ved butikker, Gågade, busser, Cafeer m.m.

Adgang til fælles gård, vaskeri, cykelparkering, dørtelefon m.m.

Forbrug: ac. varme kr. 500,-/md + el.",https://www.boligportal.dk/lejligheder/aalborg/64m2-3-vaer-id-5370493
"Hollændervej, 6000 Kolding  - 2. sal",Kolding,Hollændervej,6000,55.484941,9.475955,6.000 kr.,1.100 kr.,92 m²,3,2.,Lejlighed,Nej,Ja,Nej,Nej,Nej,Nej,Nej,Nej,N/A,"Centralt i Kolding udlejes hyggelig og dejlig lys 2. sals lejlighed i mindre, ældre velfungerende ejendom. Køkkenet er af nyere dato. Køkkenet indeholder nyt komfur, emhætte, køleskab med mindre fryser og ny opvaskemaskine. Der er delt bad og toilet. Badeafdelingen er få år gammelt. 
Der er lyse afhøvlede trægulve i alle rum samt entre. I soveværelset er stort skab. Egen vaskemaskine + tumbler kan opsættes i kælder. Der er fælles hyggelig have samt aflåst cykelskur. Gratis parkering mulig foran ejendommen. Kontaktes bedst på tlf./sms.",https://www.boligportal.dk/lejligheder/kolding/92m2-3-vaer-id-3901575
"Viften, 2670 Greve  - 1. sal",Greve,Viften,2670,55.5848,12.320129,11.000 kr.,1.000 kr.,78 m²,3,1.,Lejlighed,Nej,Nej,Ja,Nej,Ja,Nej,Ja,Ja,N/A,"UNDERSKRIV LEJEKONTRAKT PÅ EN BOLIG PÅ MINIMUM 84 KVM I JULI/AUGUST OG BETAL 0 KR FOR FØRSTE MÅNEDS LEJE!

Solviftens lejligheder er moderne indrettede og veludnyttede. Du får en nyopført, energioptimeret bolig, som er lige til at flytte ind i. Store vinduespartier sikrer masser af lys i boligen. Gulvene er i eg-laminat og derudover er der klinker i entre og badeværelse.",https://www.boligportal.dk/lejligheder/greve/78m2-3-vaer-id-5367321
"overvejen, 9220 Aalborg, Aalborg Øst  - 1. sal",Aalborg,overvejen,9220,57.047427,10.016005,6.000 kr.,0 kr.,100 m²,3,1.,Lejlighed,Nej,Ja,Nej,Nej,Nej,Nej,Ja,Nej,N/A,"Lækkert nyt hus 2017 i landlig idyl, indenfor Aalborgs bygrænse.
Denne bolig ligger på 1. stal og indeholder:
2 værelser, køkken/stue i et og badeværelse

Der er  bus til døren.

Bestemt en bolig der er værd at se.",https://www.boligportal.dk/lejligheder/aalborg/100m2-3-vaer-id-5365451
"Kongensgade, 5000 Odense, Odense C  - 2. sal",Odense,Kongensgade,5000,55.398499,10.379359,"7.992,68 kr.",690 kr.,74 m²,3,2.,Lejlighed,Nej,Nej,Nej,Ja,Nej,Nej,Nej,Nej,B,"Denne lejlighed har en helt central beliggenhed på Kongensgade. Derved ligger lejligheden i gåafstand til byen, indkøbsmuligheder, offentlig transport og diverse fritidsaktiviteter. 


I lejligheden finder man alt i hårde hvidevarer, herunder opvaskemaskine, vaskemaskine, tørretumbler, køle/fryseskab, kogeplade/indbygget ovn. Der er tilhørende depotrum i kælderen samt mulighed for at blive skrevet på venteliste for leje af p-plads i kælderen.

Der er elevator i ejendommen. 
Det er ikke tilladt at holde husdyr. 


Vi gør opmærksomme på, at den første måneds husleje er GRATIS. Det vil sige at indflytningsprisen er kr. 32.660,72‬
og at man kun skal betale for el, vand og varme, den første måned, man bor i dette lejemål.",https://www.boligportal.dk/lejligheder/odense/74m2-3-vaer-id-5369087
"Jægersborg Alle, 2920 København, Charlottenlund  - 2. sal",København,Jægersborg Alle,2920,55.754809,12.567417,17.900 kr.,2.000 kr.,129 m²,3,2.,Lejlighed,Nej,Nej,Nej,Nej,Nej,Nej,Ja,Ja,D,"Beliggende i en flot ældre herskabelig ejendom, udlejes denne lyse 3 værelses lejlighed med skøn altan. Lejligheden er flot indrettet med parketgulve, stuk samt indbyggede skabe og helt nyt Svane køkken. Værelserne er fordelt på en flot og rummelig stue/spisestue samt 2 gode soveværelser, nyere badeværelse med vaskemaskine og tørretumbler samt nyt køkken. Lejligheden er godt beliggende på hjørnet af Jægersborg Allé og Ole Bruuns Vej. Fra altanen er der god udsigt over Alléen samt de stille villaveje. Ligeledes centralt beliggende med tæt afstand til Menu og handelsstrøget med mange indkøbsmuligheder, Charlottenlund s-tog station samt Bernstorffsparken.",https://www.boligportal.dk/lejligheder/k%C3%B8benhavn/129m2-3-vaer-id-5359110
"Søhusvænget, 5270 Odense, Odense N  - 1. sal",Odense,Søhusvænget,5270,55.431771,10.362674,3.700 kr.,0 kr.,26 m²,1,1.,Værelse,Nej,Nej,Nej,Nej,Nej,Nej,Nej,Ja,C,"Værelset beliggende på først etage, der er køkken og badeværelse, som benyttes af  i alt 2 lejere, mulighed for adgang til Vaskerum med vaskmaskine og tørretumbler. Dejlig have må benyttes, Bus ""ved døren"" 6 km fra Centrum. WIFI",https://www.boligportal.dk/v%C3%A6relser/odense/26m2-1-vaer-id-5367190
"Jellingvej, 7100 Vejle",Vejle,Jellingvej,7100,55.716423,9.530357,4.145 kr.,968 kr.,46 m²,2,-,Lejlighed,Nej,Nej,Nej,Nej,Nej,Ja,Nej,Nej,N/A,"Ungdomsboliger, 7100 Vejle
Bygningerne består af i alt 215 ungdomsboliger fordelt på både 1 og 2 værelses ungdomsboliger.
Boligerne er dels beliggende i Vejle Midtby, hvor der er kort afstand til indkøbsmuligheder, Vejle strøg, banegården, busterminalen samt cafeer mv. og dels meget tæt ved Vejle Teknisk Skole, Vejle Campus, samt Rosborg og Rødkilde Gymnasium.
I mange af områderne er der gode parkeringsmuligheder .
De allerfleste bebyggelser har eget vaskeri, hvortil der benyttes vaskebrik .Forbruget opkræves sammen med huslejen.
Ungdomsboliger er forbeholdt unge under uddannelse, men i perioder, hvor antallet af ungdomsboliger er større end antallet af studerende,
er der mulighed for at leje en ungdomsbolig, hvis du er under 30 år også selv om du ikke er studerende. 
Billeder er fra sammenligneligt lejemål.
Indmeld dig gratis via vores hjemmeside.
Når du er opnoteret og har fået boligen i tilbud , kan der aftales fremvisning af lejemålet.",https://www.boligportal.dk/lejligheder/vejle/46m2-2-vaer-id-1339696
