Adress,Monthly rent,Aconto,Square meters,Rooms,Floor,Property type,Furnished,Shareable,Pets allowed,Elevator,Senior frendly,Only for students,Balcony/Terrace,Parking,Energy label,Description,Link
"Basunen, 5500 Middelfart, Strib",9.713 kr.,N/A,105 m²,4,-,Rækkehus,Nej,Nej,Ja,Nej,Ja,Nej,Ja,Ja,A,"Lyst og moderne rækkehus indrettet med entre med videre adgang til to store værelser samt husets køkkenalrum og stue i ét. Køkken er åbent og lyst med køkkenø samt god plads til spisebord. Her er ligeledes mulighed for at indrette hyggeligt sofahjørne. Fra alrummet finder man ligeledes særskilt bryggers med vask og plads til vaskemaskine/tørretumbler samt videre adgang til badeværelse. I forbindelse med stuen finder man stort soveværelse med skabsvæg. Fra det store vinduesparti i stuen er udgang til stor terrasse samt have.

Bebyggelsen opføres på et nyt vænge, der er døbt henholdsvis Harpen, Oboen samt Basunen. Bebyggelsen vil bestå af 98 energivenlige moderne rækkehuse i størrelsen 85 m², 95 m², 105 m² og 115 m² – alle i et plan og tegnet i en moderne og enkel streg.

Til hvert hus hører carport, stort redskabsrum, dejlig have, stor flisebelagt terrasse på begge sider af huset samt flisebelagt gangsti til boligens entre, hvor der udføres niveaufri adgang. Endvidere udføres der på begge sider af huset, læhegn mellem boligenhederne. Haven omkranses og lukkes af hæk.

Husene får murede facader af moderne mursten med variation i brune og sandfarvede nuancer samt sort sadeltag med 25 graders hældning. Stern af træ i farven antracit og mindre hvidmalet udhæng af træ.

Der monteres med moderne træ/alu vinduer og døre (3-lags vinduer) i mørk farve udvendig og hvid indvendig i. Sålbænke under vinduespartierne er udført i mørk skifer.

Husenes materialevalg er gennemtænkt og harmonisk, så husene vil fremstå smukke, tidløse og velholdte i mange år fremover.

Åbne og lyse rækkehuse

Alle rækkehuse indrettes lyse og venlige, med hvide glatte lofter og vægge. Dejlige vinduer for ekstra godt lysindfald overalt. Gulve af egeplank (laminat) i køkken/alrum, stue og værelser. Entré, bryggers, badeværelse og brus udføres med lækre klinkegulve i neutral mørkegrå. Alle døre i glat hvid finish med rustfri stålgreb og uden dørtrin for optimal og let færden. Vindueskarme mures og vandskures i hvid. Vægge mod gulv afsluttes med hvide glatte fodpaneler.

Fine detaljer overalt

Køkken, bad, bryggers og soveværelse monteres med moderne HTH-moduler/skabe i glat hvid afslutning og med rustfri greb. Bordplader i praktisk laminat i farven ’rustik skifer’ med rummelige stålvaske. Stænkplade bag kogepladen for nem rengøring. Vask i badeværelse af formstøbt materiale. Væghængt toilet fra Ifö Sign, kvalitetsarmaturer fra tyske Hans Grohe og linjeafløb i bruseniche.

Kvalitetshvidevarer

Alle hvidevarer medfølger og er i anerkendt kvalitet. Ovn med pyrolyse, der er indbygget i højskab i det omfang det er angivet på plantegninger. Kogesektion med induktion samt støjsvag emhætte og opvaskemaskine.

Der er forberedt for vaskemaskine og tørretumbler i bryggers – dette skal lejer selv medbringe. Dog medfølger disse på Basunen.

Fast og god belysning

Der er etableret lyskilde i bad og bryggers og i køkken er der spot i overskabene. Endvidere monteres lyskilde i redskabsrummet og ved ventilation på loft.

Forberedt for el-bil

Der er forberedt tomrør til ladestation for el-køretøj.

Sundt indeklima og behagelig gulvvarme

Der er gulvvarme i hele rækkehuset. Dette styres via separate termostater i alle rum. Boligen er udført med ventilationsanlæg, der sikrer et sundt og godt indeklima.

Individuelle forbrugsmålere

Forbrug til el, varme vand og spildevand afregnes direkte mellem lejer og forsyningsselskaberne. Opvarmning via fjernvarme.

Udvendig monteres der stikkontakt og vandhane samt væglampe ved entredør og terrassedør

Illustrationer er modelfotos. Der tages forbehold for rettelser.",https://www.boligportal.dk/r%C3%A6kkehuse/middelfart/105m2-4-vaer-id-5347618
"Vesterballe, 5600 Faaborg",7.600 kr.,0 kr.,180 m²,7,-,Hus,Nej,Nej,Ja,Nej,Nej,Nej,Ja,Ja,E,"Nyligt renoveret.
Lukket gårdhave. Nem have, primært udlagt med græs.
Gå-afstand til skole, idrætshal, indkøb m.v.
(ca. 10 min. kørsel til Faaborg by)",https://www.boligportal.dk/huse/faaborg/180m2-7-vaer-id-5081638
"Villaparken, 7800 Skive  - 1. sal",5.504 kr.,1.154 kr.,84 m²,3,1.,Lejlighed,Nej,Nej,Ja,Nej,Nej,Nej,Nej,Nej,N/A,"Lejemålet er beliggende på Villaparken og består af 3 værelser samt køkken og bad. Lejemålet er 84 m2 og er klar til overtagelse snarest. Månedlig husleje er 5504 kr. og indskud beløber sig til 11200 kr. 

Send en besked, hvis lejemålet har fanget din interesse.
For at kunne leje denne bolig, kræver det man er medlem af boligforeningen. På BoligPortal annonceres kun reelt ledige boliger uden eksisterende venteliste på annonceringstidspunktet. Venligst kontakt udlejer hvis du er interesseret i lejemålet.",https://www.boligportal.dk/lejligheder/skive/84m2-3-vaer-id-5359973
"Danmarksgade, 9000 Aalborg, Aalborg  - 4. sal",6.300 kr.,650 kr.,64 m²,3,4.,Lejlighed,Nej,Nej,Nej,Nej,Nej,Nej,Ja,Nej,N/A,"Sjældenhed med loft til kip - Lejlighed med atmosfære. 

Lejligheden er moderniseret og fremstår med dejligt lysindfald, HTH køkken med ny opvaskemaskine, samt rummeligt badeværelse med gulvarme. Lejligheden har altan med god udsigt over Aalborg. 

Man ankommer i lejlighedens entre med garderobeplads, hvorfra der er adgang til stue, bad og værelse. Fra lejlighedens stue er der adgang til køkken-alrum og udgang til lejlighedens altan. I stuen er der adgang til lejlighedens hems.

Lejligheden er indrettet med plankegulve, og gipslofter til kip, samt fritlagte spær. 

I forbindelse med lejligheden er der et opbevaringsrum i kælderen, samt et vaskerum med vaskemaskine og tørretumbler i kælderen.

Ejendommen har en hyggelig gård med bænkesæt samt et cykelskur.

Lejligheden ligger blot 100 m fra gågade-systemet i Algade/Nørregade, og der er kort til indkøbsmuligheder. 

Rygning og husdyr er ikke tilladt i ejendommen.",https://www.boligportal.dk/lejligheder/aalborg/64m2-3-vaer-id-5256405
"Østerbro, 7800 Skive  - Stuen",3.800 kr.,600 kr.,60 m²,2,Stuen,Lejlighed,Nej,Nej,Nej,Nej,Nej,Nej,Nej,Nej,N/A,"helt nyrenoveret 2 værelses lejlighed, nye gulve, bad med fliser, køkken med opvaskemaskine. nye døre, samt hems i soveværelse.
ejendommen ligger lige ud til åen, hvor der også er have til.",https://www.boligportal.dk/lejligheder/skive/60m2-2-vaer-id-5265307
"Staldgårdsgade, 8900 Randers, Randers C  - 1. sal",4.950 kr.,1.130 kr.,76 m²,3,1.,Lejlighed,Nej,Nej,Ja,Nej,Nej,Nej,Nej,Nej,D,"Vil du have en lys og venlig bolig, kort afstand til midtbyen, kort afstand til offentlig transport, god planløsning – så skal du kigge her.

Boligen fremstår lys og indbydende med ovenlys og kvist. Boligens 76 m2 er godt fordelt på 2 plan.  Du træder ind i entre med adgang til badeværelse samt lejlighedens skønne opholdsrum. Her har du køkken alrum/stue ud i et, det giver mulighed for hyggeligt samvær mens madens laves. Der er fint trappeløb til anden sal, hvor du finder to gode værelser – et masterbedroom og et mindre værelse, lille niche hvor du finder vaskesøjle. Begge værelser har indbyggede skabe.

Staldgårdsgade ligger perfekt i hjertet af Randers tæt på gågademiljø, butikker og cafeer og masser af parkering. Desuden er området vel betjent af diverse buslinjer.

<em>Boligen fremvises i tidsrummet 8-16.</em>.",https://www.boligportal.dk/lejligheder/randers/76m2-3-vaer-id-5363534
"Søren Frichs Vej, 8230 Aarhus, Åbyhøj  - 5. sal",5.950 kr.,350 kr.,34 m²,1,5.,Lejlighed,Nej,Nej,Nej,Ja,Nej,Nej,Ja,Ja,N/A,"På Søren Frichs Vej i Aarhus udlejer vi 156 skønne 1- og 2-værelses lejligheder i varierende størrelser mellem 34 og 54 m2. 

INDE:
Lejligheden er funktionel med et regulært rum med køkken- og spiseplads. Her er også plads til at indrette soveområde. 

UDE:
Alle boligerne har - uanset størrelse - en privat altan.


HÅRDE HVIDEVARER:
Der er køleskab, komfur, ovn og opvaskemaskine samt kombineret vaskemaskine og tørretumbler i alle lejemål.

HUSDYR:
Katte: Lejere kan ansøge om tilladelse til at holde én indekat på adressen. Udekatte er ikke tilladt.
Hund: Det er ikke tilladt at holde hund.
Andre dyr: Kontakt os for vores samlede husdyrsregler.

PARKERING:
P-pladser ved ejendommen kan tilkøbes for DKK 500 pr. måned.

FÆLLESAREALER:
På toppen af ejendommen findes en lækker, unik tagterrasse med fælleshus og lukket boldbane.

ELEVATOR:
Der er elevator i opgangen.

Området 
Ejendommen er en del af Åbyen - et helt nyt boligområde, der i disse år skyder op i Aarhus. Som navnet indikerer, ligger området i umiddelbar nærhed af Aarhus Å langs dens indløb fra Brabrandsøen mod Midtbyen. Området er placeret tæt på Åbyhøj, og fra Åbyen er der således ikke langt til rekreative områder som eksempelvis Åbyhøj Park, boldbanerne ved Åby Skole osv. 

Bor du i Åbyen, kan du på kort tid komme rundt i hele det centrale Aarhus. På gåben eller cykel kan du hurtigt tilbagelægge de knap 3 km til Midtbyen, ligesom der kun er et par kilometer til Aarhus BSS og lidt under 4 km til Universitetets hovedbygninger. Tilsvarende er der nem adgang til offentlig transport med et væld af buslinjer, der afgår i umiddelbar nærhed fra ejendommen. Er du i bil, er Åbyen ligeledes praktisk placeret med kort afstand til motorvejen.",https://www.boligportal.dk/lejligheder/aarhus/34m2-1-vaer-id-4665851
"Nr. Boulevard, 8900 Randers, Randers C  - 1. sal",4.111 kr.,575 kr.,57 m²,2,1.,Lejlighed,Nej,Nej,Nej,Nej,Nej,Nej,Nej,Nej,N/A,"Lejemålet er beliggende på Nr. Boulevard og består af 2 værelser samt køkken og bad. Lejemålet er 57 m2 og er klar til overtagelse snarest. Månedlig husleje er 4111 kr. og forudbetalt husleje og depositum beløber sig til i alt 16443 kr. 

Send en besked, hvis lejemålet har fanget din interesse.


Trappevask (inkluderet i huslejen): 100.00kr
Indvendig vedligeholdelse (inkluderet i huslejen): 223.25kr",https://www.boligportal.dk/lejligheder/randers/57m2-2-vaer-id-5351304
"Broloftet, 8240 Aarhus, Risskov  - 1. sal",10.095 kr.,400 kr.,81 m²,3,1.,Lejlighed,Nej,Ja,Ja,Ja,Ja,Nej,Ja,Ja,A,"Billederne er fra en lejlighed af samme type. 

KONTAKT OS FOR EN FREMVISNING!

Velkommen til Broloftet.

Her lejer du en delevenlig lejlighed som er oplagt til de 2 studerende eller den lille familie. Lejligheden har egen altan.

Broloftet er beliggende i det nye område, Risskov Brynet, der er tæt på alle Aarhus' mange muligheder og tilbud. I Risskov Brynet er man blot en 10 minutters cykeltur fra Aarhus C og universitetet. Lige uden for døren er der ligeledes et utal af muligheder med offentlig transport, der kører mange gange hver time. Ydermere byder vi husdyr velkommen med et smil.

Risskov Brynet har meget at byde på, og det inkluderer blandt andet et fitnesscenter, en café og to dagligvarebutikker i form af Meny og Netto - alt dette blot 50 meter fra ejendommen. Er man til en løbeturen i skoven eller et dyp i havet, har man god mulighed for dette, da begge dele ligger blot et stenkast fra Risskov Brynet.

Alle lejligheder er helt nye og de har derfor alt, hvad man har brug for. Der er altså både opvaskemaskine, vaskesøjle, gulvvarme og altan eller terrasse, så man slet ikke skal gå på kompromis. Værelserne er rummelige og har desuden indbyggede skabe. Lejlighederne har ligeledes depotrum i kælderen, hvor der også er aflåst cykelparkering og mulighed for leje af p-plads for blot 450 kr. pr. måned.

Som lejer i Risskov Brynet er indflytningsprisen billig, idet man kun skal betale tre måneders husleje i depositum og dermed ikke skal betale én krone i forudbetalt husleje.

OBS: Billederne er fra en anden lejlighed. 

Lyder det som noget for dig? Giv os besked her i indbakken hvis du ønsker et nærmere kig på boligerne.

//

Broloftet is located in a new area, Risskov Brynet, which is close to Aarhus. In Risskov Brynet you are just a 10-minute bike ride from Aarhus C and the university. There are good transport options in the area. 

Pets are also allowed here      
 
Risskov Brynet has a lot to offer – it has a fitness center, a café and two grocery stores: Meny and Netto - all this within 50 meters from the property. If you are looking for a run in the forest or a dip in the sea, you have a good opportunity for this. 
All apartments are new and have everything you need. There is a dishwasher, washing column, floor heating and balcony or terrace. In the rooms there are wardrobes. The apartments also have storage rooms in the basement, where there is locked bicycle parking and the possibility of renting a parking space for just DKK 475 per month.

As a tenant in Risskov Brynet, the move-in price is cheap, as you only have to pay three months' rent as a deposit.

NOTE: The pictures are from another apartment. 
Contact us today for a viewing! We look forward to hearing from you.",https://www.boligportal.dk/lejligheder/aarhus/81m2-3-vaer-id-5292158
"Birke Allé, 7100 Vejle, Ødsted",9.995 kr.,0 kr.,101 m²,4,-,Rækkehus,Nej,Ja,Nej,Nej,Nej,Nej,Ja,Ja,N/A,"BOOK EN PERSONLIG FREMVISNING ELLER MELD DIG TIL ÅBENT HUS HVER TIRSDAG FRA 16.30 -17.00 (husk tilmelding) 
Første Åbent Hus er tirsdag d. 16. maj - Vi glæder os meget til at fremvise hvad dette spændende kvarter kan. 

HELT NYE BOLIGER - KUN 15 MIN VÆK I BIL FRA VEJLE CENTRUM 

Projektet på Birke Allé består af 14 rækkehuse som er klar til indflytning pr. 1.maj/ og løbet af sommeren. 

Disse moderne lavenergi boliger har en central placering i naturskønne omgivelser.

Birke Allé skal danne ramme om liv og glæde hvor der er plads til hverdagen og alle de gode stunder med familie og venner. 

I boligerne er der fokus på funktionalitet og enkelthed således, at der bliver mere luft i hverdagen. Rækkehusene rummer hele 101m2, som er fordelt på enten tre eller fire værelser.  

Indretningen af boligerne er flot og gennemtænkt. Fra den flisebelagte parkeringsplads bevæger du dig ind i den klinkebelagte entre. Herfra er der adgang til bryggers med håndvask. 

På modsatte side finder du et lyst soveværelse med en fast monteret skabsvæg. Badeværelset er i tidløst design med flotte mørkegrå fliser, hvide vægge samt elementer.

Centralt i boligerne finder du det sore lyse alrum. Her er et lyst vinkelkøkken i stilrent design samt hvidevarer af god kvalitet. Dette giver rig mulighed for at indrette et hyggeligt spiseområde samt sofa/stue areal.

På begge sider af alrummet e der store vinduespartier med udgang til flisebelagt terrasser. Ikke nok med, at dette giver mulighed for at vælge terrasse alt efter sol og vind, giver de stor vinduer ligeledes et dejligt naturligt lysindfald i de store rum.

Fra alrummet har du ligeledes adgang til de lyse værelser, der kan indrettes som børneværelse, gæsteværelse kontor eller hobbyrum. Dertil får du et skur på cirka 4m2.

Området åbner for naturoplevelser og gåture ud gennem et rekreativt grønt område syd for boligerne. Selve boligområdet bliver udlagt i græs, træer og hæk.

Boligerne opfylder de nyeste bygningsreglementer og er opvarmet med varmepumpe hvilket gør boligerne til lavenergi boliger. For dig betyder det, at udgifterne til varme vil være lavere end ved boliger uden denne klassificering. 

Boligerne er klimavenlige i drift og har et kontrolleret indeklima, hvor ventilations-systemet selv klarer luftudskiftningen.

Ødsted er en lille by med knap 1.500 indbyggere. Byen er beliggende cirka 11 kilometer fra Vejle Kommune samt Region Syddanmark. Byen tilhører Ødsted Sogn hvor du finder både skole, idrætshal, brugsforening, bager samt pizzeria i byen.  Alt sammen under en kilometer fra Birke Allé. 

I Ødsted får du ro, smukke naturområder og livet fra lokalområdet på samme tid. Derudover er der kort afstand til større byer som Vejle og Kolding.

Afregning sker direkte via værkerne.

Mulighed for lille hund - skal godkendes af udlejer.",https://www.boligportal.dk/r%C3%A6kkehuse/vejle/101m2-4-vaer-id-5349139
"Banegårdspladsen, 8000 Aarhus, Aarhus C  - 2. sal",13.900 kr.,1.200 kr.,109 m²,3,2.,Lejlighed,Nej,Ja,Nej,Ja,Nej,Nej,Ja,Nej,N/A,"Kom med indenfor i entréen med indbyggede skabsløsninger, hvor overtøj og sko kan parkeres, inden de resterende kvadratmeter bliver taget i nærmere øjesyn. Trægulvene breder sig ud lige fremme og munder direkte ud i det skønne køkkenalrum, der har en praktisk opdeling med køkkenhalvø, alt i hårde hvidevarer og gennemgående kvalitetsmaterialer.
Og kvalitet er netop et nøgleord, der bliver ved med at gå igen i hele lejligheden. Hver enkelt modernisering er der tydeligvis tænkt grundigt over, og køkkenet er ikke det eneste sted, hvor det gør sig gældende. Også badeværelset er opført, så det afspejler en moderne bolig anno 2020 helt ud i hjørnerne med store, flotte fliser, separat brus og en praktisk vaskesøjle.
Boligen gemmer på endnu et hjerte; et dejligt stuemiljø, der ligger med store vinduespartier ud mod Aarhus pulserende byliv, glæder sig til at være base for sofahygge, mens den personlige smag i kunst kan strømme ud, så snart de hvide vægge er flot dekoreret.
Vi mangler stadig to rum: to værelser, der ligger væk fra hinanden med vinduespartier mod hh. øst og vest sætter prikker over alle i’er, og det er sikkert og vist, at de virkelig bringer mange anvendelsesmuligheder med sig.
Kort sagt: her er en lejlighed, der bare venter på at blive indtaget!",https://www.boligportal.dk/lejligheder/aarhus/109m2-3-vaer-id-5340298
"Frederiksgade, 8700 Horsens  - 2. sal",5.000 kr.,500 kr.,55 m²,2,2.,Lejlighed,Nej,Nej,Nej,Nej,Nej,Nej,Ja,Nej,N/A,"Velindrettet indflytningsklar 2 værelses lejlighed på 2 sal med altan vendt mod haven. Stor stue, men lille soverum, derudover hems.
Kælder med rum til disposition samt vaskerum.
Ejendommen ligger i gåafstand til Forum Horsens i et attraktivt boligkvarter.",https://www.boligportal.dk/lejligheder/horsens/55m2-2-vaer-id-4685555
"Onsholtvej, 8260 Aarhus, Viby J  - 1. sal",6.820 kr.,N/A,59 m²,2,1.,Lejlighed,Nej,Nej,Ja,Nej,Nej,Nej,Nej,Nej,B,"Ejendommen
Lejligheder befinder sig et byggeri fra 2008. Det er et dejligt og roligt område, hvor der er plads til folk i alle aldre. 
Her er dine husdyr også velkommen. 
 
Lejligheden
Lejligheden er godt fordelt og synes rummelig og indbydende. Du træder ind i entréen, hvor du efterfølgende vil komme ind i et stort og åben køkkenalrum i forbindelse med stuen. 
Til lejemålet tilhører en altan, der kan tilgås direkte fra alrummet. Lejligheden rummer ligeledes et stort badeværelse, samt et stort værelser med indbyggede skabe. Der er installeret køle-/fryseskab, komfur og emhætte. 
Der er ligeledes gjort klar til du kan indsætte en opvaskemaskine. 
 
Området
Du vil bosætte dig tæt på grønne arealer, tæt på offentligt transport og kun få minutters kørsel til motorvejen. Lejligheden ligger ligeledes tæt på institutioner, erhvervsakademiet og indkøb. 
Til boliger hører gratis parkering med. 
 
Andre vilkår
OBS! Billeder fra et sammenligneligt lejemål. 
Der kan lejes et stort depotrum i kælderen, for kun 100 kr. i måneden. 
Forbrug betales direkte til forsyningsselskaberne.",https://www.boligportal.dk/lejligheder/aarhus/59m2-2-vaer-id-5251984
"limfjordsvej, 9400 Aalborg, Nørresundby  - Stuen",5.400 kr.,500 kr.,75 m²,2,Stuen,Lejlighed,Nej,Nej,Ja,Nej,Ja,Nej,Nej,Nej,B,"to værelses lys lejlighed som
består af stor stue , køkken ,badeværelse og soveværelse entre
i alle rummene er der trægulve endvidere er der et stort  kælderrum
baghave med lille græsplæne.og sandkasse",https://www.boligportal.dk/lejligheder/aalborg/75m2-2-vaer-id-5009883
"Søndre Kongevej, 9400 Aalborg, Nørresundby  - 1. sal",5.980 kr.,510 kr.,96 m²,3,1.,Lejlighed,Nej,Ja,Ja,Nej,Nej,Nej,Nej,Ja,D,"Dejlig, lys, stor og hyggelig 3 vær. lejlighed i Nørresundby.

Lejligheden er beliggende på Søndre Kongevej i et rigtig dejligt og roligt område, med adgang til lukket gårdhave, vaskekælder, Cykelrum m.m.
Kort afstand til offentlig transport, motorvej og indkøbsmuligheder.

Perfekt til børnefamilie, eller dele-lejlighed

Husdyr efter aftale 

Gode parkeringsmuligheder.",https://www.boligportal.dk/lejligheder/aalborg/96m2-3-vaer-id-4725062
"Tommerupgade, 2630 København, Taastrup  - 3. sal",10.770 kr.,910 kr.,83 m²,3,3.,Lejlighed,Nej,Ja,Ja,Ja,Ja,Nej,Ja,Ja,N/A,"Ny projektejendom under opførelse med overtagelse d. 18/7-23 af 22 boliglejemål. Du har muligheden for at bo i et nyt boligkvarter i Høje-Taastrup C med grønne arealer, stisystemer og med plads til leg og ophold for både store og små.

Der er mulighed for leje af p-plads til alle lejemål mod kr. 400,00 pr. mdr. - dette er ikke indeholdt i den angivet leje. Der medfølger ikke vaskemaskine og tørretumbler til lejemålene. Der er enten kælderrum eller depotrum tilhørende lejligheden.

Området:
Du vil blive bosat centralt placeret i et livligt ny boligområde med forskellige boformer af lejeboliger og ejerboliger. I kort afstand til både cafeer, spisesteder, biografen, shopping, dagligvarebutikker, skole og daginstitutioner, Høje Taastrup st., samt Taastrup Hovedgade. Et af de helt store attraktioner er verdens længste skatepark. 

Lejlighederne:
Lejlighederne varierer fra 3-4-værelses alle med privat altan eller terrasse. Når du træder ind i lejlighederne, bydes du velkommen af de matte parketgulve og store vinduespartier, som skaber et fantastisk lys og sammenhæng mellem ude og inde. Køkken og badeværelseselementerne er fra HTH. Dine naboer har købt deres ejerlejlighed, hvorfor du får et tilhørsforhold til dine fremtidige naboer. Det er vigtigt at vide, at ejendommen med de 156 lejligheder ikke er en boligudlejningsejendom. 

Gårdmiljø
I midten omkranset af bygningerne ligger det fælles gårdmiljø, hvor der er plads til leg og afslapning. De fleste stuelejligheder har egen privat terrasse ud til gården, med plantekasser som er med til at danne rammen om en hyggelig gård og et privat udeområde. I midten af gården er der lavet en lille blomstrende bakke, som både giver karakter til gården og indeholder en cykelparkering gemt under bakken.

Bemærk: Billederne er fra en prøvebolig",https://www.boligportal.dk/lejligheder/k%C3%B8benhavn/83m2-3-vaer-id-5373130
"Jeppe Aakjærsvej, 7800 Skive, Skive By  - 4. sal",4.623 kr.,1.076 kr.,66 m²,3,4.,Lejlighed,Nej,Nej,Nej,Nej,Nej,Nej,Nej,Nej,N/A,"Lejemålet er beliggende på Jeppe Aakjærsvej og består af 3 værelser samt køkken og bad. Lejemålet er 66 m2 og er klar til overtagelse 15-01-2022. Månedlig husleje er 4532 kr. og forudbetalt husleje og indskud beløber sig til i alt 8500 kr. 

Send en besked, hvis lejemålet har fanget din interesse.",https://www.boligportal.dk/lejligheder/skive/66m2-3-vaer-id-4945689
"Aage Knudsens Strøg, 2610 København, Rødovre  - 1. sal",14.750 kr.,980 kr.,106 m²,4,1.,Lejlighed,Nej,Nej,Ja,Ja,Nej,Nej,Ja,Nej,N/A,"ÅBENT HUS hver søndag 13:30-14:30 på Aage Knudsens Strøg, 2610 Rødovre.

Erantishaven, der forvandler en gammel erhversbygning til 83 nye lejeboliger. Centralt placeret i Rødovre med kun 100 meter til det store shoppingcenter Rødovre Centrum og få minutters gang til Damhussøen. Området har tidligere været præget af erhverv, men nu bliver den naturskønne beliggenhed udnyttet fuldt ud med moderne lejeboliger.

Byggeriet opføres som en trappeformet bygning, der går fra stue til femte etage. Lejlighederne er to til seks værelser og er tiltænkt blandede aldersgrupper og familie sammensætninger.

Der etableres private tagterrasser, hvor de resterende kvadratmeter af taget dækkes med sedum og solceller. Derudover skabes der grønne friarealer i stueplan, som omkranses af bygningen og dermed skaber private fællesarealer for beboerne.

Der opføres en parkeringskælder med plads til 83 biler, hvor selve parkeringskælderen er bredere end bygningsskelettet. Ovenpå parkeringskælderen, etableres en café og fællesarealer.

Vilkår: 
• 3 måneders depositum
• Lejeperiode: Ubegrænset
• Uopsigelighed: 9 måneder for lejers side
• Opsigelsesvarsel: 3 måneder
• Lejestigning: Reguleres ifølge nettoprisindekset
• Antal lejere pr. lejlighed: antal voksne der er beboelsesrum til
• Husdyr: Mulighed for tilladelse til én hund eller én indendørskat",https://www.boligportal.dk/lejligheder/k%C3%B8benhavn/106m2-4-vaer-id-5367891
"Hørparken, 6000 Kolding  - 1. sal",3.141 kr.,480 kr.,41 m²,1,1.,Lejlighed,Nej,Nej,Nej,Ja,Nej,Ja,Nej,Ja,N/A,"I det centrale Kolding udlejer vi 60 gode 1-værelses og 2-værelses studieboliger.

Bemærk at du skal være fyldt 18 år og have et uddannelsesbevis /være under uddannelse for at kunne leje en bolig i Hørparken.

Flyt ind i en studiebolig og få :


Eget Te-køkken med køleskab samt 2 kogeplader
Eget badeværelse
Fælles køkken i stort opholdsrum på hver etage
Eget depotrum
Fælles vaskefaciliteter i vaskerum ( betaling via app)
Cykelparkering i kælderen
Tv og internet udbyder er stofa

Kolding er en god og central by at bo i, både på grund af placeringen i forhold til motorvejsnettet, men også på grund af det voksende studiemiljø. Der er ikke langt til Kolding Midtby ligesom der er en del dagligvarerbutikker i området omkring Hørparken.

Det er ej muligt at leje en bolig såfremt man er registeret i RKI.

Husdyr er ikke tilladt.

ÅBENT HUS:
 - Torsdag den 10. august 2023, kl. 18:05-18:30

OBS: Venligst hold dig opdateret, da der godt kan forekomme ændringer.",https://www.boligportal.dk/lejligheder/kolding/41m2-1-vaer-id-5288081
