Adress,Monthly rent,Aconto,Square meters,Rooms,Floor,Property type,Furnished,Shareable,Pets allowed,Elevator,Senior frendly,Only for students,Balcony/Terrace,Parking,Energy label,Description,Link
"Kochsgade, 5000 Odense, Odense C  - 1. sal",9.295 kr.,500 kr.,82 m²,3,1.,Lejlighed,Nej,Ja,Ja,Ja,Ja,Nej,Ja,Nej,N/A,"God, lys  og delevenlig lejlighed på 86 m2 beliggende på 1. sal i fantastisk ejendom på Kochsgade, Odense C

Lejemålet er studentervenlig, med mulighed for at dele lejemålet. 

Lejligheden indeholder entre, 2 værelser med højloftede garderobeskabe, lyst brusebadeværelse med mulighed for tilslutning af vaskemaskine og kondenstørretumbler.

I lejligheden er der et lyst Schmidt køkken med sort bordplade og Grohe kvalitets vandarmaturer, indrettet i åben forbindelse til stue. Der er monteret indbygningsovn, kogeplade og kølefryseskab. Der er klargjort til montering af opvaskemaskine. 

Parketgulve og gulvvarme i alle rum.

Der er adgang til fælles syd/øst vendt have/opholdsareal.

Tæt på Odense Letbane - 10 min cykel til Odense centrum - 10 min cykel til Odense Havn.
Få min. gang til lokale indkøb og kun 5 minutter på cykel til centrum. 

Der medfølger endvidere 1 aflåst kælderrum, cykelskur og mulighed for leje af parkeringsplads på grunden.

El betales direkte til forsyningsvirksomheden.

Ubegrænset lejeperiode.
Vi gør opmærksom på, at billederne er taget, da tidligere lejere beboede lejemålet. Lejligheden står nu tom.",https://www.boligportal.dk/lejligheder/odense/82m2-3-vaer-id-5376373
"Moltkesgade, 8900 Randers, Randers C  - Stuen",4.500 kr.,800 kr.,60 m²,2,Stuen,Lejlighed,Nej,Nej,Nej,Nej,Ja,Nej,Nej,Nej,N/A,"Bo i en fantastisk hyggelig lejlighed ved Tøjhusparken, ved Gudenåen og tæt på centrum i Randers. 

Lejligheden er nymalet samt alle vægge har fået filt og den er flot nyrenoveret. Der er helt nyt køkken med ny opvaskemaskine, køleskab og fryser. 

Lejligheden er beliggende i en mindre ejendom, som har været igennem en totalrenovering med sans for bygningens gamle detaljer. Der er kælderrum og cykelparkering i den meget hyggelige, lukkede gårdhave, som deles med ejendommens andre beboere. Trappevask er fordelt mellem de i alt 5 lejligheder i en fast ordning. Haven passes sammen med ejendommens andre beboer. Udvendig vedligehold varetages af viceværten, hvilket er indeholdt i huslejen. Viceværten varetager beskæring af havens træer samt tager en forårs- og efterårsgennemgang af haven.

Parkeringsmulighed lige udenfor døren. Ejendommen ligger tæt på motorvejen og banegården. Det er ikke tilladt at ryge eller have husdyr i lejligheden. 

Er du/ I interesseret, så sende en mail med besvarelse af spørgsmålene nedenfor:
1. Stemmer økonomien overens med din/ jeres privatøkonomi?
2. Hvem skal bebo lejligheden?
3. Hvad er din/ jeres profession?

Kort og godt en superlækker lejlighed til den/ dem der ønsker noget udover det sædvanlige.",https://www.boligportal.dk/lejligheder/randers/60m2-2-vaer-id-5327740
"Østergade, 9800 Hjørring  - 2. sal",2.995 kr.,500 kr.,31 m²,1,2.,Lejlighed,Nej,Nej,Nej,Nej,Nej,Nej,Nej,Ja,N/A,"Billig og nyrenoveret lejlighed i Hjørring!
– Perfekt placering med gåafstand til alt nødvendigt.

Indretning:
Totalt nyrenoveret 1-værelses lejlighed med nyt køkken med kogeplade og ovn. I stuen er der lagt nyt LVT-gulv og her er der er plads til at indrette sig ned flere møbelarrangementer f.eks. spisebord og sofa/seng, eller hvad der nu skulle passe til dine behov. Fra køkkenet har man også adgang til toilettet som har en god bruseniche.

Beliggenhed:
Fra hoveddøren i ejendommen er der direkte udgang til selveste gågaden, så bliver placeringen ikke mere central. Der er alt i alt få min. gang til diverse indkøbs- og shoppingmuligheder, offentlig transport og grønne områder som Christiansgave og Svanelunden.",https://www.boligportal.dk/lejligheder/hj%C3%B8rring/31m2-1-vaer-id-5193673
"Skippergade, 9340 Asaa  - 1. sal",4.252 kr.,400 kr.,101 m²,3,1.,Lejlighed,Nej,Nej,Nej,Nej,Nej,Nej,Nej,Nej,F,"Her kan du bo godt og billigt midt i Asaa by.
   
INDEHOLDER:
* Pæn entré med skabe og trappe til lejligheden. 
* Nyere, stort køkken med opvaskemaskine og med udsigt til haven og udgang til dejlig havestue, hvorfra der er adgang til god solrig tagterrasse.
* Renoveret badeværelse med kar og bruser samt vaskemaskine. 
* Værelse
* Soveværelse. 
* Stor, lys vinkel opholdsstue.
Der er nyere vinduer og laminatgulve i hele lejligheden.

Til lejligheden hører endvidere brugsret til godt udhus samt dobbelt garage og egen have.

Aconto forbrug 400 kr. er vand/afledning
El og varme afregnes direkte til værkerne.",https://www.boligportal.dk/lejligheder/asaa/101m2-3-vaer-id-4845717
"Vilhelm Ehlerts Alle, 8800 Viborg  - 2. sal",9.900 kr.,N/A,125 m²,3,2.,Lejlighed,Nej,Ja,Nej,Ja,Ja,Nej,Ja,Ja,N/A,"Lejligheden er nyopført og i kvalitetsmaterialer samt alle lejlighederne har egen altan. Dejlig lyst lejemål med plads til privatliv på altanen og med Banebyparken lige udenfor døren. Lejligheden byder på en fin entre, en stue med udgang til altan samt et moderne køkken fra TVIS med intregreret køle/frys ny ovn, og opvaskemaskine. Lejligheden er i 2. plans og har to gode værelser på 1. etage. Et af værelserne er med altan og trådløs varmetermostat til regulering af gulvvarme samt Genvex så der er et godt indeklima. Badeværelse er udstyret med gulvvarme, pæne mørke klinker, ny vaskemaskine og en tørretumbler. Der er egen p-kælder – lige under din egen bolig hvor du trygt kan parkere din bil og cykel. Der er dørtelefon og et fint opbevaringsrum i kælderen. I Banebyen forbinder natur og by og skaber rum til både ro og afslapning samt til leg og fællesskab. Et grønt og trygt mødested for alle aldersgrupper. Her er masser af luft og lys og plads til at være sig selv og nyde roen - midt i byen. (Det blå på trappen er beskyttelse og bliver fjernet).",https://www.boligportal.dk/lejligheder/viborg/125m2-3-vaer-id-5311177
"Torvegade, 6700 Esbjerg, Esbjerg  - 3. sal",12.500 kr.,500 kr.,113 m²,3,3.,Lejlighed,Nej,Nej,Nej,Ja,Nej,Nej,Ja,Nej,N/A,"Denne lejlighed er beliggende på 3. sal i den arkitekttegnede boligudlejningsejendom på hjørnet af Torvegade / Nørregade, midt i Esbjerg.

Lejligheden er indrettet med entré med indbygget garderobeskab, samt badeværelse med lyse klinker og gulvvarme, bruser, vaskeskab og vaskesøjle med vaskemaskine og tørretumbler af mærket Electrolux.

Herudover er lejligheden indrettet med en stor kombineret spise- og opholdsstue, som ligger i åben forbindelse med lejlighedens INVITA-køkken.

Køkkenet har hvide skabslåger og sorte granitbordplader, og indeholder alt i integrerede hårde hvidevarer, herunder bl.a. opvaskemaskine, køle- fryseskab samt induktionskogeplade og selvrensende pyrolyseovn. Alt sammen i nyeste energibesparende serier fra Electrolux.

Fra stuen er der adgang til en nordvestvendt altan på 8 m2 med foldeglaspartier, der gør at altanen reelt kan anvendes året rundt.
I forbindelse med altanen er der i øvrigt etableret et mindre skur til opbevaring, ligesom der fra altanen er udsigt over det hyggelige gårdmiljø bag ejendommen.

Herudover er lejligheden indrettet med 2 gode soveværelser, med indbyggede skabsvægge med skydelåger med spejle.

I alle opholdsrum er der lagt slidstærke Berry Alloc gulve, ligesom der er monteret indbyggede LED-spots i lofter og ventilationsanlæg i hele boligen.

Til lejligheden hører i øvrigt et ekstra opbevaringsrum i kælderen under ejendommen, hvor der også er mulighed for cykelparkering, ligesom der er etableret elevatorer fra kælder til kvist i ejendommen.

HUSDYR ER IKKE TILLADT!",https://www.boligportal.dk/lejligheder/esbjerg/113m2-3-vaer-id-4003221
"Asagården, 7500 Holstebro  - Stuen",6.114 kr.,1.113 kr.,105 m²,5,Stuen,Lejlighed,Nej,Nej,Nej,Nej,Ja,Nej,Nej,Nej,N/A,"Afdelingen består af 336 stk. 2-5 rums lejligheder i 3 etager samt 42 stk. 2-5 rums seniorboliger forbeholdt 50+ uden hjemmeboende børn. Endelig er der nyopført 22 stk. 2-5 rums rækkehuse.
Der er løbende blevet renoveret i afdelingen, og senest er der bl.A. Inddækket altaner, udskiftet vinduer og opgangsdøre samt totalrenoveret køkkener, badeværelser og vaskerier.
Asagården/jættegården ligger tæt på daginstitutioner, skoler, ungdomsuddannelserne og ca. 2,5 km. Fra nørreport-centret. Der er buskørsel fra området 4 gange i timen. Der er pr. 15. Marts 2014 indført en p-vagtordning i afdelingen, der kontrollerer færdslen i afdelingens områder.
Til afdelingen hører der fællesvaskerier, en gildesal.
Der er mulighed for leje af én af afdelingens 94 stk. Garager(venteliste). Tæt på afdelingen ligger et velfungerende trivselshus med alsidige aktiviteter, foredrag mv og et fitnesscenter.
Hårde hvidevarer: komfur, køleskab, fryser, emhætte og brus.
Varme og vand bliver opkrævet aconto sammen med huslejen hver måned - el skal betales direkte til forsyningsvirksomheden.
Det er ikke tilladt at holde husdyr i afdelingen.

Vi kan oplyse, at afdelingen har ladestanderne til hybrid- og elbiler.

Der er indledningsvis en ladestander, der hver kan betjene to opladninger ad gangen.

Derudover har vi klargjort med forberedelsesbokse til at idriftsætte yderligere et antal ladestandere, som vi kan sætte i drift, når der bliver behov for flere ladepladser.

Ladestanderne er monteret:
·,,en ladestander med to ladestik på p-pladsen hvor containergården er placeret.
Ladeboks 1 kan anvendes til både afdelingens beboere og gæster udefra.
Ladeboks 2 kan kun anvendes af afdelingens beboere.

Prisen for beboere i afdelingen er 2.50 kr. Pr. Kwh. For nuværende.
Prisen for gæster i afdelingen er 3.50 kr. Pr. Kwh. For nuværende.

Det er muligt at oplade sin hybrid- eller elbil i op til 4 timer ad gangen.

Det er tilladt at benytte parkeringspladserne i tidsrummet 21.00 - 07.00 til almindelig parkering til opladning over natten, ligesom det er muligt at oplade uden tidsbegrænsning i dette tidsrum. I tidsrummet 07.00 - 21.00 må pladserne kun benyttes i forbindelse med påladning.

Vejledning ""kom godt i gang"" fra homecharge, beskriver hvorledes du nemt kommer i gang med at benytte ladestanderne. Denne vejledning kan afhentes på viceværtkontoret.

God fornøjelse hvad enten du allerede har en hybrid- eller elbil, eller du påtænker at anskaffe én.",https://www.boligportal.dk/lejligheder/holstebro/105m2-5-vaer-id-4221233
"Bøgevej, 9460 Brovst",7.500 kr.,0 kr.,90 m²,3,-,Rækkehus,Nej,Nej,Nej,Nej,Nej,Nej,Nej,Nej,A,"Bøgevej  - beliggende i byen tæt på skole og indkøb.
⭐️ 90 kvm velisoleret bolig med lavt varmeforbrug via Fjernvarme
⭐️ Soveværelse med stor skabsvæg, 1 stort værelser + stor stue/alrum ud i et.
⭐️ Gulvvarme i alle rum
⭐️ Ventilationsanlæg for behageligt indeklima
⭐️ Klinker i bryggers, bad og entre, 60x60cm grå klinke
⭐️ Lyse trægulve i øvrige rum
⭐️ SVANE inventar
⭐️ Carport og tilhørende stort skur
⭐️ God og nem have med god plads og udsigt til flot blomstermark
Ledig fra 1/10-2023 - evt. før.
Husleje 7500,- pr mnd
For nærmere info ring/sms eller mail",https://www.boligportal.dk/r%C3%A6kkehuse/brovst/90m2-3-vaer-id-5369675
"Dalbygade, 6000 Kolding  - Stuen",8.080 kr.,1.750 kr.,131 m²,4,Stuen,Lejlighed,Nej,Ja,Nej,Nej,Nej,Nej,Nej,Nej,N/A,"med stuklofter og trægulve. Beliggende få min. gang fra gågadesystemet og med ok parkeringsforhold. Der er en stor fælles have.
Lejligheden er perfekt til delebolig for 3 personer.
Tilsluttet fællesantenne med mulighed for tilkobling til bredbånd.",https://www.boligportal.dk/lejligheder/kolding/131m2-4-vaer-id-5196461
"Bredgade, 6960 Hvide Sande  - 2. sal",8.995 kr.,1.000 kr.,120 m²,5,2.,Lejlighed,Nej,Ja,Nej,Nej,Nej,Nej,Ja,Ja,N/A,"Denne fine lejlighed udlejes møbleret, hvis det ønskes. Lejligheden består af entré, køkken/alrum med masser af skabsplads og opvaskemaskine i forbindelse med spiseareal og stue. Fire separate værelser og et lækkert badeværelse med vaskemaskine.
Lejligheden har desuden altan. Særdeles velegnet som medarbejderbolig. A'conto omfatter el, vand og varme.",https://www.boligportal.dk/lejligheder/hvide-sande/120m2-5-vaer-id-5347642
"Gråbrødregade, 6000 Kolding  - 1. sal",7.500 kr.,900 kr.,75 m²,2,1.,Lejlighed,Nej,Nej,Ja,Ja,Nej,Nej,Ja,Ja,A,"Helt nyrenoveret og indflytningsklar – Lys 75 kvm. tæt på centrum og ved gågade i Kolding

Total nyrenoveret 2 vær. lejlighed med absolut skøn beliggenhed på Koldings hyggelige gågade med de mange skønne butikker og hyggelige caféer.
Kolding Station nås på under 5 min. til fods.

Her er alt nyt, da lejligheden netop er gennemrenoveret. 

Dejligt køkken med hvide, grebsfrie køkken elementer og med alt i hårde hvidevarer. Køkkenet er i åben forbindelse med selve den store hjørnestue med det smukke lysindfald fra de mange vinduer. Stuen er yderst rummelig med plads til både spisebord samt sofaarrangement. Og frit kig ned over strøget. 

Desuden værelse samt lyst og helt nyt badeværelse med store grå klinker på gulv samt i brusenichen, håndvask nedfældet i bordplade med underskab, spejl med lys samt vaske- og tørremaskine i et. 

Kort sagt helt indflytningsklar og med det eftertragtede lyse look – hvide vægge, flotte trægulve - så du kan sætte dit personlige præg på din nye lejebolig. 

Til hver lejlighed er der et depotrum i kælderen, ligesom der er fælles cykelparkering i kælderen.",https://www.boligportal.dk/lejligheder/kolding/75m2-2-vaer-id-5269418
"Degnejorden, 4320 Lejre, Højby",15.960 kr.,0 kr.,126 m²,4,-,Rækkehus,Nej,Nej,Ja,Nej,Ja,Nej,Ja,Ja,N/A,"Degnejorden – en moderne landsby med fællesskaber som omdrejningspunkt. Nyt byggeri skyder op af jorden i Lejre.

Landskabet imellem boligklyngerne på Degnejorden, er tænkt som et naturområde med varieret beplantning i form af forskellige træer og buske på en bund af enggræsser og urter. Igennem naturområdet etableres der trampestier og mindre opholds- og aktivitetsområder.

82 lejeboliger fordelt på 3 forskellige boligtyper i ét eller 2 plan. Udover lejeboligerne bliver der frasolgt 13 huse. 

I området bliver der bygget 1 forsamlingshus og 5 fælleshuse. Der etableres der 143 parkeringspladser til fri afbenyttelse inkl. handicappladser. Der opsættes tilmed 2 el-lade standere, således at der kan oplades 4 elbiler ad gangen.

Der er indflytning i 3 etaper og indflytningen for den enkelte bolig vil fremgå af den pågældende annonce. 

Der er ikke noget a conto beløb der skal betales via udlejer, da vand leveres af FORS og husene opvarmes med varmepumpe, hvor lejer selv skal tilmelde sig en el leverandør. 

Alle hårde hvidevarer medfølger. 

Boligerne kan reserveres ved at deltage på åbent hus. Vi holder åbent hus ca. én gang om ugen indtil alt er udlejet. Ønsker du at deltage i det åbne hus, så kan du sende en besked via annoncen og vil modtage en invitation til det næstkommende åbne hus.
Indflytningsprisen skal betales umiddelbart efter modtagelsen af lejekontrakten.

Det vil ikke være muligt at besigtige andre boliger end prøveboligen inden indflytning og det er under ingen omstændigheder tilladt at opholde sig på byggepladsen uden en invitation til åbent hus.

Billeder, plantegning og tekst er vejledende.

Hvis du er registreret i RKI kan vi desværre ikke tilbyde dig lejligheden. Dette kontrolleres ved udarbejdelse af lejekontrakt.",https://www.boligportal.dk/r%C3%A6kkehuse/lejre/126m2-4-vaer-id-5347162
"Thorsmoseallé, 3200 Helsinge",12.350 kr.,250 kr.,117 m²,4,-,Rækkehus,Nej,Nej,Nej,Nej,Nej,Nej,Ja,Ja,N/A,"Dejligt funktionelt nyere rækkehus (opført 2013) i roligt og børnevenligt kvarter udlejes pr. 1. juli 2023.
Stueplan: entre, bad og toilet, køkken og stor stue (køkken alrum) med udgang til privat terrasse og fælles have.
1. sal: soveværelse, 2 børneværelser samt bad og toilet.
Tæt på skole, børnehave og vuggestue, parkering, eget skur m.v.",https://www.boligportal.dk/r%C3%A6kkehuse/helsinge/117m2-4-vaer-id-5355196
"Fjordbrynet, 6000 Kolding  - 9. sal",8.700 kr.,1.213 kr.,97 m²,3,9.,Lejlighed,Nej,Ja,Ja,Ja,Nej,Nej,Ja,Ja,A,"BOOK EN PERSONLIG FREMVISNING ELLER MELD DIG TIL ÅBENT HUS HVER TORSDAG FRA 15.00-16.00.

Boliger i første række. To boligtårne med i alt 104 boliger har rejst sig ud mod Kolding Fjord hvor de står i smukt samspil med naturen. Fokus er på høj kvalitet, den skønne beliggenhed med fantastisk udsigt samt indretning, der passer til en bred målgruppe. 

Denne bolig på 97m2 består af en entré, badeværelse med vaskemaskine og tørretumbler, køkken/stue (med opvaskemaskine) med direkte adgang til en altan, samt 2 fine værelser.  Du får en nordvendt altan med en skøn udsigt mod marinaen og Kolding fjord. 
Det har været et klart ønske at skabe et fællesskab for beboerne i Fjordbrynet. Derfor er der indrettet et helt fantastisk Orangeri med 2 store tagterrasser øverst og nederst i den flotte foyer bydes beboerne velkommen hjem.  

- Der er en parkeringsplads pr. lejemål og fri parkering til gæster.
- Du har mulighed for at tage din lille hund eller kat med (op til 15 kg) - skal godkendes af udlejer først. 
- Der er vicevært tilknyttet bygniggerne.
- Mulighed for fibernet. 
- Gulvvarme i badeværelset.
- Depotrum i sidebygningen. 

De spændende lejligheder har fokus på lys for de kommende livsnydere i Fjordbrynet. Der vil være udsigt til de grønne trækroner, Kolding by og Kolding Fjord. Lejlighederne opføres med stor variation i størrelserne med et spænd fra 77 til 157 m2 og med altaner, hvorfra udsigten virkelig kan nydes.  Det har desuden været et ønske at gøre området til et inviterende og rekreativt område, som forbinder byen, skoven og fjorden, hvilket må siges at være lykkedes rigtig godt. Fjordbrynet vil med sin attraktive og naturskønne placering i Kolding kunne tiltrække og være en boligdrøm for de fleste.

**Plantegninger er vejledende og uden ansvar.",https://www.boligportal.dk/lejligheder/kolding/97m2-3-vaer-id-5328462
"Toldbodgade, 8600 Silkeborg  - 1. sal",3.450 kr.,600 kr.,41 m²,1,1.,Lejlighed,Nej,Nej,Nej,Nej,Nej,Nej,Ja,Nej,N/A,"Bynær lejlighed beliggende på 1. sal tæt på stationen og få hundrede meter fra centrum. Lejligheden består af praktisk opdelt stue og sove afsnit, entre, køkken og badeværelse. Der er to mindre altaner, vendt mod øst og vest.
A/C omhandler forbrug af varme og vand. El betales direkte til el-leverandør.",https://www.boligportal.dk/lejligheder/silkeborg/41m2-1-vaer-id-5173863
"Holsteinsgade, 8300 Odder  - Stuen",7.950 kr.,800 kr.,99 m²,3,Stuen,Lejlighed,Nej,Ja,Ja,Nej,Nej,Nej,Nej,Nej,N/A,"Stor og lys lejlighed med gode indretnings muligheder. Ejendom total renoveret i 2020. Stort køkken med mulighed for spisekrog, funktionelt badeværelse og 3/4 værelser.
Lejligheden er i stueplan og på 99 m2. Hertil mindre kælderrum.
I køkken og badeværelse er der gulvvarme og lejligheden er udstyret med hårde hvidevarer incl. kombineret vaskemaskine og tørretumbler.
Pris pr. måned 7.950 kr. plus varme, vand og vandafledningsafgift.
Lejligheden er nymalet og står klar til Indflytning.
Holsteingade 4 er yderst central beliggende med kort afstand til tog og busstation, indkøb og restauranter.
Der er muligt at parkere på offentlig parkeringsplads bagved ejendommen.",https://www.boligportal.dk/lejligheder/odder/99m2-3-vaer-id-4997626
"Nørregade, 8800 Viborg  - Stuen",6.400 kr.,1.300 kr.,97 m²,3,Stuen,Lejlighed,Nej,Ja,Nej,Nej,Nej,Nej,Nej,Ja,N/A,"3 værelses lejlighed på 97 kvm.

Renoveret lejlighed, med stort køkken med alt i hvidevare også tørre-vaskemaskine, rummeligt renoveret badeværelse. Store lyse værelser med franske døre.

Med parkeringsplads",https://www.boligportal.dk/lejligheder/viborg/97m2-3-vaer-id-5143080
"Buchwalds Bro, 8700 Horsens  - 4. sal",9.500 kr.,1.094 kr.,101 m²,4,4.,Lejlighed,Nej,Nej,Ja,Ja,Ja,Nej,Ja,Nej,N/A,"I de nyopførte lejligheder er der kælet for detaljerne med kvalitetsinteriør, en nordisk designlinje og store vinduespartier, der inviterer dagslyset ind i dit hjem. Hvide vægge, indbyggede skabsløsninger, lyse trægulve og gulvvarme i alle rum, er alle bevidste designvalg, der giver lejligheden et eksklusivt touch.

I lejlighedens køkken-alrum er den hvide køkkenløsning fra HTH med til at understrege den lyse stemning af rummelighed og eksklusivitet. Med moderne løsninger som induktionsovn, induktionsplade, opvaskemaskine og køle/fryseskab fra Electrolux får du en gennemført køkkendrøm.

Buchwalds Bro er placeret helt ud til det rolige vand i Bygholm Å, der langsomt strømmer forbi, og de grønne naturområder, der omgiver åen, giver beboerne et fantastisk kig fra de store altaner.

Udsigten taler for sig selv, når du tager elevatoren op til en at de højtliggende udsigtslejligheder. Ugeneret vandudsigt og solopgang over fjorden, eller udendørs altanaftener i aftensolen.

NB. Billederne er af en prøvebolig og derfor ikke den specifikke bolig.",https://www.boligportal.dk/lejligheder/horsens/101m2-4-vaer-id-5230187
"Eya Jensens Gade, 8240 Aarhus, Risskov  - 3. sal",7.751 kr.,800 kr.,61 m²,3,3.,Lejlighed,Nej,Nej,Nej,Ja,Nej,Nej,Ja,Ja,N/A,"ÅBENT HUS HVER MANDAG KL. 15:00. Kontakt os for mødested. 
BEMÆRK der afholdes ikke åbent hus i UGE 31. 

Skejbyen er for dig, der drømmer om en bolig i Risskov i det nordlige Aarhus.

Her kan du føle dig hjemme og samtidig være en del af et område, hvor sport, kultur, natur og fællesskab er omdrejningspunktet. Du får et skønt hjem med en god planløsning med minimal spildplads.

Så snart du træder ind i lejligheden i Skejbyen, bliver du mødt af et fantastisk lysindfald fra de store vinduespartier. Du vil med det samme lægge mærke til den lækre loftshøjde, der gør lejligheden endnu lysere og indbydende.

Midt i lejligheden finder du det lyse og topmoderne køkken med ekstra høje overskabe til opbevaring. Der er vaskesøjle og ekstra opbevaring på badeværelset, så du ikke skal gå på kompromis med pladsen i din lejlighed. Fra stuen er der direkte adgang til egen lækker altan eller terrasse.

I Skejbyens karré 7 og 9 kan du vælge mellem 1, 2, 3 og 4-værelses lejligheder, der fordeler sig på 49 til 86 kvm. Lejlighederne passer derfor perfekt til en lille familie, et par, en studerende eller dig, der gerne vil have din egen bolig.

I gårdrummet er der plads til at trække sig tilbage eller nyde samværet med både familie, venner og naboer.

Der er parkering i nærheden af boligen, depotrum og cykelkælder med opladning til elcykel.

I ejendommens nærområde finder du f.eks. Mollerup Skov, institutioner, Skejby Centret og Veri Centret, hvor du kan gå på shopping i de mange spændende butikker.

Velkommen til Skejbyen i Risskov.

OBS: Billederne er af en prøvebolig og dermed vejledende. Se Plantegning.",https://www.boligportal.dk/lejligheder/aarhus/61m2-3-vaer-id-5358791
"Bredgade, 8722 Hedensted",6.427 kr.,725 kr.,79 m²,3,-,Lejlighed,Nej,Nej,Nej,Nej,Nej,Nej,Nej,Nej,N/A,"Her får du en fin 3 værelses lejlighed med gode indkøbsmuligheder i nærheden og E45 kan nemt nås. 
Lejligheden indeholder lyst køkken med hårde hvidevarer, hvor der er mulighed for installation af egen opvaskemaskine, badeværelse med mulighed for installation af egen vaskemaskine, stor stue med plads til både sofagruppe og spiseplads og to gode værelser.
Til huslejen er der et A/C forbrug til vand og varme. El afregnes direkte til værket.
Husdyr ikke tilladt.
Depositum svarer til 3 måneders leje.
For fremvisning kontakt kontoret mandag-torsdag mellem kl. 8-12 og oplys venligst journal-nr. 2011-7.",https://www.boligportal.dk/lejligheder/hedensted/79m2-3-vaer-id-4379860
"Bornholms Alle, 2630 København, Taastrup  - 5. sal",11.475 kr.,995 kr.,85 m²,3,5.,Lejlighed,Nej,Nej,Ja,Ja,Ja,Nej,Ja,Nej,N/A,"Hermed udlejes vores projekt A13 nær City2, som består af 101 stk. 3-værelses lejligheder.

Oplysninger om lejlighederne og ejendommen:

Uderum: Altan / terrasse
Depotrum: Kælderrum 2-4m²
Hårde hvidevarer: Kølefryseskab, indbygningsovn, kogeplade, emhætte, opvaskemaskine, vaskemaskine og tørretumbler.

Husdyr: 2 husdyr tilladt (ingen begrænsning på størrelse)
Elevator: Ja, i alle opgange
Opvarmningsform: Fjernvarme
Internet: TDC Fibernet
Parkeringsmulighed: 52 parkeringslicenser til parkeringshus. Kan lejes for 600 dkk pr. måned
Cykelparkering: Cykelstativer i kælder
Fællesarealer og faciliteter: Orangeri på tagterrasse og legeområde i gården

Øvrig information:
Lejlighederne kan reserveres ved at deltage på åbent hus. Vi holder åbent hus ca. én gang om ugen indtil alt er udlejet. 

Ønsker du at deltage i det åbne hus, så kan du sende en besked via annoncen og modtage en invitation til det næstkommende åbne hus. 

Indflytningsprisen skal betales umiddelbart efter modtagelsen af lejekontrakten. 

Det vil ikke være muligt at besigtige andre boliger end prøveboligen inden indflytning og det er ikke tilladt at opholde sig på byggepladsen uden en invitation til åbent hus. 

Billeder, plantegning og tekst er vejledende og kan afvige fra faktiske forhold.

Som udgangspunkt udlejer vi ikke til personer der er registreret i RKI og vi foretager kontrol heraf ved udarbejdelse af lejekontrakt.",https://www.boligportal.dk/lejligheder/k%C3%B8benhavn/85m2-3-vaer-id-5353072
