Adress,Monthly rent,Aconto,Square meters,Rooms,Floor,Property type,Furnished,Shareable,Pets allowed,Elevator,Senior frendly,Only for students,Balcony/Terrace,Parking,Energy label,Description,Link
"Bjergstedvej, 2700 København, Brønshøj  - 1. sal","14.166,85 kr.",1.550 kr.,142 m²,4,1.,Lejlighed,Nej,Nej,Nej,Ja,Nej,Nej,Ja,Ja,B,"Lejligheden har 3 reelle soveværelser, da der er opsat en væg ind til ""stuen"" på plantegningen. Derudover er der køkkenalrum og stue.

Bjergstedvej ligger i en attraktiv del af Husum, omgivet af større grønne områder, kun 10 minutters gang fra Utterslev Mose og Vestvolden.

De offentlige transportmidler er tæt ved bebyggelsen. Busserne 5A, 15, 22, 66, 166, 200S og 350S samt servicebussen 862 kører lige uden for døren og bus 2A i 10 minutters gåafstand derfra. Der er ca. 500 meter til Husum Station og S-tog hvorfra linierne C og F kører.

Der er gode indkøbsmuligheder i nærområdet med bl.a. Føtex, Netto, Fakta, Jysk og BR. Tæt ved findes apotek, Imerco, AGL, Fitness World og en del specialbutikker og ca. 3 km derfra findes det nye Bellahøj Svømmestadion.

Bebyggelsen har eget haverum med en veldisponeret legeplads. Korsager Kommuneskole er nabo til Bjergstedvej. Skolens udearealer vender væk fra Bjergstedvej og skolen anvendes ikke i aftentimerne, hvorfor bebyggelsens vestvendte haverum vil være stille og roligt.

Der er 2 arealer til parkering i bebyggelsen med plads til i alt 29 biler hvorfra der er direkte, niveaufri adgang til boligen.

Bebyggelsen Bjergstedvej er en ombygning af et tidligere plejehjem, men fremstår i dag som et nyt byggeri med 26 moderne familieboliger. Der vil således kun forekomme minimale drift- og vedligeholdelsesudgifter i mange år fremover.

Bjergstedvej er orienteret nord-syd, hvilket betyder, at samtlige boliger vender mod øst og vest. Dette giver et optimalt indeklima samt opholdsmuligheder i og udenfor boligerne.",https://www.boligportal.dk/lejligheder/k%C3%B8benhavn/142m2-4-vaer-id-5158992
"Købmagergade, 7000 Fredericia  - 2. sal",3.900 kr.,200 kr.,30 m²,1,2.,Lejlighed,Nej,Nej,Nej,Ja,Nej,Nej,Nej,Nej,N/A,"Lejen er 3900 men her er inkluderet vand + varme. Der betales derudover aconto EL 200kr.
Depositum beregnes ud fra lejen på 3900kr. som er inkluderet med vand/varme



med pænt nyere køkken og stort badeværelse med gulvvarme
Beliggende i flot ejendom i midtbyen på 2. sal
Ejendommen har elevator

Der er fælles vaskeri i gården samt plads til cykel

Det er IKKE tilladt at ryge i boligen eller ejendommen",https://www.boligportal.dk/lejligheder/fredericia/30m2-1-vaer-id-5098054
"Dalumvej, 5250 Odense, Odense SV  - 1. sal",8.200 kr.,600 kr.,61 m²,3,1.,Lejlighed,Nej,Ja,Nej,Nej,Nej,Nej,Ja,Ja,N/A,"Lys og lækker 1. sals lejlighed med altan og adgang til have. Lejligheden ligger i rolige omgivelser med kort afstand til gode indkøbsmuligheder og grønne omgivelser ved sø og skov.

Lejligheden har let adgang til mortorvejen og ligger 3-4 km fra Odense C.",https://www.boligportal.dk/lejligheder/odense/61m2-3-vaer-id-5353968
"Nørregade, 8620 Kjellerup  - 2. sal",4.500 kr.,600 kr.,57 m²,2,2.,Lejlighed,Ja,Nej,Nej,Nej,Nej,Nej,Nej,Ja,A,"Centralt beliggende lejlighed bestående af entre, køkken/stue, værelse, badeværelse.  Lejligheden er totalrenoveret i 2019 med nyt køkken, bad, gulve m.v.",https://www.boligportal.dk/lejligheder/kjellerup/57m2-2-vaer-id-5360031
"Idylbakken, 7730 Hanstholm",3.400 kr.,800 kr.,89 m²,3,-,Hus,Nej,Ja,Ja,Nej,Ja,Nej,Ja,Ja,N/A,"3. Værelses lejlighed på 89 Kvm. er indrettet med mindre entre, hvorfra der er adgang til stue/køkken. I køkkenet er der videre adgang til mellemgang, hvorfra der er adgang til 2 værelser samt badeværelse med toilet og brus. I det ene værelse er der indbygget skabe samt udgang til fælles areal. Der er trægulv og træloft i lejligheden. Er beliggende i børnevenligt kvarter",https://www.boligportal.dk/huse/hanstholm/89m2-3-vaer-id-2854416
"Fredericiagade, 9000 Aalborg, Aalborg  - Stuen",7.399 kr.,850 kr.,96 m²,3,Stuen,Lejlighed,Nej,Ja,Ja,Nej,Nej,Nej,Ja,Nej,D,"Super fin 3 værelses lejlighed i Aalborgs populære Vestby:-) 
Lejligheden er indrettet med 3 gode værelser, stort spisekøkken, med alle hvidevare, badeværelse med fliser på både gulv og vægge samt vaskearrangement.
Der er mulighed for montering af vaske/tørremaskine, dog er der også vaskeri i kælderen. 
Der ca. 300 m til indkøb, 500 m til havnen og grønne arealer ligesom der er er lækkert gårdmiljø til ejendommen med cykelparkering, legeplads, mulighed for at grille m.m. 
Ca 10 min gang fra ejendommen kommer man til Aalborgs gågademiljø med Salling, Magasin, Jomfru Ane Gade, cafeer og restauranter og ca. 5 min gang fra ejendommen ligger Aalborgs populære madgade Reberbansgade. 
Ligeledes er der kælderrum til lejligheden.",https://www.boligportal.dk/lejligheder/aalborg/96m2-3-vaer-id-2997662
"Eskebjergvej, 4593 Eskebjerg",5.500 kr.,300 kr.,78 m²,3,-,Lejlighed,Nej,Nej,Nej,Nej,Nej,Nej,Nej,Ja,A,"Eskebjerg by.1 Sal. med egen indgang, indeholder, entre med plads til vaskemaskine, trappe til 1 sal, hvor der er repro med adgang til toilet med brus og gulvvarme, køkken og spisestue,værelse/kontor, samt Stort soveværelse.
Dejlig hyggelig stue , opvarmes med varmepumpe/el
Lejligheden er  total renoveret og er indflytningsklar  Skur til cykel samt 1 stk parkering til bil.
150m til indkøb/ bus 20m.
2km  stranden Vesterlyng.

BEMÆRK lejligheden søger en Rolig Moden/senior lejer 40+. ikke ryger.Der tager hensyn til underbo.Husdyr IKKE tilladt.
kan reserveres nu.
Opfylder du ikke krav .vil der ikke blive besvaret mail.Mvh",https://www.boligportal.dk/lejligheder/eskebjerg/78m2-3-vaer-id-3938080
"Jagtvej , 7100 Vejle  - 2. sal",7.400 kr.,700 kr.,82 m²,1,2.,Lejlighed,Nej,Nej,Nej,Ja,Nej,Nej,Ja,Ja,N/A,"Lækker, hyggelig lejlighed på anden sal.
Nyere køkken, med alt i hvidevarer, stue med plads til spisebord.
Nyt badeværelse med gulvvarme, vaske/ tørretumbler.
Soveværelse, entre.
altan, p-plads lige uden for døren
Depot rum i kælderen.
der er elevator op til lejligheden.
Ligger lige ved skoven og få hundrede meter fra Bryggen.",https://www.boligportal.dk/lejligheder/vejle/82m2-1-vaer-id-5338669
"Viborgvej, 9670 Løgstør, Trend",9.000 kr.,0 kr.,183 m²,6,-,Hus,Nej,Ja,Nej,Nej,Nej,Nej,Ja,Ja,A,"Ejendommen ligger i det smukke Trend, der er kendt for sine flotte naturstier, grønne områder og den børnevenlige strand til afkølende svømmeture i sommermånederne. Samtidig er her også gode forhold for fiskeri og windsurfere. Der er omkring 10-15 minutters kørsel til handelsbyerne Løgstør og Farsø, der ligesom lokalområdet byder på indkøbsmuligheder, skolefaciliteter og daginstitution. Direkte adg. til fjorden.

Mulighed for butik/galleri m.m.

I får masser af plads til at udfolde familielivet på med hele 183 m2 fordelt på halvandet plan. Ejendommen er som nævnt totalrenoveret og har en meget lys og indbydende atmosfære. Udvendigt præsenterer ejendommen sig flot med nye sprossevinduer, hvide facader og nyt tegltag.

Indretning:
Her finder I tre gode stuer, hvoraf den ene er i åben forbindelse med køkkenet. Dette har integrerede hårde hvidevarer og fremstår meget unikt med sin lettere mørkegrønne farve på dele af skabsdøre og skuffer. Der er fjordkig fra køkken og den ene stue, som begge er med terrassedør ud til haven. Der er et dejligt stort badeværelse med badekar, muret bruseniche med regnbruser og vaskesølje. I forlængelse heraf findes et værelse. I tilgår førstesalen fra trappen i en af stuerne og kommer op til to skønne værelser og endnu en stue, stuen kan også anvendes til værelse. Her er loft til kip samt en forrygende udsigt til vandet fra glaspartierne og den lille altan. 

Galleri med badeværelse og tekøkken og egen indgang kan tillejes  efter nærmere aftale.  Denne del af ejendommen er også totalrenoveret i 2017.",https://www.boligportal.dk/huse/l%C3%B8gst%C3%B8r/183m2-6-vaer-id-5013609
"Hobrovej, 9000 Aalborg, Aalborg  - 1. sal",8.200 kr.,1.000 kr.,102 m²,3,1.,Lejlighed,Nej,Ja,Ja,Nej,Nej,Nej,Ja,Ja,D,"HUSLEJEN NEDSAT MED KR. 600,00- PR MDR NY PRIS 8.200,00- 
KLAR TIL INDFLYTNING MED KORT VARSEDL.
Flot lejlighed i 2 plan.
Tæt på centrum udlejers flot istandsat lys lejlighed, lejligheden er i 2 plan med følgende indretning:
Entre, gæstetoilet, gang til køkken med komfur/ovn, køl/frys samt opvasker, 2 værelser.
Næste plan hyggelig stue med loft til kip, stort badeværelse med vaskemaskine og tørretumbler.
Ejendomme fik en gennemgribende renovering i 2018, der blev bla. sat nye vinduer og udvendige døre, taget blev udskiftet, alle facaderne om fuget, så ejendommen står flot og præsentabelt.
Der er 1 stk privat parkering plads til lejligheden.
Der er adgang til have som deles med underboen i ejendommen, man er fælles om at passe den.

A conto udgør varme kr. 700,00- vand kr. 300,00- ejendommen er en ikke ryger ejendom, der må holdes små skikkelige husdyr, lejen reguleres efter netto prisindeks for september, første gang 1 januar 2024, der udføres kredit tjek på alle vore kommende lejere.",https://www.boligportal.dk/lejligheder/aalborg/102m2-3-vaer-id-2711374
"Brohusgade,, 9000 Aalborg, Aalborg  - Stuen",4.297 kr.,677 kr.,49 m²,2,Stuen,Lejlighed,Nej,Nej,Ja,Nej,Nej,Ja,Nej,Nej,N/A,"I Aalborg Centrum ligger denne afdeling, ”Brohuset”, som består af lyse og moderne lejeboliger, samt ungdomsboliger, i Brohusgade. Lejlighederne har 1-3 værelser samt køkken og badeværelse. Afdelingen har fælles vaskeri og et fællesrum, som beboerne selv har indrettet. Der er mulighed for leje af p-plads i bebyggelsens p-kælder.
Boligen udlejes af en almen boligorganisation. Det giver dig en række fordele
 Du er sikret en rimelig husleje, da der ikke er nogen, der skal tjene på lejen. Huslejen bliver fastlagt efter balancelejeprincippet, hvor afdelingens samlede husleje kun skal dække driftsomkostninger. 
 Du kan søge om boligstøtte og indskudslån hos kommunen. Du kan få medbestemmelse med beboerdemokrati. Du kan blive skrevet op på intern venteliste, hvis du en dag skulle ønske en anden bolig. Når du har boet i en almen bolig i otte år og 4 måneder, har du sparet op til en såkaldt normalistandsættelse og kan få hele dit indskud tilbage ved flytning. 
 Derudover får du adgang til et sikkerhedsnet af ejendomsfunktionærer, som kan løse forskellige opgaver vedrørende din bolig- og lejesituation. 

På BoligPortal annonceres kun reelt ledige boliger uden eksisterende venteliste på annonceringstidspunktet. Venligst kontakt udlejer hvis du er interesseret i lejemålet.",https://www.boligportal.dk/lejligheder/aalborg/49m2-2-vaer-id-5378671
"J. R. Hübertz' Gade, 8240 Aarhus, Risskov  - 1. sal",16.900 kr.,1.375 kr.,136 m²,5,1.,Lejlighed,Nej,Ja,Nej,Ja,Nej,Nej,Ja,Ja,N/A,"Alle lejligheder har enten stor syd- eller vestvendt terrasse eller altan og gavllejlighederne har 2 altaner.

        Lejlighederne har et flot lyst køkken med alle hårde hvidevarer. På badeværelset er der vaskesøjle med vaskemaskine og tørretumbler. 

        Alle lejligheder har depotrum i kælderen. Hvis man har brug for ekstra plads er der mulighed for at leje et ekstra depotrum i kælderen, dog begrænset antal. 

        Fra ejendommen kan du komme til letbanen med en kort gåtur gennem den gamle hospitalspark. Du kan også vælge at cykle ad den smukke cykelsti langs Aarhus bugten – Turen til Domkirken tager under et kvarter. 

        De 3 bygninger ligger lige ved Det Grønne Loop, som er en rekreativ sti, der i sit forløb binder den gamle hospitalspark sammen med hele Bindesbøllbyen.",https://www.boligportal.dk/lejligheder/aarhus/136m2-5-vaer-id-5272366
"Hørkær, 2730 København, Herlev  - 6. sal",13.800 kr.,900 kr.,116 m²,3,6.,Lejlighed,Nej,Ja,Ja,Ja,Nej,Nej,Ja,Ja,A,"Kvalitetsbolig, som er helt perfekt for dig, der vil bo op ad storbyen, men samtidig ønsker naturoplevelser og et trygt nærmiljø.

Boligerne er indrettet i den tidløse nordiske stil, med masser af lys, store vinduespartier i opholdsrummet, smukke trægulve og med stort fokus på enkelthed.

Den Grønne Fatning indbyder til samvær i de særlige byhaver i første sals højde, som forbindes af broer mellem de fire plinte. Haverne rækker ned mod gadeplanet, og grønne planter forbinder gården og haverne.

Husdyr er tilladt.

 

OBS: Plantegningerne er vejledende og der tages forbehold for eventuelle uoverensstemmelser.",https://www.boligportal.dk/lejligheder/k%C3%B8benhavn/116m2-3-vaer-id-5352692
"Garnisonsvej, 3520 Farum  - 2. sal",13.400 kr.,2.120 kr.,102 m²,4,2.,Lejlighed,Nej,Ja,Nej,Ja,Ja,Nej,Ja,Ja,C,"- Stor stue med vinduespartier fra gulv til loft
- Tre værelser
- Flot HTH-køkken i hvidt med opvaskemaskine
- Velindrettet badeværelse med gulvvarme og vaskemaskine
- Altan på 6 kvm med udsigt over grønne områder
- Stort opvarmet depotrum i stueetagen
- Lys opgang med elevator i bygning med samlet 5 lejligheder
- Parkering foran døren
- Gode fællesarealer med legepladser og skoven som nabo 
- Gåafstand til indkøb i Rema1000 og daginstitution
- Godt stisystem ned til Farum centrum",https://www.boligportal.dk/lejligheder/farum/102m2-4-vaer-id-5017364
"Gudrunsvej, 8220 Aarhus, Brabrand  - Stuen",7.595 kr.,600 kr.,66 m²,2,Stuen,Lejlighed,Nej,Nej,Ja,Ja,Ja,Nej,Ja,Ja,A,"Beliggende i Pionérhusene, som er en nyopført ejendom i Brabrand, lige på kanten til Åbyhøj, kan vi nu tilbyde denne meget attraktive dejlige 2-værelses lejlighed til favorabel lejepris.

Lejligheden byder på:

• Flotte materialer med lækkert køkken fra HTH og integreret opvaskemaskine.

• Rummeligt badeværelse med vaskemaskine og tørretumbler.

• Soveværelse med skabe.

• Køkken i åben forbindelse med stue, hvorfra der er udgang til altan/terrasse.

* Adgang til egen terrasse i hyggeligt gårdmiljø i byggeriet midte.

Der er lyse parketgulve i ask i lejligheden.

Til ejendommen hører fælles p-pladser samt aflåste cykelskure.

Billedet er fra en anden lejlighed med samme materialevalg.

Vi udlejer ikke til personer registreret i RKI.",https://www.boligportal.dk/lejligheder/aarhus/66m2-2-vaer-id-5357970
"Spotorno Alle, 2630 København, Taastrup  - 1. sal",13.000 kr.,1.630 kr.,104 m²,4,1.,Lejlighed,Nej,Ja,Nej,Ja,Nej,Nej,Ja,Ja,N/A,"På Spotorno Allé 14-34 udlejer Go’Bolig 145 nybyggede lejligheder på 43-111 m2. Lejlighederne er primært 2-, 3- og 4-værelses, men der er også et mindre antal 1- og 5-værelses boliger. Lejlighederne er fordelt på tre bygninger i varierende højder mellem fire og seks etager.

INDE:
Alle lejemål består af en entré, et stort opholdsrum med køkken og stue i åben forbindelse, et lækkert badeværelse og et eller flere værelser.

UDE:
Der er en lækker altan eller terrasse til alle boliger.

HÅRDE HVIDEVARER:
Køkkenet er udstyret med hårde hvidevarer i form af køle- og fryseskab, opvaskemaskine, indbygningsovn og kogeplade. Badeværelset har kombineret vaskemaskine og tørretumbler

HUSDYR:
Katte: Lejere kan ansøge om tilladelse til at holde én indekat på adressen. Udekatte er ikke tilladt.
Hund: Det er ikke tilladt at holde hund.
Andre dyr: Kontakt os.

PARKERING:
Ved ejendommen er der etableret 145 p-pladser til fri afbenyttelse af lejerne.

FÆLLESAREALER:
Mellem bygningerne er der anlagt grønne fællesarealer med beplantning, som giver mulighed for spil, leg, picnic og solbadning.

ELEVATOR:
Der er elevator i opgangen.",https://www.boligportal.dk/lejligheder/k%C3%B8benhavn/104m2-4-vaer-id-5369208
"Løkkehøj, 5471 Søndersø  - 1. sal",6.076 kr.,800 kr.,120 m²,4,1.,Lejlighed,Nej,Nej,Nej,Nej,Nej,Nej,Ja,Ja,N/A,"Dejlig 4 værelses lejlighed beliggende på 1. sal.
Tilsluttet fibernet og med mulighed for indsættelse af vaskemaskine, samt opvaskemaskine.
Primært lejere med fast job vil blive foretrukket.",https://www.boligportal.dk/lejligheder/s%C3%B8nders%C3%B8/120m2-4-vaer-id-4651312
"Vestergade, 8600 Silkeborg  - 2. sal",7.150 kr.,500 kr.,75 m²,2,2.,Lejlighed,Nej,Nej,Nej,Nej,Nej,Nej,Ja,Ja,E,"Nyrenoveret lejlighed centralt beliggende på gågaden i Silkeborg. Egen altan samt fælles tagterrasse. Cykelkælder. Mulighed for leje af depot samt P-plads. Eventuel mulighed for tidligere indflytning.
Internet incl. i lejen.",https://www.boligportal.dk/lejligheder/silkeborg/75m2-2-vaer-id-5213820
"Helgolandsgade, 6400 Sønderborg  - 1. sal",8.200 kr.,0 kr.,120 m²,3,1.,Lejlighed,Nej,Nej,Nej,Nej,Nej,Nej,Ja,Nej,B,"Virkelig lækker lejlighed med god beliggenhed i den første del af Helgolandsgade.

Lejligheden har en god indretning med entre, god størrelse toilet hvor der er plads til vaskemaskine og tørretumbler. Dejligt køkken i åben forbindelse til alrum samt stue. Her er godt lysindfald samt udgang til altan. Endvidere et værelse, soveværelse samt badeværelse.

Der er ikke anført noget aconto til denne lejligheden da alt forbrug afregnes direkte med forsyningsselskaberne.

En rigtig fin lejlighed som bør ses.",https://www.boligportal.dk/lejligheder/s%C3%B8nderborg/120m2-3-vaer-id-5367977
"Vesterbro, 9000 Aalborg, Aalborg  - Stuen",6.685 kr.,1.057 kr.,79 m²,3,Stuen,Lejlighed,Nej,Nej,Nej,Ja,Ja,Nej,Ja,Nej,B,"3 værelses bolig på 79 kvm. Boligen består af køkkenalrum, badeværelse og 2 værelser. Fra stuen er der udgang til altanen. Boligen er tæt placeret i Vestbyen tæt på AKKC og Kildeparken. Der er flere indkøbsmuligheder lige i nærheden. 

Det er ikke tilladt at have hverken hund eller kat i boligen. 

𝐁𝐨𝐥𝐢𝐠𝐞𝐧 𝐮𝐝𝐥𝐞𝐣𝐞𝐬 𝐚𝐟 𝐞𝐧 𝐚𝐥𝐦𝐞𝐧 𝐛𝐨𝐥𝐢𝐠𝐨𝐫𝐠𝐚𝐧𝐢𝐬𝐚𝐭𝐢𝐨𝐧, 𝐡𝐯𝐢𝐥𝐤𝐞𝐭 𝐠𝐢𝐯𝐞𝐫 𝐝𝐢𝐠 𝐞𝐧 𝐫æ𝐤𝐤𝐞 𝐟𝐨𝐫𝐝𝐞𝐥𝐞:
• Du har mulighed for at søge indskudslån eller enkeltydelse til din bolig
• Du bliver en del af et beboerdemokrati, hvor alle beboere kan få indflydelse på de sociale og fysiske omgivelser i boligorganisationen.
• Vi har dygtige ejendomsfunktionærer, der kan tage hånd om eventuelle problemer i din bolig.
• Vi har faste kontoråbningstider, så du altid kan få svar på eventuelle spørgsmål.
• Huslejen afspejler de faktiske udgifter. Vi må som almen boligorganisation ikke generere et overskud.
• Når du har boet i en almen bolig i 8 år og 4 måneder, kan du få dækket 100% af normalistandsættelsen af boligen ved fraflytning. 
Du optjener nemlig 1% til normalistandsættelse pr. måned du bor der. Normalistandsættelse = maling af loft og vægge.
• Ved fraflytning tilbyder vi et gratis forsyn, hvor en ejendomsfunktionær vil gennemgå din bolig sammen dig, så du kan få gode råd til at undgå uforudsete regninger.

Billederne er eksempler på, hvordan boligerne i den pågældende boligafdeling ser ud – De enkelte boligers indretning kan variere",https://www.boligportal.dk/lejligheder/aalborg/79m2-3-vaer-id-5367152
"Vester Altanvej, 8900 Randers, Randers C  - 1. sal",6.247 kr.,1.000 kr.,99 m²,3,1.,Lejlighed,Nej,Nej,Nej,Nej,Nej,Nej,Ja,Nej,N/A,"Lejemålet er beliggende på Vester Altanvej og består af 3 værelser samt køkken og bad. Lejemålet er 99 m2 og er klar til overtagelse snarest. Månedlig husleje er 6247 kr. og forudbetalt husleje og depositum beløber sig til i alt 24989 kr. 

Send en besked, hvis lejemålet har fanget din interesse.",https://www.boligportal.dk/lejligheder/randers/99m2-3-vaer-id-5358586
"Bredgade, 6920 Videbæk",5.200 kr.,1.000 kr.,96 m²,4,-,Lejlighed,Nej,Nej,Ja,Nej,Nej,Nej,Nej,Nej,N/A,"Flot, lys og stor lejlighed beliggende Bredgade  i Videbæk udlejes.
Lejligheden består af to stuer adskilt af en flot fransk fløjdør, køkken, soveværelse, børeneværelse og flot badeværelse.
I baggang er der plads til vaskemaskine og tørretumbler og  udgang til stor og nem have.
En rigtig flot lejlighed med højt til loft, som jeg gerne viser frem.",https://www.boligportal.dk/lejligheder/videb%C3%A6k/96m2-4-vaer-id-2499050
"Østergade, 5874 Hesselager",7.400 kr.,1.900 kr.,142 m²,5,-,Lejlighed,Nej,Ja,Nej,Nej,Nej,Nej,Ja,Ja,N/A,"Stor lækker  vær lejlighed i Hesselager
Stort nyere køkken med spiseplads. 
3 sammenhængende stuer, med adgang til have/terrasse. 
1 sal. 
2 børneværelse og 1 soveværelse. 
Stort badeværelse med brus og kar. 

Egen carport, tæt på off transport og indkøb.",https://www.boligportal.dk/lejligheder/hesselager/142m2-5-vaer-id-5016646
"Apisvej, 8381 Aarhus, Tilst",11.600 kr.,0 kr.,102 m²,4,-,Rækkehus,Nej,Ja,Ja,Nej,Nej,Nej,Ja,Ja,A,"På Honningvænget og Apisvej i Tilst tæt på by og natur udlejer vi 41 moderne kvalitetsrækkehuse. Lejemålene er alle på 4- til 5-værelser i to-plans boliger med et boligareal på 102-128 m2. Projektet hedder Blomsterhaven, og er et helt nyt og populært bolig område i Tilst. Der er p.t. få ledige lejemål. 

Alle rækkehusene i Blomsterhaven fremstår lyse og lækre med gulv til loft-vinduespartier i stuen. Dette komplimenteres af det lyse tegl, som beklæder boliger udvendigt, og giver dem et moderne look.

INDE: 
Rækkehusene fremstår store og lyse såvel ude som inde. I stueplan finder du husets stue samt store køkken-alrum med køkken af høj kvalitet fra Svane Køkkenet og hvidevarer fra Siemens. Der er ligeledes et toilet i stueplan. På første sal er der 3 separate værelser samt boligens rummelige badeværelse.

NB: Billederne er ikke fra det eksakte lejemål, men giver en ide om materialevalg og lignende. 

UDE:
Ejendommene er opført i lyse tegl og har store vinduespartier, herunder gulv-til-loft vinduer i stuen og ovenlysvinduer på 1. sal.

Foran rækkehusene er der et udendørs areal, som giver god plads til både at parkere bilen og sætte cykler. Der er desuden adgang til dit eget, store og praktiske opbevaringsskur. 

Bag rækkehusene findes en privat, flisebelagt terrasse, som der er udgang til fra stuen.

HÅRDE HVIDEVARER:
Alle lejligheder indeholder køle- og fryseskab, opvaskemaskine, indbygningsovn, indbygningskogeplader med induktion samt emhætte, vaskemaskine og tørretumbler.

OPVARMNING:
Der er gulvvarme i alle rum, hvilket giver et behageligt indeklima, og som ikke mindst er godt for varmeregningen.

PARKERING:
Du får parkering lige udenfor døren til én bil og cykler. Der er ligeledes flere parkeringspladser tilgængelige i området.

HUSDYR:
Katte: Lejere kan ansøge om tilladelse til at holde én indekat på adressen. Udekatte er ikke tilladt.
Hunde: Lejere kan ansøge om tilladelse til at holde hund.
Andre dyr: Kontakt os for vores samlede husdyrsregler.

OM OMRÅDET
Rækkehusene i Blomsterhaven ligger perfekt placeret for dig, der vil nyde godt af Aarhus’ mange fristelser og tilbud, men som også gerne vil nyde roen, når dagen er omme. Lige udenfor Blomsterhaven finder du to busstoppesteder, der kører til og fra Aarhus C flere gange i timen. Turen tager kun et kvarter, og så står du på Strøget. Har du bil, kan turen klares på 10 minutter. De friske kan også trille ud på den nybyggede Supercykelsti, som tager dig direkte mod blandet andet centrum og universitetet på knap 15 minutter.

I en radius af 1,5 km finder du flere dagligvarebutikker, og uanset om du er til fitness eller shopping, så finder du også butikker og Fitness World i samme afstand. Endelig har du 7-Eleven, McDonalds med flere til at stille den hurtige sult kun 400 meter fra boligområdet, ligesom du i behagelig gåafstand har en legeplads.

Som pendler får du det nemt med kun 3,5 km til E45 motorvejsafkørsel, som hurtigt fører dig til Skanderborg, Silkeborg og Randers.

Afstande til:

100 meter til ny Rema 1000
200 meter til bus
400 meter til McDonald’s
400 meter til 7-Eleven
500 meter til legeplads
2,5 km til Bilka
3,5 km til motorvej E45
7,5 km til Aarhus C",https://www.boligportal.dk/r%C3%A6kkehuse/aarhus/102m2-4-vaer-id-5290766
"Ankomstsporet, 8930 Randers, Randers NØ  - 4. sal",7.900 kr.,600 kr.,87 m²,2,4.,Lejlighed,Nej,Nej,Ja,Ja,Nej,Nej,Ja,Ja,A,Lys og virkelig godt indrettet lejlighed med udsigt over Randers By samt Fjorden. Mulighed for at have hund,https://www.boligportal.dk/lejligheder/randers/87m2-2-vaer-id-5353113
"Holme Parkvej, 8270 Aarhus, Højbjerg",4.400 kr.,4.400 kr.,25 m²,2,-,Værelse,Nej,Nej,Nej,Nej,Nej,Nej,Nej,Nej,N/A,"2 sammenhængende Værelser i rækkehus i Højbjerg udlejes, 
adgang til dejlig fælles stue,køkken,badeværelse,
gæstebadeværelse samt adgang til have. 
I huset bor der kun 2 unge mænd…så  hvis du mangler et stille og roligt sted at bo, så skriv.. Tæt ved bus nr. 13 og bus 6A. 
Skriv for flere oplysninger.",https://www.boligportal.dk/v%C3%A6relser/aarhus/25m2-2-vaer-id-5216393
"Viften, 2670 Greve  - Stuen",15.400 kr.,1.400 kr.,114 m²,5,Stuen,Lejlighed,Nej,Nej,Ja,Nej,Ja,Nej,Nej,Ja,N/A,"UNDERSKRIV LEJEKONTRAKT PÅ EN BOLIG PÅ MINIMUM 84 KVM I JULI/AUGUST OG BETAL 0 KR FOR FØRSTE MÅNEDS LEJE!

Solviftens lejligheder er moderne indrettede og veludnyttede. Du får en nyopført, energioptimeret bolig, som er lige til at flytte ind i. Store vinduespartier sikrer masser af lys i boligen. Gulvene er i eg-laminat og derudover er der klinker i entre og badeværelse.",https://www.boligportal.dk/lejligheder/greve/114m2-5-vaer-id-5367354
"Allerød Stationsvej, 3450 Allerød  - 1. sal",12.900 kr.,1.000 kr.,114 m²,4,1.,Lejlighed,Nej,Ja,Nej,Nej,Nej,Nej,Nej,Ja,B,"Med fin beliggenhed tæt på offentlig transport og indkøbsmuligheder, ligger denne lyse, næsten nyrenoverede lejlighed (fra 2019) på 1. sal i en rolig ejendom.
Lejligheden indeholder:
Stor lys stue i forbindelse med åbent køkken (med alle hvidevarer), stort soveværelse, 2 mindre værelser, stor lys hems med mange muligheder. 
Desuden p-kælder.",https://www.boligportal.dk/lejligheder/aller%C3%B8d/114m2-4-vaer-id-5378640
