Adress,Monthly rent,Aconto,Square meters,Rooms,Floor,Property type,Furnished,Shareable,Pets allowed,Elevator,Senior frendly,Only for students,Balcony/Terrace,Parking,Energy label,Description,Link
"Kirkebjerg Tværvej, 2605 København, Brøndby  - Stuen",11.850 kr.,995 kr.,90 m²,4,Stuen,Lejlighed,Nej,Nej,Ja,Ja,Ja,Nej,Ja,Ja,N/A,"156 lejeboliger fordelt på 2-, 3- eller 4-værelses lejligheder. 

Den nyligt opførte rødstensejendom præsenterer sig flot i nabolaget med store vinduespartier, grå detaljer og glasafskærmede altaner, der har en behagelig afstand imellem sig. Alle lejligheder fremstår med regulære værelser, lyse stuer, pæne køkkener og rummelige badeværelser, og når først gårdhavemiljøet er færdiganlagt, får I endnu flere udendørsarealer til rådighed. 

I bosætter jer i et nyetableret kvarter, hvorfra I får korte afstande til alle hverdagens fornødenheder - og det gælder alt fra skolefaciliteter, dagtilbud og indkøbsmuligheder, som tæller både Rema1000, SuperBrugsen, Lidl og Netto. Glostrup Station er ligeledes inden for nær rækkevidde, og her kan I komme til Indre By med S-toget på cirka 20 minutter. Det er derfor ganske nemt at pendle til og fra Indre By, hvilket gør denne adresse ekstra attraktiv. I kommer ligeledes hurtigt til Høje Taastrup, hvorfra regionaltogene fører jer videre rundt på Sjælland. Derudover tager det under fem minutter i bil at komme på motorvejsnettet

Der er 94 parkeringspladser i parkeringskælderen + 62 parkeringspladser i terræn. En parkeringsplads kan lejes for 300 dkk pr. måned i terræn og 350 dkk i parkeringskælderen. Der opsættes tilmed 2 el-lade standere, således at der kan oplades 4 elbiler ad gangen. 

Alle hårde hvidevarer der forefindes i prøveboligen medfølger i alle lejlighederne.

Der er Stofa fibernet og boligerne opvarmes med fjernvarme.

Lejlighederne kan reserveres ved at deltage på åbent hus. Vi holder åbent hus ca. én gang om ugen indtil alt er udlejet. 

Ønsker du at deltage i det åbne hus, så kan du sende en besked via annoncen og modtage en invitation til det næstkommende åbne hus. 

Indflytningsprisen skal betales umiddelbart efter modtagelsen af lejekontrakten. 

Det vil ikke være muligt at besigtige andre boliger end prøveboligen inden indflytning og det er under ingen omstændigheder tilladt at opholde sig på byggepladsen uden en invitation til åbent hus. 

Billeder, plantegning og tekst er vejledende. 

Hvis du er registreret i RKI kan vi desværre ikke tilbyde dig lejligheden. Dette kontrolleres ved udarbejdelse af lejekontrakt.",https://www.boligportal.dk/lejligheder/k%C3%B8benhavn/90m2-4-vaer-id-5351270
"Østerbro, 9800 Hjørring",4.625 kr.,1.200 kr.,95 m²,4,-,Lejlighed,Nej,Ja,Ja,Nej,Nej,Nej,Nej,Nej,N/A,"Lejligheden er centralt beliggende  og er med lukket have/ drivhus/skur .
Der er direkte adgang til haven.
Der er kælder med plads til vaskemaskine og opbevarings muligheder.
Egen indgang.",https://www.boligportal.dk/lejligheder/hj%C3%B8rring/95m2-4-vaer-id-3001460
"Børglumvej, 8240 Aarhus, Risskov  - 2. sal",8.600 kr.,700 kr.,60 m²,3,2.,Lejlighed,Nej,Ja,Nej,Ja,Nej,Nej,Ja,Ja,N/A,"Velkommen til Børglumvej 9's nyopførte lejligheder i Risskov.

Her kan du bo i en af de svanemærkede lejligheder, der er fyldt med stilrene og bæredygtige kvalitetsløsninger. De perfekte rammer for et dejligt hjem i attraktive Risskov. De 30 lejligheder fordeler sig på 2- og 3-værelses boliger på mellem 44 og 66 kvm.

Stilrent materialevalg - både inde og ude
Boligerne er tegnet af Luplau & Poulsen Arkitekter, og bygningen fremstår skarp, enkel og moderne. Facaden er holdt i lyse nuancer og altanernes forskudte placering skaber et varieret og levende udtryk.

Træd indenfor i de indbydende lejligheder, der med sin velindrettede plantegning skaber gode muligheder for at sætte dit eget præg. I lejlighedens hjerterum – køkkenalrummet - finder du det veludstyrede HTH-køkken, der byder på alt i hårde hvidevarer. Badeværelset har en god størrelse med bruseniche og stilrene elementer. Boligerne har enten egen altan, fransk altan eller terrasseområde, mens der er elevator i bygningen og vaskeri i kælderen.

Svanemærket skaber sunde og behagelige rammer
Sætter du pris på bæredygtige materialer og et sundt indeklima? På Børglumvej 9 er boligerne svanemærkede, hvilket betyder at lejlighederne lever op til en række skrappe miljøkrav. Det betyder også, at de materialer, der er brugt i lejeboligen, er af gedigen kvalitet og opfylder kravene til f.eks. miljø- og sundhedsskadelige stoffer i alle boligens aspekter.

Høj kvalitet og bæredygtige valg
Imens Børglumvej 9 blev opført, blev hele byggeriet gennemgået af en uvildig tredjepart for at sikre at boligerne lever op til Svanemærkets strenge miljø- og kvalitetskrav. Det betyder blandt andet også, at der er et lavere energiforbrug til gavn for både dig og miljøet.
Svanemærket sikrer dejlige boliger, med stort lysindfald og et sublimt indeklima.

10 minutter på cykel til parker, skov og strand
Bo i attraktive Risskov - et aktivt og indbydende område nord for Aarhus. Her bor du tæt på byens puls med kun 15 minutters cykeltur til Aarhus centrum, hvor du finder mange butikker, caféer og restauranter. Riis Skovs rolige skovstier ligger også kun 2 km væk og på bare 10 minutter på cykel kan du komme til Den Permanentes lækre sandstrand.Udnyt også den gode infrastruktur i området, hvor busserne kører ofte og letbanens to ruter får dig til midtbyens liv – kun 5 minutter væk på cykel.",https://www.boligportal.dk/lejligheder/aarhus/60m2-3-vaer-id-5368879
"Merkurvej, 8800 Viborg  - 1. sal",1.830 kr.,407 kr.,21 m²,1,1.,Værelse,Nej,Nej,Nej,Nej,Nej,Ja,Nej,Nej,N/A,"Lejemålet er beliggende på Merkurvej, er 21 m2 og er klar til overtagelse 15-08-2023. Månedlig husleje er 1830 kr. og indskud beløber sig til 2240 kr. 

Send en besked, hvis lejemålet har fanget din interesse.
For at kunne leje denne bolig, kræver det man er medlem af boligforeningen. På BoligPortal annonceres kun reelt ledige boliger uden eksisterende venteliste på annonceringstidspunktet. Venligst kontakt udlejer hvis du er interesseret i lejemålet.",https://www.boligportal.dk/v%C3%A6relser/viborg/21m2-1-vaer-id-5268546
"Østergade, 7400 Herning  - 2. sal",6.800 kr.,1.100 kr.,89 m²,3,2.,Lejlighed,Nej,Ja,Nej,Nej,Nej,Nej,Ja,Ja,N/A,"Moderniseret lejlighed centralt i Herning med nyt badeværelse.
 
Leder du efter en herskabelig fornemmelse i form af 2 sammenhængende opholdsrum med dobbelte døråbninger og med udgang til en sydvendt altan, samt ét moderniseret badeværelse, så kigger I på jeres nye hjem.
 
Lejligheden rummer 3 værelser og ved ankomst åbenbare entréen med et gangareal der åbner til samtlige rum i boligen. Køkkenet er særskilt, så du kan anvende samtlige kvadratmeter i spise- og dagligstue, hvor der fra spisestuen er direkte udgang til altanen igennem dobbelt udadgående altandøre. Badeværelset med bruseniche rummer alt hvad I behøves og fra soveværelset er det kun fuglefløjt fra baggårdens træer som forstyrrer nattesøvnen. 
 
Fra køkkenet er der adgang til bagtrappen som snor sig ned til kælderen og loftrummene, samt den hyggelige gårdhave. Bilen kan parkeres bag gårdhaven og får I gæster har de adgang til Danmarksgade P-plads via en smøg lige overfor hovedindgangen. 
 
Informationer:
•	89 m²
•	3 værelser
•	1 badeværelse
•	1 sydvendte altaner
•	1 depotrum i kælder
•	Fælles tørrerum i kælder
•	Fælles vaskerum med egen vaskemaskine i kælder
•	Fælles cykelskur i gårdhaven

Billeder er fra nabolejlighed, planløsningen er dog identisk.",https://www.boligportal.dk/lejligheder/herning/89m2-3-vaer-id-5355820
"Dalgas Avenue, 8000 Aarhus, Aarhus C  - 5. sal",10.200 kr.,700 kr.,58 m²,3,5.,Lejlighed,Nej,Ja,Ja,Ja,Nej,Nej,Ja,Ja,A,"Denne 3-værelses lejlighed har beliggenhed i den nyopførte ejendom, Colosseum. Colosseum har Frederiksbjergs bedste placering, syv fælles tagterrasser med en fantastisk udsigt, et unikt gårdmiljø med grønne områder, hængekøjer og orangeri.

Lejligheden består af et stort køkken alrum, et badeværelse og to soveværelser. Dette gør den ideel både til dem, der ønsker at dele, eller til dem, der ønsker plads til hjemmekontoret.  Der er opvaskemaskine, køle-/fryseskab, kombi tørre-/vaskemaskine i lejligheden. 

Det er muligt at tilkøbe en parkeringsplads for 1250kr/måned i parkeringskælderen. Med parkeringspladsen tilhører et depotrum.

Vi glæder os til at høre fra dig og evt. tilbyde dig en fremvisning!

Med venlig hilsen
Jessica",https://www.boligportal.dk/lejligheder/aarhus/58m2-3-vaer-id-5364435
"Vilhelm Ehlerts Alle, 8800 Viborg  - 2. sal",8.950 kr.,N/A,115 m²,3,2.,Lejlighed,Nej,Ja,Nej,Ja,Nej,Nej,Nej,Ja,N/A,"Lejligheden er nyopført og i kvalitetsmaterialer. Dejlig lyst lejemål med Banebyparken lige udenfor døren. Lejligheden byder på en fin entre, en stue med et moderne køkken fra TVIS med intregreret køle/frys ny ovn, og opvaskemaskine. Lejligheden er i 2. plans og har to gode værelser på 1. etage. Værelserne er med trådløs varmetermostat til regulering af gulvvarme samt Genvex så der er et godt indeklima. Badeværelse er udstyret med gulvvarme, pæne mørke klinker, ny vaskemaskine og en tørretumbler. Der er egen p-kælder – lige under din egen bolig hvor du trygt kan parkere din bil og cykel. Der er dørtelefon og et fint opbevaringsrum i kælderen. I Banebyen forbinder natur og by og skaber rum til både ro og afslapning samt til leg og fællesskab. Et grønt og trygt mødested for alle aldersgrupper. Her er masser af luft og lys og plads til at være sig selv og nyde roen - midt i byen.",https://www.boligportal.dk/lejligheder/viborg/115m2-3-vaer-id-5359372
"Havtornvej, 2640 København, Hedehusene  - 3. sal",11.800 kr.,1.160 kr.,96 m²,4,3.,Lejlighed,Nej,Nej,Ja,Ja,Ja,Nej,Ja,Ja,A,"Lys og rummeligt indrettet 3V lejlighed i Bøgen, hvor du har både byens bekvemmeligheder og naturen lige ved hånden. Bøgen ligger i Søkvarteret, som opføres i den nye bydel, Nærheden, der ligger som en oase mellem Roskilde og Taastrup.",https://www.boligportal.dk/lejligheder/k%C3%B8benhavn/96m2-4-vaer-id-5366637
"Karen Schacks Vej, 2800 København, Kongens Lyngby  - 1. sal",18.495 kr.,450 kr.,125 m²,4,1.,Lejlighed,Nej,Ja,Ja,Nej,Nej,Nej,Nej,Ja,N/A,"Boligtype C2 henvender sig til mange familietyper med god plads både oppe og nede. Dejligt lyst alrum udstyret med flot HTH-køkken og hårde hvidevarer fra Siemens.

Gæstebadeværelse i stueplan samt tre værelser og badeværelse på 1. sal. Boligen er lys med store vinduespartier, gulvvarme og indbyggede skabe.

Trongårdens lejeboliger er alle svanemærkede og har adgang til hyggelige, grønne fællesarealer.",https://www.boligportal.dk/lejligheder/k%C3%B8benhavn/125m2-4-vaer-id-5370213
"Hundtofte, 5771 Stenstrup",6.900 kr.,500 kr.,138 m²,6,-,Lejlighed,Nej,Nej,Nej,Nej,Nej,Nej,Ja,Ja,E,Istandsat lejlighed i stuehus. Nyt bad og køkken. God varmeøkonomi pga topisolering. Ligger i landbymidte - med nænsom trafik.  Stor have med græs. 10 minutter fra Svendborgmotorvej. Kom og få et kig. Istandsat for 250.000 - 300.000. Et besøg værd.,https://www.boligportal.dk/lejligheder/stenstrup/138m2-6-vaer-id-3534590
"Christiansgade, 9000 Aalborg, Aalborg  - 3. sal",5.295 kr.,850 kr.,51 m²,3,3.,Lejlighed,Nej,Nej,Nej,Nej,Nej,Nej,Nej,Nej,N/A,"Bylejligheden fremtræder charmerende og indbydende. Fra entreen træder du direkte ind i den store, åbne stue. Her har du rig mulighed for at have et stort sofaarrengement eller hvad end du har lyst til! Fra stuen går man ind i lejlighedens spisestue, som er perfekt indrettet til et spisebordssæt. Her der der igen mulighed for at have et stort spisebord, med plads til mange gæster.

Køkkenet fremstår fint og brugbart, og indeholder alt det nødvendige. Badeværelset er stort og lyst med en god brusniche og rig mulighed for en masse opbevaring. Til sidst går vi ind i det bagerste værelse – soveværelset, hvor der er fin plads til en store seng og opbevaringsplads.
Til ejendommen er der cykelparkering.
Leje nr : 1214OABS",https://www.boligportal.dk/lejligheder/aalborg/51m2-3-vaer-id-5360455
"Søparken, 8722 Hedensted",8.259 kr.,1.200 kr.,103 m²,3,-,Lejlighed,Nej,Ja,Nej,Ja,Ja,Nej,Ja,Ja,N/A,"Velindrettet lys og stilren stuelejlighed med udsigt til skov og natur. 

Den store lyse stue er i åben forbindelse med køkkenet, hvor der er god plads til både sofa- og spisearrangement. Der findes indbyggede skabe samt god skabsplads i bryggers, med plads til installering af vaskemaskine og tørretumbler. 

Hele lejemålet har gulvvarme.

Fra stuens store glaspartier er der udgang til den yderst rummelige terrasse på ca. 20 m².

Til lejligheden hører skur og parkeringsplads. 
Søparken har gode fællesarealer og ligger tæt på centrum, skole, idrætsliv samt bus og tog. Rundt om Søparken findes stisystemer med mulighed for hyggelige gåture.

Billederne er fra en lignende lejlighed i bebyggelsen.",https://www.boligportal.dk/lejligheder/hedensted/103m2-3-vaer-id-5365856
"Holstebrovej, 7800 Skive  - 1. sal",5.466 kr.,1.168 kr.,83 m²,3,1.,Lejlighed,Nej,Nej,Nej,Nej,Nej,Nej,Nej,Nej,N/A,"Lejemålet er beliggende på Holstebrovej og består af 3 værelser samt køkken og bad. Lejemålet er 83 m2 og er klar til overtagelse snarest. Månedlig husleje er 5466 kr. og indskud beløber sig til 10900 kr. 

Send en besked, hvis lejemålet har fanget din interesse.
For at kunne leje denne bolig, kræver det man er medlem af boligforeningen. På BoligPortal annonceres kun reelt ledige boliger uden eksisterende venteliste på annonceringstidspunktet. Venligst kontakt udlejer hvis du er interesseret i lejemålet.",https://www.boligportal.dk/lejligheder/skive/83m2-3-vaer-id-5365737
"Emma Gads Vej, 2300 København, København S  - 3. sal",14.000 kr.,800 kr.,76 m²,3,3.,Lejlighed,Nej,Ja,Ja,Ja,Ja,Nej,Ja,Ja,A,"Velkommen til boligen
BEMÆRK VENLIGST:
Ejendom med butikker og lejligheder boligen er tegnet af Praksis Arkitekter og er kendetegnet ved sin lyse teglkonstruktion med forskellige stentyper, som skaber spil i facaderne og giver bygningen sit eget unikke udtryk. I byggeriets stueetage finder du butikker, cafeer samt bydelens kultur- og beboerhus, mens resten af ejendommen indeholder private boliger.
Lyse og moderne boliger Fra 1. sal består boligen består af 2-4-værelses lejligheder. I alle boliger er der taget udgangspunkt i at sikre gode dagslysforhold og fleksible indretningsmuligheder til de primære opholdsrum. Materialerne i boligerne er lyse, og køkkenet er hvidt og moderne fra Invita.
Indbydende gårdrum Midt i boligen er der skabt et stort grønt gårdrum med plads til ophold og leg. Gårdrummet får tæt beplantning med forskellige græsser, buske og træer og i den nordøstlige del placeres en legeplads med omkringliggende bænke. Midt i gårdrummet er der mulighed for at aflevere sit affald i affaldsstandere, som omkranses af en pergola med klatreplanter.
Husdyr: Kan ansøges
*Bemærk at billederne ikke nødvendigvis er taget af/fra den pågældende lejlighed, og at udsigt m.v. derfor kan variere.",https://www.boligportal.dk/lejligheder/k%C3%B8benhavn/76m2-3-vaer-id-5347125
"Strandvejen, 9000 Aalborg, Aalborg  - 3. sal",7.600 kr.,850 kr.,73 m²,2,3.,Lejlighed,Nej,Nej,Nej,Nej,Nej,Nej,Ja,Nej,A,"Lækker New-Yorker lejlighed beliggende i Aalborg vestby.

Lejligheden indeholder éntre, soveværelse, badeværelse og et indbydende køkken-alrum. Lejlighedens stil er inspireret af et industrielt boligkvarter i Brooklyn, New York i form af rå detaljer som pudsede lofter og fritliggende rør som skaber en rustik atmosfære i boligen. Mellem stue og soveværelse er der en stor vinduesvæg, som får pladsen til at synes større og giver et godt lysindfald i lejligheden.

I lejligheden er der et minimalisk køkken, der også er udført i et industrielt look med indbyggede hvidevarer i form af opvaskemaskine og køle/frys. Ydermere er der indbygningsovn, kogeplade samt emhætte. Der er i lejligheden også vaskemaskine og tørretumbler.

Lejlighedens badeværelse er lækkert lys med gulvvarme samt vask med skabsarrangement. Der er stort garderobeskab i soveværelset. Gulvene i lejligheden er belagt med vinyl i trælook.

N. B. Billeder er fra prøvelejlighed.",https://www.boligportal.dk/lejligheder/aalborg/73m2-2-vaer-id-4938779
"Klostergade, 6000 Kolding  - 2. sal",10.083 kr.,1.130 kr.,114 m²,3,2.,Lejlighed,Nej,Ja,Ja,Nej,Nej,Nej,Nej,Nej,N/A,"Lejemålet er beliggende på Klostergade, er 114 m2 og er klar til overtagelse. Månedlig husleje er 10083 kr. og indskud beløber sig til i alt 30000 kr. Send en besked, hvis lejemålet har fanget din interesse.",https://www.boligportal.dk/lejligheder/kolding/114m2-3-vaer-id-5306653
"Honningvænget, 8381 Aarhus, Tilst  - Stuen",9.900 kr.,750 kr.,91 m²,3,Stuen,Lejlighed,Nej,Nej,Ja,Nej,Nej,Nej,Ja,Nej,N/A,"Honningvænget & Pollenvænget består af 110 lejelejligheder beliggende ved det tidligere GASA i Tilst. Lejlighederne findes med 2-5 værelser og i størrelserne 63-132 m2. Der kan vælges imellem en række forskellige boligtyper, der varierer i størrelse, værelser og planløsninger.

Alle boliger har tilhørende kælderrum på 2 kvadratmeter og der er fællesparkering i området, samt cykelparkering i gården og kælderen. Derudover har alle boligerne enten altan eller terrasse og beboerne kan også nyde godt af en gårdhave og et fælles opholdsareal i området.

Det er muligt at få godkendelse for op til to husdyr.

De lyse boliger er tidløst indrettet, med hvide vægge og loft. Køkken og stue er i ét og skaber derfor et hyggeligt samlingspunkt i boligen. Badeværelset har grå klinker og resten af boligen har lyse laminatgulve, med egetræslook. Der er desuden gulvvarme i alle rum.

Der er faste hvide HTH-elementer i boligen, så den er lige til at flytte ind i. Et ventilationsanlæg sikrer alle boligerne et godt indeklima og de kvalitetsmaterialer der er anvendt, er nemme at holde.",https://www.boligportal.dk/lejligheder/aarhus/91m2-3-vaer-id-5287441
"Åparken, 9000 Aalborg, Aalborg  - 5. sal",7.355 kr.,660 kr.,58 m²,2,5.,Lejlighed,Nej,Nej,Nej,Ja,Nej,Nej,Ja,Ja,N/A,"Lyse lejeboliger i naturskønne omgivelser med stor solrig altan

Østeråparken byder på 200 skønne lejeboliger på Godsbanen i Aalborg – en attraktiv ny bydel, der er skudt op blandt togskinner og lysmaster og nu byder på grønne oaser og på sigt den fritlagte Østerå.

Lejeboligerne er veldisponerede og indbydende med lyse trægulve og store vinduespartier fra gulv til loft, der lader dagslyset strømme ind.

De har indbyggede skabe, der gør det let at møblere dine værelser, og mange af dem er desuden indrettet med et ekstra 3 m2 opbevaringsrum i forlængelse af soveværelset, der er oplagt at bruge som walk-in-closet.

Hver bolig har sin egen store, solrige altan ­ eller terrasse i stueetagen – ud mod det hyggelige gårdmiljø og den kommende å. Altanerne er afskærmet med glas, der giver læ, udsigt og et elegant udtryk på én gang. For at sikre mere privatliv er en af siderne holdt i en varm, bruneret aluminium.

Østeråparken byder både på mindre 2- og 3-værelses lejligheder samt større 3-værelses lejligheder, der ud over altanen også har fransk altan i begge værelser. Der er altså plads til både børnefamilier, studerende, par og singler, hvilket skaber masser af liv og dynamik.

Ejendommen er endvidere beliggende tæt på offentlige transportmidler, som bus og tog. Herudover er ejendommen beliggende midt i Aalborg Centrum tæt på indkøbsmuligheder, Musikkens Hus, Nordkraft, grønne parker m.m.",https://www.boligportal.dk/lejligheder/aalborg/58m2-2-vaer-id-5370465
"Nørrevang, 7451 Sunds  - 1. sal",5.395 kr.,900 kr.,79 m²,3,1.,Lejlighed,Nej,Ja,Nej,Nej,Nej,Nej,Ja,Ja,D,"Total istandsat lejlighed på 79 kvm udlejes. Beliggende på Nørrevang i Sunds, 8 km. nord for Herning. 
Nyistandsat køkken, bad, fyldningsdøre, nye parketgulve osv. samt mulighed for at få installeret opvaskemaskine.
Dejlig stor altan. 
Vinduer med 3-lags glas. 
Stort fællesvaskeri med Miele vaskemaskiner og tørretumblere samt plads til sammenlægning af tøj, og tørrestativer i haven. 
Fælles grønne områder med græsplæne og træer. 
Gode parkeringsforhold. 
Overdækket cykelparkering. 
Ny servicebygning med eget stort og aflåst depotrum. 
Pavillon til 12 personer. 
Husdyr ikke tilladt. 
Fotos fra lignende lejlighed

Lejemålet har energimærket : D",https://www.boligportal.dk/lejligheder/sunds/79m2-3-vaer-id-3608059
"Nordre Strandvej, 3000 Helsingør  - 2. sal",14.950 kr.,N/A,110 m²,3,2.,Lejlighed,Nej,Ja,Ja,Ja,Nej,Nej,Ja,Ja,N/A,"**Velkommen til**

Boligerne er nyopført og skabt i moderne stil med robuste og vedligeholdelsesvenlige materialer i lyse og lette farver. 
Alle boliger har et lyst og lækkert køkken/alrum i åben forbindelse med et indbydende stuemiljø med udgang til enten terrasse eller altan.

Køkkenet er model Next fra HTH, der med sine enkle og rene linjer giver et tidsløst udtryk. De er udstyret med alt i hårde hvidevarer fra Siemens, herunder indbygningsovn, induktionskogesektion samt integreret opvaskemaskine og køle/fryseskab. Badeværelserne er lyse og moderne med brusenische, skabe, vask og gulvvarme. Det er også her I finder jeres egen vaskemaskine og tørretumbler. 
 
Der er gulvvarme overalt og elevator i alle opgange og derfor velegnede til alle aldersgrupper. Desuden har hver bolig eget rummeligt depotrum.

 _Bemærk at billederne er fra en prøvebolig._

 **Nænsomt restaureret hovedbygning**

Boligerne har udsigt til den gamle hovedbygning fra 1916, tegnet af arkitekt Poul Holsøe. Den har i sin tid været benyttet som en herskabsbolig med stueetage for repræsentation og ophold, samt 1. sal for soverum, tjenestefolk m.m.

Bygningen er nænsomt renoveret med respekt for den oprindelige arkitektur, hvor detaljer som f.eks. den bevaringsværdige hoveddør, kassetteloft, oprindelige snedkerarbejder og egetræstrappe til 1. sal er bevaret. 
Bygningen er nu omdannet og udgør 8 herskabslejligheder.

 **Pragtfuldt haveanlæg** 
Det stemningsfulde haveanlæg er oprindelig tegnet af landskabsarkitekt G.N. Brandt, og du vil ankomme ad indkørslen med den hyggelige høj med ældre store træer på venstre hånd foran hovedbygningen. Terrasser og altaner i den ene nye bygning støder op til dette område. 

Terrasser og altaner vender ud til haven mod sydøst, som anlægges med buske, frugttræer, skyggekroge, forskellige græssorter og grusstier. Området er ideelt for alle generationer. Her kan du nyde morgenmaden på terrassen eller lade børnene løbe frit omkring i trygge og sikre rammer. Der bliver anlagt parkering mellem de to nye bygninger samt i den ene side foran hovedbygningen.",https://www.boligportal.dk/lejligheder/helsing%C3%B8r/110m2-3-vaer-id-5377329
"Blåbærvej, 7500 Holstebro",9.800 kr.,0 kr.,110 m²,4,-,Hus,Nej,Nej,Ja,Nej,Ja,Nej,Nej,Ja,C,"1 plans villa med 1 soveværelse, 2 værelser og 1 stue. Stor stue og et funktionelt køkken. Have på 710 m2. 

Der kan gives tilladelse til husdyr.

Forbrug betales direkte til værkerne og er ikke inkluderet i huslejen.",https://www.boligportal.dk/huse/holstebro/110m2-4-vaer-id-5378075
"Gyvelvej, 7361 Ejstrupholm  - Stuen",3.380 kr.,725 kr.,44 m²,2,Stuen,Lejlighed,Nej,Nej,Nej,Nej,Nej,Nej,Nej,Ja,N/A,"2 værelses lejlighed til leje i Ejstrupholm
Egen terrasse 
44 m2
Gyvelvej 
Parkeringsplads
Vaskerum",https://www.boligportal.dk/lejligheder/ejstrupholm/44m2-2-vaer-id-5098351
"Sentvedvej, 5871 Frørup",5.900 kr.,0 kr.,99 m²,4,-,Hus,Nej,Ja,Nej,Nej,Nej,Nej,Ja,Ja,N/A,"Hus i Frørup udlejes. Huset er istandsat. indeholder 2 værelser og 1 kammer, samt 2 stuer og køkken med brændeovn. 
Dejlig have og indkørsel. Derudover er der 2 skure/værksted på lejemålet.",https://www.boligportal.dk/huse/fr%C3%B8rup/99m2-4-vaer-id-2222284
"Borgergade, 7860 Spøttrup",4.395 kr.,550 kr.,114 m²,5,-,Hus,Nej,Nej,Ja,Nej,Nej,Nej,Nej,Ja,N/A,"Klar til indflytning hvis man selv maler/renoverer lejemålet.
Rækkehus i midtbyen 100m fra alt.
Stueplan består af: Entre med adgang til gæste wc & stort bryggers/grovkøkken, opgang til 1. sal.
Stort køkken med spiseplads, 2 stuer, det ene er sænket et trin ned(evt. bruges til 1 værelse/legerum). 
1. sal 3 værelser i alt: 1 soveværelse i gavlen 2 værelser i  mellemgangen, badeværelse med bruser, toilet. 
Der er en stor garage på ca 40 m. Syd/østvendt terrasse og lille have med græsplæne.
Butikker 100m fra lejemålet:  Slagter-SuperBrugsen-Kro-pizzaria-skole m.m.
Skole/skovbørnehave i Rødding, der er godt 1 km. til Limfjorden med fin badestrand og spisesteder. 3 Busforbindelser (50m) med timedrift.
Rødding By kåret som Årets landsby 2012.
Opvarmes med lokalt fjernvarme. “Billigt”
Er også velegnet som.
Sms gerne for billeder.

Evt nyt køkken (HTH) ved mere husleje. 1200.- mere om mdr

OBS: Lejer må gerne selv male/renoverer lejemålet. Indskuddet/depositum er kun 1 mdrs. husleje hvis man selv renoverer/maler lejemålet.
Tager man lejemålet total renoveret med malerarbejde og nye gulvtæpper er indskuddet 3*husleje + 1 mdrs forudbetalt husleje.

Kan også lejes med forkøbsret. Til 368.000kr",https://www.boligportal.dk/huse/sp%C3%B8ttrup/114m2-5-vaer-id-1848546
"Nørregade, 6100 Haderslev  - 2. sal",5.300 kr.,900 kr.,83 m²,3,2.,Lejlighed,Nej,Nej,Nej,Nej,Nej,Nej,Nej,Nej,N/A,Centralt liggende lejlighed midt i Haderslev,https://www.boligportal.dk/lejligheder/haderslev/83m2-3-vaer-id-5351825
