Adress,Monthly rent,Aconto,Square meters,Rooms,Floor,Property type,Furnished,Shareable,Pets allowed,Elevator,Senior frendly,Only for students,Balcony/Terrace,Parking,Energy label,Description,Link
"Østre Havnepark, 9000 Aalborg, Aalborg  - 3. sal",9.495 kr.,600 kr.,90 m²,2,3.,Lejlighed,Nej,Nej,Ja,Ja,Nej,Nej,Ja,Nej,N/A,"Fjordtrappen er bygget indefra og ud.
Man er nemlig startet indvendigt og har fyldt hver lejlighed med solid kvalitet og lækre detaljer i alt fra hvidevarer og speciallavet køkken til behagelig gulvvarme i alle rum.
Lyse trægulve.
Grebsfri skabe.
Afstemte klinker.
Vi har tænkt over det hele.
Du får et Svane Køkken, der er tilpasset lejligheden med grebsfrie speciallåger og indbygget lys.
Og din madlavning bliver en del sjovere med den komplette hvidevarepakke fra Blomberg.
Dit nye badeværelse er designet med masser af plads og vaskesøjle fra Blomberg.
Og som lejlighedens højdepunkt har du lysindfaldet og udsigten – fra din altan kan du enten nyde kigget udover havnebassinet og fjorden eller udsigten indover byen.
Fakta om boligerne:

1-, 2-, 3- og 4-værelses lejeboliger
Køkken fra Svane Køkken
Opvaskemaskine
Hvidevarer fra Blomberg med indbygget ovn, induktionskogeplade, emhætte, køl/fryseskab, vaskemaskine og tørretumbler
Gulvvarme i alle rum med trådløs temperaturstyring
Mulighed for egen altan enten med fjordudsigt eller udsigt over Aalborg og sol hele dagen
Elevator til alle plan
Fælles tagterrasse, orangeri og grønne uderum
Depotrum i kælderen
Mulighed for at leje en p-plads med ladestander til el-bil

 
Alle lejligheder har et stort badeværelse.
Der er entre i de fleste boliger, og som en harmonisk rød tråd er lamper, vindueskanter, altaner, riste, postkasser og greb lavet i indfarvet metal med samme nuance.
Ydermere har de fleste lejligheder en skøn altan.
Udvendigt har bygningerne forskydninger, vinduesspring og forskellige højder, der skaber en dynamisk og spændende facade med ekstra meget sollys i lejligheder og gård.
Og det store grønne plateau ud mod Østre Havnebassin er skabt som en trappe, hvor du kan sætte dig ned – alene eller sammen med de andre – og nyde stemningen ved havnebassinet og det maritime, urbane liv.
På Østre havn finder du både specialbutikker, cafeer og byliv.
Meny og Lagkagehuset lokker med fristende delikatesser, IsVærftet serverer Ryå is året rundt, og Baco byder på baristakaffe og solide bagels.
Du kan gå på opdagelse mellem restaurerede pakhuse og siloer og nyde områdets spændende arkitektur og de skjulte kunstværker af lokale kunstnere.
Og du har hele Aalborg i baghaven.
Du kan på få minutter stå midt på gågaden eller nyde sommerens fredagsfester i Karolinelund.
Der er kun en kort slentretur til Musikkens Hus og Nordkraft, hvor du finder kunstudstillinger, koncerter, teater, biograf og restauranter.
Udsigten fra Fjordtrappen er ekstraordinær.
Som nærmeste nabo til havnebassinet og fjorden kan du ikke komme tættere på vandet.
Og uanset hvor du kigger hen, er udsigten fantastisk.
Overalt er der bænke, pladser og grønne området, så du kan sidde ned, slappe af og nyde fjordkigget.
Samtidig starter Aalborgs havnepromenade midt på Østre havn.
Her får du 4 kilometers uforstyrret gå- eller cykeltur ud til Vestre Fjordpark.
Hele turen går langs fjorden med vandet på din højre hånd og byen til venstre - forbi Musikkens Hus og havnefronten, Kulturbroen, Fjordbyen, lystbådehavnen og Aalborg Street Food.",https://www.boligportal.dk/lejligheder/aalborg/90m2-2-vaer-id-5353395
"Ringstedvej, 4440 Mørkøv",15.500 kr.,0 kr.,380 m²,10,-,Hus,Nej,Nej,Ja,Nej,Nej,Nej,Nej,Nej,N/A,"Torbenhøj er beliggende i et af Danmarks smukkeste herregårdslandskaber kun 50 minutter fra København ved enden af Kalundborgmotorvejen. Til Novo Nordisk i Kalundborg er køretiden ca. 22 minutter. 
Torbenhøj er en moderniseret 3-længet stråtækt ejendom med bindingsværk, beliggende I særdeles naturskønne omgivelser. Indkørsel til Torbenhøj sker via nyplantet lindeallé.

Til lejemålet er der en stor og hyggelig gammel have.  Huset er holdt i en rustik bondehusstil med synlige loftbjælker, planke-, parket- og klinkegulve samt 3 ildsteder og brændekomfur. Boligen er opdelt i 3 soveafdelinger med egne badeværelser. Torbenhøj er endvidere indrettet således, at boligen ved brug kan aflukkes i sektioner, således at man ikke behøver at bruge hele boligen året rundt.
Kort afstand til skov, skole og indkøbsmuligheder. 
Det er desuden muligt at ride i godsets skove, når man har indløst ridekort.
  
Torbenhøj vil være velegnet til børnefamilier eller lejere med ønske om kombineret bolig og erhverv. 
Leje kr. 15.500 pr. måned inkl. vand, skatter og offentlige afgifter. 

Skriftlig ansøgninger indeholdende person og erhvervsoplysninger fremsendes til udlejer.",https://www.boligportal.dk/huse/m%C3%B8rk%C3%B8v/380m2-10-vaer-id-500282
"Amaliegade, 8700 Horsens  - 4. sal",6.400 kr.,600 kr.,77 m²,2,4.,Lejlighed,Nej,Nej,Nej,Nej,Nej,Nej,Nej,Nej,N/A,"Hyggelig og rummelig kvistlejlighed med synlige bjælker. Lejligheden har tre franske altaner med udsigt over byen. Det store badeværelse, med god plads, med vaskemaskine/ tumpler. Fra det store køkken nydes udsigten over byens tage, køkkenet indeholder, komfur,køl/ frys samt opvaskemaskine, er på vej,   Dejligt lyst værelse med fransk altan. Over værelset er der en stor hems med plads til overnattende gæster.
Der er elevator i ejendommen samt depotrum i kælderen.  parkeringsplads. Fast viceret , der vasker trapperne.",https://www.boligportal.dk/lejligheder/horsens/77m2-2-vaer-id-4456913
"Else Sørensens Vej, 2610 København, Rødovre  - 3. sal",14.400 kr.,1.000 kr.,93 m²,4,3.,Lejlighed,Nej,Nej,Ja,Ja,Nej,Nej,Ja,Ja,N/A,"Velkommen til boligen
boligen samler 85 lejligheder, der lader livet blomstre i Rødovres nye bydel Gartnerbyen.
I boligen er der tænkt over alle de detaljer, du bliver glad for i hverdagen, og som gør, at du kan føle dig hjemme.
Noget af det første, du vil lægge mærke til er rummeligheden, de gode velindrettede værelser, flotte egetræsgulve, indbyggende skabe samt vaskemaskine og tørretumbler i boligerne. I boligen findes der flere forskellige planløsninger. Her er mulighed for at vælge mellem 2-4-værelses lejligheder, ligesom der også findes lejligheder med to toiletter.
Du kan leje:
- 2-værelses moderne lejligheder til parret
- 3-værelses lejligheder til den lille familie eller parret hvor børnene er flyttet hjemmefra
- 4-værelses lejligheder til de større familier
Med en lejlighed på 1. sal eller højere oppe får du din egen private altan, hvor du i stuen har adgang til en hyggelig terrasse. Alle altanerne har glas, så du får læ og en afskærmning, som gør, at du kan være privat. Boligerne i boligen er klar til indflytning pr. 15. november 2023
Derudover:
- Elevator i bygningen
- Depotrum i lejligheden
- Det er muligt at leje en p-plads i kælderen
Det med småt:
- Det er ikke tilladt at stå i RKI
- Husdyr skal godkendes af udlejer
- Bemærk, at billedmaterialet ikke nødvendigvis stammer fra den pågældende bolig.",https://www.boligportal.dk/lejligheder/k%C3%B8benhavn/93m2-4-vaer-id-5368454
"Michael Strunges Vej, 2300 København, København S  - 1. sal",12.950 kr.,800 kr.,78 m²,2,1.,Lejlighed,Nej,Ja,Ja,Ja,Ja,Nej,Ja,Ja,A,"Velkommen til boligen
BEMÆRK VENLIGST:
Ejendom med butikker og lejligheder boligen er tegnet af Praksis Arkitekter og er kendetegnet ved sin lyse teglkonstruktion med forskellige stentyper, som skaber spil i facaderne og giver bygningen sit eget unikke udtryk. I byggeriets stueetage finder du butikker, cafeer samt bydelens kultur- og beboerhus, mens resten af ejendommen indeholder private boliger.
Lyse og moderne boliger Fra 1. sal består boligen består af 2-4-værelses lejligheder. I alle boliger er der taget udgangspunkt i at sikre gode dagslysforhold og fleksible indretningsmuligheder til de primære opholdsrum. Materialerne i boligerne er lyse, og køkkenet er hvidt og moderne fra Invita.
Indbydende gårdrum Midt i boligen er der skabt et stort grønt gårdrum med plads til ophold og leg. Gårdrummet får tæt beplantning med forskellige græsser, buske og træer og i den nordøstlige del placeres en legeplads med omkringliggende bænke. Midt i gårdrummet er der mulighed for at aflevere sit affald i affaldsstandere, som omkranses af en pergola med klatreplanter.
Husdyr: Kan ansøges
*Bemærk at billederne ikke nødvendigvis er taget af/fra den pågældende lejlighed, og at udsigt m.v. derfor kan variere.",https://www.boligportal.dk/lejligheder/k%C3%B8benhavn/78m2-2-vaer-id-5363019
"Ågade, 9000 Aalborg, Aalborg  - Stuen",5.895 kr.,600 kr.,67 m²,2,Stuen,Lejlighed,Nej,Ja,Nej,Nej,Nej,Nej,Nej,Nej,N/A,"Højdepunkter:Flot nyrenoveret lejlighedPræsentabel beliggenhed i Aalborg centrumNyere og stilfuldt køkken med opvaskemaskine og kølefryseskabFlot badeværelse med moderne faciliteterDenne lejlighed præsenterer sig med en imponerende renovering, der kombinerer æstetik og funktionalitet på den mest forbløffende måde. DPlaceret i Aalborg centrum er beliggenheden af denne lejlighed en absolut fordel. Du vil have nem adgang til shopping, restauranter, kulturelle begivenheder og offentlig transport, der gør det nemt at udforske byen og alt, den har at tilbyde.Lejligheden ligger i en smuk ejendom med adgang til en hyggelig gårdhave.",https://www.boligportal.dk/lejligheder/aalborg/67m2-2-vaer-id-5372704
"Banevænget, 5672 Broby, Allested",8.450 kr.,0 kr.,104 m²,3,-,Rækkehus,Nej,Ja,Ja,Nej,Ja,Nej,Ja,Ja,N/A,"4 nyopførte boliger udlejes på Banevænget i Allested-Vejle med indflytning ca. 1. august. 

Få fremvist en færdig bolig ved henvendelse til Flemming Thomsen på tlf.

Alle 4 boliger er 3-værelses boliger, som rummer entre, køkken og stue i ét med udgang til egen terrasse samt mindre have, soveværelse, værelse samt badeværelse med brus.

Mindre udhus til hver bolig samt terrasse på hver side af boligen og mindre have.

Alt i hårde hvidevarer: Emhætte, induktionskogeplade, køle-/fryseskab, indb. ovn, opvaskemaskine, tørretumbler, vaskemaskine.

Billige at bo i !! Opvarmes ved luft til vand varmepumpe.

Boligerne er på 104 kvm. og 109 kvm.

Parkering ved boligerne.

Allested-Vejle er et aktivt lokalsamfund med bl.a. børnehave, skole, Dagli Brugs, idrætscenter med motionscenter, off. samt private dagplejere samt meget mere. Alt indenfor gå-afstand.

Mdl. Husleje for 104 kvm. kr. 8.450,00
Mdl. Husleje for 109 kvm. kr. 8.650,00

3 mdr’s depositum.

Få mere information eller lej en bolig ved henvendelse til Flemming",https://www.boligportal.dk/r%C3%A6kkehuse/broby/104m2-3-vaer-id-5363088
"Hovedgaden, 8831 Løgstrup  - 1. sal",3.995 kr.,950 kr.,78 m²,2,1.,Lejlighed,Nej,Nej,Ja,Nej,Nej,Nej,Nej,Nej,N/A,"God beliggenhed i Løgstrup, tæt på indkøbsmuligheder m.v.

	​

	Lejlighed i to etager, som på nederste etage indeholder dejlig lys stue og køkken m/ hårde hvidevarer (inkl. opvaskemaskine), badeværelse samt mindre depotrum/opbevaring. På øverste etage er der et lille repos, toilet samt soveværelse. Der er trægulve i lejligheden.

	​

	Der medfølger eget depotrum i kælderen samt fælles vaskerum og gårdanlæg​​.​

	​",https://www.boligportal.dk/lejligheder/l%C3%B8gstrup/78m2-2-vaer-id-5296154
"Hadsundvej, 9000 Aalborg, Aalborg",2.600 kr.,0 kr.,14 m²,1,-,Værelse,Nej,Nej,Nej,Nej,Nej,Nej,Nej,Nej,N/A,"Billigt værelse på ca. 14kvm er til leje på Hadsundvej, på skællet mellem Vejgård og Aalborg Ø.

Værelset ligger i stueetagen, uden skråvægge og generelt dejligt kvadratisk, så man har nemt ved at udnytte al pladsen.
Det ligger i en ældre, hyggelig Villa, med fælles køkken og badeværelse. Dette deles med to andre værelser.

Huslejen er på 2600kr om måneden (inkl. el, vand, varme, internet).
Du kan vaske tøj i kælderen hvor du får 160 min. vasketid pr. vaskepolet til 25kr, og der er også mulighed for at hænge vasketøj til tørre.
Derudover er der en baggård hvor der er plads til cyklen, og til at sidde ude, når vejret tillader det.

Ifølge maps er der:
* 350m til Rema1000.
* 1km til Netto
* 1,6km til Vejgård bymidte, hvor der er mange andre handle-muligheder.
* 3,4km til Aalborg Uni i øst - 10min på cykel.
* 3,9km til Aalborg centrum - 15min på cykel.

Lyder det her som noget for dig, har du nogle spørgsmål eller kunne du godt tænke dig at se stedet, så kan du kontakte Carsten.",https://www.boligportal.dk/v%C3%A6relser/aalborg/14m2-1-vaer-id-4961224
"Herningvej, 8600 Silkeborg  - 2. sal",9.395 kr.,0 kr.,98 m²,4,2.,Lejlighed,Nej,Ja,Ja,Ja,Ja,Nej,Ja,Ja,A,"Lejligheden
Lejlighedens køkken-alrum består af et lyst og stilrent køkken med nye og moderne hårdehvidevarer samt en lækker køkkenø. I forlængelse af køkkenet er der god plads til at indrette en spiseplads. I den modsatte ende af rummet er der også god plads til at indrette en hyggelig stue. Fra køkken-alrummet er der udgang til en dejlig stor altan, hvor det er muligt at have havemøbler stående. Lejligheden indeholder tre værelser, hvoraf det store soveværelse ligger i den ene ende af lejligheden, mens de to andre værelser ligger i modsatte ende af boligen. Det er derfor muligt at indrette en separat forældreafdeling og en børneafdeling. Soveværelset indeholder tre faste garderobeskabe, plads til en dobbeltseng og masser af gulvplads. Derudover har du adgang til et depotrum med plads til alt det, du gerne vil have gemt lidt af vejen. Begge børneværelser indeholder et fast garderobeskab, plads til en seng samt et skrivebord. Du træder direkte ind i en stor og indbydende entré, hvor der er masser af plads til overtøj, spændende indretning og et fast skab med plads til opbevaring. Fra entréen har du adgang til badeværelset, som er indrettet i stilrene og moderne materialer. På badeværelset kan du glæde dig over en funktionel vaskesøjle med egen vaskemaskine og tørretumbler. Lejligheden har egen altan, som indbyder til gode og afslappende stunder under åben himmel. Altanens størrelse gør det muligt at indrette en hyggeligt uderum med havemøbler, grill og stemningsskabende krukker.

Attraktiv beliggenhed
Ørnsøhave ligger placeret i det populære boligområde Lysbro, kun tre kilometer fra Silkeborg midtby. Med en lejlighed i Ørnsøhave har du kun 500 meter til Ørnsø og skoven. Lysbro ligger i forlængelse af Funder og Hvinningdal med gode skoler, daginstitutioner, indkøbsmuligheder og fritidsaktiviteter.

Nemt for pendlere
Ørnsøhave ligger blot tre kilometer fra Silkeborg Station, som let nås på cykel. Med den korte afstand til stationen, kan du nemt tage toget mod studiet eller jobbet. Har du bil, får du med en bolig i Ørnsøhave let adgang til motorvejen, og kan være i enten Herning på blot 25 minutter eller Aarhus på 35 minutter

Energivenligt byggeri
Ørnsøhave er opført som energivenligt byggeri og forventes at opnå bæredygtighedscertificeringen DGNB. Det betyder, at der udvises både social-, økonomisk- og miljømæssigt ansvar igennem hele byggeprocessen

OBS: Billeder, visualiseringer og plantegninger er vejledende.",https://www.boligportal.dk/lejligheder/silkeborg/98m2-4-vaer-id-5361549
"Honningvænget, 8381 Aarhus, Tilst  - 1. sal",9.900 kr.,750 kr.,90 m²,3,1.,Lejlighed,Nej,Nej,Ja,Nej,Nej,Nej,Ja,Nej,N/A,"1 måneds huslejefrihed


Honningvænget & Pollenvænget består af 110 lejelejligheder beliggende ved det tidligere GASA i Tilst. Lejlighederne findes med 2-5 værelser og i størrelserne 63-132 m2. Der kan vælges imellem en række forskellige boligtyper, der varierer i størrelse, værelser og planløsninger.

Alle boliger har tilhørende kælderrum på 2 kvadratmeter og der er fællesparkering i området, samt cykelparkering i gården og kælderen. Derudover har alle boligerne enten altan eller terrasse og beboerne kan også nyde godt af en gårdhave og et fælles opholdsareal i området.

Det er muligt at få godkendelse for op til to husdyr.

De lyse boliger er tidløst indrettet, med hvide vægge og loft. Køkken og stue er i ét og skaber derfor et hyggeligt samlingspunkt i boligen. Badeværelset har grå klinker og resten af boligen har lyse laminatgulve, med egetræslook. Der er desuden gulvvarme i alle rum.

Der er faste hvide HTH-elementer i boligen, så den er lige til at flytte ind i. Et ventilationsanlæg sikrer alle boligerne et godt indeklima og de kvalitetsmaterialer der er anvendt, er nemme at holde.",https://www.boligportal.dk/lejligheder/aarhus/90m2-3-vaer-id-5287452
"Nibevej, 9200 Aalborg, Aalborg SV",3.500 kr.,950 kr.,66 m²,2,-,Lejlighed,Nej,Nej,Nej,Nej,Nej,Nej,Nej,Ja,N/A,Central beliggende lejlighed med nem adgang til offentlig transport og indkøb. Lejlighed er på 1 sal med egen parkering.,https://www.boligportal.dk/lejligheder/aalborg/66m2-2-vaer-id-4820857
"Engsøvej, 8240 Aarhus, Risskov  - 1. sal",9.995 kr.,950 kr.,85 m²,4,1.,Lejlighed,Nej,Nej,Ja,Ja,Ja,Nej,Ja,Ja,N/A,"I Enghaven finder du 248 nyopførte lejelejligheder i en karakteristisk karrébebyggelse i det stemningsfulde nye boligkvarter, Engbyen.

Her finder du lækre lejligheder på et til fem værelser (50m2 - 153m2) med forskellige planløsninger, så du kan få opfyldt dit behov.

Her får du:


Gode planløsninger med køkken-alrum, lyse rum og store vinduer
Egen altan eller terrasse
Opvaskemaskine
Gulvvarme i alle rum
Lækkert badeværelse med vaskesøjle
Adgang til skønt, grønt udeområde.
Seperat depotrum

Bliv en del af det nye naboskab og fællesskab i Enghaven og bydelen Engbyen i Risskov - perfekt til den lille og store familie.

Det er tilladt at holde én mindre hund.

Det er ikke tilladt at anvende boligen som bofællesskab eller delebolig blandt venner.

* Bemærk at billederne ikke nødvendigvis er taget af/fra den pågældende bolig, og at udsigt m.v. derfor kan variere.

Området:

Med en bolig i Enghaven bor du tæt på strand, skov og Aarhus C, og samtidig bliver du en del af det hyggelige lokalområde Engbyen i Risskov, der byder på specialbutikker, et aktivt sports- og foreningsliv og mange indkøbsmuligheder. En kort cykeltur bringer dig til det naturskønne område omkring Engsøen, skov og strand.

Enghaven er til dig, der lægger vægt på at bo i et trygt område i grønne omgivelser – med nem adgang til byen. 

Kontakt os i dag for en fremvisning.",https://www.boligportal.dk/lejligheder/aarhus/85m2-4-vaer-id-5302107
"Østre Havnepark, 9000 Aalborg, Aalborg  - 7. sal",7.425 kr.,N/A,56 m²,2,7.,Lejlighed,Nej,Nej,Ja,Ja,Nej,Nej,Ja,Nej,N/A,"DOK-Øst ligger lige ud til Østre Havnebassin, hvor det vrimler med liv og en skøn, urban stemning. Her kan du vælge mellem 86 lejligheder, hvor kvaliteten har fået et ekstra nøk, og intet er overladt til tilfældighederne.

Det hele ligger i detaljen, og i de velindrettede lejligheder er der gjort ekstra meget ud af alle de små ting, der gør hverdagen lettere og mere komfortabel. Her er ekstra højt til loftet, og opholdsrummene har forbedret akustik med særlige lydlofter. Rumhøjden er desuden udnyttet med overskabe, så du får masser af opbevaringsplads, og her er ekstra mange el- og tv-stik, så du kan indrette din lejlighed, som det passer dig. Der er desuden håndklædetørrer på badeværelset, ekstra stor køkkenvask og gulvvarme i alle rum.

Du kan også glæde dig over at lave mad i et eksklusivt køkken fra Svane Køkkenet og nyde lejlighedens fulde hvidevarepakke med induktionskogeplade, opvaskemaskine, vaskemaskine og tørretumbler fra Siemens.

Og det bedste af det hele? Alle lejligheder har et fantastisk lysindfald fra facadens mange vinduer og egen altan eller terrasse med en spændende og varieret udsigt. Nyd den blå udsigt over vandet, den grønne udsigt over den nye Havnepark og den røde udsigt over byen og bygningerne, der spejler sig i havnebassinet.

Fra altanerne mod vest, nord og øst er der blivende panoramaudsigt over Limfjorden, mens de sydvendte lejligheder har udsigt over byen og glæde af solen fra morgen til aften.
OBS! Billederne er fra en lejlighed magen til. Lejligheden har udsigt over parkeringshuset.
Leje nr : 1214OLB",https://www.boligportal.dk/lejligheder/aalborg/56m2-2-vaer-id-5363139
"Strandvejen, 9000 Aalborg, Aalborg  - 3. sal",7.600 kr.,800 kr.,73 m²,2,3.,Lejlighed,Nej,Nej,Nej,Ja,Nej,Nej,Nej,Nej,N/A,"Velkommen indenfor i denne moderne 2-værelses lejlighed på Strandvejen i starten af Vestbyen. 

Her får du en super skøn beliggenhed, tæt på fjorden, indkøb, spisesteder, take-away og meget mere. 

Lejlighedens cool urban stil kommer til udtryk ved eksempelvis de mørkegrå køkkenelementer, de rå lofter og glasvæggen mellem stue og soveværelse. Lejlighedens kvadratmeter fordeler sig over en entré, et kombineret køkkenalrum og stue, soveværelse med indbyggede skabe samt et badeværelse med separat bruseniche og - igen - super god skabsplads/opbevaringsplads.

Lejligheden indeholder alt i hårde hvidevarer.

OBS. Billederne er fra en lignende bolig i samme kvalitet og materialer.",https://www.boligportal.dk/lejligheder/aalborg/73m2-2-vaer-id-5296025
"Lille Gråbrødrestræde, 5000 Odense, Odense C  - 2. sal",13.310 kr.,1.500 kr.,163 m²,4,2.,Lejlighed,Nej,Nej,Nej,Nej,Nej,Nej,Ja,Nej,N/A,"Lejemålet overtages nyistandsat.
Består af 3 værelser, et badeværelse, et toilet med vaskemask. og tørretumbler samt køkkenalrum. Alt i hårde hvidevarer. 
Egen altan. 

Ingen elevator og ingen p-pladser. 

A/c forbrug dækker varme og vand.",https://www.boligportal.dk/lejligheder/odense/163m2-4-vaer-id-3829147
"Rugårdsvej, 5210 Odense, Odense NV  - 1. sal",4.750 kr.,957 kr.,51 m²,2,1.,Lejlighed,Nej,Nej,Nej,Nej,Nej,Nej,Nej,Nej,N/A,"Dejlig lejlighed i velordnet ejendom, i dejligt kvarter.

Der er gode indkøbsmuligheder og kort afstand til Tarup Centret, gågaden, grønne områder m.v.

Udover huslejen betales der til udlejer for varme, el og antenne.
Vand er indeholdt i lejen.
Beløbet figurerer under a conto forbrug.

Der er adgang til følgende:
-	Fællesvaskeri
-	Fælles gårdanlæg
-	Skur",https://www.boligportal.dk/lejligheder/odense/51m2-2-vaer-id-3478879
"Kongstedgårds Alle, 6600 Vejen, Askov",14.100 kr.,200 kr.,140 m²,4,-,Hus,Nej,Nej,Nej,Nej,Ja,Nej,Ja,Ja,A,"De nye huse henvender sig til familier og ældre, der gerne vil bo i en ny arkitekttegnet villa, beliggende i et grønt stilleområde, præget af søer, grønne områder til ophold. Materialer både inde og ude er nøje udvalgt, så alt fremstår eksklusivt og indbydende.
Der opføres i alt 30 nye huse i fire forskellige arketype. Det har været vigtigt for os som udviklere, at området kommer til at fremstå med varieret arkitektur, som er tilpasset de målgrupper, vi henvender os til. Husene er fra 123 til 141 m2. Der opføres 23 stk. 1-plans huse samt 7 stk. 2-plans huse. Alle er med egne vognly samt isoleret skur.
Fælles for all er de grønne tage, som placeres på vognly samt enkelte udvalgte tagområder. Disse indgår også overordnet i den optimering, vi ønsker at ramme mht. bæredygtighed ved LAR-anlæg. De grønne tage har forskellige blomstringstider, som farven på tagene følger årstiderne.

Beskrivelse Bolig:
Kvalitetsmaterialer. 
Energimærke 2020
Solcelleanlæg.
2 Badeværelser.
2 Værelser. Og walk-in
Eg Plank prima natur gulv
Terrasse stueplan.
Tagterrasse med udsigt.
Egen carport med depotrum
Robotplæneklipper
Genvex ECO 275 – Varmegenvindingsanlæg
Hårde hvidevare Siemens  / Quooke m/pro 3 beholder.
Der skal betales til grundejerforenings som man er en del af.

Der vil være mulighed for køb inden for 1 år. Hvor lejen på huset vil blive modregnet i en købsaftale 
Se mere på",https://www.boligportal.dk/huse/vejen/140m2-4-vaer-id-5367413
"Højmarksvej, 8723 Løsning",7.466 kr.,500 kr.,89 m²,3,-,Rækkehus,Nej,Nej,Ja,Nej,Ja,Nej,Ja,Ja,C,"Særdeles velbeliggende rækkehus.
Dejligt, lyst og regulært hus. 2 værelser, stor køkken-alrum-stue. Der er gulvvarme og i bryggerset er der plads til vaskemaskine og tørretumbler. Lille have og terrasse. Dertil et lille aflåst skur. Der bliver installeret fjernvarme i løbet af efteråret. 
Det er tilladt med 1 stk. kæledyr/hund.",https://www.boligportal.dk/r%C3%A6kkehuse/l%C3%B8sning/89m2-3-vaer-id-4154804
