Adress,Monthly rent,Aconto,Square meters,Rooms,Floor,Property type,Furnished,Shareable,Pets allowed,Elevator,Senior frendly,Only for students,Balcony/Terrace,Parking,Energy label,Description,Link
"Sct Knuds Alle, 6740 Bramming  - 1. sal",7.712 kr.,868 kr.,109 m²,4,1.,Lejlighed,Nej,Ja,Nej,Nej,Nej,Nej,Nej,Nej,N/A,"Flyt i lækkert nybyggeri centralt i Bramming
På grunden hvor Brammings gamle rådhus lå ligger nu et skønt nyt boligkvarter for både seniorer og børnefamilier.Boligerne er i to plan med indvendig trappe. Der er store vinduer, hvilket giver et godt lysindfald. Køkkenerne, garderobe og bad er også opført i lyse materialer og der er trægulve i lys eg i køkken, stue og værelser. Til hver bolig hører et depotrum, enten placeret på terræn eller i kælderen. Bygningerne er velisoleret og med ventilationsanlæg, der sikrer et godt indeklima.
Se billeder her.
Beliggenhed
De kommende beboere får glæde af lækre boliger, der er placeret yderst centralt i Brammings bykerne med gågade og gode handelsmuligheder. Dertil er der gode trafikale forbindelser til de større byer Esbjerg, Kolding og Ribe. Der er også rig mulighed for at nyde naturen, da det nye boligområde ligger tæt på et dejligt grønt parkområde.

Boligområdet
Boligområdet giver beboerne mulighed for både at nyde privatlivets fred, men også samværet med naboerne på de udendørs fællesområder, som inviterer til ophold. Området får et fælleshus og der etableres min. 51 parkeringspladser samt cykelparkering.

Indret dig som du vil
Du kan ændre boligens indretning, dog skal du først anmelde dine ønsker til ændringer i boligen. Når du flytter, kan du få godtgørelse for forbedringer, som du selv har betalt.

Vedligeholdelse
En ejendomsfunktionær vedligeholder og tager sig af mindre reparationer i boligerne. Der er også tilknyttet en driftschef, der sørger for den løbende vedligeholdelse af bebyggelsen.
For at kunne leje denne bolig, kræver det man er medlem af boligforeningen. På BoligPortal annonceres kun reelt ledige boliger uden eksisterende venteliste på annonceringstidspunktet. Venligst kontakt udlejer hvis du er interesseret i lejemålet.",https://www.boligportal.dk/lejligheder/bramming/109m2-4-vaer-id-5375615
"Strøget, 7430 Ikast  - 2. sal",5.725 kr.,900 kr.,91 m²,3,2.,Lejlighed,Nej,Ja,Nej,Nej,Nej,Nej,Ja,Nej,E,"Central placeret 3 værelses lejlighed udlejes i centrum af Ikast. Lejligheden er med 3 værelser samt lille altan.

Separat køkken med køle/fryseskab, komfur/ovn og emhætte.

Stort toilet med brusekabine.

Fælles vaskemaskine og tørretumbler i kælder

Ejendommen er beliggende tæt på indkøb. 

Til lejemålet kan der lejes en p-plads.",https://www.boligportal.dk/lejligheder/ikast/91m2-3-vaer-id-4590523
"Lykkehåbs Alle, 8722 Hedensted  - 1. sal",8.545 kr.,1.000 kr.,83 m²,3,1.,Lejlighed,Nej,Nej,Ja,Ja,Ja,Nej,Ja,Ja,A,"Lejlighederne er bygget i elegant skandinavisk design af lokale entreprenører, som sætter en ære i at skabe de bedste rammer i den højeste kvalitet. Alle materialer lever op til vores krav om funktionalitet og kvalitet – det gælder alt fra hvidevarer til udendørslamper. 

Lejlighederne består af 2-3 værelser med egen altan eller terrasse vendt mod syd eller vest. Lejlighederne er lyse med store vinduer i begge ender, hvor der er kig ud over skov, grønne områder, boligkvarter og fællesområdet. Fællesområdet er det sociale samlingspunkt i Lykkehåb med fælleshus, orangeri og petanquebane, hvor der er plads til hyggelige stunder med dine naboer, men også massér af muligheder for privatliv. 

Alle lejligheder har et moderne hvidt køkken med flot stenbordplade. Lejlighederne er i et plan enten i stuen, 1. sal eller 2. sal. De er let tilgængelige med elevator, som udelukkende deles mellem 3-4 lejligheder. Badeværelserne er rummelige og lavet af lyse materialer. Alle lejligheder har eget skur eller depotrum med plads til opbevaring. Der er gratis fællesparkering for biler og cykler. 

Ved at bo i Lykkehåb kan du fokusere på at nyde livet, da faciliteterne omkring dig er i orden og bliver løst af vores egne folk, hvis der opstår udfordringer.

Lejlighederne er komplet nyopførte og klar til indflytning i februar 2024. Du kan fra start være med til at forme fællesskabet med aktiviteter, du gerne vil deltage i.",https://www.boligportal.dk/lejligheder/hedensted/83m2-3-vaer-id-5362866
"Annagade, 4220 Korsør  - 1. sal",7.000 kr.,1.100 kr.,98 m²,3,1.,Lejlighed,Nej,Nej,Nej,Nej,Nej,Nej,Nej,Nej,N/A,"Stor 3 værelses lejlighed beliggende på Annagade tæt på indkøb og skole. Lejligheden indeholder stue, 2 værelser, badeværelse og nyere køkken. Det er tilladt at holde en hund i lejemålet såfremt at husordenen overholdes.",https://www.boligportal.dk/lejligheder/kors%C3%B8r/98m2-3-vaer-id-5371905
"Ramsvej, 8800 Viborg  - 2. sal",6.990 kr.,1.000 kr.,100 m²,3,2.,Lejlighed,Nej,Ja,Nej,Nej,Nej,Nej,Nej,Nej,N/A,"Rigtig fin lejlighed med central  beliggenhed i Viborg, tæt på gågade, banegård, Midtbyens Gymnasium, indkøbsmuligheder m.v.

	​

	Lejligheden indeholder to stuer en suite (en stor og en mindre), soveværelse m/ udgang til altan, mindre værelse, køkken (inkl. opvaskemaskine m.v.), badeværelse (m/ vaskemaskine) samt entré. Der er nye trægulve i hele lejligheden.​",https://www.boligportal.dk/lejligheder/viborg/100m2-3-vaer-id-4409083
"Gl Kongevej, 7442 Engesvang",5.047 kr.,1.635 kr.,104 m²,4,-,Lejlighed,Nej,Ja,Nej,Nej,Nej,Nej,Nej,Ja,N/A,"Hyggelig 4 vær. Lejlighed med egen indgang. 
Mindre gang, køkken, toilet og badeværelse.
Fælles have og gård til parkering.
Med plads til vaskemaskine, men også fælles vaskeri.

Tæt på Silkeborg motorvejen og togstationen.",https://www.boligportal.dk/lejligheder/engesvang/104m2-4-vaer-id-5359149
"Lokesvej, 8230 Aarhus, Åbyhøj  - 1. sal",12.500 kr.,850 kr.,114 m²,4,1.,Lejlighed,Nej,Ja,Ja,Ja,Nej,Nej,Ja,Ja,N/A,"**ÅBENT HUS HVER SØNDAG KL. 15:15 VED LOKESVEJ**

VELKOMMEN TIL ÅBYEN 

Vær OBS på at billederne er fra vores prøvebolig, og kan derfor afvige.

Husdyr er tilladt - et pr. bolig - hunde må højest veje 15 kg. - der skal indhentes tilladelse inden erhvervelse af husdyr/indflytning!


Langs Århus Å og stemningsfyldte villaområder findes Åbyen, der er kendetegnet ved optimalt indrettede arkitekt lejligheder og solorienterede terrasser og altaner. Ejendommene fremstår som flotte nyfortolkninger af klassisk dansk arkitektur, med flotte teglfacader og med en spændende asymmetrisk vindues- og altanplacering, der gør lejlighederne spændende at se på, og dermed også at bo i for de kommende glade lejere.

Planløsningerne og disponeringen af lejlighederne er indrettet med fokus på optimal udnyttelse af boligarealerne, solorientering og direkte udgang til rummelige altaner eller terrasser. Hver af lejlighederne er indrettet med åbent køkken, stort og indbydende badeværelse og rummelig opdeling af værelserne. Fra de øverste lejligheder, er der en fantastisk udsigt over kolonihaverne til de grønne områder omkring Brabrand Stien, og op mod det stemningsfyldte villakvarter i nedre Åbyhøj.

Lejlighederne er beliggende i et kvarter, hvor man på den ene side er flankeret af et hyggeligt villaområde med gamle stemningsfyldte huse og opvoksede haver. På den anden side af bebyggelsen har man et skønt grønt areal, der blandt andet rummer Brabrand Stien, der løber rundt om Brabrand Søen og ind i hjertet af Århus Centrum. Det er et område der er i hurtig forvandling, med omkringliggende byggefelter der begynder at fremstå færdige, og med flot anlagt bassin med gangbroer i midten af de nyopførte flotte bygninger.
Nærområdet byder på et hav af sportsaktiviteter og handlemuligheder, samtidig kan Århus Centrum og Århus BSS nås på cykel på blot 10 minutter.

Opsummeret er Åbyen for dig der ønsker ro, arkitekttegnede rammer, solorienterede udearealer og samtidig med centrum i cykel afstand.",https://www.boligportal.dk/lejligheder/aarhus/114m2-4-vaer-id-5148557
"Niels Brocks Gade, 8900 Randers, Randers C  - 1. sal",2.750 kr.,700 kr.,54 m²,2,1.,Lejlighed,Nej,Nej,Nej,Nej,Nej,Nej,Nej,Nej,N/A,"Lejesagsnummer 1-107-2

Tæt ved centrum, men alligevel roligt beliggende i Tøjhushavekvarteret, forefindes denne 2-vær. lejlighed.

Lejligheden er indrettet med entré, god stue, lille toilet, soveværelse med bruseniche samt godt køkken. 
Fælles baghave.

Vaskeri: kr. 95,- mdl.

Der er indgået aftale med Norlys Fiber om installation af fiber i ejendommen. Dette forventes klart i løbet af året.",https://www.boligportal.dk/lejligheder/randers/54m2-2-vaer-id-4826599
"Koldingvej, 8800 Viborg  - Stuen",5.720 kr.,1.150 kr.,74 m²,3,Stuen,Lejlighed,Nej,Nej,Nej,Nej,Nej,Nej,Nej,Ja,N/A,"3 værelses lejlighed på 74 kvm., med store lyse to stuer og stort rummeligt soveværelse.

Nyere køkken med alt i hårde hvidevare.",https://www.boligportal.dk/lejligheder/viborg/74m2-3-vaer-id-4950484
"Studiestrædet, 3400 Hillerød  - 1. sal",12.900 kr.,850 kr.,94 m²,3,1.,Lejlighed,Nej,Ja,Nej,Ja,Nej,Nej,Ja,Ja,N/A,"Vi udlejer 113 lækre 1-, 2-, 3- og 4-værelses lejligheder i varierende størrelser mellem 42 og 99 m2.

INDE:
Lejlighederne består alle af en entré, et stort og lyst køkken/alrum, et dejligt badeværelse og et eller flere værelser. Lejlighederne er velindrettede og lækre, og eksempelvis sikrer store gulv-til-loft-vinduer både lys og luft i lejlighederne.

UDE:
Lejligheden har altan.

HÅRDE HVIDEVARER:
Lejlighederne har alle køle- og fryseskab, indbygningsovn, induktionskogeplade, opvaskemaskine, vaskemaskine og tørretumbler. 

HUSDYR:
Katte: Lejere kan ansøge om tilladelse til at holde én indekat på adressen. Udekatte er ikke tilladt.
Hund: Det er ikke tilladt at holde hund.
Andre dyr: Kontakt os. 

PARKERING:
Der er fællesparkeringspladser ved ejendommen.

FÆLLESAREALER:
Ejendommen består af 3 sammenhængende længer, der ved at danne en trekant lukker sig om et stort, fælles gårdrum. I gårdrummet forbinder stisystemer de forskellige længer, og der vil være god plads til både grillhygge, leg og solbadning. Højden på længerne varierer mellem 4 og 5 etager - lavest mod vest og højest mod øst, og den varierende bygningshøjde udnyttes til at anlægge en stor, fælles tagterrasse, hvor det er oplagt at mødes med familier, venner og naboer. 

ELEVATOR:
Der er elevator i opgangen.

OM OMRÅDET
Carlsbergvej ligger godt placeret i smukke Hillerød, der er kendt for sin stærke identitet og aktive byliv. Ejendommen ligger i gåafstand fra det absolutte bycentrum med gågadeområde, indkøbscenteret SlotsArkaderne, caféliv og kulturtilbud som eksempelvis Hillerød Musik & Teater. Tilsvarende er der blot 7-800 m til Rema 1000 og Netto, hvormed de daglige indkøb kan klares i nærområdet. 

Fra Carlsbergvej er der ligeledes kort afstand til en række af byens skoler og uddannelsesinstitutioner, og eksempelvis er Hillerød Gymnasium & HF, Teknisk Gymnasium, Professionshøjskolen UCC og Frederiksborg Byskole placeret inden for en radius af 400 meter fra ejendommen. Tilsvarende kan du på blot en 5 minutters gåtur være i det nordvestlige hjørne af Store Dyrehave, mens du i løbet af 15 minutter kan nå Slotssøen, hvor Frederiksborg Slot ligger smukt placeret.",https://www.boligportal.dk/lejligheder/hiller%C3%B8d/94m2-3-vaer-id-5256818
"Kattesund, 8700 Horsens  - 3. sal",5.395 kr.,600 kr.,67 m²,2,3.,Lejlighed,Nej,Ja,Nej,Nej,Nej,Nej,Nej,Ja,C,"Vi har nu fornøjelsen af, at udbyde denne fantastiske lejlighed med en rigtig god og attraktiv beliggenhed. 

Lejligheden byder på god størrelse entre hvorfra der er adgang til det separate køkken, badeværelset samt stort soveværelser og stor stue. Desuden er der 2 altaner i lejligheden hvorfra der strømmer en masse lys ind i lejligheden. 

Kattesund ligger centralt i Horsens, hvorfor der også er nem adgang til alle byens tilbud. 

Der er mulighed for leje af p-plads i ejendommens baggård.

Som ny lejer får du helt særligt første måneds husleje gratis. Det vil sige, at der ved indflytning kun skal betales 3 mdr. depositum + første måneds forbrug i alt: 16.785 kr.

Kontakt os for aftale om fremvisning af boligen.",https://www.boligportal.dk/lejligheder/horsens/67m2-2-vaer-id-5376236
"Remmerslund Skovby, 8722 Hedensted",9.000 kr.,350 kr.,84 m²,3,-,Rækkehus,Nej,Ja,Nej,Nej,Ja,Nej,Ja,Ja,A,"Velkommen til Søhusene, Hedensted - Find dit nye hjem tæt på Sø & Natur. 

Søhusene består af 51 moderne rækkehuse i både 1-plan og 2-plan. Søhusene er tegnet af Atra arkitekter, som har sikret minimal spildplads, hvilket giver dig en masse gode og forskellige indretningsmuligheder. 

Boligernes placering er optimal placeret for dem, der gerne vil bo i et miljø der læner sig op ad sø og natur, og derudover et socialt liv omkring dig.
Fra Søhusene er du i cykel afstand til Hedensted skolen, med trykke cykelstier og tunneller, undgår man at skulle passere vejen for at komme i skole. 

Boligerne er i størrelsen 80-110m2 (3 og 4 værelsesenheder) og rummer køkkenalrum, stue samt badeværelse med vaskemaskine og tørretumbler. Derudover har alle boliger eget depotrum til opbevaring. 
Fra boligerne er der adgang til privat udeareal, hvor man kan nyde sin terrasse. 

Værd at nævne om disse fantastiske livsstilsboliger:

- Energioptimale boliger med fjernvarme
- Træ/Alu vinduer 
- Gulvvarme i hele boligen
- Kvalitets hvidevarer fra Gorenje 
- Genveksanlæg
- Egetræs laminat 
- HTH Køkkener i høj kvalitet med indfræset greb
- Massive indvendige døre
- Underlimet håndvaske 
- Linjeafløb i brusenicher 
- Udvendige frostsikrede haner 

Lejer tilmeldes direkte til forsyningsværkerne på både EL, Vand og Varme og afregner direkte.",https://www.boligportal.dk/r%C3%A6kkehuse/hedensted/84m2-3-vaer-id-5313249
"Storegade, 9560 Hadsund  - 2. sal",3.600 kr.,1.000 kr.,62 m²,2,2.,Lejlighed,Nej,Nej,Nej,Nej,Nej,Nej,Nej,Nej,D,"Hyggelig 2-værelses lejlighed, centralt beliggende i Hadsund med en fantastisk udsigt over Mariager Fjord. Indeholder stue, soveværelse, køkken, gang, toilet og helt ny bruseniche. Perfekt begynderlejlighed til 1-2 personer. Gratis parkering i gården.",https://www.boligportal.dk/lejligheder/hadsund/62m2-2-vaer-id-3767720
"Skovkanten, 6700 Esbjerg, Esbjerg  - 1. sal",3.650 kr.,485 kr.,39 m²,1,1.,Lejlighed,Nej,Nej,Nej,Nej,Nej,Nej,Ja,Ja,N/A,"Pæn istandsat 1 værelses til leje
Flotte gulve-vægge-lofter
Stort flot bad-køkken
Gode vaskeforhold-cykel kælder
Beliggende nær centrum
tæt på indkøbsmuligheder
Tæt på Svømmestadium
tæt på Havet",https://www.boligportal.dk/lejligheder/esbjerg/39m2-1-vaer-id-1810050
"Dytmærsken, 8900 Randers, Randers C  - Stuen",6.695 kr.,750 kr.,110 m²,3,Stuen,Lejlighed,Nej,Ja,Nej,Nej,Ja,Nej,Ja,Ja,N/A,"Lej en rummelig og velindrettet 3-værelses lejlighed på 110 m² centralt beliggende i Dytmærsken i Randers C. Lejligheden er placeret ovenpå en vinhandler og kun et minut fra busterminalen. En række butikker ligger lige nedenfor lejligheden, hvilket giver dig bekvemmelighed og nem adgang til shopping.

Lejligheden er flot indrettet og byder på en stor entre, 2 soveværelser, et køkken med opvaskemaskine, en rummelig stue med udgang til altan, et badeværelse og et gæstetoilet. Parketgulve giver lejligheden et elegant look, mens egen vaskemaskine og tørretumbler gør hverdagen mere bekvem.

For din ekstra komfort, er der mulighed for at leje en p-plads direkte ved lejligheden. Varmeudgifterne er kr. 750 pr. måned aconto, mens vand er kr. 300.

Tøv ikke med at kontakte os for en fremvisning af denne fantastiske lejlighed. Vi er sikre på, at du vil elske at bo her!",https://www.boligportal.dk/lejligheder/randers/110m2-3-vaer-id-5343366
"Boulevarden, 9000 Aalborg, Aalborg  - 4. sal",9.850 kr.,900 kr.,115 m²,3,4.,Lejlighed,Nej,Ja,Nej,Nej,Nej,Nej,Ja,Nej,N/A,"Total nyrenoveret lækker stor 3 værelses på bedste plads i Aalborg ved Kennedys Plads. 

Lejligheden er placeret helt centralt i Aalborg med kort afstand til Kildeparken, Kennedy Arkaden, Midtbyen, diverse handlemuligheder samt offentlig transport. 

Lejligheden består af en stor lys stue med adgang til stor hems, som er velegnet til kontor, 2 værelser med indbyggede skabe med skydelåger, nyt køkken med masser af skabsplads, dejligt badeværelse med gulvvarme og masser af spots samt stor altan med udsigt over grønt gårdareal og over byen. Der er desuden alt i hårde hvidevarer. Derudover er der et fælles stort haveanlæg. 

Lejemålet overtages som nyistandsat.",https://www.boligportal.dk/lejligheder/aalborg/115m2-3-vaer-id-5311702
"Tycho Brahes Allé, 2300 København, København S  - 1. sal","17.776,23 kr.",1.000 kr.,116 m²,4,1.,Lejlighed,Nej,Nej,Nej,Ja,Ja,Nej,Ja,Nej,A,"Sundby Park tilbyder med sin hel unikke beliggenhed en bolig med direkte udsigt til skønne, grønne omgivelser, der giver fri mulighed for at opleve en grøn oase i hjertet af Amager. Boligerne er moderne, velindrettede og opført med det rette lysindfald og er yderst funktionelle indrettet.

De to smukke bygninger er med deres særlige arkitektur, grønne tagterrasser og eksklusive udtryk unikke for området. Bygning B´s boliger bevæger sig i terrassefald fra de højeste boliger på 5. etage og ned til jordplan med egen have.

Alle lejligheder i begge bygninger fra første sal til 5. sal har egen altan på begge sider. 

Udlejer er et professionelt ejendomsselskab.",https://www.boligportal.dk/lejligheder/k%C3%B8benhavn/116m2-4-vaer-id-5054818
"Tønnesgade, 7100 Vejle  - 1. sal",7.600 kr.,950 kr.,96 m²,3,1.,Lejlighed,Nej,Nej,Nej,Nej,Nej,Nej,Nej,Nej,N/A,"Velbeliggende 3-værelses lejlighed på 1. sal. i en ejendom med kun to lejemål. 

Entre, hvorfra der er adgang til 2 stuer en suite. Stort lyst soveværelse. 

Køkken og badeværelse med brus. 

Der er vaskemaskine i lejligheden.",https://www.boligportal.dk/lejligheder/vejle/96m2-3-vaer-id-5377924
"Bytoften, 8240 Aarhus, Risskov",9.900 kr.,0 kr.,83 m²,3,-,Lejlighed,Nej,Ja,Ja,Ja,Ja,Nej,Ja,Nej,N/A,"Leder du efter en delevenlig 3'er i Risskov, der er nyopført i lyse materialer og ligger helt perfekt i forhold til både indkøb og transportmuligheder? 
Så er denne lejlighed på første sal i det nye Bytoften lige noget for dig!

Du får
- 83 kvm
- To gode værelser
- Skøn altan ifbm. indgangen til lejligheden
- Gulvvarme i hele lejligheden
- Alt i hårde hvidevarer, inkl. opvaskemaskine, vaskemaskine og tørretumbler

Der er desuden mulighed for at leje en p-plads i parkeringskælderen.

Ring til os og book en fremvisning allerede idag!

Generelt om Bytoften er det en ny bydel opført centralt i den attraktive bydel Vejlby-Risskov med gode transportmuligheder, der hurtigt lader dig nå Universitetet og centrum af Aarhus.
Bydelen strækker sig langs Aarhus Bugten, hvor skov og strand lader dig nyde naturen i fulde drag.
På adressen er du aldrig langt fra indkøb, og du kan bl.a. gå til Veri-Centeret på 10 min., mens Rema1000 er kun 4 min væk.

Leder du efter noget lignende, men måske større eller mindre? Tøv ikke med at kontakte os - Bytoften består af 38 boliger i forskellige størrelser, så vi står klar til at hjælpe dig med at finde dit næste hjem.

OBS.
Aconto betales direkte til forsyningsværkerne. Der må derfor påregnes udgift til vand og varme.
Billederne har visualiserede møbler.",https://www.boligportal.dk/lejligheder/aarhus/83m2-3-vaer-id-5377680
"Emil Møllers Gade, 8700 Horsens  - 1. sal",5.000 kr.,700 kr.,52 m²,2,1.,Lejlighed,Nej,Nej,Nej,Nej,Nej,Nej,Nej,Nej,E,"God 2-værelses lejlighed på 1. sal beliggende tæt på indkøb, uddannelsessteder, park og transportmuligheder i Horsens.

Boligen har en lys stue, et soveværelse og pænt køkken med skabs- og bordplads samt komfur, emhætte og køle-/fryseskab. Der er et mindre badeværelse.

Der er vaskekælder i ejendommen hvor vaskefaciliteter kan benyttes mod betaling. Endvidere er der et depotrum.

Der er mulighed for mindre dyr i boligen, som aftales nærmere med udlejer.

Beløbet for a conto opkrævningen er fastsat ud fra forrige lejers forbrug.
Der tages forbehold for fejl og evt. lejereguleringer siden annoncens publicering.
Der vil blive indhentet oplysninger hos RKI, og er du registreret hos RKI, vil vi ikke kunne udleje boligen til dig.

Billeder kommer!",https://www.boligportal.dk/lejligheder/horsens/52m2-2-vaer-id-5326556
"Nørretanderupvej, 7400 Herning, Snejbjerg",10.595 kr.,0 kr.,113 m²,4,-,Rækkehus,Nej,Nej,Ja,Nej,Ja,Nej,Ja,Ja,A,"Få glæden af at flytte ind som den første i et lækkert rækkehus, nyopført - de forventes at stå færdige til indflytning 15.12.2023

Boligen byder på et fantastisk køkken/alrum og stue i et, hvor et stilfuldt Svane køkken med hvide elementer og hvidevarer er integreret i rummet. Fra det store alrum/stuen er der udgang til privat terrasse og have.

Boligen indeholder desuden et soveværelse med faste skabe, samt to yderligere værelser. Endvidere er der et flot badeværelse med bruseniche, hvidt skabsarrangement samt klinkegulv og gulvvarme. Endelig er der et godt bryggers, med opbevaringsmulighed og mulighed for vaskemaskine og tørretumbler.

Boligerne opføres med fokus på godt indeklima. Der etableres ventilationsanlæg og gulvvarme i alle rum, ligesom der monteres 3 lags lavenergivinduer, der sikrer lave varmeudgifter. Materialerne er gennemgående valgt med henblik på minimal vedligehold, så tiden i stedet kan bruges på mindre praktiske ting.

Alle boligerne har private haver og terrasser, hvor solen kan nydes. Omkring rækkehuset er der grønne arealer og desuden 2 parkeringspladser pr. bolig. Foran boligen ved parkeringen er der et 4m² stort skur med isoleret bund til opbevaring af cykler, havemøbler og andet.

Der er kort afstand til både Snejbjerg Skole og til hallen. I umiddelbar nærhed findes dagligvarebutikker og grønne arealer.

Forbrugsafgifter til vand, varme og el afregnes direkte med forsyningsselskaberne. 

Boligerne nettoprisindeksreguleres til 2024.

Gårdhavehusene her ligger i midten. Vi har en anden annonce på dem i gavlene.

Kæledyr kan holdes med skriftlig tilladelse.

Boligerne der opføres nu er etape 2. Opføringen af etape 3 har ukendt tidshorisont.

Skriv gerne hvis du ønsker mere info. Da rækkehusene endnu ikke er bygget kan de ikke fremvises.",https://www.boligportal.dk/r%C3%A6kkehuse/herning/113m2-4-vaer-id-5364158
"Sankelmarksgade, 9000 Aalborg, Aalborg  - Stuen",7.453 kr.,880 kr.,92 m²,3,Stuen,Lejlighed,Nej,Ja,Nej,Ja,Ja,Nej,Nej,Nej,N/A,"Velkommen til Sankelmarksgade 🏠

Med Aalborg Teater i baghaven, gå-afstand til hele midtbyen, havnen og Vestbyen er denne 3-værelses lejlighed attraktivt placeret midt i Aalborgs pulserende byliv. Tæt på kulturliv, indkøbsmuligheder, spisesteder og Aalborg Banegård.

Lejligheden er velindrettet med indbydende rum og godt lysindfald. Blandt andet et dejligt køkken, stue, to værelser og et badeværelse. Lejligheden er indrettet i neutrale materialevalg, som gør, at du kan skabe dit helt eget personlige hjem 💐 

Lyder denne bolig som noget for dig, er du mere end velkommen til at kontakte os. Så arrangerer vi en personlig fremvisning for dig☺️

Vi glæder os til at høre fra dig!",https://www.boligportal.dk/lejligheder/aalborg/92m2-3-vaer-id-5376533
"Tordenskjoldsgade, 8700 Horsens  - Stuen",5.000 kr.,800 kr.,60 m²,2,Stuen,Lejlighed,Nej,Nej,Nej,Nej,Nej,Nej,Ja,Nej,N/A,"Lækker ny lejlighed fra december 2018, ejendommen total renoveret.
HTH køkken med emhætte, komfur og køleskab.
Badeværelse med klinker og gulvvarme.
Soveværelse med skab.
Stor egen altan.
Stor have
Lejligheden er nymalet og rengjort ved indflytning.
INGEN DYR eller rygning.
Høj stue lejlighed.
Ejendommen er udstyret med porttelefon, kælderrum og fri fællesvaskeri.
Ligger i et meget roligt kvarter.
Tæt på banegården.",https://www.boligportal.dk/lejligheder/horsens/60m2-2-vaer-id-4254567
"Teglgården, 3460 Birkerød",16.400 kr.,800 kr.,118 m²,4,-,Rækkehus,Nej,Ja,Ja,Ja,Ja,Nej,Ja,Ja,A,"Velkommen til boligen!
Rækkehuset er centralt placeret i Birkerød i dejlige naturskønne omgivelser. Her er fred og ro - men på få øjeblikke kan du være på hovedgaden og shoppe, eller du kan springe på et tog mod København C eller Helsingør. Området Christianslund er lukket, så du uden problemer kan lade børnene løbe fra haven og ud på én af legepladserne på fællesarealet. Der er ikke langt til den populære Birkerødskole og institutioner, hvilket gør logistikken let i en travl hverdag.
Boligen består af to plan, der byder på en god entré med plads til overtøj og fodtøj, et rummeligt og lyst køkken med plads til spisesektion, en stor stue med masser plads til sofaarrangement og udgang til en stor sydvendt terrasse/have. I stueplan finder man også rækkehuset første badeværelse. 2. salen er står af et badeværelse, 2 børneværelser og et stort soveværelse med udgang til altan.
*Husdyr med ansøgning
Der kan søges om husdyrstilladelse.
*Bemærk at billederne ikke nødvendigvis er taget af/fra den pågældende bolig, og at udsigt m.v. derfor kan variere.",https://www.boligportal.dk/r%C3%A6kkehuse/birker%C3%B8d/118m2-4-vaer-id-5372706
