Adress,Monthly rent,Aconto,Square meters,Rooms,Floor,Property type,Furnished,Shareable,Pets allowed,Elevator,Senior frendly,Only for students,Balcony/Terrace,Parking,Energy label,Description,Link
"Marmorvej, 2100 København, København Ø  - 2. sal",22.500 kr.,1.520 kr.,140 m²,3,2.,Lejlighed,Nej,Nej,Ja,Ja,Nej,Nej,Ja,Nej,N/A,"Lejlighederne varierer i størrelse fra de mindste på 78 m2 til de største på 151 m2 placeret i tårnbygningerne.

Boligerne sikrer med deres høje vinduespartier et fantastisk kig mod vandet og himlen, ligesom der i alle boliger er adgang til tilbagetrukne altaner.

Lejlighederne har mange forskellige planløsninger, der gør det muligt at finde netop den lejlighed, der passer til din livsstil.

Bygningerne følger nordisk byggetradition med enkle linjer og imponerende lysindfald. Fælles for boligerne er store lyse trapperum, entré med skabe og et centralt placeret køkken- og opholdsareal.

Alle boliger har tilknyttet depotrum i enten lejligheden eller kælderen.

Det er muligt at tilvælge leje af underjordiske p-pladser til din bil.

BEMÆRK: Billederne er fra en prøvebolig",https://www.boligportal.dk/lejligheder/k%C3%B8benhavn/140m2-3-vaer-id-5377394
"Skolegade, 9320 Hjallerup",6.950 kr.,0 kr.,120 m²,3,-,Hus,Nej,Nej,Nej,Nej,Nej,Nej,Ja,Ja,N/A,"Godt regulært hus med en god indretning, egner sig perfekt til en lille familie. Huset har en skøn udestue, som vender ud mod haven.

Huset ligger i et pænt boligkvarter centralt i Hjallerup.",https://www.boligportal.dk/huse/hjallerup/120m2-3-vaer-id-5351411
"Vilhelm Ehlerts Alle, 8800 Viborg  - 1. sal",4.200 kr.,0 kr.,39 m²,1,1.,Lejlighed,Nej,Nej,Ja,Ja,Nej,Nej,Ja,Ja,A,"På VEA finder du denne lyse og energivenlige etværelses lejlighed med højt til loftet. Her kan der indrettes en fantastisk mini-bolig, hvor der er plads til det vigtigste i hverdagen. Spar penge på boligposten og få større råderum til oplevelser og hygge!

Køkken-alrum og stue
Her træder du direkte ind i lejlighedens køkken-alrum, som indeholder plads til både et køkken- og stueområde. Du kan desuden indrette dig med et bord, som kan bruges til både lektielæsning eller hyggelige madaftener med vennerne

Badeværelse
Lejlighedens stilrene badeværelse indeholder både toilet, håndvask og separat bruseniche. Her har du samtidig mulighed for at sætte vasketøjskurven, så du nemt og bekvemt kan holde orden på vasketøjet.

Fælles faciliteter
Foruden egen lejlighed har du også adgang til et aktivitetshus. Her finder du blandt andet vaskefaciliteter i vaskeriet, så du let kan få styr på vasketøjet.

Uderum
Du får adgang til det etablerede grønne gårdmiljø, som er til fælles brug mellem boligerne. Her er plads til at nyde solens stråler eller måske rykke studielæsningen udenfor i de lune sommerdage.

I kælderen under byggeriet er der parkering til biler og cykler, samt mindre kælderrum. Det er også muligt at parkere sin bil i gårdrummet. Har du elbil, så er der også mulighed for at oplade disse på udvalgte pladser.

Forbrug afregnes direkte med forsyningsværkerne.
Vi aflæser målerne på indflytningsdagen og herefter tilmelder vi lejer til de respektive forsyningsværker.

Det er tilladt at holde op til 2. stk. husdyr mod godkendelse fra udlejer. Visse hunderacer må vi desværre sige nej til grundet race, størrelse og temperament.

Billederne er taget i 4 forskellige lejligheder, således man kan danne sig et indtryk af de forskellige indretningsmuligheder.",https://www.boligportal.dk/lejligheder/viborg/39m2-1-vaer-id-5356057
"Slagtergade, 6100 Haderslev  - 1. sal",3.850 kr.,300 kr.,48 m²,2,1.,Lejlighed,Nej,Nej,Nej,Nej,Nej,Nej,Nej,Nej,E,"1. sals lejlighed fordelt på 2 værelser. Lille køkken i forlængelse af stuen, som er nem at indrette.

Lille fælles gårdhave, hvor der er mulighed for at sætte et par stole op. Fælles cykelparkering i skuret.

Der er offentlig parkering udenfor huset.

Der er tilknyttet en vicevært til ejendommen. 

I ejendommen er der 2 andre lejemål.

Ejendommen er beliggende 5 minutter fra gågaden og Damparken.

El/varme afregnes direkte til forsyningsselskabet, og lejer er forpligtet til at tilmelde sig pr. indflytningsdagen.

Huslejen bliver pristalsreguleret årligt, første gang pr. 1. januar 2024.",https://www.boligportal.dk/lejligheder/haderslev/48m2-2-vaer-id-5377397
"Heliosvænget, 5250 Odense, Odense SV  - 2. sal","3.946,80 kr.",600 kr.,33 m²,1,2.,Lejlighed,Nej,Nej,Nej,Nej,Nej,Nej,Ja,Ja,C,"Lejligheden ligger på 2. sal i kompleks med store grønne områder, der er velvedligeholdt. 
Nye gulve i stue/køkken og gang i 2022. Dejlig altan
Eget kælderrum og fælles vaskekælder. 

Ligger med kort afstand til Odense Universitets Hospital, Syddansk Universitet, tæt på motorvejsnettet og indkøb. Der er ikke langt ind til Odense Centrum. Gode offentlige transportmuligheder",https://www.boligportal.dk/lejligheder/odense/33m2-1-vaer-id-5260441
"Fortunas Have, 2680 Solrød Strand  - 3. sal",13.800 kr.,1.000 kr.,100 m²,4,3.,Lejlighed,Nej,Nej,Ja,Ja,Nej,Nej,Ja,Nej,N/A,"Lejligheden
                            5  værelses lejlighed med 2 soveværelser med køkken/alrum og dagligstue.
Du kommer ind i lejligheden gennem en rummelig entré med skabsplads og med adgang til alle lejlighedens rum.  Der er mellem de to af boligens soveværelser mod gården skabt et multirum, som kan udnyttes til blandt andet hjemmekontor, legeområde eller hobbyrum. Derudover byder lejligheden på køkken/alrum med moderne hvidt Invita køkken med alt i hårde hvidevarer, med adgang til dagligstuen som er opdelt fra køkkenet med franske døre, samt badeværelse i tidløst minimalistisk design med fliser på gulv og i brusenichen, gulvvarme og vaskesøjle. Lejligheden har udgang til altaner både fra stuen og fra soveværelset. 
Lejligheden har flotte lamelgulve og gulvvarme. 
Det er muligt at ansøge om husdyrtilladelse til et husdyr i alle lejemål, som skal godkendes af udlejer.
Her er et ambitiøst byggeri, der er bygget efter skrappe krav fra certificeringsordningen DGNB. Du er her tæt på strand, grønne områder, fritidsaktiviteter og transport.

                                      NB: Billederne viser derfor ikke den pågældende lejlighed, men i stedet billeder fra prøveboligen. Billedernes formål er at give en fornemmelse af stil og materialevalg. Ift. planløsning henviser vi til plantegningen. Kom gerne forbi til et åbent hus, eller ring og book en personlig fremvisning.

                                                      Ejendommen
                            Green Hills  er et ambitiøst boligbyggeri tegnet af de prisvindende arkitekter i Danielsen Architecture, og har fået sit navn efter den karakteristiske bakkeform. Mellem bakkerne findes det ca. 4 hektar store gårdrum med blandt andet en lille sø, bakkelandskab og svævebane. Her er masser af kroge, som inviterer til både leg og rolige stunder for store og små. 
Ejendommen byder på mange funktionelle og æstetiske detaljer såsom græsarten sedum på de grønne tage, der hjælper med at bidrager til både biodiversitet og klimasikret regnvandshåndtering, samtidig med at den fuldender det grønne udtryk. 
Der er lagt stor vægt på at skabe fællesområder- og faciliteter som bidrager til et godt og balanceret hverdagsliv, for eksempel fælles træningssal, gæstelounge, værksted og selskabslokale.

                                      Lokalområdet
              Solrød er en hyggelig by som har noget at byde på for alle aldre. Bymidten er fyldt med specialbutikker og arrangementer året rundt, som for eksempel  juletræstænding og loppemarkeder. 
Byen er omringet af store naturoplevelser, ikke mindst den lange strand som kan danne centrum for både sportslige udfoldelse og sociale aktiviteter. Gå også på opdagelse i for eksempel Karlstrup Kalkgrav, Trylleskoven eller fuglehabitat-området Staunings Ø. 
Daginstitutioner, skoler og indkøb er alt sammen indenfor rækkevidde, så hverdagens logistik let går op, og den velfungerende infrastruktur sikrer, at du nemt når din destination hvad end du er til fods, på cykel, med offentlig transport eller i bil. Stisystemer forbinder byen trygt og S-toget fra den nærliggende  Jersie Station bringer dig til København H på en halv time.

                      
Bofællesskab ikke muligt.",https://www.boligportal.dk/lejligheder/solr%C3%B8d-strand/100m2-4-vaer-id-5346201
"Degnejorden, 4320 Lejre, Højby",11.600 kr.,0 kr.,80 m²,3,-,Rækkehus,Nej,Nej,Ja,Nej,Ja,Nej,Ja,Ja,N/A,"Degnejorden – en moderne landsby med fællesskaber som omdrejningspunkt. Nyt byggeri skyder op af jorden i Lejre.

Landskabet imellem boligklyngerne på Degnejorden, er tænkt som et naturområde med varieret beplantning i form af forskellige træer og buske på en bund af enggræsser og urter. Igennem naturområdet etableres der trampestier og mindre opholds- og aktivitetsområder.

82 lejeboliger fordelt på 3 forskellige boligtyper i ét eller 2 plan. Udover lejeboligerne bliver der frasolgt 13 huse. 

I området bliver der bygget 1 forsamlingshus og 5 fælleshuse. Der etableres der 143 parkeringspladser til fri afbenyttelse inkl. handicappladser. Der opsættes tilmed 2 el-lade standere, således at der kan oplades 4 elbiler ad gangen.

Der er indflytning i 3 etaper og indflytningen for den enkelte bolig vil fremgå af den pågældende annonce. 

Der er ikke noget a conto beløb der skal betales via udlejer, da vand leveres af FORS og husene opvarmes med varmepumpe, hvor lejer selv skal tilmelde sig en el leverandør. 

Alle hårde hvidevarer medfølger. 

Boligerne kan reserveres ved at deltage på åbent hus. Vi holder åbent hus ca. én gang om ugen indtil alt er udlejet. Ønsker du at deltage i det åbne hus, så kan du sende en besked via annoncen og vil modtage en invitation til det næstkommende åbne hus.
Indflytningsprisen skal betales umiddelbart efter modtagelsen af lejekontrakten.

Det vil ikke være muligt at besigtige andre boliger end prøveboligen inden indflytning og det er under ingen omstændigheder tilladt at opholde sig på byggepladsen uden en invitation til åbent hus.

Billeder, plantegning og tekst er vejledende.

Hvis du er registreret i RKI kan vi desværre ikke tilbyde dig lejligheden. Dette kontrolleres ved udarbejdelse af lejekontrakt.",https://www.boligportal.dk/r%C3%A6kkehuse/lejre/80m2-3-vaer-id-5346997
"Sidesporet, 8930 Randers, Randers NØ  - Stuen",9.495 kr.,N/A,108 m²,3,Stuen,Lejlighed,Nej,Ja,Ja,Ja,Ja,Nej,Ja,Ja,N/A,"Lejemålet er en 3-værelses lejlighed på i alt 108,3 kvadratmeter med udgang til egen terrasse.

Lejligheder har et dejligt stort køkkenalrum, hvor der er tilhørende emhætte, køle/fryseskab, opvaskemaskine, induktionskogeplade samt indbygningsovn. Der er desuden vaskesøjle i badeværelset.

Der er lyse trægulve overalt i hele lejemålet dog undtaget badeværelset. Her er der flytte mørke fliser. Der er gulvvarme overalt i lejligheden.

Der er elevator i ejendommen, og lige ude foran ejendommen er der cykelparkering samt et skur til hvert lejemål. Der er mulighed gode parkeringsforhold til lejemålene i denne bygning.

Ved at søge om tilladelse, kan man holde et husdyr i lejemålet.",https://www.boligportal.dk/lejligheder/randers/108m2-3-vaer-id-5274741
"Fischersgade, 8900 Randers, Randers C  - 2. sal",5.995 kr.,900 kr.,100 m²,4,2.,Lejlighed,Nej,Ja,Nej,Nej,Nej,Nej,Nej,Nej,N/A,"Lejesagsnummer 1-133-20

Med udsigt til Østervold og Dytmærsken ligger denne dejlige, lyse 4-vær. i god ejendom med dørtlf.  

Lejligheden er indrettet med rummelig entré/gang med skabsplads, 2 gode værelser - heraf det ene med skabe - godt badeværelse med bruseniche, dejligt køkken med bl.a. opvaskemaskine og spiseafdeling (tæller som værelse) samt meget rummelig og lys vinkelstue. 
Store, nyere vinduer med udvendige solpersienner.
Depotrum og cykelkælder til rådighed.
Mulighed for leje af p-plads i gården.

Tv: youSee-grundpakke kr. 299,48. mdl. 
Vaskeri: kr. 95,- mdl. 

Der er indgået aftale med Norlys Fiber om installation af fiber i ejendommen. Dette forventes klart i løbet af året.",https://www.boligportal.dk/lejligheder/randers/100m2-4-vaer-id-3066460
"Pollenvænget, 8381 Aarhus, Tilst  - 2. sal",8.950 kr.,700 kr.,80 m²,3,2.,Lejlighed,Nej,Ja,Ja,Ja,Ja,Nej,Ja,Ja,A,"Velkommen til Blomsterhaven! 

Beliggende på den tidligere GASA grund, der i sagens natur er døbt Blomsterhaven.

Her er du kun et kvarter fra Aarhus C, om det så er bus, cykel eller bil, du vælger som transportmiddel. Du får ligeledes fri parkering lige foran ejendommen!
Derudover byder boligen på en god planløsning med alt i hårde hvidevarer og et anvendeligt depotrum i ejendommens kælder.

Den flotte bebyggelse tegnet af Arkitema Architects passer med sine venlige etagespring og flotte teglstensfacader perfekt ind i områdets hyggelige landsbymiljø. Gårdrummet giver et fint sammenhæng i bebyggelsen og en fornemmelse af intimitet og nærhed, hvor der er plads til alle.
Området er særdeles attraktivt for både unge og studerende, ældre og børnefamilier, der søger en beliggenhed tæt på folkeskole, indkøb, offentlig transport og med kort afstand til midtbyen.

Kontakt os allerede i dag for en fremvisning!

Det er tilladt at have ét husdyr pr. lejlighed. Hunde må maks. veje 15 kg. som fuldvoksen og der skal søges tilladelse hertil.

Vær OBS på at billederne er fra vores prøvebolig, og kan derfor afvige.

VIGTIGT INFORMATION: Der sker ingen indeksregulering før 2024!",https://www.boligportal.dk/lejligheder/aarhus/80m2-3-vaer-id-5363437
"Truevej, 8220 Aarhus, Brabrand  - 1. sal",8.695 kr.,300 kr.,70 m²,3,1.,Lejlighed,Nej,Ja,Nej,Nej,Nej,Nej,Ja,Ja,A,"På Truevej i Gl. Brabrand har vi her fornøjelsen af at udbyde en skøn 3'er til leje.

Lejligheden som er opført i ultimo 2018, byder på 2 gode værelser, et stort køkken alrum, et godt badeværelse og en stor altan. Lejligheden byder endvidere på alt i hårde hvidevare. 

Materialerne er nøje udvalgt med bl.a. Svane køkken og egetræsgulve med gulvvarme.

Skal du være den nye lejer af denne skønne bolig? Så kontakt os allerede i dag for en fremvisning!",https://www.boligportal.dk/lejligheder/aarhus/70m2-3-vaer-id-5247088
"Robert Jacobsens Vej, 2300 København, København S  - 10. sal","5.398,01 kr.",300 kr.,9.5 m²,1,10.,Værelse,Nej,Nej,Nej,Ja,Nej,Nej,Ja,Nej,N/A,"Dejlig lejlighed med udsigt over Amager til den ene side og fælleden på den anden. 

Der er vaskemaske, tørretumbler,  opvaskemaskine og to dejlige altaner i lejligheden – den ene ud til stuen, den anden deles mellem værelser. Der ligger Rema 1000 tæt på, samt et mindre udvalg af butikker og cafér. Derudover har området dejlig natur, og så ligger det 2 minutters gang fra metroen.

Du kommer til at bo med Robert, 35, Claes, 27 og Morten, 25. Vi er alle stille og rolige og vant til at bo sammen med andre. Vi leder efter en person der er ordentlig opdraget og som har lyst til at være en del af et hyggeligt fællesskab, hvor det også er helt okay at være for sig selv. 

Billedet er fra vores stue - der er tale om værelset i hjørnet, uden altanadgang, på 9.5 kvm.",https://www.boligportal.dk/v%C3%A6relser/k%C3%B8benhavn/9m2-1-vaer-id-5301321
"Østergade, 9320 Hjallerup",7.416 kr.,120 kr.,90 m²,3,-,Lejlighed,Nej,Nej,Nej,Ja,Ja,Nej,Ja,Ja,N/A,"NYBYGGEDE LEJLIGHEDER
I Hjallerup finder du 63 lejligheder i en moderne ejendom, som er bygget i klassisk dansk byggestil. Alle boligerne er på ca. 90 kvm og er 3 værelses. Her er der god plads til skønt samvær med familie og venner. Alle lejlighederne har rummelige køkken-alrum og de fleste med udgang til en solrig terrasse eller altan, hvorfra du også får et skønt lysindfald i lejligheden.",https://www.boligportal.dk/lejligheder/hjallerup/90m2-3-vaer-id-5268017
"Ranunkelhaven, 5500 Middelfart",9.950 kr.,0 kr.,106 m²,4,-,Rækkehus,Nej,Ja,Ja,Nej,Nej,Nej,Ja,Ja,A,"På Ranunkelhaven får du ca. 100 kvadratmeter effektiv udnyttet 4-værelses bolig. Boligen indeholder entré med trappe til 1. sal og med plads til at hænge overtøj. I forlængelse af entréen er placeret ét mindre toilet med mulighed for vaskesøjle. Forsætter man i stueetage går man ud i et stort køkkenalrum med et lyst og moderne samtale køkken. Stueetagen afsluttes med en stue med mulighed for en sofagruppe. På 1. sal finder man et stort soveværelse samt 2 værelser desuden et badeværelse. Boligen har gulvvarme i stueetagen samt på 1. sals badeværelset. Boligerne har eget ventilationsanlæg og energieffektive. Boligerne udlejes inkl. hårde-hvidevare i køkken. Til boligen hører en forhave samt baghave begge med flisebelagte terrasser, så man har god mulighed for at opleve solen i løbet af dagen. Hver bolig har i forhaven placeret et mindre redskabsskur til brug for opbevaring. Boligen har parkering i egen indkørsel med mulighed for opsætning af egen el-ladestander. 
Mindre husdyr tilladt – skal godkendes af udlejer. 
Forbrug: vand, varme mv. afregnes direkte med værkerne.
Under henvisning til energimærkning af tidligere opførte huse forventes varmeforbruget at være under 400 kr./md. i gennemsnit.

Lillebælt Gruppen A/S opfører 17 rækkehuse og 24 lejligheder til udlejning omkring sommer 2023. Bebyggelsen med 41 boliger er placeret i en af Middelfarts nye udstykninger ved Ranunkelhaven. Fra Ranunkelhaven er der kun få minutters kørsel til Middelfart centrum med bl.a. skole, banegård, gågaden, havnepromenaden og dagligvareindkøb. Bebyggelsen er placeret flot og giver mulighed for at se begge broer og Lillebælt hver dag. Boligerne er placeret 400 meter fra Lillebælt og er nabo til et stort grønt område. Placeringen i Middelfart giver mulighed for at nå Odense, Kolding og Vejle på under 30 min. og mere end 408.000 jobs inden for én time. 

Highlights
2,2 km. til nærmeste folkeskole (Østre Skole)
4. min til E20 motorvej
5. min til Middelfart Centrum
400 m. til Lillebælt
1,7 km. til indkøb",https://www.boligportal.dk/r%C3%A6kkehuse/middelfart/106m2-4-vaer-id-5358822
"Frodesgade, 6700 Esbjerg, Esbjerg  - Stuen",5.100 kr.,625 kr.,60 m²,2,Stuen,Lejlighed,Nej,Nej,Nej,Nej,Nej,Nej,Nej,Nej,N/A,"Moderniseret 2er, tæt på indkøb og grønne områder.
Pænt køkken med adgang til altan mod gård
Indretningsvenlig stue
Rigtig pænt badeværelse med brus
Soveværelse mod gården.",https://www.boligportal.dk/lejligheder/esbjerg/60m2-2-vaer-id-3516802
"Østervold, 8900 Randers, Randers C  - 1. sal",6.500 kr.,400 kr.,91 m²,2,1.,Lejlighed,Nej,Nej,Nej,Ja,Nej,Nej,Ja,Nej,A,"Beliggende i flot og markant hjørneejendom lige overfor byens vartegn - den Jyske Hingst på Østervold. Byens gågade med masser af liv og spændende butikker ligger et stenkast fra ejendommen ligesom Underværket, Randers Bibliotek, Værket, Parkeringshuset samt biografen nås på få minutter til fods.

Ejendommen er totalt renoveret overalt. Her er træ/alu vinduer, tegltag og flotte murstensfacader. Adgangen sker via elevator og flotte aflåste opgange med kaldeanlæg. Lejligheden er ny-isoleret, ligesom der er genvex-anlæg samt nye el- og vvs-installationer. 

Køkken og badeværelse er med inventar fra Svane i hvid grebsfri udførelse, ligesom hvidevarer er fra bl.a. AEG. Her er induktionskogeplade, indbygningsovn, emhætte, indbygnings-køle/fryseskab samt indbygnings-opvaskemaskine. Badeværelset har klinkegulve med gulvvarme, bruseniche med klinker på vægge, væghængt toilet samt forberedelse for vaskesøjle. Soverum har indbygningsskabe. Overalt er der fuldspartlede hvidmalede vægge samt flotte laminatgulve i eg/plank.

Lejligheden har adgang til fælles terrasse. Desuden stort kælderrum til hver lejlighed, cykelrum samt stort fælles aktivitetsrum i kælder.

Der er tilknyttet vicevært til ejendommen, som sørger for ugentlig trappevask samt fejning af fortov mm. 

Ingen husdyr. AC varme mdl. 400, AC vand 300 samt indlagt YouSee internet/TV i hver bolig. Der er dog ingen tilslutningspligt.",https://www.boligportal.dk/lejligheder/randers/91m2-2-vaer-id-3899685
"Pollenvænget, 8381 Aarhus, Tilst  - 1. sal",6.800 kr.,600 kr.,54 m²,2,1.,Lejlighed,Nej,Nej,Ja,Ja,Ja,Nej,Nej,Ja,A,"Velkommen til Blomsterhaven! 


Beliggende på den tidligere GASA grund, der i sagens natur er døbt Blomsterhaven.

Her er du kun et kvarter fra Aarhus C, om det så er bus, cykel eller bil, du vælger som transportmiddel. Du får ligeledes fri parkering lige foran ejendommen!
Derudover byder boligen på en god planløsning med alt i hårde hvidevarer og et anvendeligt depotrum i ejendommens kælder.

Den flotte bebyggelse tegnet af Arkitema Architects passer med sine venlige etagespring og flotte teglstensfacader perfekt ind i områdets hyggelige landsbymiljø. Gårdrummet giver et fint sammenhæng i bebyggelsen og en fornemmelse af intimitet og nærhed, hvor der er plads til alle.
Området er særdeles attraktivt for både unge og studerende, ældre og børnefamilier, der søger en beliggenhed tæt på folkeskole, indkøb, offentlig transport og med kort afstand til midtbyen.

Kontakt os allerede i dag for en fremvisning!

Det er tilladt at have ét husdyr pr. lejlighed. Hunde må maks. veje 15 kg. som fuldvoksen og der skal søges tilladelse hertil.",https://www.boligportal.dk/lejligheder/aarhus/54m2-2-vaer-id-5363435
"Ida Nielsens Vej, 7323 Give, Bregnhoved",9.645 kr.,N/A,105 m²,4,-,Rækkehus,Nej,Nej,Ja,Nej,Ja,Nej,Ja,Ja,A,"Moderne og lyst rækkehus med masser af naturligt lysindfald fra store vinduespartier. Man træder ind i særskilt entre med videre adgang til to gode værelser. Fra entreen finder man husets store opholdsrum med lyst køkken samt god plads til spisebord. Her er ligeledes mulighed for indretning af hyggeligt sofahjørne. Fra alrummet finder man særskilt bryggers med vask samt plads til vaskemaskine og tørretumbler, herfra finder man et stort moderne badeværelse. Ydermere forefindes soveværelse med indbygget skabsvæg. Fra stue er udgang til terrasse i hele husets bredde samt dejlig have.

Pigernes kvarter vil bestå af 144 energioptimeret og moderne dobbelthuse i størrelsen 85 m², 95 m², 105 m² og 115 m² – alle i et plan tegnet i en moderne og enkel streg.

Til hvert hus hører redskabsrum og stor flisebelagt terrasse på begge sider af huset samt flisebelagt gangsti til entreen.

Murede facader og gavle af morderne grålig mursten med brune nuancer og sort sadeltag med 25 graders hældning. Stern af træ i farven antracit og mindre hvidmalet udhæng af træ.

Husene monteres med moderne træ/alu vinduer og døre (Auraplus 3-lags vinduer) i mørk farve udvendig og hvid indvendig. Sålbænke under vinduespartierne i mørk skifer.

Husenes materialevalg er gennemtænkt og harmonisk, så husene vil fremstå smuk, tidløs og velholdt i mange år fremover.

Åbne og lyse dobbelthuse

Alle dobbelthuse indrettes lyse og venlige, med hvide glatte lofter og vægge. Dejlige vinduer for ekstra godt lysindfald overalt. Gulve af egeplank (laminat) i køkken/alrum, stue og værelser. Entre, bryggers, badeværelse og brus udføres med lækre klinkegulve i mørkegrå. Alle døre i glat hvid finish med rustfri stålgreb og uden dørtrin for optimal betjening. Vindueskarme mures og vandskures i hvid. Vægge mod gulv afsluttes med hvide glatte fodpaneler.

Fine detaljer overalt

Køkken, bad, bryggers og soveværelse monteres med moderne HTH-moduler i glat hvid afslutning og med antracit line greb. Bordplader i praktisk laminat i farven ’rustik skifer’ med rummelige stålvaske. Stænkplade bag kogepladen, for nem rengøring. Vask i badeværelse af formstøbt materiale. Væghængt toilet fra Ifö Sign, kvalitetsarmaturer fra tyske Hans Grohe og linjeafløb i bruseniche.

Kvalitetshvidevarer

Alle hvidevarer medfølger og i anerkendt kvalitet. Ovn er indbygget i højskab.

Der medfølger ligeledes vaskemaskine og kondenstørretumbler.

Fast og god belysning

Der er etableret lyskilde i bad og bryggers, samt ved ventilation på loft. I køkken er der spot i overskabene.

Forberedt for el-bil

Der er forberedt tomrør til ladestation for el-køretøj.

Sundt indeklima og gulvvarme

Der er gulvvarme i hele dobbelthuset. Dette styres via separate termostater i alle rum. Boligen er udført med ventilationsanlæg, der sikrer et sundt og godt indeklima.

Individuelle forbrugsmålere

Forbrug til el, varme, vand og spildevand afregnes direkte mellem lejer og forsyningsselskaberne. Opvarmning via fjernvarme.

Udvendig monteres der stikkontakt og vandhane samt væglampe ved entredør.

Illustrationer er modelfotos. Der tages forbehold for rettelser.",https://www.boligportal.dk/r%C3%A6kkehuse/give/105m2-4-vaer-id-5369223
"Rugårdsvej, 5000 Odense, Odense C  - Stuen",10.637 kr.,1.250 kr.,166 m²,4,Stuen,Lejlighed,Nej,Nej,Nej,Nej,Ja,Nej,Ja,Ja,N/A,"4 værelses lys og hyggelig høj hulmurs-isoleret stuelejlighed i yderst rolig og velfungerende 3-families ejendom. Centralt beliggende ca. 1 km fra gågaden og 1,9 km til Odense Banegård. Hele ejendommen er ejet af udlejer. Lyst køkken og nyere flisebadeværelse. Pæn opgang m. dørtelefon + egen ekstra bagindgang direkte fra egen p-plads til entre med de 2 store værelser + mindre værelse i bagerste del af lejligheden. 2 store sammenhængende stuer + lys hyggelig ""karnap"" med udgang til egen terrasse/mindre have og resten af den dejlige lukkede fælles have som passes af ejer/plænerobot. Eget pulterrum i kælderen. Stort fælles vaskerum med egen vaskemaskine og fælles tørretumbler (tumbler mod automatbetaling). Mulighed for tilslutning af fællesantenne. Fælles cykelskur og lukket baghave. P-plads på ejendommens grund foran huset. Ingen husdyr. Ikke til delelejlighed. Lejemålet overtages nyistandsat.",https://www.boligportal.dk/lejligheder/odense/166m2-4-vaer-id-4554771
