Adress,Monthly rent,Aconto,Square meters,Rooms,Floor,Property type,Furnished,Shareable,Pets allowed,Elevator,Senior frendly,Only for students,Balcony/Terrace,Parking,Energy label,Description,Link
"Drechselsgade, 2300 København, København S  - 3. sal",26.600 kr.,1.600 kr.,151 m²,4,3.,Lejlighed,Nej,Nej,Ja,Ja,Nej,Nej,Ja,Ja,A,"Sjældent udbudt 4-værelses lejlighed på 151 kvm. Oplagt lejebolig til familien der ønsker at bo dejligt og tæt på både Fælled og Islands Brygges havnemiljø.Eksklusive lejeboliger på Islands Brygge! Lyse lejligheder i New York-stil beliggende i hjertet af det pulserende Islands Brygge!
Lejlighederne varierer fra 2-5 værelser og har en enkel og god planløsning. Alle lejlighederne har et stort køkken-alrum, rummeligt badeværelse med tørretumbler-vaskemaskine, separat brus og gode soveværelser.
Lejlighederne er ideelle for par, børnefamilier, singlen eller venner der ønsker at bo sammen i lækre omgivelser. Som en af de unikke ting i A-huset har du som beboer adgang til fitnesscenteret der har et stort udvalg af moderne maskiner.
Udover at ejendommen er placeret på det aktive Islands Brygge har ejendommen følgende unikke faciliteter:

Fælles tagterrasse på 4.000m2 med fantastisk udsigt udover København.
Gratis adgang til in-house fitnesscenter for alle lejere
Fælles gårdareal med møbler
Privat parkering i kælderen til både cykler og biler
P-plads lejes separat
Husdyr: Kræver udlejers godkendelse
Kælderrum til alle lejlighederne

 
Denne lejlighed er beliggende på 3. sal og rummer 3 gode soveværelser. Lejligheden er gennemrenoveret og fremstår i rigtig god stand med nyere køkken med kogeø, alt i hårde hvidevarer, lyst badeværelse, 3 gode værelser samt bryggers. Lige ude foran din hoveddør har du desuden direkte adgang til den store fælles tagterrasse via elevatoren.
Lejligheden er klar til overtagelsen d. 1. maj. Lejemålets lejeperiode er ubegrænset.
Ejendommen har desuden restauranter, bager og supermarked og er placeret på Islands Brygge, som er et favoritsted for mange københavnere, specielt om sommeren. Du kan svømme i det store havnebad eller i Lagunen, slappe af på græsset ved Havneparken og forkæle dig selv med de mange lækre spisesteder i området.
 .",https://www.boligportal.dk/lejligheder/k%C3%B8benhavn/151m2-4-vaer-id-5352801
"Bredegade, 4200 Slagelse  - 3. sal",7.300 kr.,700 kr.,69 m²,2,3.,Lejlighed,Nej,Nej,Nej,Ja,Ja,Nej,Ja,Nej,C,"𝗟𝗶𝗱𝘁 𝗼𝗺 𝗹𝗲𝗷𝗹𝗶𝗴𝗵𝗲𝗱𝗲𝗻:
Her får du 69 m2 og indrettet med: åbent køkken sammen med 𝗱𝗲𝗻 𝗹𝘆𝘀𝗲 𝘀𝘁𝘂𝗲, soveværelse og et stort badeværelse med plads til din egen vaskemaskine og tørretumbler.
Du kan tage enten trapperne eller elevatoren når du skal op til lejligheden og så er svalegangen lavet sådan, at du har en 𝗵𝘆𝗴𝗴𝗲𝗹𝗶𝗴 𝘁𝗲𝗿𝗿𝗮𝘀𝘀𝗲 foran din lejlighed. Du har mulighed for at leje en 🅿-plads tæt på ejendommen og der er altid plads til din cykel i den private gård.
Lejligheden har 𝗴𝘂𝗹𝘃𝘃𝗮𝗿𝗺𝗲 overalt og under renoveringen i 2018 er lejligheden ikke kun blevet flottere, den har også gennemgået 𝗲𝗻𝗲𝗿𝗴𝗶𝗼𝗽𝘁𝗶𝗺𝗲𝗿𝗶𝗻𝗴 for at sikre vores lejere et lavere forbrug. Ejendommen er koblet på fjernvarme.

𝗟𝗶𝗱𝘁 𝗼𝗺 𝗯𝗲𝗹𝗶𝗴𝗴𝗲𝗻𝗵𝗲𝗱𝗲𝗻:
Lejligheden ligger perfekt til dig der vil bo tæt på alting. Du bor midt i Slagelse og har derfor butikker, indkøbsmuligheder og spisesteder lige udenfor hoveddøren. Trænger du til at se lidt grønt eller skal du med toget, ligger stationen og Slagelses hyggelige anlæg bare en kort gåtur væk. 

𝗟𝗶𝗱𝘁 𝗼𝗺 𝗼𝘀:
Vi har 20 års erfaring med udlejning og så har vi egne viceværter og egen administration med kontor lige midt i Slagelse hvor du altid er velkommen til at kigge forbi.
Kontakt os for en 𝗽𝗲𝗿𝘀𝗼𝗻𝗹𝗶𝗴 𝗳𝗿𝗲𝗺𝘃𝗶𝘀𝗻𝗶𝗻𝗴 af lejligheden. Vi vender tilbage hurtigst muligt på hverdage indenfor normal arbejdstid.


🟠 Vil du se mere? Kontakt os og book en personlig fremvisning. Vi svarer på 𝘢𝘭𝘭𝘦 henvendelser og det gør vi hurtigst muligt (på hverdage indenfor normal arbejdstid). 🟠 


✔ Egen terrasse på svalegangen 
✔ Gulvvarme i hele lejligheden 
✔ Plads til egen vaskemaskine og tørretumbler 
✔ Eget, aflåst kælderrum 
✔ Opvaskemaskine  
✔ Elevator 
✔ Fjernvarme

𝗔𝗳𝘀𝘁𝗮𝗻𝗱𝗲:
🛒 Indkøb: 100 m 
🛍 Bymidte: 200 m
🚉 Station: 750 m

𝗕𝘂𝗱𝗴𝗲𝘁:
Husleje               kr.   7.300,00
A conto varme    kr.     400,00
A conto vand      kr.     300,00
I alt                     kr.   8.000,00 
Indskud              kr. 36.500,00",https://www.boligportal.dk/lejligheder/slagelse/69m2-2-vaer-id-5372386
"Vestergade, 8723 Løsning  - Stuen",5.900 kr.,800 kr.,86 m²,2,Stuen,Lejlighed,Nej,Nej,Ja,Nej,Nej,Nej,Nej,Nej,N/A,"Lejligheden består af et køkken med mulighed for mindre spiseplads, en lys stue og et stort værelse med skabsvæg.
Der er desuden et badeværelse, en forindgang samt en baggang, hvor lejer kan opstille egen vaskemaskine

Der er en fælles have, som alle ejendommens beboere kan benytte.

Vand er indeholdt i huslejen, a'conto dækker varmen - el afregnes direkte til forsyningsselskabet.",https://www.boligportal.dk/lejligheder/l%C3%B8sning/86m2-2-vaer-id-5366685
"Slyngborggade, 8900 Randers, Randers C  - 4. sal",6.350 kr.,1.450 kr.,112 m²,4,4.,Lejlighed,Ja,Ja,Ja,Nej,Nej,Nej,Nej,Ja,D,"Denne skønne lejlighed i Randers, tæt på centrum - tæt på alle dagligdagens fornødenheder er klar til indflytning. 

4 værelser under tagetagen med udsigt til Randers' tage og Randers Regnskov.

Du har eget toilet og bad, dejligt køkken med opvaskemaskine, og en super fin udsigt fra køkkenet ned mod åen. 

Til lejligheden medfølger der lille kælderrum med plads til opbevaring, samt baggård med mindre grønt areal til fri benyttelse. 
           
Boligen er klar til overtagelse, og står kun og venter på dig! 

Lejligheden rummer 4 værelser og er hele 112 kvm. 

Er du interesseret, så tøv ikke med at give os et kald.
Vi fremviser gerne!",https://www.boligportal.dk/lejligheder/randers/112m2-4-vaer-id-5338172
"Else Alfelts Vej, 2300 København, København S  - 4. sal",15.200 kr.,950 kr.,103 m²,4,4.,Lejlighed,Nej,Nej,Ja,Ja,Ja,Nej,Ja,Ja,A,"Velkommen til denne skønne 4-værelses lejlighed med 2 dejlige altaner!
Lejligheden er oplagt til familien, som har brug for en moderne planløsning og en masse naturskønne områder.
Boligen byder på 103 velindrettede kvadratmeter, som er fordelt således: Rummelig entré, med plads til overtøj og sko, tre gode værelser og stort køkkenalrum med plads til spiseafdeling og sofaarrangement. Fra stuen er der udgang til boligens ene altan, og fra to af værelserne er der udgang til den anden altan. Lejlighedens badeværelse byder på separat brus samt vaskesøjle. Endvidere findes et godt depotrum i kælderen.
Lejlighederne i boligen passer med deres varierede størrelser til både små og store børnefamilier, singlen, der ønsker sig et helle midt i det travle byliv og det kræsne par, der vil udnytte byens mange kulturelle tilbud, men også vil kunne trække stikket og nyde naturens ro.
Ørestad Syd er stedet, hvor det sker. Nye boliger skyder op, nye fællesskaber etableres og en ny identitet tager form. I forvejen findes alt, hvad du behøver til en aktiv livsstil.
Opsigelse: 3 måneder
Husdyr: Kan ansøges om
*Bemærk at billederne ikke nødvendigvis er taget af/fra den pågældende bolig, og at udsigt m.v. derfor kan variere.",https://www.boligportal.dk/lejligheder/k%C3%B8benhavn/103m2-4-vaer-id-4598442
"Langstrømpevej, 8600 Silkeborg  - 1. sal",8.795 kr.,N/A,128 m²,4,1.,Lejlighed,Nej,Nej,Ja,Nej,Nej,Nej,Nej,Nej,N/A,"FLYT IND MED RABAT:Netop nu tilbyder vi en særlig lejerabat på en lejebolig på langstrømpevej. Underskriver du lejekontrakt inden 1. august 2023, får du to måneders gratis husleje (gælder ikke a conto-udgifter).
Her finder du 84 moderne rækkehuse og lejligheder med skøn placering i Silkeborg som især er kendt for Søhøjlandets mange outdooroplevelser og unikke kulturelle events.

I denne bolig med 4 værelser får du:


3 gode værelser med skabe fra HTH
Stor lys stue i forbindelse med køkken
Flotte egetræsgulve
Ventilationsanlæg som er med til at sikre et godt indeklima
Gulvarme der kan reguleres i alle rum
Stor entre vaskesøjle
HTH-elementer i alle værelser
Altan
Skur
Elevator

Lejevilkår:


Det er tilladt at holde 1 stk. hund på max 35 kg eller under 40 cm i højden (med forbehold). Katte er ikke tilladt.
Det er ikke muligt at leje boligen, hvis du er registreret i RKI.

* Bemærk at billederne ikke nødvendigvis er taget af/fra den pågældende bolig, og at udsigt m.v. derfor kan variere.

Området:

Buskelund-området ligger i et naturskønt og kuperet område mellem Balle og Hvinningdal med en naturlig sammenhæng mellem de tre byområder. Denne attraktive og forholdsvis nye bydel har alt, hvad der er brug for i hverdagen: skoler, daginstitutioner, idrætsfaciliteter og indkøbsmuligheder.

Via stisystem er det muligt at nå til skole uden at skulle krydse Nordre Højmarksvej. Området er generelt roligt og børnevenligt med legepladser og et godt stisystem.

Med kun 1 km til motorvejen, kan man nå til Aarhus eller Herning på kun ½ time.

Kort afstand til skov og natur giver mulighed for gode naturoplevelser og en aktiv fritid.

Med kun 5 kilometer til Silkeborg centrum er der nem adgang til bylivets faciliteter som café, restauranter og specialbutikker.

ÅBENT HUS:
 - Søndag den 20. august 2023, kl. 14:40-15:10

OBS: Venligst hold dig opdateret, da der godt kan forekomme ændringer.",https://www.boligportal.dk/lejligheder/silkeborg/128m2-4-vaer-id-5273836
"Aagade, 7100 Vejle  - Stuen",7.443 kr.,560 kr.,77 m²,3,Stuen,Lejlighed,Nej,Ja,Nej,Nej,Nej,Nej,Ja,Ja,C,"ENGLISH BELOW 

Denne skønne 3-værelses lejlighed på 77m2 i hjertet af Vejle udlejes. 

Lejligheden udgør et dejligt køkken, to stuer en suite samt et soveværelse, og står i samme omgang med alle hårde hvidevarer - herunder: vaskemaskine, tørretumbler, opvaskemaskine etc. 

Til lejligheden følger en gårdhave som deles med ejendommens øvrige beboere. 

Det er muligt at tilkøbe en parkeringsplads til en månedlig leje på 500 kr. 

Aagade er nabo til Spinderihallerne hvor der afholdes flere underholdningsarrangementer, kulturbegivenheder og fællesskabssamlinger. Herudover er der under 5 minutters gang til byens faciliteter med gågade, cafeer samt restauranter og specialbutikker. Lige om hjørnet findes Vejle Politi, Erhvervsskolen, Kunstmuseum, Musikteateret, Gymnasiet og mange flere. Flere dagligvarebutikker ligger ydermere i gåafstand. 

Lyder det som noget for dig/jer eller nogen du kender? Så tøv ikke med at kontakte os for en fremvisning. 
__________________________________________________________________________________________________________________________________________

This beautiful 3-room apartment of 77m2 in the heart of Vejle is for rent.

The apartment consists of a nice kitchen, two living rooms and one bedroom, and is in the same room with all white goods - including: washing machine, tumble dryer, dishwasher etc.

The apartment comes with a courtyard which is shared with the property's other residents.

It is possible to purchase an additional parking space for a monthly rent of DKK 500.

Aagade is a neighbor of Spinderihallerne, where several entertainment events, cultural events and community gatherings are held. In addition, there are less than 5 minutes' walk to the city's facilities with a pedestrian street, cafes as well as restaurants and specialty shops. Just around the corner are the Vejle Police, the Vocational School, the Art Museum, the Music Theatre, the High School and many more. Several grocery stores are also within walking distance.

Does this sound like something for you or someone you know? So don't hesitate to contact us for a viewing.",https://www.boligportal.dk/lejligheder/vejle/77m2-3-vaer-id-5376311
"Sjælsø Vænge, 3460 Birkerød  - Stuen",12.050 kr.,N/A,88 m²,3,Stuen,Lejlighed,Nej,Nej,Ja,Nej,Nej,Nej,Nej,Nej,B,"Ejendommen
Elegant ejendom med røde facader, gule tage og flotte, store hvide indgangsgavle, som skaber unikke enkelte boliger. Ejendommen er opført i 1995 og består af 92 dejlige lejligheder. Der er separat indgang til alle lejlighederne fra gadeplan. 
 
Området
Ejendommen ligger godt placeret i skønne naturomgivelser med både sø og marker i nærheden af Rude Skov. 
 
Andre vilkår
Det gælder for alle nye lejeaftaler, at det ikke er tilladt at ryge i lejemålet. Det skyldes, at udlejer ønsker at minimere rygning på ejendommen og på sigt gøre den røgfri. 
Husdyrhold er ikke tilladt.",https://www.boligportal.dk/lejligheder/birker%C3%B8d/88m2-3-vaer-id-5372026
"Else Alfelts Vej, 2300 København, København S  - 3. sal",14.950 kr.,N/A,108 m²,4,3.,Lejlighed,Nej,Nej,Nej,Ja,Nej,Nej,Ja,Nej,N/A,"I Savannehusets lejeboliger får du Københavns enorme, fredede naturpark som baghave. Ejendommen ligger direkte ud til Kalvebod Fælleds grønne savannelandskab få hundrede meter fra den grønne udsigtsbakke Bumlebjerg, som forvandler sig til en skøn kælkebakke om vinteren. Savannehuset består af lejligheder på 2-4 værelser i en høj kvalitet med egetræsgulve, gulvvarme i alle rum og lyse køkkener fra Invita. Lejlighederne er rummelige, gennemlyste og har adgang til en privat altan. Enkelte lejligheder har ovenikøbet to altaner. Nyd det bedste fra byen og naturen.
 
Ørestad indeholder det bedste fra to verdener. Den lettilgængelige metro og gode cykelstier gør det let at nyde det pulserende københavnerliv, mens bydelens nærområde også byder på caféer, indkøbsmuligheder, skoler, daginstitutioner, legepladser og shopping. Når du trænger til ro og fordybelse, kan du trække dig tilbage til din egen naturoase og nyde godt af Fælledens uforstyrrede vildmark.
 
NB: Der udlejes ikke til bofællesskaber",https://www.boligportal.dk/lejligheder/k%C3%B8benhavn/108m2-4-vaer-id-5361482
"Brogårdsvej, 5250 Odense, Odense SV  - Stuen",5.650 kr.,750 kr.,76 m²,2,Stuen,Lejlighed,Nej,Nej,Nej,Nej,Nej,Nej,Nej,Ja,N/A,"ODENSE SV (Bellinge) udlejes 2. værelses lejl. beliggende i stuen(høj stueetage) i 3. families ejendom tæt på dagligvarer butikker mv.

Der er NYT TOTALRENOVERET køkken med alt i hvidevarer og spiseplads.

Lejlighed er indrettet med stor lys stue, soveværelse med garderobeskab, spisekøkken samt badeværelse. Badeværelset er beliggende udenfor lejligheden på gangen lige ved siden af indgangsdør.

Der er vaskefaciliteter i kælder og udhus til cykelopbevaring, stor fælles terrasse samt parkeringsplads.

Leje pr. måned 5.650 + a/c varme 350 + a/c vand 200 + a/c el 200 i alt 6.400.
Depositum 15.900. Forudbetalt leje 5.300.

Henvendelse via boligportal med personlige data (alder, job mv.) Husk tlf.nr.",https://www.boligportal.dk/lejligheder/odense/76m2-2-vaer-id-3969842
"Mølledalen, 3400 Hillerød",16.500 kr.,500 kr.,141 m²,5,-,Rækkehus,Nej,Nej,Ja,Nej,Ja,Nej,Ja,Ja,B,"Skønt enderækkehus på 141 m2 i mindre bebyggelse med masser af luft omkring. Husene er indrettet til en børnefamilie, men også seniorer bor i området.
Alle boliger er indrettet med loft til kip på 1.sal, hvidevægge med filt, gulvvarme over alt, dobbelt carport med stort udhus, og meget mere.

Boligen ligger på lille lukket vej med stort fælles område. I gå- cykelafstand ligger der en skole, institutioner, sportshal og her er masser af natur.

Indeholder: Stor lys entre med praktisk klinkegulv, bryggers med egen indgang, badeværelse med bruseniche, lys stue med aftensol. Fra stuen er der udgang til solrig terrasse og mindre have.
1.sal: Repos, badeværelse med bruseniche, stort alrum/soveværelse med udgang til østvendt terrasse, stort soveværelse med skabsvæg med skydelåger og udgang til østvendt terrasse, samt 2 børneværelser på ca 11 m2.",https://www.boligportal.dk/r%C3%A6kkehuse/hiller%C3%B8d/141m2-5-vaer-id-1899479
"Gøteborg Allé, 8200 Aarhus, Aarhus N  - Stuen",5.700 kr.,385 kr.,36 m²,1,Stuen,Lejlighed,Nej,Nej,Ja,Nej,Nej,Nej,Nej,Ja,A,"Boligerne har et godt køkken med komfur i forbindelse med boligens alrum. Derudover er der et rummeligt badeværelse med stor bruseplads. Både værelser og opholdsrum er med pæne parketgulve, mens badeværelserne har klinkegulv.

Ejendommen bliver opført med lækker gårdhave og adgang til stor fælles tagterrasse. Derud over er der gode parkeringsmuligheder på terræn til din cykel. Der vil desuden på 2. sal kunne findes betalingsvaskeri samt et fint fællesrum med køkken, hvor beboere kan mødes til arrangementer og hyggestunder.

*OBS - billederne er fra en lignende lejlighed",https://www.boligportal.dk/lejligheder/aarhus/36m2-1-vaer-id-5372759
"Bredgade, 8500 Grenaa  - Stuen",4.888 kr.,900 kr.,65 m²,3,Stuen,Lejlighed,Nej,Nej,Ja,Nej,Nej,Nej,Nej,Nej,N/A,"Lækker nyistandsat lejlighed i Grenaa udlejes. Her får du en lejlighed med nye gulve, nyt køkken og nye vinduer. Lejligheden består af egen entre, køkken, soveværelse, 2 stuer, badeværelse, vaskebryggers og ekstra værelse. Hygge område udenfor er under renovering.",https://www.boligportal.dk/lejligheder/grenaa/65m2-3-vaer-id-5376341
"Granskoven, 2600 København, Glostrup  - 2. sal",10.995 kr.,1.200 kr.,68 m²,3,2.,Lejlighed,Nej,Ja,Ja,Ja,Nej,Nej,Ja,Ja,B,"Velkommen til boligen!
Nu udbyder vi denne rummelige 3-værelses lejlighed i boligen. Lejligheden består af en rummelig entré samt stort køkken/alrum. Endvidere får du to gode soveværelser med indbyggede skabe. Derudover får du et lækkert badeværelse med separat bruseniche og vaskesøjle.
Ejendommen består af 60 moderne lejeboliger i forskellige størrelser med gode og gennemtænkte planløsninger, praktiske materialevalg og optimale lysforhold.
boligen er en tidligere kontorbygning, som efter total istandsættelse nu udgør de optimale rammer for et hverdagsliv.
boligens lejeboliger ligger i Glostrup, kun 20 minutters kørsel fra København. Tæt på ejendommen finder du også den populære supercykelsti, som fører direkte til København C.
Glostrup kommune byder på afmærkede motionsruter og byparker, det hyggelige Hvissinge Torv samt et rigt foreningsliv, der hylder og bakker op om lokalsamfundet. Her får du gode indkøbsmuligheder og en masse kulturoplevelser i form af bibliotek, biograf, teater og musikskole samt arrangementer og mulighed for socialt samvær med andre. Til børnefamilierne er der gode pasningsmuligheder i nærheden og talrige legepladser at besøge, ligesom boligen Glostrup ligger i gåafstand til Skovvangsskolen.
(Vi gør opmærksom på at billederne ikke er taget af/fra den pågældende bolig, men en anden bolig i samme ejendom).",https://www.boligportal.dk/lejligheder/k%C3%B8benhavn/68m2-3-vaer-id-5343551
"Nyborggade, 8000 Aarhus, Aarhus C  - 4. sal",2.900 kr.,200 kr.,15 m²,1,4.,Værelse,Nej,Nej,Nej,Nej,Nej,Nej,Nej,Nej,F,"Vil du gerne bo i et lille bofælleskab med 2 øvrige beboer inde i midtbyen? Fin 1 værelses lejlighed udlejes pr. 01/01/2022. 

Privat værelse med en lille entre også

Køkken og badeværelse deles med de 2 øvrige beboere. Ideel til studerende. Området Frederiksbjerg byder på rigtig mange gode ting. Hyggelig loppemarkeder på Ingerslev Boulevard eller lange gåture ved Marselis og dyrehaven.

Køkkenet er lige blevet istandsat med et nyt køleskab til hvert værelse, samt skabe.

Fælles vaskeri i kælder, et hyggeligt aflåst gårdanlæg og cykelparkering.

Gode busforbindelser med blandt andet bus, som går direkte til universitetsparken og det øvrige Aarhus C-N.",https://www.boligportal.dk/v%C3%A6relser/aarhus/15m2-1-vaer-id-5325599
"Kløvervej, 6000 Kolding  - 7. sal",8.950 kr.,1.000 kr.,89 m²,3,7.,Lejlighed,Nej,Nej,Ja,Ja,Nej,Nej,Nej,Ja,N/A,"FLYT IND MED LEJERABAT: Underskriv lejekontrakten inden 1. september 2023 og få 2 måneders gratis husleje (gælder ikke aconto-udgifter).

NYE MODERNE UDSIGTSLEJLIGHEDER VED KOLDING FJORD.

Kløverhaven er bygget i 2022/2023 og består af fire bygninger placeret forskudt af hinanden i grønne omgivelser – med udsigt over fjorden med den skønne lystbådehavn og kun 2,5 kilometer væk fra Kolding centrum.

De moderne og lyse boliger tilbydes i forskellige størrelser. Indretningen er funktionel, enkel og udført i nordisk stil med kvalitetsmaterialer og godt lysindfald fra de store vinduespartier.

Alle lejligheder har en skøn rummelig altan eller terrasse.Foran terrassen er der beplantet med høje græsser som er plantet med tanken ” vild med vilje ” ….

De fire etagebygninger bindes sammen af et unikt parkområde med grønne oaser, legeplads og opholdszoner. Her bliver masser af plads til både at dyrke egotid, familietid, leg og fællesskab i de grønne omgivelser.


Flyt ind på Kløverhaven og få :


En virkelig flot og moderne lejlighed med lavenergiklasse A2020
Alt i hårde hvidevarer
Flotte gulve i egetræs look
Skøn rummelig altan eller terrasse - de øverste med udsigt til fjorden/lystbådehavnen
Lyse indbydende opgange med dørtelefon og elevator
Fri parkering med El standere (via app)
Molokker
Unikt parkområde med legeplads, stier samt hyggelige fællesområder
Mulighed for cykelparkering (overdækket)
Aflåst skur til f.eks. barnevogn, rollator samt el cykel
Yousee fibernet
Hund tilladt (med forbehold)



Bofællesskaber og delebolig er ikke tilladt.

Det er ej muligt at leje en bolig såfremt man er registeret i RKI.

ÅBENT HUS:
 - Onsdag den 9. august 2023, kl. 10:00-11:00
 - Torsdag den 10. august 2023, kl. 16:00-17:00

OBS: Venligst hold dig opdateret, da der godt kan forekomme ændringer.",https://www.boligportal.dk/lejligheder/kolding/89m2-3-vaer-id-5330139
"Pollenvænget, 8381 Aarhus, Tilst  - 2. sal",5.995 kr.,600 kr.,39 m²,2,2.,Lejlighed,Nej,Nej,Ja,Ja,Nej,Nej,Nej,Ja,N/A,"Oversigt over lejligheden
Det er en nybygget ejendom fra 2019. Dermed får du et lyst og moderne interiør. Der er i alt 2 værelser herunder en stue og et soveværelse. 

Køkken/stue
Køkkenet er fra Invita og hårde hvidevarer er inkluderet - her taler vi om ovn, køle-/fryseskab og opvaskemaskine. Stuen er i åben forlængelse til køkkenet. 

Soveværelset
Rummet har et godt lysindfald, og der er plads til en dobbeltseng. 

Badeværelse
Det er et stort og flot badeværelse, hvor der er inkluderet en kombineret vaskemaskine og tørretumbler - du behøver derfor ikke at gå ned i en vaskekælder for at ordne vasketøj. 

Området
Der er gode indkøbsmuligheder og kort til supercykelstien. Der er 7 min. på cykel til Bilka, hvor der i samme område ligger en Jysk, Power, Elgiganten m.m. Derudover kan du cykle til Aarhus BSS på 20 min. 

Faciliteter
Du kan benytte dig af en flot fælles tagterrasse, hvor der er en god udsigt. Derudover er der en kælder med opbevaring og cykelparkering. 
Ejendommen har elevator og er handicapvenlig.

Husdyr
1 husdyr er tilladt, og det må max. veje 15 kg.",https://www.boligportal.dk/lejligheder/aarhus/39m2-2-vaer-id-5024431
"Gyngemose Parkvej, 2860 København, Søborg  - 5. sal",15.500 kr.,800 kr.,102 m²,4,5.,Lejlighed,Nej,Ja,Ja,Ja,Ja,Nej,Ja,Ja,A,"Velkommen til boligen!
Nu har du muligheden for at leje en lys og moderne lejlighed i boligen, der ligger i den nye attraktive bydel Gyngemosen. Her er du både tæt på naturen og byen. boligen ligger i rekreative grønne omgivelser ved en nyanlagt sø.
Lejligheden er oplagt til familien eller som delebolig. Boligen byder på 98 velindrettede kvadratmeter, som er fordelt således: Rummelig entré med plads til overtøj og sko, 2 gode værelser og stort køkken alrum med plads til spiseafdeling og sofaarrangement. Lejlighedens badeværelse byder på separat brus samt vaskesøjle. Endvidere findes et godt depotrum i kælderen. Der findes også elevator i opgangen.
TÆT PÅ BÅDE NATUR OG BY
Gyngemosen ligger kun 1 km fra den fredede Utterslev Mose og 8 km fra Københavns Rådhusplads. Der er nem adgang til indkøb med dagligvarebutikker i området. Der ligger flere daginstitutioner og skoler tæt ved, og der er gode trafikale forbindelser til både offentlig transport og motorvejsnet. Gladsaxe kommune har opført en multihal i området.
LYST DESIGN I GOD KVALITET
• Matlakeret trægulv.
• Invita Trendline køkken i grebsfrit design.
• Induktionskogeplade, indbygget pyrolyseovn, integreret køle-/fryseskab, integreret opvaskemaskine.
• Hvid køkkenbordplade med sort kerne.
• Planforsænket køkkenvask i sort silgranit.
• Indbyggede skabe i de fleste lejligheder.
• Vaskemaskine og tørretumbler fra Miele.
• Aflåseligt pulterrum i kælder, ca. 3 m2.
• Dørtelefon med kamera. Adgangskontrol med briksystem.
*Husdyr med ansøgning!
Lejemålet kan ikke opsiges de første 12 måneder. Herefter er der 3 måneders opsigelse
*Bemærk at billederne ikke nødvendigvis er taget af/fra den pågældende bolig, og at udsigt m.v. derfor kan variere.",https://www.boligportal.dk/lejligheder/k%C3%B8benhavn/102m2-4-vaer-id-5207923
"Rønnedevej, 4640 Faxe",10.000 kr.,1.000 kr.,129 m²,3,-,Lejlighed,Nej,Nej,Ja,Nej,Ja,Nej,Ja,Ja,C,"Stor 3 værelses lejlighed på 129m2 centralt beliggende i Faxe.
Indeholder: Meget stor stue, 2 værelser, køkken, badeværelse og gæstetoilet. Opvarmes med fjernvarme, stor terrasse og gode parkeringsforhold.
Lejen er incl. vand, vandafledning og renovation. 
A'conto fjernvarme kr. 1.000,- pr. md.",https://www.boligportal.dk/lejligheder/faxe/129m2-3-vaer-id-5370145
